01-02-03 12:33:46 => 2003-01-02T12:33:46
01-02-03 12:33:46 am => 2003-01-02T00:33:46
01-02-03 12:33:46 pm => 2003-01-02T12:33:46
01-02-03 12:3:46 => 2003-01-02T12:03:46
01-02-03 12:3:46 am => 2003-01-02T00:03:46
01-02-03 12:3:46 pm => 2003-01-02T12:03:46
01-02-03 12:3:6 => 2003-01-02T12:03:06
01-02-03 12:3:6 am => 2003-01-02T00:03:06
01-02-03 12:3:6 pm => 2003-01-02T12:03:06
01-02-03 1:33:46 => 2003-01-02T01:33:46
01-02-03 1:33:46 am => 2003-01-02T01:33:46
01-02-03 1:33:46 pm => 2003-01-02T13:33:46
01-02-03 1:3:46 => 2003-01-02T01:03:46
01-02-03 1:3:46 am => 2003-01-02T01:03:46
01-02-03 1:3:46 pm => 2003-01-02T13:03:46
01-02-03 1:3:6 => 2003-01-02T01:03:06
01-02-03 1:3:6 am => 2003-01-02T01:03:06
01-02-03 1:3:6 pm => 2003-01-02T13:03:06
01 02 03 => 2003-01-02T00:00:00
01-02-03 => 2003-01-02T00:00:00
01/02/03 => 2003-01-02T00:00:00
01.02.03 => 2003-01-02T00:00:00
01\02\03 => 2003-01-02T00:00:00
01-30-2000 12:33:46 => 2000-01-30T12:33:46
01-30-2000 12:33:46 am => 2000-01-30T00:33:46
01-30-2000 12:33:46 pm => 2000-01-30T12:33:46
01-30-2000 12:3:46 => 2000-01-30T12:03:46
01-30-2000 12:3:46 am => 2000-01-30T00:03:46
01-30-2000 12:3:46 pm => 2000-01-30T12:03:46
01-30-2000 12:3:6 => 2000-01-30T12:03:06
01-30-2000 12:3:6 am => 2000-01-30T00:03:06
01-30-2000 12:3:6 pm => 2000-01-30T12:03:06
01-30-2000 1:33:46 => 2000-01-30T01:33:46
01-30-2000 1:33:46 am => 2000-01-30T01:33:46
01-30-2000 1:33:46 pm => 2000-01-30T13:33:46
01-30-2000 1:3:46 => 2000-01-30T01:03:46
01-30-2000 1:3:46 am => 2000-01-30T01:03:46
01-30-2000 1:3:46 pm => 2000-01-30T13:03:46
01-30-2000 1:3:6 => 2000-01-30T01:03:06
01-30-2000 1:3:6 am => 2000-01-30T01:03:06
01-30-2000 1:3:6 pm => 2000-01-30T13:03:06
01 March    1999 12:33:46 => 1999-03-01T12:33:46
01 March 1999 12:33:46 => 1999-03-01T12:33:46
01 March    1999 12:33:46 am => 1999-03-01T00:33:46
01 March 1999 12:33:46 am => 1999-03-01T00:33:46
01 March    1999 12:33:46 pm => 1999-03-01T12:33:46
01 March 1999 12:33:46 pm => 1999-03-01T12:33:46
01 March    1999 12:3:46 => 1999-03-01T12:03:46
01 March 1999 12:3:46 => 1999-03-01T12:03:46
01 March    1999 12:3:46 am => 1999-03-01T00:03:46
01 March 1999 12:3:46 am => 1999-03-01T00:03:46
01 March    1999 12:3:46 pm => 1999-03-01T12:03:46
01 March 1999 12:3:46 pm => 1999-03-01T12:03:46
01 March    1999 12:3:6 => 1999-03-01T12:03:06
01 March 1999 12:3:6 => 1999-03-01T12:03:06
01 March    1999 12:3:6 am => 1999-03-01T00:03:06
01 March 1999 12:3:6 am => 1999-03-01T00:03:06
01 March    1999 12:3:6 pm => 1999-03-01T12:03:06
01 March 1999 12:3:6 pm => 1999-03-01T12:03:06
01 March    1999 1:33:46 => 1999-03-01T01:33:46
01 March 1999 1:33:46 => 1999-03-01T01:33:46
01 March    1999 1:33:46 am => 1999-03-01T01:33:46
01 March 1999 1:33:46 am => 1999-03-01T01:33:46
01 March    1999 1:33:46 pm => 1999-03-01T13:33:46
01 March 1999 1:33:46 pm => 1999-03-01T13:33:46
01 March    1999 1:3:46 => 1999-03-01T01:03:46
01 March 1999 1:3:46 => 1999-03-01T01:03:46
01 March    1999 1:3:46 am => 1999-03-01T01:03:46
01 March 1999 1:3:46 am => 1999-03-01T01:03:46
01 March    1999 1:3:46 pm => 1999-03-01T13:03:46
01 March 1999 1:3:46 pm => 1999-03-01T13:03:46
01 March    1999 1:3:6 => 1999-03-01T01:03:06
01 March 1999 1:3:6 => 1999-03-01T01:03:06
01 March    1999 1:3:6 am => 1999-03-01T01:03:06
01 March 1999 1:3:6 am => 1999-03-01T01:03:06
01 March    1999 1:3:6 pm => 1999-03-01T13:03:06
01 March 1999 1:3:6 pm => 1999-03-01T13:03:06
02/11/2005 04:00:43 PM => 2005-02-11T16:00:43
02/11/2005 04:44:09 PM => 2005-02-11T16:44:09
02-28-1998 12:33:46 => 1998-02-28T12:33:46
02-28-1998 12:33:46 am => 1998-02-28T00:33:46
02-28-1998 12:33:46 pm => 1998-02-28T12:33:46
02-28-1998 12:3:46 => 1998-02-28T12:03:46
02-28-1998 12:3:46 am => 1998-02-28T00:03:46
02-28-1998 12:3:46 pm => 1998-02-28T12:03:46
02-28-1998 12:3:6 => 1998-02-28T12:03:06
02-28-1998 12:3:6 am => 1998-02-28T00:03:06
02-28-1998 12:3:6 pm => 1998-02-28T12:03:06
02-28-1998 1:33:46 => 1998-02-28T01:33:46
02-28-1998 1:33:46 am => 1998-02-28T01:33:46
02-28-1998 1:33:46 pm => 1998-02-28T13:33:46
02-28-1998 1:3:46 => 1998-02-28T01:03:46
02-28-1998 1:3:46 am => 1998-02-28T01:03:46
02-28-1998 1:3:46 pm => 1998-02-28T13:03:46
02-28-1998 1:3:6 => 1998-02-28T01:03:06
02-28-1998 1:3:6 am => 1998-02-28T01:03:06
02-28-1998 1:3:6 pm => 1998-02-28T13:03:06
03-01-1999 12:33:46 => 1999-03-01T12:33:46
03-01-1999 12:33:46 am => 1999-03-01T00:33:46
03-01-1999 12:33:46 pm => 1999-03-01T12:33:46
03-01-1999 12:3:46 => 1999-03-01T12:03:46
03-01-1999 12:3:46 am => 1999-03-01T00:03:46
03-01-1999 12:3:46 pm => 1999-03-01T12:03:46
03-01-1999 12:3:6 => 1999-03-01T12:03:06
03-01-1999 12:3:6 am => 1999-03-01T00:03:06
03-01-1999 12:3:6 pm => 1999-03-01T12:03:06
03-01-1999 1:33:46 => 1999-03-01T01:33:46
03-01-1999 1:33:46 am => 1999-03-01T01:33:46
03-01-1999 1:33:46 pm => 1999-03-01T13:33:46
03-01-1999 1:3:46 => 1999-03-01T01:03:46
03-01-1999 1:3:46 am => 1999-03-01T01:03:46
03-01-1999 1:3:46 pm => 1999-03-01T13:03:46
03-01-1999 1:3:6 => 1999-03-01T01:03:06
03-01-1999 1:3:6 am => 1999-03-01T01:03:06
03-01-1999 1:3:6 pm => 1999-03-01T13:03:06
04-FEB-1995 12:33:46 => 1995-02-04T12:33:46
04-FEB-1995 12:33:46 am => 1995-02-04T00:33:46
04-FEB-1995 12:33:46 pm => 1995-02-04T12:33:46
04-FEB-1995 12:3:46 => 1995-02-04T12:03:46
04-FEB-1995 12:3:46 am => 1995-02-04T00:03:46
04-FEB-1995 12:3:46 pm => 1995-02-04T12:03:46
04-FEB-1995 12:3:6 => 1995-02-04T12:03:06
04-FEB-1995 12:3:6 am => 1995-02-04T00:03:06
04-FEB-1995 12:3:6 pm => 1995-02-04T12:03:06
04-FEB-1995 1:33:46 => 1995-02-04T01:33:46
04-FEB-1995 1:33:46 am => 1995-02-04T01:33:46
04-FEB-1995 1:33:46 pm => 1995-02-04T13:33:46
04-FEB-1995 1:3:46 => 1995-02-04T01:03:46
04-FEB-1995 1:3:46 am => 1995-02-04T01:03:46
04-FEB-1995 1:3:46 pm => 1995-02-04T13:03:46
04-FEB-1995 1:3:6 => 1995-02-04T01:03:06
04-FEB-1995 1:3:6 am => 1995-02-04T01:03:06
04-FEB-1995 1:3:6 pm => 1995-02-04T13:03:06
05/10/93 => 1993-05-10T00:00:00
05-18-06 12:33:46 => 2006-05-18T12:33:46
05-18-06 12:33:46 am => 2006-05-18T00:33:46
05-18-06 12:33:46 pm => 2006-05-18T12:33:46
05-18-06 12:3:46 => 2006-05-18T12:03:46
05-18-06 12:3:46 am => 2006-05-18T00:03:46
05-18-06 12:3:46 pm => 2006-05-18T12:03:46
05-18-06 12:3:6 => 2006-05-18T12:03:06
05-18-06 12:3:6 am => 2006-05-18T00:03:06
05-18-06 12:3:6 pm => 2006-05-18T12:03:06
05-18-06 1:33:46 => 2006-05-18T01:33:46
05-18-06 1:33:46 am => 2006-05-18T01:33:46
05-18-06 1:33:46 pm => 2006-05-18T13:33:46
05-18-06 1:3:46 => 2006-05-18T01:03:46
05-18-06 1:3:46 am => 2006-05-18T01:03:46
05-18-06 1:3:46 pm => 2006-05-18T13:03:46
05-18-06 1:3:6 => 2006-05-18T01:03:06
05-18-06 1:3:6 am => 2006-05-18T01:03:06
05-18-06 1:3:6 pm => 2006-05-18T13:03:06
05 18 06 => 2006-05-18T00:00:00
05-18-06 => 2006-05-18T00:00:00
05/18/06 => 2006-05-18T00:00:00
05.18.06 => 2006-05-18T00:00:00
05\18\06 => 2006-05-18T00:00:00
05-18-2006 12:33:46 => 2006-05-18T12:33:46
05-18-2006 12:33:46 am => 2006-05-18T00:33:46
05-18-2006 12:33:46 pm => 2006-05-18T12:33:46
05-18-2006 12:3:46 => 2006-05-18T12:03:46
05-18-2006 12:3:46 am => 2006-05-18T00:03:46
05-18-2006 12:3:46 pm => 2006-05-18T12:03:46
05-18-2006 12:3:6 => 2006-05-18T12:03:06
05-18-2006 12:3:6 am => 2006-05-18T00:03:06
05-18-2006 12:3:6 pm => 2006-05-18T12:03:06
05-18-2006 1:33:46 => 2006-05-18T01:33:46
05-18-2006 1:33:46 am => 2006-05-18T01:33:46
05-18-2006 1:33:46 pm => 2006-05-18T13:33:46
05-18-2006 1:3:46 => 2006-05-18T01:03:46
05-18-2006 1:3:46 am => 2006-05-18T01:03:46
05-18-2006 1:3:46 pm => 2006-05-18T13:03:46
05-18-2006 1:3:6 => 2006-05-18T01:03:06
05-18-2006 1:3:6 am => 2006-05-18T01:03:06
05-18-2006 1:3:6 pm => 2006-05-18T13:03:06
05 18 2006 => 2006-05-18T00:00:00
05-18-2006 => 2006-05-18T00:00:00
05/18/2006 => 2006-05-18T00:00:00
05.18.2006 => 2006-05-18T00:00:00
05\18\2006 => 2006-05-18T00:00:00
05-8-06 12:33:46 => 2006-05-08T12:33:46
05-8-06 12:33:46 am => 2006-05-08T00:33:46
05-8-06 12:33:46 pm => 2006-05-08T12:33:46
05-8-06 12:3:46 => 2006-05-08T12:03:46
05-8-06 12:3:46 am => 2006-05-08T00:03:46
05-8-06 12:3:46 pm => 2006-05-08T12:03:46
05-8-06 12:3:6 => 2006-05-08T12:03:06
05-8-06 12:3:6 am => 2006-05-08T00:03:06
05-8-06 12:3:6 pm => 2006-05-08T12:03:06
05-8-06 1:33:46 => 2006-05-08T01:33:46
05-8-06 1:33:46 am => 2006-05-08T01:33:46
05-8-06 1:33:46 pm => 2006-05-08T13:33:46
05-8-06 1:3:46 => 2006-05-08T01:03:46
05-8-06 1:3:46 am => 2006-05-08T01:03:46
05-8-06 1:3:46 pm => 2006-05-08T13:03:46
05-8-06 1:3:6 => 2006-05-08T01:03:06
05-8-06 1:3:6 am => 2006-05-08T01:03:06
05-8-06 1:3:6 pm => 2006-05-08T13:03:06
05 8 06 => 2006-05-08T00:00:00
05-8-06 => 2006-05-08T00:00:00
05/8/06 => 2006-05-08T00:00:00
05.8.06 => 2006-05-08T00:00:00
05\8\06 => 2006-05-08T00:00:00
05-8-2006 12:33:46 => 2006-05-08T12:33:46
05-8-2006 12:33:46 am => 2006-05-08T00:33:46
05-8-2006 12:33:46 pm => 2006-05-08T12:33:46
05-8-2006 12:3:46 => 2006-05-08T12:03:46
05-8-2006 12:3:46 am => 2006-05-08T00:03:46
05-8-2006 12:3:46 pm => 2006-05-08T12:03:46
05-8-2006 12:3:6 => 2006-05-08T12:03:06
05-8-2006 12:3:6 am => 2006-05-08T00:03:06
05-8-2006 12:3:6 pm => 2006-05-08T12:03:06
05-8-2006 1:33:46 => 2006-05-08T01:33:46
05-8-2006 1:33:46 am => 2006-05-08T01:33:46
05-8-2006 1:33:46 pm => 2006-05-08T13:33:46
05-8-2006 1:3:46 => 2006-05-08T01:03:46
05-8-2006 1:3:46 am => 2006-05-08T01:03:46
05-8-2006 1:3:46 pm => 2006-05-08T13:03:46
05-8-2006 1:3:6 => 2006-05-08T01:03:06
05-8-2006 1:3:6 am => 2006-05-08T01:03:06
05-8-2006 1:3:6 pm => 2006-05-08T13:03:06
05 8 2006 => 2006-05-08T00:00:00
05-8-2006 => 2006-05-08T00:00:00
05/8/2006 => 2006-05-08T00:00:00
05.8.2006 => 2006-05-08T00:00:00
05\8\2006 => 2006-05-08T00:00:00
07/01/2007  10:00 AM => 2007-07-01T10:00:00
08-Jan-1999 12:33:46 => 1999-01-08T12:33:46
08-Jan-1999 12:33:46 am => 1999-01-08T00:33:46
08-Jan-1999 12:33:46 pm => 1999-01-08T12:33:46
08-Jan-1999 12:3:46 => 1999-01-08T12:03:46
08-Jan-1999 12:3:46 am => 1999-01-08T00:03:46
08-Jan-1999 12:3:46 pm => 1999-01-08T12:03:46
08-Jan-1999 12:3:6 => 1999-01-08T12:03:06
08-Jan-1999 12:3:6 am => 1999-01-08T00:03:06
08-Jan-1999 12:3:6 pm => 1999-01-08T12:03:06
08-Jan-1999 1:33:46 => 1999-01-08T01:33:46
08-Jan-1999 1:33:46 am => 1999-01-08T01:33:46
08-Jan-1999 1:33:46 pm => 1999-01-08T13:33:46
08-Jan-1999 1:3:46 => 1999-01-08T01:03:46
08-Jan-1999 1:3:46 am => 1999-01-08T01:03:46
08-Jan-1999 1:3:46 pm => 1999-01-08T13:03:46
08-Jan-1999 1:3:6 => 1999-01-08T01:03:06
08-Jan-1999 1:3:6 am => 1999-01-08T01:03:06
08-Jan-1999 1:3:6 pm => 1999-01-08T13:03:06
08 Jan 1999 => 1999-01-08T00:00:00
08-Jan-1999 => 1999-01-08T00:00:00
08/Jan/1999 => 1999-01-08T00:00:00
08.Jan.1999 => 1999-01-08T00:00:00
08\Jan\1999 => 1999-01-08T00:00:00
08-Jan-99 12:33:46 => 1999-01-08T12:33:46
08-Jan-99 12:33:46 am => 1999-01-08T00:33:46
08-Jan-99 12:33:46 pm => 1999-01-08T12:33:46
08-Jan-99 12:3:46 => 1999-01-08T12:03:46
08-Jan-99 12:3:46 am => 1999-01-08T00:03:46
08-Jan-99 12:3:46 pm => 1999-01-08T12:03:46
08-Jan-99 12:3:6 => 1999-01-08T12:03:06
08-Jan-99 12:3:6 am => 1999-01-08T00:03:06
08-Jan-99 12:3:6 pm => 1999-01-08T12:03:06
08-Jan-99 1:33:46 => 1999-01-08T01:33:46
08-Jan-99 1:33:46 am => 1999-01-08T01:33:46
08-Jan-99 1:33:46 pm => 1999-01-08T13:33:46
08-Jan-99 1:3:46 => 1999-01-08T01:03:46
08-Jan-99 1:3:46 am => 1999-01-08T01:03:46
08-Jan-99 1:3:46 pm => 1999-01-08T13:03:46
08-Jan-99 1:3:6 => 1999-01-08T01:03:06
08-Jan-99 1:3:6 am => 1999-01-08T01:03:06
08-Jan-99 1:3:6 pm => 1999-01-08T13:03:06
08 Jan 99 => 1999-01-08T00:00:00
08-Jan-99 => 1999-01-08T00:00:00
08/Jan/99 => 1999-01-08T00:00:00
08.Jan.99 => 1999-01-08T00:00:00
08\Jan\99 => 1999-01-08T00:00:00
10-18-6 12:33:46 => 2006-10-18T12:33:46
10-18-6 12:33:46 am => 2006-10-18T00:33:46
10-18-6 12:33:46 pm => 2006-10-18T12:33:46
10-18-6 12:3:46 => 2006-10-18T12:03:46
10-18-6 12:3:46 am => 2006-10-18T00:03:46
10-18-6 12:3:46 pm => 2006-10-18T12:03:46
10-18-6 12:3:6 => 2006-10-18T12:03:06
10-18-6 12:3:6 am => 2006-10-18T00:03:06
10-18-6 12:3:6 pm => 2006-10-18T12:03:06
10-18-6 1:33:46 => 2006-10-18T01:33:46
10-18-6 1:33:46 am => 2006-10-18T01:33:46
10-18-6 1:33:46 pm => 2006-10-18T13:33:46
10-18-6 1:3:46 => 2006-10-18T01:03:46
10-18-6 1:3:46 am => 2006-10-18T01:03:46
10-18-6 1:3:46 pm => 2006-10-18T13:03:46
10-18-6 1:3:6 => 2006-10-18T01:03:06
10-18-6 1:3:6 am => 2006-10-18T01:03:06
10-18-6 1:3:6 pm => 2006-10-18T13:03:06
10 18 6 => 2006-10-18T00:00:00
10-18-6 => 2006-10-18T00:00:00
10/18/6 => 2006-10-18T00:00:00
10.18.6 => 2006-10-18T00:00:00
10\18\6 => 2006-10-18T00:00:00
10-8-6 12:33:46 => 2006-10-08T12:33:46
10-8-6 12:33:46 am => 2006-10-08T00:33:46
10-8-6 12:33:46 pm => 2006-10-08T12:33:46
10-8-6 12:3:46 => 2006-10-08T12:03:46
10-8-6 12:3:46 am => 2006-10-08T00:03:46
10-8-6 12:3:46 pm => 2006-10-08T12:03:46
10-8-6 12:3:6 => 2006-10-08T12:03:06
10-8-6 12:3:6 am => 2006-10-08T00:03:06
10-8-6 12:3:6 pm => 2006-10-08T12:03:06
10-8-6 1:33:46 => 2006-10-08T01:33:46
10-8-6 1:33:46 am => 2006-10-08T01:33:46
10-8-6 1:33:46 pm => 2006-10-08T13:33:46
10-8-6 1:3:46 => 2006-10-08T01:03:46
10-8-6 1:3:46 am => 2006-10-08T01:03:46
10-8-6 1:3:46 pm => 2006-10-08T13:03:46
10-8-6 1:3:6 => 2006-10-08T01:03:06
10-8-6 1:3:6 am => 2006-10-08T01:03:06
10-8-6 1:3:6 pm => 2006-10-08T13:03:06
10 8 6 => 2006-10-08T00:00:00
10-8-6 => 2006-10-08T00:00:00
10/8/6 => 2006-10-08T00:00:00
10.8.6 => 2006-10-08T00:00:00
10\8\6 => 2006-10-08T00:00:00
10-Dec-1965 5:30:25 => 1965-12-10T05:30:25
10 December 1999 12:33:46 => 1999-12-10T12:33:46
10 December 1999 12:33:46 am => 1999-12-10T00:33:46
10 December 1999 12:33:46 pm => 1999-12-10T12:33:46
10 December 1999 12:3:46 => 1999-12-10T12:03:46
10 December 1999 12:3:46 am => 1999-12-10T00:03:46
10 December 1999 12:3:46 pm => 1999-12-10T12:03:46
10 December 1999 12:3:6 => 1999-12-10T12:03:06
10 December 1999 12:3:6 am => 1999-12-10T00:03:06
10 December 1999 12:3:6 pm => 1999-12-10T12:03:06
10 December 1999 1:33:46 => 1999-12-10T01:33:46
10 December 1999 1:33:46 am => 1999-12-10T01:33:46
10 December 1999 1:33:46 pm => 1999-12-10T13:33:46
10 December 1999 1:3:46 => 1999-12-10T01:03:46
10 December 1999 1:3:46 am => 1999-12-10T01:03:46
10 December 1999 1:3:46 pm => 1999-12-10T13:03:46
10 December 1999 1:3:6 => 1999-12-10T01:03:06
10 December 1999 1:3:6 am => 1999-12-10T01:03:06
10 December 1999 1:3:6 pm => 1999-12-10T13:03:06
10/December/65 => 2065-12-10T00:00:00
10-December-65 5:30:25 => 2065-12-10T05:30:25
10/December/65 5:30:25 => 2065-12-10T05:30:25
1/1/0 12:33:46 => 2000-01-01T12:33:46
1/1/0 12:33:46 am => 2000-01-01T00:33:46
1/1/0 12:33:46 pm => 2000-01-01T12:33:46
1/1/0 12:3:46 => 2000-01-01T12:03:46
1/1/0 12:3:46 am => 2000-01-01T00:03:46
1/1/0 12:3:46 pm => 2000-01-01T12:03:46
1/1/0 12:3:6 => 2000-01-01T12:03:06
1/1/0 12:3:6 am => 2000-01-01T00:03:06
1/1/0 12:3:6 pm => 2000-01-01T12:03:06
1/1/0 1:33:46 => 2000-01-01T01:33:46
1/1/0 1:33:46 am => 2000-01-01T01:33:46
1/1/0 1:33:46 pm => 2000-01-01T13:33:46
1/1/0 1:3:46 => 2000-01-01T01:03:46
1/1/0 1:3:46 am => 2000-01-01T01:03:46
1/1/0 1:3:46 pm => 2000-01-01T13:03:46
1/1/0 1:3:6 => 2000-01-01T01:03:06
1/1/0 1:3:6 am => 2000-01-01T01:03:06
1/1/0 1:3:6 pm => 2000-01-01T13:03:06
11-12-13 => 2013-11-12T00:00:00
11.16.03 12:33:46 => 2003-11-16T12:33:46
11.16.03 12:33:46 am => 2003-11-16T00:33:46
11.16.03 12:33:46 pm => 2003-11-16T12:33:46
11.16.03 12:3:46 => 2003-11-16T12:03:46
11.16.03 12:3:46 am => 2003-11-16T00:03:46
11.16.03 12:3:46 pm => 2003-11-16T12:03:46
11.16.03 12:3:6 => 2003-11-16T12:03:06
11.16.03 12:3:6 am => 2003-11-16T00:03:06
11.16.03 12:3:6 pm => 2003-11-16T12:03:06
11.16.03 1:33:46 => 2003-11-16T01:33:46
11.16.03 1:33:46 am => 2003-11-16T01:33:46
11.16.03 1:33:46 pm => 2003-11-16T13:33:46
11.16.03 1:3:46 => 2003-11-16T01:03:46
11.16.03 1:3:46 am => 2003-11-16T01:03:46
11.16.03 1:3:46 pm => 2003-11-16T13:03:46
11.16.03 1:3:6 => 2003-11-16T01:03:06
11.16.03 1:3:6 am => 2003-11-16T01:03:06
11.16.03 1:3:6 pm => 2003-11-16T13:03:06
11-16-2003 12:33:46 => 2003-11-16T12:33:46
11/16/2003 12:33:46 => 2003-11-16T12:33:46
11.16.2003 12:33:46 => 2003-11-16T12:33:46
11-16-2003 12:33:46 am => 2003-11-16T00:33:46
11/16/2003 12:33:46 am => 2003-11-16T00:33:46
11.16.2003 12:33:46 am => 2003-11-16T00:33:46
11-16-2003 12:33:46 pm => 2003-11-16T12:33:46
11/16/2003 12:33:46 pm => 2003-11-16T12:33:46
11.16.2003 12:33:46 pm => 2003-11-16T12:33:46
11-16-2003 12:3:46 => 2003-11-16T12:03:46
11/16/2003 12:3:46 => 2003-11-16T12:03:46
11.16.2003 12:3:46 => 2003-11-16T12:03:46
11-16-2003 12:3:46 am => 2003-11-16T00:03:46
11/16/2003 12:3:46 am => 2003-11-16T00:03:46
11.16.2003 12:3:46 am => 2003-11-16T00:03:46
11-16-2003 12:3:46 pm => 2003-11-16T12:03:46
11/16/2003 12:3:46 pm => 2003-11-16T12:03:46
11.16.2003 12:3:46 pm => 2003-11-16T12:03:46
11-16-2003 12:3:6 => 2003-11-16T12:03:06
11/16/2003 12:3:6 => 2003-11-16T12:03:06
11.16.2003 12:3:6 => 2003-11-16T12:03:06
11-16-2003 12:3:6 am => 2003-11-16T00:03:06
11/16/2003 12:3:6 am => 2003-11-16T00:03:06
11.16.2003 12:3:6 am => 2003-11-16T00:03:06
11-16-2003 12:3:6 pm => 2003-11-16T12:03:06
11/16/2003 12:3:6 pm => 2003-11-16T12:03:06
11.16.2003 12:3:6 pm => 2003-11-16T12:03:06
11-16-2003 1:33:46 => 2003-11-16T01:33:46
11/16/2003 1:33:46 => 2003-11-16T01:33:46
11.16.2003 1:33:46 => 2003-11-16T01:33:46
11-16-2003 1:33:46 am => 2003-11-16T01:33:46
11/16/2003 1:33:46 am => 2003-11-16T01:33:46
11.16.2003 1:33:46 am => 2003-11-16T01:33:46
11-16-2003 1:33:46 pm => 2003-11-16T13:33:46
11/16/2003 1:33:46 pm => 2003-11-16T13:33:46
11.16.2003 1:33:46 pm => 2003-11-16T13:33:46
11-16-2003 1:3:46 => 2003-11-16T01:03:46
11/16/2003 1:3:46 => 2003-11-16T01:03:46
11.16.2003 1:3:46 => 2003-11-16T01:03:46
11-16-2003 1:3:46 am => 2003-11-16T01:03:46
11/16/2003 1:3:46 am => 2003-11-16T01:03:46
11.16.2003 1:3:46 am => 2003-11-16T01:03:46
11-16-2003 1:3:46 pm => 2003-11-16T13:03:46
11/16/2003 1:3:46 pm => 2003-11-16T13:03:46
11.16.2003 1:3:46 pm => 2003-11-16T13:03:46
11-16-2003 1:3:6 => 2003-11-16T01:03:06
11/16/2003 1:3:6 => 2003-11-16T01:03:06
11.16.2003 1:3:6 => 2003-11-16T01:03:06
11-16-2003 1:3:6 am => 2003-11-16T01:03:06
11/16/2003 1:3:6 am => 2003-11-16T01:03:06
11.16.2003 1:3:6 am => 2003-11-16T01:03:06
11-16-2003 1:3:6 pm => 2003-11-16T13:03:06
11/16/2003 1:3:6 pm => 2003-11-16T13:03:06
11.16.2003 1:3:6 pm => 2003-11-16T13:03:06
1-18-1999 12:33:46 => 1999-01-18T12:33:46
1-18-1999 12:33:46 am => 1999-01-18T00:33:46
1-18-1999 12:33:46 pm => 1999-01-18T12:33:46
1-18-1999 12:3:46 => 1999-01-18T12:03:46
1-18-1999 12:3:46 am => 1999-01-18T00:03:46
1-18-1999 12:3:46 pm => 1999-01-18T12:03:46
1-18-1999 12:3:6 => 1999-01-18T12:03:06
1-18-1999 12:3:6 am => 1999-01-18T00:03:06
1-18-1999 12:3:6 pm => 1999-01-18T12:03:06
1-18-1999 1:33:46 => 1999-01-18T01:33:46
1-18-1999 1:33:46 am => 1999-01-18T01:33:46
1-18-1999 1:33:46 pm => 1999-01-18T13:33:46
1-18-1999 1:3:46 => 1999-01-18T01:03:46
1-18-1999 1:3:46 am => 1999-01-18T01:03:46
1-18-1999 1:3:46 pm => 1999-01-18T13:03:46
1-18-1999 1:3:6 => 1999-01-18T01:03:06
1-18-1999 1:3:6 am => 1999-01-18T01:03:06
1-18-1999 1:3:6 pm => 1999-01-18T13:03:06
1 18 1999 => 1999-01-18T00:00:00
1-18-1999 => 1999-01-18T00:00:00
1/18/1999 => 1999-01-18T00:00:00
1.18.1999 => 1999-01-18T00:00:00
1\18\1999 => 1999-01-18T00:00:00
12/10/1965 => 1965-12-10T00:00:00
12-10-1965 5:30:25 => 1965-12-10T05:30:25
12 10 65 => 2065-12-10T00:00:00
12/10/65 => 2065-12-10T00:00:00
12.10.65 => 2065-12-10T00:00:00
12-10-65 5:30:25 => 2065-12-10T05:30:25
12/10/65 5:30:25 => 2065-12-10T05:30:25
12-10-65 at 5:30:25 => 2065-12-10T05:30:25
12/10/65 at 5:30:25 => 2065-12-10T05:30:25
1221753628 => 2008-09-18T16:00:28
1221753628.79859 => 2008-09-18T16:00:28
12-25-1998 12:33:46 => 1998-12-25T12:33:46
12/25/1998 12:33:46 => 1998-12-25T12:33:46
12-25-1998 12:33:46 am => 1998-12-25T00:33:46
12/25/1998 12:33:46 am => 1998-12-25T00:33:46
12-25-1998 12:33:46 pm => 1998-12-25T12:33:46
12/25/1998 12:33:46 pm => 1998-12-25T12:33:46
12-25-1998 12:3:46 => 1998-12-25T12:03:46
12/25/1998 12:3:46 => 1998-12-25T12:03:46
12-25-1998 12:3:46 am => 1998-12-25T00:03:46
12/25/1998 12:3:46 am => 1998-12-25T00:03:46
12-25-1998 12:3:46 pm => 1998-12-25T12:03:46
12/25/1998 12:3:46 pm => 1998-12-25T12:03:46
12-25-1998 12:3:6 => 1998-12-25T12:03:06
12/25/1998 12:3:6 => 1998-12-25T12:03:06
12-25-1998 12:3:6 am => 1998-12-25T00:03:06
12/25/1998 12:3:6 am => 1998-12-25T00:03:06
12-25-1998 12:3:6 pm => 1998-12-25T12:03:06
12/25/1998 12:3:6 pm => 1998-12-25T12:03:06
12-25-1998 1:33:46 => 1998-12-25T01:33:46
12/25/1998 1:33:46 => 1998-12-25T01:33:46
12-25-1998 1:33:46 am => 1998-12-25T01:33:46
12/25/1998 1:33:46 am => 1998-12-25T01:33:46
12-25-1998 1:33:46 pm => 1998-12-25T13:33:46
12/25/1998 1:33:46 pm => 1998-12-25T13:33:46
12-25-1998 1:3:46 => 1998-12-25T01:03:46
12/25/1998 1:3:46 => 1998-12-25T01:03:46
12-25-1998 1:3:46 am => 1998-12-25T01:03:46
12/25/1998 1:3:46 am => 1998-12-25T01:03:46
12-25-1998 1:3:46 pm => 1998-12-25T13:03:46
12/25/1998 1:3:46 pm => 1998-12-25T13:03:46
12-25-1998 1:3:6 => 1998-12-25T01:03:06
12/25/1998 1:3:6 => 1998-12-25T01:03:06
12-25-1998 1:3:6 am => 1998-12-25T01:03:06
12/25/1998 1:3:6 am => 1998-12-25T01:03:06
12-25-1998 1:3:6 pm => 1998-12-25T13:03:06
12/25/1998 1:3:6 pm => 1998-12-25T13:03:06
12/25/98 12:33:46 => 1998-12-25T12:33:46
12/25/98 12:33:46 am => 1998-12-25T00:33:46
12/25/98 12:33:46 pm => 1998-12-25T12:33:46
12/25/98 12:3:46 => 1998-12-25T12:03:46
12/25/98 12:3:46 am => 1998-12-25T00:03:46
12/25/98 12:3:46 pm => 1998-12-25T12:03:46
12/25/98 12:3:6 => 1998-12-25T12:03:06
12/25/98 12:3:6 am => 1998-12-25T00:03:06
12/25/98 12:3:6 pm => 1998-12-25T12:03:06
12/25/98 1:33:46 => 1998-12-25T01:33:46
12/25/98 1:33:46 am => 1998-12-25T01:33:46
12/25/98 1:33:46 pm => 1998-12-25T13:33:46
12/25/98 1:3:46 => 1998-12-25T01:03:46
12/25/98 1:3:46 am => 1998-12-25T01:03:46
12/25/98 1:3:46 pm => 1998-12-25T13:03:46
12/25/98 1:3:6 => 1998-12-25T01:03:06
12/25/98 1:3:6 am => 1998-12-25T01:03:06
12/25/98 1:3:6 pm => 1998-12-25T13:03:06
12/30/06 12:33:46 => 2006-12-30T12:33:46
12/30/06 12:33:46 am => 2006-12-30T00:33:46
12/30/06 12:33:46 pm => 2006-12-30T12:33:46
12/30/06 12:3:46 => 2006-12-30T12:03:46
12/30/06 12:3:46 am => 2006-12-30T00:03:46
12/30/06 12:3:46 pm => 2006-12-30T12:03:46
12/30/06 12:3:6 => 2006-12-30T12:03:06
12/30/06 12:3:6 am => 2006-12-30T00:03:06
12/30/06 12:3:6 pm => 2006-12-30T12:03:06
12/30/06 1:33:46 => 2006-12-30T01:33:46
12/30/06 1:33:46 am => 2006-12-30T01:33:46
12/30/06 1:33:46 pm => 2006-12-30T13:33:46
12/30/06 1:3:46 => 2006-12-30T01:03:46
12/30/06 1:3:46 am => 2006-12-30T01:03:46
12/30/06 1:3:46 pm => 2006-12-30T13:03:46
12/30/06 1:3:6 => 2006-12-30T01:03:06
12/30/06 1:3:6 am => 2006-12-30T01:03:06
12/30/06 1:3:6 pm => 2006-12-30T13:03:06
12:30 Dec 12th 1880 => 1880-12-12T12:30:00
12:30 Dec 12TH 1880 => 1880-12-12T12:30:00
13 Oct 94 10:13:13 => 1994-10-13T10:13:13
16 Jun 94 07:29:35 => 1994-06-16T07:29:35
16 Nov 2003 12:33:46 => 2003-11-16T12:33:46
16 Nov 2003 12:33:46 am => 2003-11-16T00:33:46
16 Nov 2003 12:33:46 pm => 2003-11-16T12:33:46
16 Nov 2003 12:3:46 => 2003-11-16T12:03:46
16 Nov 2003 12:3:46 am => 2003-11-16T00:03:46
16 Nov 2003 12:3:46 pm => 2003-11-16T12:03:46
16 Nov 2003 12:3:6 => 2003-11-16T12:03:06
16 Nov 2003 12:3:6 am => 2003-11-16T00:03:06
16 Nov 2003 12:3:6 pm => 2003-11-16T12:03:06
16 Nov 2003 1:33:46 => 2003-11-16T01:33:46
16 Nov 2003 1:33:46 am => 2003-11-16T01:33:46
16 Nov 2003 1:33:46 pm => 2003-11-16T13:33:46
16 Nov 2003 1:3:46 => 2003-11-16T01:03:46
16 Nov 2003 1:3:46 am => 2003-11-16T01:03:46
16 Nov 2003 1:3:46 pm => 2003-11-16T13:03:46
16 Nov 2003 1:3:6 => 2003-11-16T01:03:06
16 Nov 2003 1:3:6 am => 2003-11-16T01:03:06
16 Nov 2003 1:3:6 pm => 2003-11-16T13:03:06
16 Nov 94 22:28:20 => 1994-11-16T22:28:20
16 November 2003 12:33:46 => 2003-11-16T12:33:46
16 November 2003 12:33:46 am => 2003-11-16T00:33:46
16 November 2003 12:33:46 pm => 2003-11-16T12:33:46
16 November 2003 12:3:46 => 2003-11-16T12:03:46
16 November 2003 12:3:46 am => 2003-11-16T00:03:46
16 November 2003 12:3:46 pm => 2003-11-16T12:03:46
16 November 2003 12:3:6 => 2003-11-16T12:03:06
16 November 2003 12:3:6 am => 2003-11-16T00:03:06
16 November 2003 12:3:6 pm => 2003-11-16T12:03:06
16 November 2003 1:33:46 => 2003-11-16T01:33:46
16 November 2003 1:33:46 am => 2003-11-16T01:33:46
16 November 2003 1:33:46 pm => 2003-11-16T13:33:46
16 November 2003 1:3:46 => 2003-11-16T01:03:46
16 November 2003 1:3:46 am => 2003-11-16T01:03:46
16 November 2003 1:3:46 pm => 2003-11-16T13:03:46
16 November 2003 1:3:6 => 2003-11-16T01:03:06
16 November 2003 1:3:6 am => 2003-11-16T01:03:06
16 November 2003 1:3:6 pm => 2003-11-16T13:03:06
16th November 2003 12:33:46 => 2003-11-16T12:33:46
16th November 2003 12:33:46 am => 2003-11-16T00:33:46
16th November 2003 12:33:46 pm => 2003-11-16T12:33:46
16th November 2003 12:3:46 => 2003-11-16T12:03:46
16th November 2003 12:3:46 am => 2003-11-16T00:03:46
16th November 2003 12:3:46 pm => 2003-11-16T12:03:46
16th November 2003 12:3:6 => 2003-11-16T12:03:06
16th November 2003 12:3:6 am => 2003-11-16T00:03:06
16th November 2003 12:3:6 pm => 2003-11-16T12:03:06
16th November 2003 1:33:46 => 2003-11-16T01:33:46
16th November 2003 1:33:46 am => 2003-11-16T01:33:46
16th November 2003 1:33:46 pm => 2003-11-16T13:33:46
16th November 2003 1:3:46 => 2003-11-16T01:03:46
16th November 2003 1:3:46 am => 2003-11-16T01:03:46
16th November 2003 1:3:46 pm => 2003-11-16T13:03:46
16th November 2003 1:3:6 => 2003-11-16T01:03:06
16th November 2003 1:3:6 am => 2003-11-16T01:03:06
16th November 2003 1:3:6 pm => 2003-11-16T13:03:06
16th of November 2003 12:33:46 => 2003-11-16T12:33:46
16th of November 2003 12:33:46 am => 2003-11-16T00:33:46
16th of November 2003 12:33:46 pm => 2003-11-16T12:33:46
16th of November 2003 12:3:46 => 2003-11-16T12:03:46
16th of November 2003 12:3:46 am => 2003-11-16T00:03:46
16th of November 2003 12:3:46 pm => 2003-11-16T12:03:46
16th of November 2003 12:3:6 => 2003-11-16T12:03:06
16th of November 2003 12:3:6 am => 2003-11-16T00:03:06
16th of November 2003 12:3:6 pm => 2003-11-16T12:03:06
16th of November 2003 1:33:46 => 2003-11-16T01:33:46
16th of November 2003 1:33:46 am => 2003-11-16T01:33:46
16th of November 2003 1:33:46 pm => 2003-11-16T13:33:46
16th of November 2003 1:3:46 => 2003-11-16T01:03:46
16th of November 2003 1:3:46 am => 2003-11-16T01:03:46
16th of November 2003 1:3:46 pm => 2003-11-16T13:03:46
16th of November 2003 1:3:6 => 2003-11-16T01:03:06
16th of November 2003 1:3:6 am => 2003-11-16T01:03:06
16th of November 2003 1:3:6 pm => 2003-11-16T13:03:06
17 Nov 1858 12:33:46 => 1858-11-17T12:33:46
17 Nov 1858 12:33:46 am => 1858-11-17T00:33:46
17 Nov 1858 12:33:46 pm => 1858-11-17T12:33:46
17 Nov 1858 12:3:46 => 1858-11-17T12:03:46
17 Nov 1858 12:3:46 am => 1858-11-17T00:03:46
17 Nov 1858 12:3:46 pm => 1858-11-17T12:03:46
17 Nov 1858 12:3:6 => 1858-11-17T12:03:06
17 Nov 1858 12:3:6 am => 1858-11-17T00:03:06
17 Nov 1858 12:3:6 pm => 1858-11-17T12:03:06
17 Nov 1858 1:33:46 => 1858-11-17T01:33:46
17 Nov 1858 1:33:46 am => 1858-11-17T01:33:46
17 Nov 1858 1:33:46 pm => 1858-11-17T13:33:46
17 Nov 1858 1:3:46 => 1858-11-17T01:03:46
17 Nov 1858 1:3:46 am => 1858-11-17T01:03:46
17 Nov 1858 1:3:46 pm => 1858-11-17T13:03:46
17 Nov 1858 1:3:6 => 1858-11-17T01:03:06
17 Nov 1858 1:3:6 am => 1858-11-17T01:03:06
17 Nov 1858 1:3:6 pm => 1858-11-17T13:03:06
1-8-1999 12:33:46 => 1999-01-08T12:33:46
1-8-1999 12:33:46 am => 1999-01-08T00:33:46
1-8-1999 12:33:46 pm => 1999-01-08T12:33:46
1-8-1999 12:3:46 => 1999-01-08T12:03:46
1-8-1999 12:3:46 am => 1999-01-08T00:03:46
1-8-1999 12:3:46 pm => 1999-01-08T12:03:46
1-8-1999 12:3:6 => 1999-01-08T12:03:06
1-8-1999 12:3:6 am => 1999-01-08T00:03:06
1-8-1999 12:3:6 pm => 1999-01-08T12:03:06
1-8-1999 1:33:46 => 1999-01-08T01:33:46
1-8-1999 1:33:46 am => 1999-01-08T01:33:46
1-8-1999 1:33:46 pm => 1999-01-08T13:33:46
1-8-1999 1:3:46 => 1999-01-08T01:03:46
1-8-1999 1:3:46 am => 1999-01-08T01:03:46
1-8-1999 1:3:46 pm => 1999-01-08T13:03:46
1-8-1999 1:3:6 => 1999-01-08T01:03:06
1-8-1999 1:3:6 am => 1999-01-08T01:03:06
1-8-1999 1:3:6 pm => 1999-01-08T13:03:06
1 8 1999 => 1999-01-08T00:00:00
1-8-1999 => 1999-01-08T00:00:00
1/8/1999 => 1999-01-08T00:00:00
1.8.1999 => 1999-01-08T00:00:00
1\8\1999 => 1999-01-08T00:00:00
18-Dec-06 12:33:46 => 2006-12-18T12:33:46
18-Dec-06 12:33:46 am => 2006-12-18T00:33:46
18-Dec-06 12:33:46 pm => 2006-12-18T12:33:46
18-Dec-06 12:3:46 => 2006-12-18T12:03:46
18-Dec-06 12:3:46 am => 2006-12-18T00:03:46
18-Dec-06 12:3:46 pm => 2006-12-18T12:03:46
18-Dec-06 12:3:6 => 2006-12-18T12:03:06
18-Dec-06 12:3:6 am => 2006-12-18T00:03:06
18-Dec-06 12:3:6 pm => 2006-12-18T12:03:06
18-Dec-06 1:33:46 => 2006-12-18T01:33:46
18-Dec-06 1:33:46 am => 2006-12-18T01:33:46
18-Dec-06 1:33:46 pm => 2006-12-18T13:33:46
18-Dec-06 1:3:46 => 2006-12-18T01:03:46
18-Dec-06 1:3:46 am => 2006-12-18T01:03:46
18-Dec-06 1:3:46 pm => 2006-12-18T13:03:46
18-Dec-06 1:3:6 => 2006-12-18T01:03:06
18-Dec-06 1:3:6 am => 2006-12-18T01:03:06
18-Dec-06 1:3:6 pm => 2006-12-18T13:03:06
18 Dec 06 => 2006-12-18T00:00:00
18-Dec-06 => 2006-12-18T00:00:00
18/Dec/06 => 2006-12-18T00:00:00
18.Dec.06 => 2006-12-18T00:00:00
18\Dec\06 => 2006-12-18T00:00:00
18-Dec-6 12:33:46 => 2006-12-18T12:33:46
18-Dec-6 12:33:46 am => 2006-12-18T00:33:46
18-Dec-6 12:33:46 pm => 2006-12-18T12:33:46
18-Dec-6 12:3:46 => 2006-12-18T12:03:46
18-Dec-6 12:3:46 am => 2006-12-18T00:03:46
18-Dec-6 12:3:46 pm => 2006-12-18T12:03:46
18-Dec-6 12:3:6 => 2006-12-18T12:03:06
18-Dec-6 12:3:6 am => 2006-12-18T00:03:06
18-Dec-6 12:3:6 pm => 2006-12-18T12:03:06
18-Dec-6 1:33:46 => 2006-12-18T01:33:46
18-Dec-6 1:33:46 am => 2006-12-18T01:33:46
18-Dec-6 1:33:46 pm => 2006-12-18T13:33:46
18-Dec-6 1:3:46 => 2006-12-18T01:03:46
18-Dec-6 1:3:46 am => 2006-12-18T01:03:46
18-Dec-6 1:3:46 pm => 2006-12-18T13:03:46
18-Dec-6 1:3:6 => 2006-12-18T01:03:06
18-Dec-6 1:3:6 am => 2006-12-18T01:03:06
18-Dec-6 1:3:6 pm => 2006-12-18T13:03:06
18 Dec 6 => 2006-12-18T00:00:00
18-Dec-6 => 2006-12-18T00:00:00
18/Dec/6 => 2006-12-18T00:00:00
18.Dec.6 => 2006-12-18T00:00:00
18\Dec\6 => 2006-12-18T00:00:00
18-Mar-06 12:33:46 => 2006-03-18T12:33:46
18-Mar-06 12:33:46 am => 2006-03-18T00:33:46
18-Mar-06 12:33:46 pm => 2006-03-18T12:33:46
18-Mar-06 12:3:46 => 2006-03-18T12:03:46
18-Mar-06 12:3:46 am => 2006-03-18T00:03:46
18-Mar-06 12:3:46 pm => 2006-03-18T12:03:46
18-Mar-06 12:3:6 => 2006-03-18T12:03:06
18-Mar-06 12:3:6 am => 2006-03-18T00:03:06
18-Mar-06 12:3:6 pm => 2006-03-18T12:03:06
18-Mar-06 1:33:46 => 2006-03-18T01:33:46
18-Mar-06 1:33:46 am => 2006-03-18T01:33:46
18-Mar-06 1:33:46 pm => 2006-03-18T13:33:46
18-Mar-06 1:3:46 => 2006-03-18T01:03:46
18-Mar-06 1:3:46 am => 2006-03-18T01:03:46
18-Mar-06 1:3:46 pm => 2006-03-18T13:03:46
18-Mar-06 1:3:6 => 2006-03-18T01:03:06
18-Mar-06 1:3:6 am => 2006-03-18T01:03:06
18-Mar-06 1:3:6 pm => 2006-03-18T13:03:06
18 Mar 06 => 2006-03-18T00:00:00
18-Mar-06 => 2006-03-18T00:00:00
18/Mar/06 => 2006-03-18T00:00:00
18.Mar.06 => 2006-03-18T00:00:00
18\Mar\06 => 2006-03-18T00:00:00
18-Mar-2006 12:33:46 => 2006-03-18T12:33:46
18-Mar-2006 12:33:46 am => 2006-03-18T00:33:46
18-Mar-2006 12:33:46 pm => 2006-03-18T12:33:46
18-Mar-2006 12:3:46 => 2006-03-18T12:03:46
18-Mar-2006 12:3:46 am => 2006-03-18T00:03:46
18-Mar-2006 12:3:46 pm => 2006-03-18T12:03:46
18-Mar-2006 12:3:6 => 2006-03-18T12:03:06
18-Mar-2006 12:3:6 am => 2006-03-18T00:03:06
18-Mar-2006 12:3:6 pm => 2006-03-18T12:03:06
18-Mar-2006 1:33:46 => 2006-03-18T01:33:46
18-Mar-2006 1:33:46 am => 2006-03-18T01:33:46
18-Mar-2006 1:33:46 pm => 2006-03-18T13:33:46
18-Mar-2006 1:3:46 => 2006-03-18T01:03:46
18-Mar-2006 1:3:46 am => 2006-03-18T01:03:46
18-Mar-2006 1:3:46 pm => 2006-03-18T13:03:46
18-Mar-2006 1:3:6 => 2006-03-18T01:03:06
18-Mar-2006 1:3:6 am => 2006-03-18T01:03:06
18-Mar-2006 1:3:6 pm => 2006-03-18T13:03:06
18 Mar 2006 => 2006-03-18T00:00:00
18-Mar-2006 => 2006-03-18T00:00:00
18/Mar/2006 => 2006-03-18T00:00:00
18.Mar.2006 => 2006-03-18T00:00:00
18\Mar\2006 => 2006-03-18T00:00:00
1965120100:00:00 => 1965-12-01T00:00:00
1965121004:50:54 => 1965-12-10T04:50:54
1965121005:30:25 => 1965-12-10T05:30:25
1965121012:00:00 => 1965-12-10T12:00:00
1965121012:30:00 => 1965-12-10T12:30:00
1965121017:30:00 => 1965-12-10T17:30:00
1970010510:06:40 => 1970-01-05T10:06:40
1975-12-29 12:33:46 => 1975-12-29T12:33:46
1975-12-29 12:33:46 am => 1975-12-29T00:33:46
1975-12-29 12:33:46 pm => 1975-12-29T12:33:46
1975-12-29 12:3:46 => 1975-12-29T12:03:46
1975-12-29 12:3:46 am => 1975-12-29T00:03:46
1975-12-29 12:3:46 pm => 1975-12-29T12:03:46
1975-12-29 12:3:6 => 1975-12-29T12:03:06
1975-12-29 12:3:6 am => 1975-12-29T00:03:06
1975-12-29 12:3:6 pm => 1975-12-29T12:03:06
1975-12-29 1:33:46 => 1975-12-29T01:33:46
1975-12-29 1:33:46 am => 1975-12-29T01:33:46
1975-12-29 1:33:46 pm => 1975-12-29T13:33:46
1975-12-29 1:3:46 => 1975-12-29T01:03:46
1975-12-29 1:3:46 am => 1975-12-29T01:03:46
1975-12-29 1:3:46 pm => 1975-12-29T13:03:46
1975-12-29 1:3:6 => 1975-12-29T01:03:06
1975-12-29 1:3:6 am => 1975-12-29T01:03:06
1975-12-29 1:3:6 pm => 1975-12-29T13:03:06
1977-01-02 12:33:46 => 1977-01-02T12:33:46
1977-01-02 12:33:46 am => 1977-01-02T00:33:46
1977-01-02 12:33:46 pm => 1977-01-02T12:33:46
1977-01-02 12:3:46 => 1977-01-02T12:03:46
1977-01-02 12:3:46 am => 1977-01-02T00:03:46
1977-01-02 12:3:46 pm => 1977-01-02T12:03:46
1977-01-02 12:3:6 => 1977-01-02T12:03:06
1977-01-02 12:3:6 am => 1977-01-02T00:03:06
1977-01-02 12:3:6 pm => 1977-01-02T12:03:06
1977-01-02 1:33:46 => 1977-01-02T01:33:46
1977-01-02 1:33:46 am => 1977-01-02T01:33:46
1977-01-02 1:33:46 pm => 1977-01-02T13:33:46
1977-01-02 1:3:46 => 1977-01-02T01:03:46
1977-01-02 1:3:46 am => 1977-01-02T01:03:46
1977-01-02 1:3:46 pm => 1977-01-02T13:03:46
1977-01-02 1:3:6 => 1977-01-02T01:03:06
1977-01-02 1:3:6 am => 1977-01-02T01:03:06
1977-01-02 1:3:6 pm => 1977-01-02T13:03:06
1980021100:00:00 => 1980-02-11T00:00:00
1980021200:00:00 => 1980-02-12T00:00:00
1980021400:00:00 => 1980-02-14T00:00:00
1980021500:00:00 => 1980-02-15T00:00:00
1980021600:00:00 => 1980-02-16T00:00:00
1980110100:00:00 => 1980-11-01T00:00:00
1981020900:00:00 => 1981-02-09T00:00:00
1981021000:00:00 => 1981-02-10T00:00:00
1981030100:00:00 => 1981-03-01T00:00:00
1981030200:00:00 => 1981-03-02T00:00:00
1981030900:00:00 => 1981-03-09T00:00:00
1981031000:00:00 => 1981-03-10T00:00:00
1981033000:00:00 => 1981-03-30T00:00:00
1982020800:00:00 => 1982-02-08T00:00:00
1982020900:00:00 => 1982-02-09T00:00:00
1982021400:00:00 => 1982-02-14T00:00:00
1982021500:00:00 => 1982-02-15T00:00:00
1982021600:00:00 => 1982-02-16T00:00:00
1982051000:00:00 => 1982-05-10T00:00:00
1982051100:00:00 => 1982-05-11T00:00:00
1982052400:00:00 => 1982-05-24T00:00:00
1982120100:00:00 => 1982-12-01T00:00:00
1983030100:00:00 => 1983-03-01T00:00:00
1983030200:00:00 => 1983-03-02T00:00:00
1983030700:00:00 => 1983-03-07T00:00:00
1983030800:00:00 => 1983-03-08T00:00:00
1983033000:00:00 => 1983-03-30T00:00:00
1984021400:00:00 => 1984-02-14T00:00:00
1984021500:00:00 => 1984-02-15T00:00:00
1984021600:00:00 => 1984-02-16T00:00:00
1985010100:00:00 => 1985-01-01T00:00:00
1985021100:00:00 => 1985-02-11T00:00:00
1985021200:00:00 => 1985-02-12T00:00:00
1985021800:00:00 => 1985-02-18T00:00:00
1985030100:00:00 => 1985-03-01T00:00:00
1985030200:00:00 => 1985-03-02T00:00:00
1985030500:00:00 => 1985-03-05T00:00:00
1985031100:00:00 => 1985-03-11T00:00:00
1985033000:00:00 => 1985-03-30T00:00:00
1985051300:00:00 => 1985-05-13T00:00:00
1985051400:00:00 => 1985-05-14T00:00:00
1985052000:00:00 => 1985-05-20T00:00:00
1986021400:00:00 => 1986-02-14T00:00:00
1986021500:00:00 => 1986-02-15T00:00:00
1986021600:00:00 => 1986-02-16T00:00:00
1987020100:00:00 => 1987-02-01T00:00:00
1987030100:00:00 => 1987-03-01T00:00:00
1987030200:00:00 => 1987-03-02T00:00:00
1987030900:00:00 => 1987-03-09T00:00:00
1987031000:00:00 => 1987-03-10T00:00:00
1987033000:00:00 => 1987-03-30T00:00:00
1988020900:00:00 => 1988-02-09T00:00:00
1988021400:00:00 => 1988-02-14T00:00:00
1988021500:00:00 => 1988-02-15T00:00:00
1988021600:00:00 => 1988-02-16T00:00:00
1988051000:00:00 => 1988-05-10T00:00:00
1989030100:00:00 => 1989-03-01T00:00:00
1989030200:00:00 => 1989-03-02T00:00:00
1989030600:00:00 => 1989-03-06T00:00:00
1989030700:00:00 => 1989-03-07T00:00:00
1989033000:00:00 => 1989-03-30T00:00:00
1990010100:00:00 => 1990-01-01T00:00:00
1990010112:30:00 => 1990-01-01T12:30:00
1990010113:30:00 => 1990-01-01T13:30:00
1990010114:30:00 => 1990-01-01T14:30:00
1990010115:30:00 => 1990-01-01T15:30:00
1990010116:30:00 => 1990-01-01T16:30:00
1990010117:30:00 => 1990-01-01T17:30:00
1990010118:30:00 => 1990-01-01T18:30:00
1990010119:30:00 => 1990-01-01T19:30:00
1990010120:30:00 => 1990-01-01T20:30:00
1990010121:30:00 => 1990-01-01T21:30:00
1990010122:30:00 => 1990-01-01T22:30:00
1990010123:30:00 => 1990-01-01T23:30:00
1990010200:30:00 => 1990-01-02T00:30:00
1990010201:30:00 => 1990-01-02T01:30:00
1990021400:00:00 => 1990-02-14T00:00:00
1992022905:30 => 1992-02-29T05:30:00
1993120105:30 => 1993-12-01T05:30:00
1993120105:30:25.05 am => 1993-12-01T05:30:25
1993120105:30:25:05 pM => 1993-12-01T17:30:25
1993120105:30:25 => 1993-12-01T05:30:25
1993120105:30:25 pM GMT => 1993-12-01T17:30:25 => UTC
1993120117:30:25 GMT => 1993-12-01T17:30:25
19931201 => 1993-12-01T00:00:00
19931201 at 05:30:25 pM GMT => 1993-12-01T17:30:25 => UTC
19931201at05:30:25 pM GMT => 1993-12-01T17:30:25 => UTC
1995-02-04 12:33:46 => 1995-02-04T12:33:46
19950204 12:33:46 => 1995-02-04T12:33:46
1995-02-04 12:33:46 am => 1995-02-04T00:33:46
19950204 12:33:46 am => 1995-02-04T00:33:46
1995-02-04 12:33:46 pm => 1995-02-04T12:33:46
19950204 12:33:46 pm => 1995-02-04T12:33:46
1995-02-04 12:3:46 => 1995-02-04T12:03:46
19950204 12:3:46 => 1995-02-04T12:03:46
1995-02-04 12:3:46 am => 1995-02-04T00:03:46
19950204 12:3:46 am => 1995-02-04T00:03:46
1995-02-04 12:3:46 pm => 1995-02-04T12:03:46
19950204 12:3:46 pm => 1995-02-04T12:03:46
1995-02-04 12:3:6 => 1995-02-04T12:03:06
19950204 12:3:6 => 1995-02-04T12:03:06
1995-02-04 12:3:6 am => 1995-02-04T00:03:06
19950204 12:3:6 am => 1995-02-04T00:03:06
1995-02-04 12:3:6 pm => 1995-02-04T12:03:06
19950204 12:3:6 pm => 1995-02-04T12:03:06
1995-02-04 1:33:46 => 1995-02-04T01:33:46
19950204 1:33:46 => 1995-02-04T01:33:46
1995-02-04 1:33:46 am => 1995-02-04T01:33:46
19950204 1:33:46 am => 1995-02-04T01:33:46
1995-02-04 1:33:46 pm => 1995-02-04T13:33:46
19950204 1:33:46 pm => 1995-02-04T13:33:46
1995-02-04 1:3:46 => 1995-02-04T01:03:46
19950204 1:3:46 => 1995-02-04T01:03:46
1995-02-04 1:3:46 am => 1995-02-04T01:03:46
19950204 1:3:46 am => 1995-02-04T01:03:46
1995-02-04 1:3:46 pm => 1995-02-04T13:03:46
19950204 1:3:46 pm => 1995-02-04T13:03:46
1995-02-04 1:3:6 => 1995-02-04T01:03:06
19950204 1:3:6 => 1995-02-04T01:03:06
1995-02-04 1:3:6 am => 1995-02-04T01:03:06
19950204 1:3:6 am => 1995-02-04T01:03:06
1995-02-04 1:3:6 pm => 1995-02-04T13:03:06
19950204 1:3:6 pm => 1995-02-04T13:03:06
1995-02-05 00:00 => 1995-02-05T00:00:00
1995-02 12:33:46 => 1995-02-01T12:33:46
1995-02 12:33:46 am => 1995-02-01T00:33:46
1995-02 12:33:46 pm => 1995-02-01T12:33:46
1995-02 12:3:46 => 1995-02-01T12:03:46
1995-02 12:3:46 am => 1995-02-01T00:03:46
1995-02 12:3:46 pm => 1995-02-01T12:03:46
1995-02 12:3:6 => 1995-02-01T12:03:06
1995-02 12:3:6 am => 1995-02-01T00:03:06
1995-02 12:3:6 pm => 1995-02-01T12:03:06
1995-02 1:33:46 => 1995-02-01T01:33:46
1995-02 1:33:46 am => 1995-02-01T01:33:46
1995-02 1:33:46 pm => 1995-02-01T13:33:46
1995-02 1:3:46 => 1995-02-01T01:03:46
1995-02 1:3:46 am => 1995-02-01T01:03:46
1995-02 1:3:46 pm => 1995-02-01T13:03:46
1995-02 1:3:6 => 1995-02-01T01:03:06
1995-02 1:3:6 am => 1995-02-01T01:03:06
1995-02 1:3:6 pm => 1995-02-01T13:03:06
1995-04-02 12:33:46 => 1995-04-02T12:33:46
1995-04-02 12:33:46 am => 1995-04-02T00:33:46
1995-04-02 12:33:46 pm => 1995-04-02T12:33:46
1995-04-02 12:3:46 => 1995-04-02T12:03:46
1995-04-02 12:3:46 am => 1995-04-02T00:03:46
1995-04-02 12:3:46 pm => 1995-04-02T12:03:46
1995-04-02 12:3:6 => 1995-04-02T12:03:06
1995-04-02 12:3:6 am => 1995-04-02T00:03:06
1995-04-02 12:3:6 pm => 1995-04-02T12:03:06
1995-04-02 1:33:46 => 1995-04-02T01:33:46
1995-04-02 1:33:46 am => 1995-04-02T01:33:46
1995-04-02 1:33:46 pm => 1995-04-02T13:33:46
1995-04-02 1:3:46 => 1995-04-02T01:03:46
1995-04-02 1:3:46 am => 1995-04-02T01:03:46
1995-04-02 1:3:46 pm => 1995-04-02T13:03:46
1995-04-02 1:3:6 => 1995-04-02T01:03:06
1995-04-02 1:3:6 am => 1995-04-02T01:03:06
1995-04-02 1:3:6 pm => 1995-04-02T13:03:06
1995-04-02 12:34 pm => 1995-04-02T12:34:00
1995-04-02 12:34 P.M. => 1995-04-02T12:34:00
1995-04-02 9:31 A.M. => 1995-04-02T09:31:00
19951231T235959 => 1995-12-31T23:59:59
1996-05 12:33:46 => 1996-05-01T12:33:46
1996-05 12:33:46 am => 1996-05-01T00:33:46
1996-05 12:33:46 pm => 1996-05-01T12:33:46
1996-05 12:3:46 => 1996-05-01T12:03:46
1996-05 12:3:46 am => 1996-05-01T00:03:46
1996-05 12:3:46 pm => 1996-05-01T12:03:46
1996-05 12:3:6 => 1996-05-01T12:03:06
1996-05 12:3:6 am => 1996-05-01T00:03:06
1996-05 12:3:6 pm => 1996-05-01T12:03:06
1996-05 1:33:46 => 1996-05-01T01:33:46
1996-05 1:33:46 am => 1996-05-01T01:33:46
1996-05 1:33:46 pm => 1996-05-01T13:33:46
1996-05 1:3:46 => 1996-05-01T01:03:46
1996-05 1:3:46 am => 1996-05-01T01:03:46
1996-05 1:3:46 pm => 1996-05-01T13:03:46
1996-05 1:3:6 => 1996-05-01T01:03:06
1996-05 1:3:6 am => 1996-05-01T01:03:06
1996-05 1:3:6 pm => 1996-05-01T13:03:06
1996061800:00:00 => 1996-06-18T00:00:00
1996061800:00 => 1996-06-18T00:00:00
1996-12-30 12:33:46 => 1996-12-30T12:33:46
1996-12-30 12:33:46 am => 1996-12-30T00:33:46
1996-12-30 12:33:46 pm => 1996-12-30T12:33:46
1996-12-30 12:3:46 => 1996-12-30T12:03:46
1996-12-30 12:3:46 am => 1996-12-30T00:03:46
1996-12-30 12:3:46 pm => 1996-12-30T12:03:46
1996-12-30 12:3:6 => 1996-12-30T12:03:06
1996-12-30 12:3:6 am => 1996-12-30T00:03:06
1996-12-30 12:3:6 pm => 1996-12-30T12:03:06
1996-12-30 1:33:46 => 1996-12-30T01:33:46
1996-12-30 1:33:46 am => 1996-12-30T01:33:46
1996-12-30 1:33:46 pm => 1996-12-30T13:33:46
1996-12-30 1:3:46 => 1996-12-30T01:03:46
1996-12-30 1:3:46 am => 1996-12-30T01:03:46
1996-12-30 1:3:46 pm => 1996-12-30T13:03:46
1996-12-30 1:3:6 => 1996-12-30T01:03:06
1996-12-30 1:3:6 am => 1996-12-30T01:03:06
1996-12-30 1:3:6 pm => 1996-12-30T13:03:06
1996-12-31 12:33:46 => 1996-12-31T12:33:46
1996-12-31 12:33:46 am => 1996-12-31T00:33:46
1996-12-31 12:33:46 pm => 1996-12-31T12:33:46
1996-12-31 12:3:46 => 1996-12-31T12:03:46
1996-12-31 12:3:46 am => 1996-12-31T00:03:46
1996-12-31 12:3:46 pm => 1996-12-31T12:03:46
1996-12-31 12:3:6 => 1996-12-31T12:03:06
1996-12-31 12:3:6 am => 1996-12-31T00:03:06
1996-12-31 12:3:6 pm => 1996-12-31T12:03:06
1996-12-31 1:33:46 => 1996-12-31T01:33:46
1996-12-31 1:33:46 am => 1996-12-31T01:33:46
1996-12-31 1:33:46 pm => 1996-12-31T13:33:46
1996-12-31 1:3:46 => 1996-12-31T01:03:46
1996-12-31 1:3:46 am => 1996-12-31T01:03:46
1996-12-31 1:3:46 pm => 1996-12-31T13:03:46
1996-12-31 1:3:6 => 1996-12-31T01:03:06
1996-12-31 1:3:6 am => 1996-12-31T01:03:06
1996-12-31 1:3:6 pm => 1996-12-31T13:03:06
1997-01-05 12:33:46 => 1997-01-05T12:33:46
1997-01-05 12:33:46 am => 1997-01-05T00:33:46
1997-01-05 12:33:46 pm => 1997-01-05T12:33:46
1997-01-05 12:3:46 => 1997-01-05T12:03:46
1997-01-05 12:3:46 am => 1997-01-05T00:03:46
1997-01-05 12:3:46 pm => 1997-01-05T12:03:46
1997-01-05 12:3:6 => 1997-01-05T12:03:06
1997-01-05 12:3:6 am => 1997-01-05T00:03:06
1997-01-05 12:3:6 pm => 1997-01-05T12:03:06
1997-01-05 1:33:46 => 1997-01-05T01:33:46
1997-01-05 1:33:46 am => 1997-01-05T01:33:46
1997-01-05 1:33:46 pm => 1997-01-05T13:33:46
1997-01-05 1:3:46 => 1997-01-05T01:03:46
1997-01-05 1:3:46 am => 1997-01-05T01:03:46
1997-01-05 1:3:46 pm => 1997-01-05T13:03:46
1997-01-05 1:3:6 => 1997-01-05T01:03:06
1997-01-05 1:3:6 am => 1997-01-05T01:03:06
1997-01-05 1:3:6 pm => 1997-01-05T13:03:06
1998-02-28 12:33:46 => 1998-02-28T12:33:46
1998-02-28 12:33:46 am => 1998-02-28T00:33:46
1998-02-28 12:33:46 pm => 1998-02-28T12:33:46
1998-02-28 12:3:46 => 1998-02-28T12:03:46
1998-02-28 12:3:46 am => 1998-02-28T00:03:46
1998-02-28 12:3:46 pm => 1998-02-28T12:03:46
1998-02-28 12:3:6 => 1998-02-28T12:03:06
1998-02-28 12:3:6 am => 1998-02-28T00:03:06
1998-02-28 12:3:6 pm => 1998-02-28T12:03:06
1998-02-28 1:33:46 => 1998-02-28T01:33:46
1998-02-28 1:33:46 am => 1998-02-28T01:33:46
1998-02-28 1:33:46 pm => 1998-02-28T13:33:46
1998-02-28 1:3:46 => 1998-02-28T01:03:46
1998-02-28 1:3:46 am => 1998-02-28T01:03:46
1998-02-28 1:3:46 pm => 1998-02-28T13:03:46
1998-02-28 1:3:6 => 1998-02-28T01:03:06
1998-02-28 1:3:6 am => 1998-02-28T01:03:06
1998-02-28 1:3:6 pm => 1998-02-28T13:03:06
1998-12-25 12:33:46 => 1998-12-25T12:33:46
19981225 12:33:46 => 1998-12-25T12:33:46
1998-12-25 12:33:46 am => 1998-12-25T00:33:46
19981225 12:33:46 am => 1998-12-25T00:33:46
1998-12-25 12:33:46 pm => 1998-12-25T12:33:46
19981225 12:33:46 pm => 1998-12-25T12:33:46
1998-12-25 12:3:46 => 1998-12-25T12:03:46
19981225 12:3:46 => 1998-12-25T12:03:46
1998-12-25 12:3:46 am => 1998-12-25T00:03:46
19981225 12:3:46 am => 1998-12-25T00:03:46
1998-12-25 12:3:46 pm => 1998-12-25T12:03:46
19981225 12:3:46 pm => 1998-12-25T12:03:46
1998-12-25 12:3:6 => 1998-12-25T12:03:06
19981225 12:3:6 => 1998-12-25T12:03:06
1998-12-25 12:3:6 am => 1998-12-25T00:03:06
19981225 12:3:6 am => 1998-12-25T00:03:06
1998-12-25 12:3:6 pm => 1998-12-25T12:03:06
19981225 12:3:6 pm => 1998-12-25T12:03:06
1998-12-25 1:33:46 => 1998-12-25T01:33:46
19981225 1:33:46 => 1998-12-25T01:33:46
1998-12-25 1:33:46 am => 1998-12-25T01:33:46
19981225 1:33:46 am => 1998-12-25T01:33:46
1998-12-25 1:33:46 pm => 1998-12-25T13:33:46
19981225 1:33:46 pm => 1998-12-25T13:33:46
1998-12-25 1:3:46 => 1998-12-25T01:03:46
19981225 1:3:46 => 1998-12-25T01:03:46
1998-12-25 1:3:46 am => 1998-12-25T01:03:46
19981225 1:3:46 am => 1998-12-25T01:03:46
1998-12-25 1:3:46 pm => 1998-12-25T13:03:46
19981225 1:3:46 pm => 1998-12-25T13:03:46
1998-12-25 1:3:6 => 1998-12-25T01:03:06
19981225 1:3:6 => 1998-12-25T01:03:06
1998-12-25 1:3:6 am => 1998-12-25T01:03:06
19981225 1:3:6 am => 1998-12-25T01:03:06
1998-12-25 1:3:6 pm => 1998-12-25T13:03:06
19981225 1:3:6 pm => 1998-12-25T13:03:06
1999-01-08 12:33:46 => 1999-01-08T12:33:46
19990108 12:33:46 => 1999-01-08T12:33:46
1999-01-08 12:33:46 am => 1999-01-08T00:33:46
19990108 12:33:46 am => 1999-01-08T00:33:46
1999-01-08 12:33:46 pm => 1999-01-08T12:33:46
19990108 12:33:46 pm => 1999-01-08T12:33:46
1999-01-08 12:3:46 => 1999-01-08T12:03:46
19990108 12:3:46 => 1999-01-08T12:03:46
1999-01-08 12:3:46 am => 1999-01-08T00:03:46
19990108 12:3:46 am => 1999-01-08T00:03:46
1999-01-08 12:3:46 pm => 1999-01-08T12:03:46
19990108 12:3:46 pm => 1999-01-08T12:03:46
1999-01-08 12:3:6 => 1999-01-08T12:03:06
19990108 12:3:6 => 1999-01-08T12:03:06
1999-01-08 12:3:6 am => 1999-01-08T00:03:06
19990108 12:3:6 am => 1999-01-08T00:03:06
1999-01-08 12:3:6 pm => 1999-01-08T12:03:06
19990108 12:3:6 pm => 1999-01-08T12:03:06
1999-01-08 1:33:46 => 1999-01-08T01:33:46
19990108 1:33:46 => 1999-01-08T01:33:46
1999-01-08 1:33:46 am => 1999-01-08T01:33:46
19990108 1:33:46 am => 1999-01-08T01:33:46
1999-01-08 1:33:46 pm => 1999-01-08T13:33:46
19990108 1:33:46 pm => 1999-01-08T13:33:46
1999-01-08 1:3:46 => 1999-01-08T01:03:46
19990108 1:3:46 => 1999-01-08T01:03:46
1999-01-08 1:3:46 am => 1999-01-08T01:03:46
19990108 1:3:46 am => 1999-01-08T01:03:46
1999-01-08 1:3:46 pm => 1999-01-08T13:03:46
19990108 1:3:46 pm => 1999-01-08T13:03:46
1999-01-08 1:3:6 => 1999-01-08T01:03:06
19990108 1:3:6 => 1999-01-08T01:03:06
1999-01-08 1:3:6 am => 1999-01-08T01:03:06
19990108 1:3:6 am => 1999-01-08T01:03:06
1999-01-08 1:3:6 pm => 1999-01-08T13:03:06
19990108 1:3:6 pm => 1999-01-08T13:03:06
1999 01 08 => 1999-01-08T00:00:00
1999-01-08 => 1999-01-08T00:00:00
1999/01/08 => 1999-01-08T00:00:00
1999.01.08 => 1999-01-08T00:00:00
1999\01\08 => 1999-01-08T00:00:00
19990108 => 1999-01-08T00:00:00
1999-03-01 12:33:46 => 1999-03-01T12:33:46
1999-03-01 12:33:46 am => 1999-03-01T00:33:46
1999-03-01 12:33:46 pm => 1999-03-01T12:33:46
1999-03-01 12:3:46 => 1999-03-01T12:03:46
1999-03-01 12:3:46 am => 1999-03-01T00:03:46
1999-03-01 12:3:46 pm => 1999-03-01T12:03:46
1999-03-01 12:3:6 => 1999-03-01T12:03:06
1999-03-01 12:3:6 am => 1999-03-01T00:03:06
1999-03-01 12:3:6 pm => 1999-03-01T12:03:06
1999-03-01 1:33:46 => 1999-03-01T01:33:46
1999-03-01 1:33:46 am => 1999-03-01T01:33:46
1999-03-01 1:33:46 pm => 1999-03-01T13:33:46
1999-03-01 1:3:46 => 1999-03-01T01:03:46
1999-03-01 1:3:46 am => 1999-03-01T01:03:46
1999-03-01 1:3:46 pm => 1999-03-01T13:03:46
1999-03-01 1:3:6 => 1999-03-01T01:03:06
1999-03-01 1:3:6 am => 1999-03-01T01:03:06
1999-03-01 1:3:6 pm => 1999-03-01T13:03:06
1999 10:02:18 => 1999-01-01T10:02:18
1999-12-27 12:33:46 => 1999-12-27T12:33:46
1999-12-27 12:33:46 am => 1999-12-27T00:33:46
1999-12-27 12:33:46 pm => 1999-12-27T12:33:46
1999-12-27 12:3:46 => 1999-12-27T12:03:46
1999-12-27 12:3:46 am => 1999-12-27T00:03:46
1999-12-27 12:3:46 pm => 1999-12-27T12:03:46
1999-12-27 12:3:6 => 1999-12-27T12:03:06
1999-12-27 12:3:6 am => 1999-12-27T00:03:06
1999-12-27 12:3:6 pm => 1999-12-27T12:03:06
1999-12-27 1:33:46 => 1999-12-27T01:33:46
1999-12-27 1:33:46 am => 1999-12-27T01:33:46
1999-12-27 1:33:46 pm => 1999-12-27T13:33:46
1999-12-27 1:3:46 => 1999-12-27T01:03:46
1999-12-27 1:3:46 am => 1999-12-27T01:03:46
1999-12-27 1:3:46 pm => 1999-12-27T13:03:46
1999-12-27 1:3:6 => 1999-12-27T01:03:06
1999-12-27 1:3:6 am => 1999-12-27T01:03:06
1999-12-27 1:3:6 pm => 1999-12-27T13:03:06
1999-12-31 12:33:46 => 1999-12-31T12:33:46
1999-12-31 12:33:46 am => 1999-12-31T00:33:46
1999-12-31 12:33:46 pm => 1999-12-31T12:33:46
1999-12-31 12:3:46 => 1999-12-31T12:03:46
1999-12-31 12:3:46 am => 1999-12-31T00:03:46
1999-12-31 12:3:46 pm => 1999-12-31T12:03:46
1999-12-31 12:3:6 => 1999-12-31T12:03:06
1999-12-31 12:3:6 am => 1999-12-31T00:03:06
1999-12-31 12:3:6 pm => 1999-12-31T12:03:06
1999-12-31 1:33:46 => 1999-12-31T01:33:46
1999-12-31 1:33:46 am => 1999-12-31T01:33:46
1999-12-31 1:33:46 pm => 1999-12-31T13:33:46
1999-12-31 1:3:46 => 1999-12-31T01:03:46
1999-12-31 1:3:46 am => 1999-12-31T01:03:46
1999-12-31 1:3:46 pm => 1999-12-31T13:03:46
1999-12-31 1:3:6 => 1999-12-31T01:03:06
1999-12-31 1:3:6 am => 1999-12-31T01:03:06
1999-12-31 1:3:6 pm => 1999-12-31T13:03:06
1999345 12:33:46 => 1999-12-11T12:33:46
1999345 12:33:46 am => 1999-12-11T00:33:46
1999345 12:33:46 pm => 1999-12-11T12:33:46
1999345 12:3:46 => 1999-12-11T12:03:46
1999345 12:3:46 am => 1999-12-11T00:03:46
1999345 12:3:46 pm => 1999-12-11T12:03:46
1999345 12:3:6 => 1999-12-11T12:03:06
1999345 12:3:6 am => 1999-12-11T00:03:06
1999345 12:3:6 pm => 1999-12-11T12:03:06
1999345 1:33:46 => 1999-12-11T01:33:46
1999345 1:33:46 am => 1999-12-11T01:33:46
1999345 1:33:46 pm => 1999-12-11T13:33:46
1999345 1:3:46 => 1999-12-11T01:03:46
1999345 1:3:46 am => 1999-12-11T01:03:46
1999345 1:3:46 pm => 1999-12-11T13:03:46
1999345 1:3:6 => 1999-12-11T01:03:06
1999345 1:3:6 am => 1999-12-11T01:03:06
1999345 1:3:6 pm => 1999-12-11T13:03:06
1999-365 12:33:46 => 1999-12-31T12:33:46
1999-365 12:33:46 am => 1999-12-31T00:33:46
1999-365 12:33:46 pm => 1999-12-31T12:33:46
1999-365 12:3:46 => 1999-12-31T12:03:46
1999-365 12:3:46 am => 1999-12-31T00:03:46
1999-365 12:3:46 pm => 1999-12-31T12:03:46
1999-365 12:3:6 => 1999-12-31T12:03:06
1999-365 12:3:6 am => 1999-12-31T00:03:06
1999-365 12:3:6 pm => 1999-12-31T12:03:06
1999-365 1:33:46 => 1999-12-31T01:33:46
1999-365 1:33:46 am => 1999-12-31T01:33:46
1999-365 1:33:46 pm => 1999-12-31T13:33:46
1999-365 1:3:46 => 1999-12-31T01:03:46
1999-365 1:3:46 am => 1999-12-31T01:03:46
1999-365 1:3:46 pm => 1999-12-31T13:03:46
1999-365 1:3:6 => 1999-12-31T01:03:06
1999-365 1:3:6 am => 1999-12-31T01:03:06
1999-365 1:3:6 pm => 1999-12-31T13:03:06
1999-Jan-08 12:33:46 => 1999-01-08T12:33:46
1999-Jan-08 12:33:46 am => 1999-01-08T00:33:46
1999-Jan-08 12:33:46 pm => 1999-01-08T12:33:46
1999-Jan-08 12:3:46 => 1999-01-08T12:03:46
1999-Jan-08 12:3:46 am => 1999-01-08T00:03:46
1999-Jan-08 12:3:46 pm => 1999-01-08T12:03:46
1999-Jan-08 12:3:6 => 1999-01-08T12:03:06
1999-Jan-08 12:3:6 am => 1999-01-08T00:03:06
1999-Jan-08 12:3:6 pm => 1999-01-08T12:03:06
1999-Jan-08 1:33:46 => 1999-01-08T01:33:46
1999-Jan-08 1:33:46 am => 1999-01-08T01:33:46
1999-Jan-08 1:33:46 pm => 1999-01-08T13:33:46
1999-Jan-08 1:3:46 => 1999-01-08T01:03:46
1999-Jan-08 1:3:46 am => 1999-01-08T01:03:46
1999-Jan-08 1:3:46 pm => 1999-01-08T13:03:46
1999-Jan-08 1:3:6 => 1999-01-08T01:03:06
1999-Jan-08 1:3:6 am => 1999-01-08T01:03:06
1999-Jan-08 1:3:6 pm => 1999-01-08T13:03:06
1999 Jan 08 => 1999-01-08T00:00:00
1999-Jan-08 => 1999-01-08T00:00:00
1999/Jan/08 => 1999-01-08T00:00:00
1999.Jan.08 => 1999-01-08T00:00:00
1999\Jan\08 => 1999-01-08T00:00:00
1st December, 2006 => 2006-12-01T00:00:00
1st of April 2006 12:33:46 => 2006-04-01T12:33:46
1st of April 2006 12:33:46 am => 2006-04-01T00:33:46
1st of April 2006 12:33:46 pm => 2006-04-01T12:33:46
1st of April 2006 12:3:46 => 2006-04-01T12:03:46
1st of April 2006 12:3:46 am => 2006-04-01T00:03:46
1st of April 2006 12:3:46 pm => 2006-04-01T12:03:46
1st of April 2006 12:3:6 => 2006-04-01T12:03:06
1st of April 2006 12:3:6 am => 2006-04-01T00:03:06
1st of April 2006 12:3:6 pm => 2006-04-01T12:03:06
1st of April 2006 1:33:46 => 2006-04-01T01:33:46
1st of April 2006 1:33:46 am => 2006-04-01T01:33:46
1st of April 2006 1:33:46 pm => 2006-04-01T13:33:46
1st of April 2006 1:3:46 => 2006-04-01T01:03:46
1st of April 2006 1:3:46 am => 2006-04-01T01:03:46
1st of April 2006 1:3:46 pm => 2006-04-01T13:03:46
1st of April 2006 1:3:6 => 2006-04-01T01:03:06
1st of April 2006 1:3:6 am => 2006-04-01T01:03:06
1st of April 2006 1:3:6 pm => 2006-04-01T13:03:06
2000-01-01 12:33:46 => 2000-01-01T12:33:46
2000-01-01 12:33:46 am => 2000-01-01T00:33:46
2000-01-01 12:33:46 pm => 2000-01-01T12:33:46
2000-01-01 12:3:46 => 2000-01-01T12:03:46
2000-01-01 12:3:46 am => 2000-01-01T00:03:46
2000-01-01 12:3:46 pm => 2000-01-01T12:03:46
2000-01-01 12:3:6 => 2000-01-01T12:03:06
2000-01-01 12:3:6 am => 2000-01-01T00:03:06
2000-01-01 12:3:6 pm => 2000-01-01T12:03:06
2000-01-01 1:33:46 => 2000-01-01T01:33:46
2000-01-01 1:33:46 am => 2000-01-01T01:33:46
2000-01-01 1:33:46 pm => 2000-01-01T13:33:46
2000-01-01 1:3:46 => 2000-01-01T01:03:46
2000-01-01 1:3:46 am => 2000-01-01T01:03:46
2000-01-01 1:3:46 pm => 2000-01-01T13:03:46
2000-01-01 1:3:6 => 2000-01-01T01:03:06
2000-01-01 1:3:6 am => 2000-01-01T01:03:06
2000-01-01 1:3:6 pm => 2000-01-01T13:03:06
2000-01-02 12:33:46 => 2000-01-02T12:33:46
2000-01-02 12:33:46 am => 2000-01-02T00:33:46
2000-01-02 12:33:46 pm => 2000-01-02T12:33:46
2000-01-02 12:3:46 => 2000-01-02T12:03:46
2000-01-02 12:3:46 am => 2000-01-02T00:03:46
2000-01-02 12:3:46 pm => 2000-01-02T12:03:46
2000-01-02 12:3:6 => 2000-01-02T12:03:06
2000-01-02 12:3:6 am => 2000-01-02T00:03:06
2000-01-02 12:3:6 pm => 2000-01-02T12:03:06
2000-01-02 1:33:46 => 2000-01-02T01:33:46
2000-01-02 1:33:46 am => 2000-01-02T01:33:46
2000-01-02 1:33:46 pm => 2000-01-02T13:33:46
2000-01-02 1:3:46 => 2000-01-02T01:03:46
2000-01-02 1:3:46 am => 2000-01-02T01:03:46
2000-01-02 1:3:46 pm => 2000-01-02T13:03:46
2000-01-02 1:3:6 => 2000-01-02T01:03:06
2000-01-02 1:3:6 am => 2000-01-02T01:03:06
2000-01-02 1:3:6 pm => 2000-01-02T13:03:06
2000-01-30 12:33:46 => 2000-01-30T12:33:46
2000-01-30 12:33:46 am => 2000-01-30T00:33:46
2000-01-30 12:33:46 pm => 2000-01-30T12:33:46
2000-01-30 12:3:46 => 2000-01-30T12:03:46
2000-01-30 12:3:46 am => 2000-01-30T00:03:46
2000-01-30 12:3:46 pm => 2000-01-30T12:03:46
2000-01-30 12:3:6 => 2000-01-30T12:03:06
2000-01-30 12:3:6 am => 2000-01-30T00:03:06
2000-01-30 12:3:6 pm => 2000-01-30T12:03:06
2000-01-30 1:33:46 => 2000-01-30T01:33:46
2000-01-30 1:33:46 am => 2000-01-30T01:33:46
2000-01-30 1:33:46 pm => 2000-01-30T13:33:46
2000-01-30 1:3:46 => 2000-01-30T01:03:46
2000-01-30 1:3:46 am => 2000-01-30T01:03:46
2000-01-30 1:3:46 pm => 2000-01-30T13:03:46
2000-01-30 1:3:6 => 2000-01-30T01:03:06
2000-01-30 1:3:6 am => 2000-01-30T01:03:06
2000-01-30 1:3:6 pm => 2000-01-30T13:03:06
2003-11-16 12:33:46 => 2003-11-16T12:33:46
2003-11-16 12:33:46 am => 2003-11-16T00:33:46
2003-11-16 12:33:46 pm => 2003-11-16T12:33:46
2003-11-16 12:3:46 => 2003-11-16T12:03:46
2003-11-16 12:3:46 am => 2003-11-16T00:03:46
2003-11-16 12:3:46 pm => 2003-11-16T12:03:46
2003-11-16 12:3:6 => 2003-11-16T12:03:06
2003-11-16 12:3:6 am => 2003-11-16T00:03:06
2003-11-16 12:3:6 pm => 2003-11-16T12:03:06
2003-11-16 1:33:46 => 2003-11-16T01:33:46
2003-11-16 1:33:46 am => 2003-11-16T01:33:46
2003-11-16 1:33:46 pm => 2003-11-16T13:33:46
2003-11-16 1:3:46 => 2003-11-16T01:03:46
2003-11-16 1:3:46 am => 2003-11-16T01:03:46
2003-11-16 1:3:46 pm => 2003-11-16T13:03:46
2003-11-16 1:3:6 => 2003-11-16T01:03:06
2003-11-16 1:3:6 am => 2003-11-16T01:03:06
2003-11-16 1:3:6 pm => 2003-11-16T13:03:06
2003 November 16 12:33:46 => 2003-11-16T12:33:46
2003 November 16 12:33:46 am => 2003-11-16T00:33:46
2003 November 16 12:33:46 pm => 2003-11-16T12:33:46
2003 November 16 12:3:46 => 2003-11-16T12:03:46
2003 November 16 12:3:46 am => 2003-11-16T00:03:46
2003 November 16 12:3:46 pm => 2003-11-16T12:03:46
2003 November 16 12:3:6 => 2003-11-16T12:03:06
2003 November 16 12:3:6 am => 2003-11-16T00:03:06
2003 November 16 12:3:6 pm => 2003-11-16T12:03:06
2003 November 16 1:33:46 => 2003-11-16T01:33:46
2003 November 16 1:33:46 am => 2003-11-16T01:33:46
2003 November 16 1:33:46 pm => 2003-11-16T13:33:46
2003 November 16 1:3:46 => 2003-11-16T01:03:46
2003 November 16 1:3:46 am => 2003-11-16T01:03:46
2003 November 16 1:3:46 pm => 2003-11-16T13:03:46
2003 November 16 1:3:6 => 2003-11-16T01:03:06
2003 November 16 1:3:6 am => 2003-11-16T01:03:06
2003 November 16 1:3:6 pm => 2003-11-16T13:03:06
2006-05-07T00:00:00 => 2006-05-07T00:00:00
2006/05/18 12:33:46 => 2006-05-18T12:33:46
2006/05/18 12:33:46 am => 2006-05-18T00:33:46
2006/05/18 12:33:46 pm => 2006-05-18T12:33:46
2006/05/18 12:3:46 => 2006-05-18T12:03:46
2006/05/18 12:3:46 am => 2006-05-18T00:03:46
2006/05/18 12:3:46 pm => 2006-05-18T12:03:46
2006/05/18 12:3:6 => 2006-05-18T12:03:06
2006/05/18 12:3:6 am => 2006-05-18T00:03:06
2006/05/18 12:3:6 pm => 2006-05-18T12:03:06
2006/05/18 1:33:46 => 2006-05-18T01:33:46
2006/05/18 1:33:46 am => 2006-05-18T01:33:46
2006/05/18 1:33:46 pm => 2006-05-18T13:33:46
2006/05/18 1:3:46 => 2006-05-18T01:03:46
2006/05/18 1:3:46 am => 2006-05-18T01:03:46
2006/05/18 1:3:46 pm => 2006-05-18T13:03:46
2006/05/18 1:3:6 => 2006-05-18T01:03:06
2006/05/18 1:3:6 am => 2006-05-18T01:03:06
2006/05/18 1:3:6 pm => 2006-05-18T13:03:06
2006/05/18 => 2006-05-18T00:00:00
20060518 => 2006-05-18T00:00:00
20060518T0513 => 2006-05-18T05:13:00
20060518T051326 => 2006-05-18T05:13:26
20060518T05 => 2006-05-18T05:00:00
200605 => 2006-05-01T00:00:00
2006/05/8 12:33:46 => 2006-05-08T12:33:46
2006/05/8 12:33:46 am => 2006-05-08T00:33:46
2006/05/8 12:33:46 pm => 2006-05-08T12:33:46
2006/05/8 12:3:46 => 2006-05-08T12:03:46
2006/05/8 12:3:46 am => 2006-05-08T00:03:46
2006/05/8 12:3:46 pm => 2006-05-08T12:03:46
2006/05/8 12:3:6 => 2006-05-08T12:03:06
2006/05/8 12:3:6 am => 2006-05-08T00:03:06
2006/05/8 12:3:6 pm => 2006-05-08T12:03:06
2006/05/8 1:33:46 => 2006-05-08T01:33:46
2006/05/8 1:33:46 am => 2006-05-08T01:33:46
2006/05/8 1:33:46 pm => 2006-05-08T13:33:46
2006/05/8 1:3:46 => 2006-05-08T01:03:46
2006/05/8 1:3:46 am => 2006-05-08T01:03:46
2006/05/8 1:3:46 pm => 2006-05-08T13:03:46
2006/05/8 1:3:6 => 2006-05-08T01:03:06
2006/05/8 1:3:6 am => 2006-05-08T01:03:06
2006/05/8 1:3:6 pm => 2006-05-08T13:03:06
2006/05/8 => 2006-05-08T00:00:00
2006/5/18 12:33:46 => 2006-05-18T12:33:46
2006/5/18 12:33:46 am => 2006-05-18T00:33:46
2006/5/18 12:33:46 pm => 2006-05-18T12:33:46
2006/5/18 12:3:46 => 2006-05-18T12:03:46
2006/5/18 12:3:46 am => 2006-05-18T00:03:46
2006/5/18 12:3:46 pm => 2006-05-18T12:03:46
2006/5/18 12:3:6 => 2006-05-18T12:03:06
2006/5/18 12:3:6 am => 2006-05-18T00:03:06
2006/5/18 12:3:6 pm => 2006-05-18T12:03:06
2006/5/18 1:33:46 => 2006-05-18T01:33:46
2006/5/18 1:33:46 am => 2006-05-18T01:33:46
2006/5/18 1:33:46 pm => 2006-05-18T13:33:46
2006/5/18 1:3:46 => 2006-05-18T01:03:46
2006/5/18 1:3:46 am => 2006-05-18T01:03:46
2006/5/18 1:3:46 pm => 2006-05-18T13:03:46
2006/5/18 1:3:6 => 2006-05-18T01:03:06
2006/5/18 1:3:6 am => 2006-05-18T01:03:06
2006/5/18 1:3:6 pm => 2006-05-18T13:03:06
2006/5/18 => 2006-05-18T00:00:00
2006/5/8 12:33:46 => 2006-05-08T12:33:46
2006/5/8 12:33:46 am => 2006-05-08T00:33:46
2006/5/8 12:33:46 pm => 2006-05-08T12:33:46
2006/5/8 12:3:46 => 2006-05-08T12:03:46
2006/5/8 12:3:46 am => 2006-05-08T00:03:46
2006/5/8 12:3:46 pm => 2006-05-08T12:03:46
2006/5/8 12:3:6 => 2006-05-08T12:03:06
2006/5/8 12:3:6 am => 2006-05-08T00:03:06
2006/5/8 12:3:6 pm => 2006-05-08T12:03:06
2006/5/8 1:33:46 => 2006-05-08T01:33:46
2006/5/8 1:33:46 am => 2006-05-08T01:33:46
2006/5/8 1:33:46 pm => 2006-05-08T13:33:46
2006/5/8 1:3:46 => 2006-05-08T01:03:46
2006/5/8 1:3:46 am => 2006-05-08T01:03:46
2006/5/8 1:3:46 pm => 2006-05-08T13:03:46
2006/5/8 1:3:6 => 2006-05-08T01:03:06
2006/5/8 1:3:6 am => 2006-05-08T01:03:06
2006/5/8 1:3:6 pm => 2006-05-08T13:03:06
2006/5/8 => 2006-05-08T00:00:00
  2006-Dec-08   12:33:46 => 2006-12-08T12:33:46
  2006-Dec-08 12:33:46 => 2006-12-08T12:33:46
2006----------/-Dec-08 12:33:46 => 2006-12-08T12:33:46
2006--Dec-08 12:33:46 => 2006-12-08T12:33:46
2006-Dec-08   12:33:46 => 2006-12-08T12:33:46
2006/-Dec-08 12:33:46 => 2006-12-08T12:33:46
2006//-Dec///08 12:33:46 => 2006-12-08T12:33:46
  2006-Dec-08   12:33:46 am => 2006-12-08T00:33:46
  2006-Dec-08 12:33:46 am => 2006-12-08T00:33:46
2006----------/-Dec-08 12:33:46 am => 2006-12-08T00:33:46
2006--Dec-08 12:33:46 am => 2006-12-08T00:33:46
2006-Dec-08   12:33:46 am => 2006-12-08T00:33:46
2006/-Dec-08 12:33:46 am => 2006-12-08T00:33:46
2006//-Dec///08 12:33:46 am => 2006-12-08T00:33:46
  2006-Dec-08   12:33:46 pm => 2006-12-08T12:33:46
  2006-Dec-08 12:33:46 pm => 2006-12-08T12:33:46
2006----------/-Dec-08 12:33:46 pm => 2006-12-08T12:33:46
2006--Dec-08 12:33:46 pm => 2006-12-08T12:33:46
2006-Dec-08   12:33:46 pm => 2006-12-08T12:33:46
2006/-Dec-08 12:33:46 pm => 2006-12-08T12:33:46
2006//-Dec///08 12:33:46 pm => 2006-12-08T12:33:46
  2006-Dec-08   12:3:46 => 2006-12-08T12:03:46
  2006-Dec-08 12:3:46 => 2006-12-08T12:03:46
2006----------/-Dec-08 12:3:46 => 2006-12-08T12:03:46
2006--Dec-08 12:3:46 => 2006-12-08T12:03:46
2006-Dec-08   12:3:46 => 2006-12-08T12:03:46
2006/-Dec-08 12:3:46 => 2006-12-08T12:03:46
2006//-Dec///08 12:3:46 => 2006-12-08T12:03:46
  2006-Dec-08   12:3:46 am => 2006-12-08T00:03:46
  2006-Dec-08 12:3:46 am => 2006-12-08T00:03:46
2006----------/-Dec-08 12:3:46 am => 2006-12-08T00:03:46
2006--Dec-08 12:3:46 am => 2006-12-08T00:03:46
2006-Dec-08   12:3:46 am => 2006-12-08T00:03:46
2006/-Dec-08 12:3:46 am => 2006-12-08T00:03:46
2006//-Dec///08 12:3:46 am => 2006-12-08T00:03:46
  2006-Dec-08   12:3:46 pm => 2006-12-08T12:03:46
  2006-Dec-08 12:3:46 pm => 2006-12-08T12:03:46
2006----------/-Dec-08 12:3:46 pm => 2006-12-08T12:03:46
2006--Dec-08 12:3:46 pm => 2006-12-08T12:03:46
2006-Dec-08   12:3:46 pm => 2006-12-08T12:03:46
2006/-Dec-08 12:3:46 pm => 2006-12-08T12:03:46
2006//-Dec///08 12:3:46 pm => 2006-12-08T12:03:46
  2006-Dec-08   12:3:6 => 2006-12-08T12:03:06
  2006-Dec-08 12:3:6 => 2006-12-08T12:03:06
2006----------/-Dec-08 12:3:6 => 2006-12-08T12:03:06
2006--Dec-08 12:3:6 => 2006-12-08T12:03:06
2006-Dec-08   12:3:6 => 2006-12-08T12:03:06
2006/-Dec-08 12:3:6 => 2006-12-08T12:03:06
2006//-Dec///08 12:3:6 => 2006-12-08T12:03:06
  2006-Dec-08   12:3:6 am => 2006-12-08T00:03:06
  2006-Dec-08 12:3:6 am => 2006-12-08T00:03:06
2006----------/-Dec-08 12:3:6 am => 2006-12-08T00:03:06
2006--Dec-08 12:3:6 am => 2006-12-08T00:03:06
2006-Dec-08   12:3:6 am => 2006-12-08T00:03:06
2006/-Dec-08 12:3:6 am => 2006-12-08T00:03:06
2006//-Dec///08 12:3:6 am => 2006-12-08T00:03:06
  2006-Dec-08   12:3:6 pm => 2006-12-08T12:03:06
  2006-Dec-08 12:3:6 pm => 2006-12-08T12:03:06
2006----------/-Dec-08 12:3:6 pm => 2006-12-08T12:03:06
2006--Dec-08 12:3:6 pm => 2006-12-08T12:03:06
2006-Dec-08   12:3:6 pm => 2006-12-08T12:03:06
2006/-Dec-08 12:3:6 pm => 2006-12-08T12:03:06
2006//-Dec///08 12:3:6 pm => 2006-12-08T12:03:06
  2006-Dec-08   1:33:46 => 2006-12-08T01:33:46
  2006-Dec-08 1:33:46 => 2006-12-08T01:33:46
2006----------/-Dec-08 1:33:46 => 2006-12-08T01:33:46
2006--Dec-08 1:33:46 => 2006-12-08T01:33:46
2006-Dec-08   1:33:46 => 2006-12-08T01:33:46
2006/-Dec-08 1:33:46 => 2006-12-08T01:33:46
2006//-Dec///08 1:33:46 => 2006-12-08T01:33:46
  2006-Dec-08   1:33:46 am => 2006-12-08T01:33:46
  2006-Dec-08 1:33:46 am => 2006-12-08T01:33:46
2006----------/-Dec-08 1:33:46 am => 2006-12-08T01:33:46
2006--Dec-08 1:33:46 am => 2006-12-08T01:33:46
2006-Dec-08   1:33:46 am => 2006-12-08T01:33:46
2006/-Dec-08 1:33:46 am => 2006-12-08T01:33:46
2006//-Dec///08 1:33:46 am => 2006-12-08T01:33:46
  2006-Dec-08   1:33:46 pm => 2006-12-08T13:33:46
  2006-Dec-08 1:33:46 pm => 2006-12-08T13:33:46
2006----------/-Dec-08 1:33:46 pm => 2006-12-08T13:33:46
2006--Dec-08 1:33:46 pm => 2006-12-08T13:33:46
2006-Dec-08   1:33:46 pm => 2006-12-08T13:33:46
2006/-Dec-08 1:33:46 pm => 2006-12-08T13:33:46
2006//-Dec///08 1:33:46 pm => 2006-12-08T13:33:46
  2006-Dec-08   1:3:46 => 2006-12-08T01:03:46
  2006-Dec-08 1:3:46 => 2006-12-08T01:03:46
2006----------/-Dec-08 1:3:46 => 2006-12-08T01:03:46
2006--Dec-08 1:3:46 => 2006-12-08T01:03:46
2006-Dec-08   1:3:46 => 2006-12-08T01:03:46
2006/-Dec-08 1:3:46 => 2006-12-08T01:03:46
2006//-Dec///08 1:3:46 => 2006-12-08T01:03:46
  2006-Dec-08   1:3:46 am => 2006-12-08T01:03:46
  2006-Dec-08 1:3:46 am => 2006-12-08T01:03:46
2006----------/-Dec-08 1:3:46 am => 2006-12-08T01:03:46
2006--Dec-08 1:3:46 am => 2006-12-08T01:03:46
2006-Dec-08   1:3:46 am => 2006-12-08T01:03:46
2006/-Dec-08 1:3:46 am => 2006-12-08T01:03:46
2006//-Dec///08 1:3:46 am => 2006-12-08T01:03:46
  2006-Dec-08   1:3:46 pm => 2006-12-08T13:03:46
  2006-Dec-08 1:3:46 pm => 2006-12-08T13:03:46
2006----------/-Dec-08 1:3:46 pm => 2006-12-08T13:03:46
2006--Dec-08 1:3:46 pm => 2006-12-08T13:03:46
2006-Dec-08   1:3:46 pm => 2006-12-08T13:03:46
2006/-Dec-08 1:3:46 pm => 2006-12-08T13:03:46
2006//-Dec///08 1:3:46 pm => 2006-12-08T13:03:46
  2006-Dec-08   1:3:6 => 2006-12-08T01:03:06
  2006-Dec-08 1:3:6 => 2006-12-08T01:03:06
2006----------/-Dec-08 1:3:6 => 2006-12-08T01:03:06
2006--Dec-08 1:3:6 => 2006-12-08T01:03:06
2006-Dec-08   1:3:6 => 2006-12-08T01:03:06
2006/-Dec-08 1:3:6 => 2006-12-08T01:03:06
2006//-Dec///08 1:3:6 => 2006-12-08T01:03:06
  2006-Dec-08   1:3:6 am => 2006-12-08T01:03:06
  2006-Dec-08 1:3:6 am => 2006-12-08T01:03:06
2006----------/-Dec-08 1:3:6 am => 2006-12-08T01:03:06
2006--Dec-08 1:3:6 am => 2006-12-08T01:03:06
2006-Dec-08   1:3:6 am => 2006-12-08T01:03:06
2006/-Dec-08 1:3:6 am => 2006-12-08T01:03:06
2006//-Dec///08 1:3:6 am => 2006-12-08T01:03:06
  2006-Dec-08   1:3:6 pm => 2006-12-08T13:03:06
  2006-Dec-08 1:3:6 pm => 2006-12-08T13:03:06
2006----------/-Dec-08 1:3:6 pm => 2006-12-08T13:03:06
2006--Dec-08 1:3:6 pm => 2006-12-08T13:03:06
2006-Dec-08   1:3:6 pm => 2006-12-08T13:03:06
2006/-Dec-08 1:3:6 pm => 2006-12-08T13:03:06
2006//-Dec///08 1:3:6 pm => 2006-12-08T13:03:06
  2006 Dec 08 => 2006-12-08T00:00:00
  2006 Dec 08   => 2006-12-08T00:00:00
  2006-Dec-08 => 2006-12-08T00:00:00
  2006-Dec-08   => 2006-12-08T00:00:00
  2006/Dec/08 => 2006-12-08T00:00:00
  2006/Dec/08   => 2006-12-08T00:00:00
  2006.Dec.08 => 2006-12-08T00:00:00
  2006.Dec.08   => 2006-12-08T00:00:00
  2006\Dec\08 => 2006-12-08T00:00:00
  2006\Dec\08   => 2006-12-08T00:00:00
2006          / Dec 08 => 2006-12-08T00:00:00
2006  Dec 08 => 2006-12-08T00:00:00
2006 Dec 08   => 2006-12-08T00:00:00
2006----------/-Dec-08 => 2006-12-08T00:00:00
2006--Dec-08 => 2006-12-08T00:00:00
2006-Dec-08   => 2006-12-08T00:00:00
2006/ Dec 08 => 2006-12-08T00:00:00
2006/-Dec-08 => 2006-12-08T00:00:00
2006// Dec///08 => 2006-12-08T00:00:00
2006//-Dec///08 => 2006-12-08T00:00:00
2006////////////Dec/08 => 2006-12-08T00:00:00
2006///Dec///08 => 2006-12-08T00:00:00
2006//.Dec///08 => 2006-12-08T00:00:00
2006//\Dec///08 => 2006-12-08T00:00:00
2006//Dec/08 => 2006-12-08T00:00:00
2006/.Dec.08 => 2006-12-08T00:00:00
2006/\Dec\08 => 2006-12-08T00:00:00
2006/Dec/08   => 2006-12-08T00:00:00
2006........../.Dec.08 => 2006-12-08T00:00:00
2006..Dec.08 => 2006-12-08T00:00:00
2006.Dec.08   => 2006-12-08T00:00:00
2006\\\\\\\\\\/\Dec\08 => 2006-12-08T00:00:00
2006\\Dec\08 => 2006-12-08T00:00:00
2006\Dec\08   => 2006-12-08T00:00:00
2006-Dec 12:33:46 => 2006-12-01T12:33:46
2006-Dec 12:33:46 am => 2006-12-01T00:33:46
2006-Dec 12:33:46 pm => 2006-12-01T12:33:46
2006-Dec 12:3:46 => 2006-12-01T12:03:46
2006-Dec 12:3:46 am => 2006-12-01T00:03:46
2006-Dec 12:3:46 pm => 2006-12-01T12:03:46
2006-Dec 12:3:6 => 2006-12-01T12:03:06
2006-Dec 12:3:6 am => 2006-12-01T00:03:06
2006-Dec 12:3:6 pm => 2006-12-01T12:03:06
2006-Dec 1:33:46 => 2006-12-01T01:33:46
2006-Dec 1:33:46 am => 2006-12-01T01:33:46
2006-Dec 1:33:46 pm => 2006-12-01T13:33:46
2006-Dec 1:3:46 => 2006-12-01T01:03:46
2006-Dec 1:3:46 am => 2006-12-01T01:03:46
2006-Dec 1:3:46 pm => 2006-12-01T13:03:46
2006-Dec 1:3:6 => 2006-12-01T01:03:06
2006-Dec 1:3:6 am => 2006-12-01T01:03:06
2006-Dec 1:3:6 pm => 2006-12-01T13:03:06
2006-Dec-18 12:33:46 => 2006-12-18T12:33:46
2006-Dec-18 12:33:46 am => 2006-12-18T00:33:46
2006-Dec-18 12:33:46 pm => 2006-12-18T12:33:46
2006-Dec-18 12:3:46 => 2006-12-18T12:03:46
2006-Dec-18 12:3:46 am => 2006-12-18T00:03:46
2006-Dec-18 12:3:46 pm => 2006-12-18T12:03:46
2006-Dec-18 12:3:6 => 2006-12-18T12:03:06
2006-Dec-18 12:3:6 am => 2006-12-18T00:03:06
2006-Dec-18 12:3:6 pm => 2006-12-18T12:03:06
2006-Dec-18 1:33:46 => 2006-12-18T01:33:46
2006-Dec-18 1:33:46 am => 2006-12-18T01:33:46
2006-Dec-18 1:33:46 pm => 2006-12-18T13:33:46
2006-Dec-18 1:3:46 => 2006-12-18T01:03:46
2006-Dec-18 1:3:46 am => 2006-12-18T01:03:46
2006-Dec-18 1:3:46 pm => 2006-12-18T13:03:46
2006-Dec-18 1:3:6 => 2006-12-18T01:03:06
2006-Dec-18 1:3:6 am => 2006-12-18T01:03:06
2006-Dec-18 1:3:6 pm => 2006-12-18T13:03:06
2006 Dec 18 => 2006-12-18T00:00:00
2006-Dec-18 => 2006-12-18T00:00:00
2006/Dec/18 => 2006-12-18T00:00:00
2006.Dec.18 => 2006-12-18T00:00:00
2006\Dec\18 => 2006-12-18T00:00:00
2006 Dec => 2006-12-01T00:00:00
2006-Dec => 2006-12-01T00:00:00
2006/Dec => 2006-12-01T00:00:00
2006.Dec => 2006-12-01T00:00:00
2006\Dec => 2006-12-01T00:00:00
2006-Dec-8 12:33:46 => 2006-12-08T12:33:46
2006-Dec-8 12:33:46 am => 2006-12-08T00:33:46
2006-Dec-8 12:33:46 pm => 2006-12-08T12:33:46
2006-Dec-8 12:3:46 => 2006-12-08T12:03:46
2006-Dec-8 12:3:46 am => 2006-12-08T00:03:46
2006-Dec-8 12:3:46 pm => 2006-12-08T12:03:46
2006-Dec-8 12:3:6 => 2006-12-08T12:03:06
2006-Dec-8 12:3:6 am => 2006-12-08T00:03:06
2006-Dec-8 12:3:6 pm => 2006-12-08T12:03:06
2006-Dec-8 1:33:46 => 2006-12-08T01:33:46
2006-Dec-8 1:33:46 am => 2006-12-08T01:33:46
2006-Dec-8 1:33:46 pm => 2006-12-08T13:33:46
2006-Dec-8 1:3:46 => 2006-12-08T01:03:46
2006-Dec-8 1:3:46 am => 2006-12-08T01:03:46
2006-Dec-8 1:3:46 pm => 2006-12-08T13:03:46
2006-Dec-8 1:3:6 => 2006-12-08T01:03:06
2006-Dec-8 1:3:6 am => 2006-12-08T01:03:06
2006-Dec-8 1:3:6 pm => 2006-12-08T13:03:06
2006 Dec 8 => 2006-12-08T00:00:00
2006-Dec-8 => 2006-12-08T00:00:00
2006/Dec/8 => 2006-12-08T00:00:00
2006.Dec.8 => 2006-12-08T00:00:00
2006\Dec\8 => 2006-12-08T00:00:00
2006-JAN-01 12:33:46 => 2006-01-01T12:33:46
2006-JAN-01 12:33:46 am => 2006-01-01T00:33:46
2006-JAN-01 12:33:46 pm => 2006-01-01T12:33:46
2006-JAN-01 12:3:46 => 2006-01-01T12:03:46
2006-JAN-01 12:3:46 am => 2006-01-01T00:03:46
2006-JAN-01 12:3:46 pm => 2006-01-01T12:03:46
2006-JAN-01 12:3:6 => 2006-01-01T12:03:06
2006-JAN-01 12:3:6 am => 2006-01-01T00:03:06
2006-JAN-01 12:3:6 pm => 2006-01-01T12:03:06
2006-JAN-01 1:33:46 => 2006-01-01T01:33:46
2006-JAN-01 1:33:46 am => 2006-01-01T01:33:46
2006-JAN-01 1:33:46 pm => 2006-01-01T13:33:46
2006-JAN-01 1:3:46 => 2006-01-01T01:03:46
2006-JAN-01 1:3:46 am => 2006-01-01T01:03:46
2006-JAN-01 1:3:46 pm => 2006-01-01T13:03:46
2006-JAN-01 1:3:6 => 2006-01-01T01:03:06
2006-JAN-01 1:3:6 am => 2006-01-01T01:03:06
2006-JAN-01 1:3:6 pm => 2006-01-01T13:03:06
2006-Jan 12:33:46 => 2006-01-01T12:33:46
2006-Jan 12:33:46 am => 2006-01-01T00:33:46
2006-Jan 12:33:46 pm => 2006-01-01T12:33:46
2006-Jan 12:3:46 => 2006-01-01T12:03:46
2006-Jan 12:3:46 am => 2006-01-01T00:03:46
2006-Jan 12:3:46 pm => 2006-01-01T12:03:46
2006-Jan 12:3:6 => 2006-01-01T12:03:06
2006-Jan 12:3:6 am => 2006-01-01T00:03:06
2006-Jan 12:3:6 pm => 2006-01-01T12:03:06
2006-Jan 1:33:46 => 2006-01-01T01:33:46
2006-Jan 1:33:46 am => 2006-01-01T01:33:46
2006-Jan 1:33:46 pm => 2006-01-01T13:33:46
2006-Jan 1:3:46 => 2006-01-01T01:03:46
2006-Jan 1:3:46 am => 2006-01-01T01:03:46
2006-Jan 1:3:46 pm => 2006-01-01T13:03:46
2006-Jan 1:3:6 => 2006-01-01T01:03:06
2006-Jan 1:3:6 am => 2006-01-01T01:03:06
2006-Jan 1:3:6 pm => 2006-01-01T13:03:06
2006 Jan => 2006-01-01T00:00:00
2006-Jan => 2006-01-01T00:00:00
2006/Jan => 2006-01-01T00:00:00
2006.Jan => 2006-01-01T00:00:00
2006\Jan => 2006-01-01T00:00:00
2007 => 2007-01-01T00:00:00
2009-04-26 4pm => 2009-04-26T16:00:00
2009-04-26 at 4pm => 2009-04-26T16:00:00
2099-12-31 12:33:46 => 2099-12-31T12:33:46
2099-12-31 12:33:46 am => 2099-12-31T00:33:46
2099-12-31 12:33:46 pm => 2099-12-31T12:33:46
2099-12-31 12:3:46 => 2099-12-31T12:03:46
2099-12-31 12:3:46 am => 2099-12-31T00:03:46
2099-12-31 12:3:46 pm => 2099-12-31T12:03:46
2099-12-31 12:3:6 => 2099-12-31T12:03:06
2099-12-31 12:3:6 am => 2099-12-31T00:03:06
2099-12-31 12:3:6 pm => 2099-12-31T12:03:06
2099-12-31 1:33:46 => 2099-12-31T01:33:46
2099-12-31 1:33:46 am => 2099-12-31T01:33:46
2099-12-31 1:33:46 pm => 2099-12-31T13:33:46
2099-12-31 1:3:46 => 2099-12-31T01:03:46
2099-12-31 1:3:46 am => 2099-12-31T01:03:46
2099-12-31 1:3:46 pm => 2099-12-31T13:03:46
2099-12-31 1:3:6 => 2099-12-31T01:03:06
2099-12-31 1:3:6 am => 2099-12-31T01:03:06
2099-12-31 1:3:6 pm => 2099-12-31T13:03:06
21/dec/93 17:05 => 1993-12-21T17:05:00
2/4/5 12:33:46 => 2005-02-04T12:33:46
2/4/5 12:33:46 am => 2005-02-04T00:33:46
2/4/5 12:33:46 pm => 2005-02-04T12:33:46
2/4/5 12:3:46 => 2005-02-04T12:03:46
2/4/5 12:3:46 am => 2005-02-04T00:03:46
2/4/5 12:3:46 pm => 2005-02-04T12:03:46
2/4/5 12:3:6 => 2005-02-04T12:03:06
2/4/5 12:3:6 am => 2005-02-04T00:03:06
2/4/5 12:3:6 pm => 2005-02-04T12:03:06
2/4/5 1:33:46 => 2005-02-04T01:33:46
2/4/5 1:33:46 am => 2005-02-04T01:33:46
2/4/5 1:33:46 pm => 2005-02-04T13:33:46
2/4/5 1:3:46 => 2005-02-04T01:03:46
2/4/5 1:3:46 am => 2005-02-04T01:03:46
2/4/5 1:3:46 pm => 2005-02-04T13:03:46
2/4/5 1:3:6 => 2005-02-04T01:03:06
2/4/5 1:3:6 am => 2005-02-04T01:03:06
2/4/5 1:3:6 pm => 2005-02-04T13:03:06
2/4/95 12:33:46 => 1995-02-04T12:33:46
2/4/95 12:33:46 am => 1995-02-04T00:33:46
2/4/95 12:33:46 pm => 1995-02-04T12:33:46
2/4/95 12:3:46 => 1995-02-04T12:03:46
2/4/95 12:3:46 am => 1995-02-04T00:03:46
2/4/95 12:3:46 pm => 1995-02-04T12:03:46
2/4/95 12:3:6 => 1995-02-04T12:03:06
2/4/95 12:3:6 am => 1995-02-04T00:03:06
2/4/95 12:3:6 pm => 1995-02-04T12:03:06
2/4/95 1:33:46 => 1995-02-04T01:33:46
2/4/95 1:33:46 am => 1995-02-04T01:33:46
2/4/95 1:33:46 pm => 1995-02-04T13:33:46
2/4/95 1:3:46 => 1995-02-04T01:03:46
2/4/95 1:3:46 am => 1995-02-04T01:03:46
2/4/95 1:3:46 pm => 1995-02-04T13:03:46
2/4/95 1:3:6 => 1995-02-04T01:03:06
2/4/95 1:3:6 am => 1995-02-04T01:03:06
2/4/95 1:3:6 pm => 1995-02-04T13:03:06
28 February 1998 12:33:46 => 1998-02-28T12:33:46
28 February 1998 12:33:46 am => 1998-02-28T00:33:46
28 February 1998 12:33:46 pm => 1998-02-28T12:33:46
28 February 1998 12:3:46 => 1998-02-28T12:03:46
28 February 1998 12:3:46 am => 1998-02-28T00:03:46
28 February 1998 12:3:46 pm => 1998-02-28T12:03:46
28 February 1998 12:3:6 => 1998-02-28T12:03:06
28 February 1998 12:3:6 am => 1998-02-28T00:03:06
28 February 1998 12:3:6 pm => 1998-02-28T12:03:06
28 February 1998 1:33:46 => 1998-02-28T01:33:46
28 February 1998 1:33:46 am => 1998-02-28T01:33:46
28 February 1998 1:33:46 pm => 1998-02-28T13:33:46
28 February 1998 1:3:46 => 1998-02-28T01:03:46
28 February 1998 1:3:46 am => 1998-02-28T01:03:46
28 February 1998 1:3:46 pm => 1998-02-28T13:03:46
28 February 1998 1:3:6 => 1998-02-28T01:03:06
28 February 1998 1:3:6 am => 1998-02-28T01:03:06
28 February 1998 1:3:6 pm => 1998-02-28T13:03:06
2nd December, 2006 => 2006-12-02T00:00:00
2ND December, 2006 => 2006-12-02T00:00:00
30 January  2000 12:33:46 => 2000-01-30T12:33:46
30 January 2000 12:33:46 => 2000-01-30T12:33:46
30 January  2000 12:33:46 am => 2000-01-30T00:33:46
30 January 2000 12:33:46 am => 2000-01-30T00:33:46
30 January  2000 12:33:46 pm => 2000-01-30T12:33:46
30 January 2000 12:33:46 pm => 2000-01-30T12:33:46
30 January  2000 12:3:46 => 2000-01-30T12:03:46
30 January 2000 12:3:46 => 2000-01-30T12:03:46
30 January  2000 12:3:46 am => 2000-01-30T00:03:46
30 January 2000 12:3:46 am => 2000-01-30T00:03:46
30 January  2000 12:3:46 pm => 2000-01-30T12:03:46
30 January 2000 12:3:46 pm => 2000-01-30T12:03:46
30 January  2000 12:3:6 => 2000-01-30T12:03:06
30 January 2000 12:3:6 => 2000-01-30T12:03:06
30 January  2000 12:3:6 am => 2000-01-30T00:03:06
30 January 2000 12:3:6 am => 2000-01-30T00:03:06
30 January  2000 12:3:6 pm => 2000-01-30T12:03:06
30 January 2000 12:3:6 pm => 2000-01-30T12:03:06
30 January  2000 1:33:46 => 2000-01-30T01:33:46
30 January 2000 1:33:46 => 2000-01-30T01:33:46
30 January  2000 1:33:46 am => 2000-01-30T01:33:46
30 January 2000 1:33:46 am => 2000-01-30T01:33:46
30 January  2000 1:33:46 pm => 2000-01-30T13:33:46
30 January 2000 1:33:46 pm => 2000-01-30T13:33:46
30 January  2000 1:3:46 => 2000-01-30T01:03:46
30 January 2000 1:3:46 => 2000-01-30T01:03:46
30 January  2000 1:3:46 am => 2000-01-30T01:03:46
30 January 2000 1:3:46 am => 2000-01-30T01:03:46
30 January  2000 1:3:46 pm => 2000-01-30T13:03:46
30 January 2000 1:3:46 pm => 2000-01-30T13:03:46
30 January  2000 1:3:6 => 2000-01-30T01:03:06
30 January 2000 1:3:6 => 2000-01-30T01:03:06
30 January  2000 1:3:6 am => 2000-01-30T01:03:06
30 January 2000 1:3:6 am => 2000-01-30T01:03:06
30 January  2000 1:3:6 pm => 2000-01-30T13:03:06
30 January 2000 1:3:6 pm => 2000-01-30T13:03:06
 30th of December 2006 12:33:46 => 2006-12-30T12:33:46
 30th of December 2006 12:33:46 am => 2006-12-30T00:33:46
 30th of December 2006 12:33:46 pm => 2006-12-30T12:33:46
 30th of December 2006 12:3:46 => 2006-12-30T12:03:46
 30th of December 2006 12:3:46 am => 2006-12-30T00:03:46
 30th of December 2006 12:3:46 pm => 2006-12-30T12:03:46
 30th of December 2006 12:3:6 => 2006-12-30T12:03:06
 30th of December 2006 12:3:6 am => 2006-12-30T00:03:06
 30th of December 2006 12:3:6 pm => 2006-12-30T12:03:06
 30th of December 2006 1:33:46 => 2006-12-30T01:33:46
 30th of December 2006 1:33:46 am => 2006-12-30T01:33:46
 30th of December 2006 1:33:46 pm => 2006-12-30T13:33:46
 30th of December 2006 1:3:46 => 2006-12-30T01:03:46
 30th of December 2006 1:3:46 am => 2006-12-30T01:03:46
 30th of December 2006 1:3:46 pm => 2006-12-30T13:03:46
 30th of December 2006 1:3:6 => 2006-12-30T01:03:06
 30th of December 2006 1:3:6 am => 2006-12-30T01:03:06
 30th of December 2006 1:3:6 pm => 2006-12-30T13:03:06
 30TH of December 2006 1:3:6 pm => 2006-12-30T13:03:06
3-18-2006 12:33:46 => 2006-03-18T12:33:46
3-18-2006 12:33:46 am => 2006-03-18T00:33:46
3-18-2006 12:33:46 pm => 2006-03-18T12:33:46
3-18-2006 12:3:46 => 2006-03-18T12:03:46
3-18-2006 12:3:46 am => 2006-03-18T00:03:46
3-18-2006 12:3:46 pm => 2006-03-18T12:03:46
3-18-2006 12:3:6 => 2006-03-18T12:03:06
3-18-2006 12:3:6 am => 2006-03-18T00:03:06
3-18-2006 12:3:6 pm => 2006-03-18T12:03:06
3-18-2006 1:33:46 => 2006-03-18T01:33:46
3-18-2006 1:33:46 am => 2006-03-18T01:33:46
3-18-2006 1:33:46 pm => 2006-03-18T13:33:46
3-18-2006 1:3:46 => 2006-03-18T01:03:46
3-18-2006 1:3:46 am => 2006-03-18T01:03:46
3-18-2006 1:3:46 pm => 2006-03-18T13:03:46
3-18-2006 1:3:6 => 2006-03-18T01:03:06
3-18-2006 1:3:6 am => 2006-03-18T01:03:06
3-18-2006 1:3:6 pm => 2006-03-18T13:03:06
3 18 2006 => 2006-03-18T00:00:00
3-18-2006 => 2006-03-18T00:00:00
3/18/2006 => 2006-03-18T00:00:00
3.18.2006 => 2006-03-18T00:00:00
3\18\2006 => 2006-03-18T00:00:00
35-12-23 => 2035-12-23T00:00:00
3. Aug. 1994 12:33:46 => 1994-08-03T12:33:46
3. Aug. 1994 12:33:46 am => 1994-08-03T00:33:46
3. Aug. 1994 12:33:46 pm => 1994-08-03T12:33:46
3. Aug. 1994 12:3:46 => 1994-08-03T12:03:46
3. Aug. 1994 12:3:46 am => 1994-08-03T00:03:46
3. Aug. 1994 12:3:46 pm => 1994-08-03T12:03:46
3. Aug. 1994 12:3:6 => 1994-08-03T12:03:06
3. Aug. 1994 12:3:6 am => 1994-08-03T00:03:06
3. Aug. 1994 12:3:6 pm => 1994-08-03T12:03:06
3. Aug. 1994 1:33:46 => 1994-08-03T01:33:46
3. Aug. 1994 1:33:46 am => 1994-08-03T01:33:46
3. Aug. 1994 1:33:46 pm => 1994-08-03T13:33:46
3. Aug. 1994 1:3:46 => 1994-08-03T01:03:46
3. Aug. 1994 1:3:46 am => 1994-08-03T01:03:46
3. Aug. 1994 1:3:46 pm => 1994-08-03T13:03:46
3. Aug. 1994 1:3:6 => 1994-08-03T01:03:06
3. Aug. 1994 1:3:6 am => 1994-08-03T01:03:06
3. Aug. 1994 1:3:6 pm => 1994-08-03T13:03:06
3. August 1994 12:33:46 => 1994-08-03T12:33:46
3. August 1994 12:33:46 am => 1994-08-03T00:33:46
3. August 1994 12:33:46 pm => 1994-08-03T12:33:46
3. August 1994 12:3:46 => 1994-08-03T12:03:46
3. August 1994 12:3:46 am => 1994-08-03T00:03:46
3. August 1994 12:3:46 pm => 1994-08-03T12:03:46
3. August 1994 12:3:6 => 1994-08-03T12:03:06
3. August 1994 12:3:6 am => 1994-08-03T00:03:06
3. August 1994 12:3:6 pm => 1994-08-03T12:03:06
3. August 1994 1:33:46 => 1994-08-03T01:33:46
3. August 1994 1:33:46 am => 1994-08-03T01:33:46
3. August 1994 1:33:46 pm => 1994-08-03T13:33:46
3. August 1994 1:3:46 => 1994-08-03T01:03:46
3. August 1994 1:3:46 am => 1994-08-03T01:03:46
3. August 1994 1:3:46 pm => 1994-08-03T13:03:46
3. August 1994 1:3:6 => 1994-08-03T01:03:06
3. August 1994 1:3:6 am => 1994-08-03T01:03:06
3. August 1994 1:3:6 pm => 1994-08-03T13:03:06
3rd December, 2006 => 2006-12-03T00:00:00
3RD December, 2006 => 2006-12-03T00:00:00
4/1/06 12:33:46 => 2006-04-01T12:33:46
4/1/06 12:33:46 am => 2006-04-01T00:33:46
4/1/06 12:33:46 pm => 2006-04-01T12:33:46
4/1/06 12:3:46 => 2006-04-01T12:03:46
4/1/06 12:3:46 am => 2006-04-01T00:03:46
4/1/06 12:3:46 pm => 2006-04-01T12:03:46
4/1/06 12:3:6 => 2006-04-01T12:03:06
4/1/06 12:3:6 am => 2006-04-01T00:03:06
4/1/06 12:3:6 pm => 2006-04-01T12:03:06
4/1/06 1:33:46 => 2006-04-01T01:33:46
4/1/06 1:33:46 am => 2006-04-01T01:33:46
4/1/06 1:33:46 pm => 2006-04-01T13:33:46
4/1/06 1:3:46 => 2006-04-01T01:03:46
4/1/06 1:3:46 am => 2006-04-01T01:03:46
4/1/06 1:3:46 pm => 2006-04-01T13:03:46
4/1/06 1:3:6 => 2006-04-01T01:03:06
4/1/06 1:3:6 am => 2006-04-01T01:03:06
4/1/06 1:3:6 pm => 2006-04-01T13:03:06
4.2.1995 12:33:46 => 1995-04-02T12:33:46
4.2.1995 12:33:46 am => 1995-04-02T00:33:46
4.2.1995 12:33:46 pm => 1995-04-02T12:33:46
4.2.1995 12:3:46 => 1995-04-02T12:03:46
4.2.1995 12:3:46 am => 1995-04-02T00:03:46
4.2.1995 12:3:46 pm => 1995-04-02T12:03:46
4.2.1995 12:3:6 => 1995-04-02T12:03:06
4.2.1995 12:3:6 am => 1995-04-02T00:03:06
4.2.1995 12:3:6 pm => 1995-04-02T12:03:06
4.2.1995 1:33:46 => 1995-04-02T01:33:46
4.2.1995 1:33:46 am => 1995-04-02T01:33:46
4.2.1995 1:33:46 pm => 1995-04-02T13:33:46
4.2.1995 1:3:46 => 1995-04-02T01:03:46
4.2.1995 1:3:46 am => 1995-04-02T01:03:46
4.2.1995 1:3:46 pm => 1995-04-02T13:03:46
4.2.1995 1:3:6 => 1995-04-02T01:03:06
4.2.1995 1:3:6 am => 1995-04-02T01:03:06
4.2.1995 1:3:6 pm => 1995-04-02T13:03:06
4/2/95 12:33:46 => 1995-04-02T12:33:46
4/2/95 12:33:46 am => 1995-04-02T00:33:46
4/2/95 12:33:46 pm => 1995-04-02T12:33:46
4/2/95 12:3:46 => 1995-04-02T12:03:46
4/2/95 12:3:46 am => 1995-04-02T00:03:46
4/2/95 12:3:46 pm => 1995-04-02T12:03:46
4/2/95 12:3:6 => 1995-04-02T12:03:06
4/2/95 12:3:6 am => 1995-04-02T00:03:06
4/2/95 12:3:6 pm => 1995-04-02T12:03:06
4/2/95 1:33:46 => 1995-04-02T01:33:46
4/2/95 1:33:46 am => 1995-04-02T01:33:46
4/2/95 1:33:46 pm => 1995-04-02T13:33:46
4/2/95 1:3:46 => 1995-04-02T01:03:46
4/2/95 1:3:46 am => 1995-04-02T01:03:46
4/2/95 1:3:46 pm => 1995-04-02T13:03:46
4/2/95 1:3:6 => 1995-04-02T01:03:06
4/2/95 1:3:6 am => 1995-04-02T01:03:06
4/2/95 1:3:6 pm => 1995-04-02T13:03:06
4-February-1995 12:33:46 => 1995-02-04T12:33:46
4-February-1995 12:33:46 am => 1995-02-04T00:33:46
4-February-1995 12:33:46 pm => 1995-02-04T12:33:46
4-February-1995 12:3:46 => 1995-02-04T12:03:46
4-February-1995 12:3:46 am => 1995-02-04T00:03:46
4-February-1995 12:3:46 pm => 1995-02-04T12:03:46
4-February-1995 12:3:6 => 1995-02-04T12:03:06
4-February-1995 12:3:6 am => 1995-02-04T00:03:06
4-February-1995 12:3:6 pm => 1995-02-04T12:03:06
4-February-1995 1:33:46 => 1995-02-04T01:33:46
4-February-1995 1:33:46 am => 1995-02-04T01:33:46
4-February-1995 1:33:46 pm => 1995-02-04T13:33:46
4-February-1995 1:3:46 => 1995-02-04T01:03:46
4-February-1995 1:3:46 am => 1995-02-04T01:03:46
4-February-1995 1:3:46 pm => 1995-02-04T13:03:46
4-February-1995 1:3:6 => 1995-02-04T01:03:06
4-February-1995 1:3:6 am => 1995-02-04T01:03:06
4-February-1995 1:3:6 pm => 1995-02-04T13:03:06
4th December, 2006 => 2006-12-04T00:00:00
5-08-2006 12:33:46 => 2006-05-08T12:33:46
5-08-2006 12:33:46 am => 2006-05-08T00:33:46
5-08-2006 12:33:46 pm => 2006-05-08T12:33:46
5-08-2006 12:3:46 => 2006-05-08T12:03:46
5-08-2006 12:3:46 am => 2006-05-08T00:03:46
5-08-2006 12:3:46 pm => 2006-05-08T12:03:46
5-08-2006 12:3:6 => 2006-05-08T12:03:06
5-08-2006 12:3:6 am => 2006-05-08T00:03:06
5-08-2006 12:3:6 pm => 2006-05-08T12:03:06
5-08-2006 1:33:46 => 2006-05-08T01:33:46
5-08-2006 1:33:46 am => 2006-05-08T01:33:46
5-08-2006 1:33:46 pm => 2006-05-08T13:33:46
5-08-2006 1:3:46 => 2006-05-08T01:03:46
5-08-2006 1:3:46 am => 2006-05-08T01:03:46
5-08-2006 1:3:46 pm => 2006-05-08T13:03:46
5-08-2006 1:3:6 => 2006-05-08T01:03:06
5-08-2006 1:3:6 am => 2006-05-08T01:03:06
5-08-2006 1:3:6 pm => 2006-05-08T13:03:06
5 08 2006 => 2006-05-08T00:00:00
5-08-2006 => 2006-05-08T00:00:00
5/08/2006 => 2006-05-08T00:00:00
5.08.2006 => 2006-05-08T00:00:00
5\08\2006 => 2006-05-08T00:00:00
5-18-06 12:33:46 => 2006-05-18T12:33:46
5-18-06 12:33:46 am => 2006-05-18T00:33:46
5-18-06 12:33:46 pm => 2006-05-18T12:33:46
5-18-06 12:3:46 => 2006-05-18T12:03:46
5-18-06 12:3:46 am => 2006-05-18T00:03:46
5-18-06 12:3:46 pm => 2006-05-18T12:03:46
5-18-06 12:3:6 => 2006-05-18T12:03:06
5-18-06 12:3:6 am => 2006-05-18T00:03:06
5-18-06 12:3:6 pm => 2006-05-18T12:03:06
5-18-06 1:33:46 => 2006-05-18T01:33:46
5-18-06 1:33:46 am => 2006-05-18T01:33:46
5-18-06 1:33:46 pm => 2006-05-18T13:33:46
5-18-06 1:3:46 => 2006-05-18T01:03:46
5-18-06 1:3:46 am => 2006-05-18T01:03:46
5-18-06 1:3:46 pm => 2006-05-18T13:03:46
5-18-06 1:3:6 => 2006-05-18T01:03:06
5-18-06 1:3:6 am => 2006-05-18T01:03:06
5-18-06 1:3:6 pm => 2006-05-18T13:03:06
5 18 06 => 2006-05-18T00:00:00
5-18-06 => 2006-05-18T00:00:00
5/18/06 => 2006-05-18T00:00:00
5.18.06 => 2006-05-18T00:00:00
5\18\06 => 2006-05-18T00:00:00
5-18-6 12:33:46 => 2006-05-18T12:33:46
5-18-6 12:33:46 am => 2006-05-18T00:33:46
5-18-6 12:33:46 pm => 2006-05-18T12:33:46
5-18-6 12:3:46 => 2006-05-18T12:03:46
5-18-6 12:3:46 am => 2006-05-18T00:03:46
5-18-6 12:3:46 pm => 2006-05-18T12:03:46
5-18-6 12:3:6 => 2006-05-18T12:03:06
5-18-6 12:3:6 am => 2006-05-18T00:03:06
5-18-6 12:3:6 pm => 2006-05-18T12:03:06
5-18-6 1:33:46 => 2006-05-18T01:33:46
5-18-6 1:33:46 am => 2006-05-18T01:33:46
5-18-6 1:33:46 pm => 2006-05-18T13:33:46
5-18-6 1:3:46 => 2006-05-18T01:03:46
5-18-6 1:3:46 am => 2006-05-18T01:03:46
5-18-6 1:3:46 pm => 2006-05-18T13:03:46
5-18-6 1:3:6 => 2006-05-18T01:03:06
5-18-6 1:3:6 am => 2006-05-18T01:03:06
5-18-6 1:3:6 pm => 2006-05-18T13:03:06
5 18 6 => 2006-05-18T00:00:00
5-18-6 => 2006-05-18T00:00:00
5/18/6 => 2006-05-18T00:00:00
5.18.6 => 2006-05-18T00:00:00
5\18\6 => 2006-05-18T00:00:00
5-8-06 12:33:46 => 2006-05-08T12:33:46
5-8-06 12:33:46 am => 2006-05-08T00:33:46
5-8-06 12:33:46 pm => 2006-05-08T12:33:46
5-8-06 12:3:46 => 2006-05-08T12:03:46
5-8-06 12:3:46 am => 2006-05-08T00:03:46
5-8-06 12:3:46 pm => 2006-05-08T12:03:46
5-8-06 12:3:6 => 2006-05-08T12:03:06
5-8-06 12:3:6 am => 2006-05-08T00:03:06
5-8-06 12:3:6 pm => 2006-05-08T12:03:06
5-8-06 1:33:46 => 2006-05-08T01:33:46
5-8-06 1:33:46 am => 2006-05-08T01:33:46
5-8-06 1:33:46 pm => 2006-05-08T13:33:46
5-8-06 1:3:46 => 2006-05-08T01:03:46
5-8-06 1:3:46 am => 2006-05-08T01:03:46
5-8-06 1:3:46 pm => 2006-05-08T13:03:46
5-8-06 1:3:6 => 2006-05-08T01:03:06
5-8-06 1:3:6 am => 2006-05-08T01:03:06
5-8-06 1:3:6 pm => 2006-05-08T13:03:06
5 8 06 => 2006-05-08T00:00:00
5-8-06 => 2006-05-08T00:00:00
5/8/06 => 2006-05-08T00:00:00
5.8.06 => 2006-05-08T00:00:00
5\8\06 => 2006-05-08T00:00:00
5-8-2006 12:33:46 => 2006-05-08T12:33:46
5-8-2006 12:33:46 am => 2006-05-08T00:33:46
5-8-2006 12:33:46 pm => 2006-05-08T12:33:46
5-8-2006 12:3:46 => 2006-05-08T12:03:46
5-8-2006 12:3:46 am => 2006-05-08T00:03:46
5-8-2006 12:3:46 pm => 2006-05-08T12:03:46
5-8-2006 12:3:6 => 2006-05-08T12:03:06
5-8-2006 12:3:6 am => 2006-05-08T00:03:06
5-8-2006 12:3:6 pm => 2006-05-08T12:03:06
5-8-2006 1:33:46 => 2006-05-08T01:33:46
5-8-2006 1:33:46 am => 2006-05-08T01:33:46
5-8-2006 1:33:46 pm => 2006-05-08T13:33:46
5-8-2006 1:3:46 => 2006-05-08T01:03:46
5-8-2006 1:3:46 am => 2006-05-08T01:03:46
5-8-2006 1:3:46 pm => 2006-05-08T13:03:46
5-8-2006 1:3:6 => 2006-05-08T01:03:06
5-8-2006 1:3:6 am => 2006-05-08T01:03:06
5-8-2006 1:3:6 pm => 2006-05-08T13:03:06
5 8 2006 => 2006-05-08T00:00:00
5-8-2006 => 2006-05-08T00:00:00
5/8/2006 => 2006-05-08T00:00:00
5.8.2006 => 2006-05-08T00:00:00
5\8\2006 => 2006-05-08T00:00:00
5-8-6 12:33:46 => 2006-05-08T12:33:46
5-8-6 12:33:46 am => 2006-05-08T00:33:46
5-8-6 12:33:46 pm => 2006-05-08T12:33:46
5-8-6 12:3:46 => 2006-05-08T12:03:46
5-8-6 12:3:46 am => 2006-05-08T00:03:46
5-8-6 12:3:46 pm => 2006-05-08T12:03:46
5-8-6 12:3:6 => 2006-05-08T12:03:06
5-8-6 12:3:6 am => 2006-05-08T00:03:06
5-8-6 12:3:6 pm => 2006-05-08T12:03:06
5-8-6 1:33:46 => 2006-05-08T01:33:46
5-8-6 1:33:46 am => 2006-05-08T01:33:46
5-8-6 1:33:46 pm => 2006-05-08T13:33:46
5-8-6 1:3:46 => 2006-05-08T01:03:46
5-8-6 1:3:46 am => 2006-05-08T01:03:46
5-8-6 1:3:46 pm => 2006-05-08T13:03:46
5-8-6 1:3:6 => 2006-05-08T01:03:06
5-8-6 1:3:6 am => 2006-05-08T01:03:06
5-8-6 1:3:6 pm => 2006-05-08T13:03:06
5 8 6 => 2006-05-08T00:00:00
5-8-6 => 2006-05-08T00:00:00
5/8/6 => 2006-05-08T00:00:00
5.8.6 => 2006-05-08T00:00:00
5\8\6 => 2006-05-08T00:00:00
8-Dec-06 12:33:46 => 2006-12-08T12:33:46
8-Dec-06 12:33:46 am => 2006-12-08T00:33:46
8-Dec-06 12:33:46 pm => 2006-12-08T12:33:46
8-Dec-06 12:3:46 => 2006-12-08T12:03:46
8-Dec-06 12:3:46 am => 2006-12-08T00:03:46
8-Dec-06 12:3:46 pm => 2006-12-08T12:03:46
8-Dec-06 12:3:6 => 2006-12-08T12:03:06
8-Dec-06 12:3:6 am => 2006-12-08T00:03:06
8-Dec-06 12:3:6 pm => 2006-12-08T12:03:06
8-Dec-06 1:33:46 => 2006-12-08T01:33:46
8-Dec-06 1:33:46 am => 2006-12-08T01:33:46
8-Dec-06 1:33:46 pm => 2006-12-08T13:33:46
8-Dec-06 1:3:46 => 2006-12-08T01:03:46
8-Dec-06 1:3:46 am => 2006-12-08T01:03:46
8-Dec-06 1:3:46 pm => 2006-12-08T13:03:46
8-Dec-06 1:3:6 => 2006-12-08T01:03:06
8-Dec-06 1:3:6 am => 2006-12-08T01:03:06
8-Dec-06 1:3:6 pm => 2006-12-08T13:03:06
8 Dec 06 => 2006-12-08T00:00:00
8-Dec-06 => 2006-12-08T00:00:00
8/Dec/06 => 2006-12-08T00:00:00
8.Dec.06 => 2006-12-08T00:00:00
8\Dec\06 => 2006-12-08T00:00:00
8-Dec-2006 12:33:46 => 2006-12-08T12:33:46
8-Dec-2006 12:33:46 am => 2006-12-08T00:33:46
8-Dec-2006 12:33:46 pm => 2006-12-08T12:33:46
8-Dec-2006 12:3:46 => 2006-12-08T12:03:46
8-Dec-2006 12:3:46 am => 2006-12-08T00:03:46
8-Dec-2006 12:3:46 pm => 2006-12-08T12:03:46
8-Dec-2006 12:3:6 => 2006-12-08T12:03:06
8-Dec-2006 12:3:6 am => 2006-12-08T00:03:06
8-Dec-2006 12:3:6 pm => 2006-12-08T12:03:06
8-Dec-2006 1:33:46 => 2006-12-08T01:33:46
8-Dec-2006 1:33:46 am => 2006-12-08T01:33:46
8-Dec-2006 1:33:46 pm => 2006-12-08T13:33:46
8-Dec-2006 1:3:46 => 2006-12-08T01:03:46
8-Dec-2006 1:3:46 am => 2006-12-08T01:03:46
8-Dec-2006 1:3:46 pm => 2006-12-08T13:03:46
8-Dec-2006 1:3:6 => 2006-12-08T01:03:06
8-Dec-2006 1:3:6 am => 2006-12-08T01:03:06
8-Dec-2006 1:3:6 pm => 2006-12-08T13:03:06
8 Dec 2006 => 2006-12-08T00:00:00
8-Dec-2006 => 2006-12-08T00:00:00
8/Dec/2006 => 2006-12-08T00:00:00
8.Dec.2006 => 2006-12-08T00:00:00
8\Dec\2006 => 2006-12-08T00:00:00
8-Dec-6 12:33:46 => 2006-12-08T12:33:46
8-Dec-6 12:33:46 am => 2006-12-08T00:33:46
8-Dec-6 12:33:46 pm => 2006-12-08T12:33:46
8-Dec-6 12:3:46 => 2006-12-08T12:03:46
8-Dec-6 12:3:46 am => 2006-12-08T00:03:46
8-Dec-6 12:3:46 pm => 2006-12-08T12:03:46
8-Dec-6 12:3:6 => 2006-12-08T12:03:06
8-Dec-6 12:3:6 am => 2006-12-08T00:03:06
8-Dec-6 12:3:6 pm => 2006-12-08T12:03:06
8-Dec-6 1:33:46 => 2006-12-08T01:33:46
8-Dec-6 1:33:46 am => 2006-12-08T01:33:46
8-Dec-6 1:33:46 pm => 2006-12-08T13:33:46
8-Dec-6 1:3:46 => 2006-12-08T01:03:46
8-Dec-6 1:3:46 am => 2006-12-08T01:03:46
8-Dec-6 1:3:46 pm => 2006-12-08T13:03:46
8-Dec-6 1:3:6 => 2006-12-08T01:03:06
8-Dec-6 1:3:6 am => 2006-12-08T01:03:06
8-Dec-6 1:3:6 pm => 2006-12-08T13:03:06
8 Dec 6 => 2006-12-08T00:00:00
8-Dec-6 => 2006-12-08T00:00:00
8/Dec/6 => 2006-12-08T00:00:00
8.Dec.6 => 2006-12-08T00:00:00
8\Dec\6 => 2006-12-08T00:00:00
8-Mar-06 12:33:46 => 2006-03-08T12:33:46
8-Mar-06 12:33:46 am => 2006-03-08T00:33:46
8-Mar-06 12:33:46 pm => 2006-03-08T12:33:46
8-Mar-06 12:3:46 => 2006-03-08T12:03:46
8-Mar-06 12:3:46 am => 2006-03-08T00:03:46
8-Mar-06 12:3:46 pm => 2006-03-08T12:03:46
8-Mar-06 12:3:6 => 2006-03-08T12:03:06
8-Mar-06 12:3:6 am => 2006-03-08T00:03:06
8-Mar-06 12:3:6 pm => 2006-03-08T12:03:06
8-Mar-06 1:33:46 => 2006-03-08T01:33:46
8-Mar-06 1:33:46 am => 2006-03-08T01:33:46
8-Mar-06 1:33:46 pm => 2006-03-08T13:33:46
8-Mar-06 1:3:46 => 2006-03-08T01:03:46
8-Mar-06 1:3:46 am => 2006-03-08T01:03:46
8-Mar-06 1:3:46 pm => 2006-03-08T13:03:46
8-Mar-06 1:3:6 => 2006-03-08T01:03:06
8-Mar-06 1:3:6 am => 2006-03-08T01:03:06
8-Mar-06 1:3:6 pm => 2006-03-08T13:03:06
8 Mar 06 => 2006-03-08T00:00:00
8-Mar-06 => 2006-03-08T00:00:00
8/Mar/06 => 2006-03-08T00:00:00
8.Mar.06 => 2006-03-08T00:00:00
8\Mar\06 => 2006-03-08T00:00:00
8-Mar-2006 12:33:46 => 2006-03-08T12:33:46
8-Mar-2006 12:33:46 am => 2006-03-08T00:33:46
8-Mar-2006 12:33:46 pm => 2006-03-08T12:33:46
8-Mar-2006 12:3:46 => 2006-03-08T12:03:46
8-Mar-2006 12:3:46 am => 2006-03-08T00:03:46
8-Mar-2006 12:3:46 pm => 2006-03-08T12:03:46
8-Mar-2006 12:3:6 => 2006-03-08T12:03:06
8-Mar-2006 12:3:6 am => 2006-03-08T00:03:06
8-Mar-2006 12:3:6 pm => 2006-03-08T12:03:06
8-Mar-2006 1:33:46 => 2006-03-08T01:33:46
8-Mar-2006 1:33:46 am => 2006-03-08T01:33:46
8-Mar-2006 1:33:46 pm => 2006-03-08T13:33:46
8-Mar-2006 1:3:46 => 2006-03-08T01:03:46
8-Mar-2006 1:3:46 am => 2006-03-08T01:03:46
8-Mar-2006 1:3:46 pm => 2006-03-08T13:03:46
8-Mar-2006 1:3:6 => 2006-03-08T01:03:06
8-Mar-2006 1:3:6 am => 2006-03-08T01:03:06
8-Mar-2006 1:3:6 pm => 2006-03-08T13:03:06
8 Mar 2006 => 2006-03-08T00:00:00
8-Mar-2006 => 2006-03-08T00:00:00
8/Mar/2006 => 2006-03-08T00:00:00
8.Mar.2006 => 2006-03-08T00:00:00
8\Mar\2006 => 2006-03-08T00:00:00
8-Mar-6 12:33:46 => 2006-03-08T12:33:46
8-Mar-6 12:33:46 am => 2006-03-08T00:33:46
8-Mar-6 12:33:46 pm => 2006-03-08T12:33:46
8-Mar-6 12:3:46 => 2006-03-08T12:03:46
8-Mar-6 12:3:46 am => 2006-03-08T00:03:46
8-Mar-6 12:3:46 pm => 2006-03-08T12:03:46
8-Mar-6 12:3:6 => 2006-03-08T12:03:06
8-Mar-6 12:3:6 am => 2006-03-08T00:03:06
8-Mar-6 12:3:6 pm => 2006-03-08T12:03:06
8-Mar-6 1:33:46 => 2006-03-08T01:33:46
8-Mar-6 1:33:46 am => 2006-03-08T01:33:46
8-Mar-6 1:33:46 pm => 2006-03-08T13:33:46
8-Mar-6 1:3:46 => 2006-03-08T01:03:46
8-Mar-6 1:3:46 am => 2006-03-08T01:03:46
8-Mar-6 1:3:46 pm => 2006-03-08T13:03:46
8-Mar-6 1:3:6 => 2006-03-08T01:03:06
8-Mar-6 1:3:6 am => 2006-03-08T01:03:06
8-Mar-6 1:3:6 pm => 2006-03-08T13:03:06
8 Mar 6 => 2006-03-08T00:00:00
8-Mar-6 => 2006-03-08T00:00:00
8/Mar/6 => 2006-03-08T00:00:00
8.Mar.6 => 2006-03-08T00:00:00
8\Mar\6 => 2006-03-08T00:00:00
93-12-01 => 1993-12-01T00:00:00
96-06-1800:00:00 => 1996-06-18T00:00:00
96-06-1800:00 => 1996-06-18T00:00:00
99345 12:33:46 => 1999-12-11T12:33:46
99345 12:33:46 am => 1999-12-11T00:33:46
99345 12:33:46 pm => 1999-12-11T12:33:46
99345 12:3:46 => 1999-12-11T12:03:46
99345 12:3:46 am => 1999-12-11T00:03:46
99345 12:3:46 pm => 1999-12-11T12:03:46
99345 12:3:6 => 1999-12-11T12:03:06
99345 12:3:6 am => 1999-12-11T00:03:06
99345 12:3:6 pm => 1999-12-11T12:03:06
99345 1:33:46 => 1999-12-11T01:33:46
99345 1:33:46 am => 1999-12-11T01:33:46
99345 1:33:46 pm => 1999-12-11T13:33:46
99345 1:3:46 => 1999-12-11T01:03:46
99345 1:3:46 am => 1999-12-11T01:03:46
99345 1:3:46 pm => 1999-12-11T13:03:46
99345 1:3:6 => 1999-12-11T01:03:06
99345 1:3:6 am => 1999-12-11T01:03:06
99345 1:3:6 pm => 1999-12-11T13:03:06
9 Nov 1994 09:50:32 => 1994-11-09T09:50:32
Dec-18-6 12:33:46 => 2006-12-18T12:33:46
Dec-18-6 12:33:46 am => 2006-12-18T00:33:46
Dec-18-6 12:33:46 pm => 2006-12-18T12:33:46
Dec-18-6 12:3:46 => 2006-12-18T12:03:46
Dec-18-6 12:3:46 am => 2006-12-18T00:03:46
Dec-18-6 12:3:46 pm => 2006-12-18T12:03:46
Dec-18-6 12:3:6 => 2006-12-18T12:03:06
Dec-18-6 12:3:6 am => 2006-12-18T00:03:06
Dec-18-6 12:3:6 pm => 2006-12-18T12:03:06
Dec-18-6 1:33:46 => 2006-12-18T01:33:46
Dec-18-6 1:33:46 am => 2006-12-18T01:33:46
Dec-18-6 1:33:46 pm => 2006-12-18T13:33:46
Dec-18-6 1:3:46 => 2006-12-18T01:03:46
Dec-18-6 1:3:46 am => 2006-12-18T01:03:46
Dec-18-6 1:3:46 pm => 2006-12-18T13:03:46
Dec-18-6 1:3:6 => 2006-12-18T01:03:06
Dec-18-6 1:3:6 am => 2006-12-18T01:03:06
Dec-18-6 1:3:6 pm => 2006-12-18T13:03:06
Dec 18 6 => 2006-12-18T00:00:00
Dec-18-6 => 2006-12-18T00:00:00
Dec/18/6 => 2006-12-18T00:00:00
Dec.18.6 => 2006-12-18T00:00:00
Dec\18\6 => 2006-12-18T00:00:00
Dec-2006 12:33:46 => 2006-12-01T12:33:46
Dec-2006 12:33:46 am => 2006-12-01T00:33:46
Dec-2006 12:33:46 pm => 2006-12-01T12:33:46
Dec-2006 12:3:46 => 2006-12-01T12:03:46
Dec-2006 12:3:46 am => 2006-12-01T00:03:46
Dec-2006 12:3:46 pm => 2006-12-01T12:03:46
Dec-2006 12:3:6 => 2006-12-01T12:03:06
Dec-2006 12:3:6 am => 2006-12-01T00:03:06
Dec-2006 12:3:6 pm => 2006-12-01T12:03:06
Dec-2006 1:33:46 => 2006-12-01T01:33:46
Dec-2006 1:33:46 am => 2006-12-01T01:33:46
Dec-2006 1:33:46 pm => 2006-12-01T13:33:46
Dec-2006 1:3:46 => 2006-12-01T01:03:46
Dec-2006 1:3:46 am => 2006-12-01T01:03:46
Dec-2006 1:3:46 pm => 2006-12-01T13:03:46
Dec-2006 1:3:6 => 2006-12-01T01:03:06
Dec-2006 1:3:6 am => 2006-12-01T01:03:06
Dec-2006 1:3:6 pm => 2006-12-01T13:03:06
Dec 2006 => 2006-12-01T00:00:00
Dec-2006 => 2006-12-01T00:00:00
Dec/2006 => 2006-12-01T00:00:00
Dec.2006 => 2006-12-01T00:00:00
Dec\2006 => 2006-12-01T00:00:00
Dec-8-6 12:33:46 => 2006-12-08T12:33:46
Dec-8-6 12:33:46 am => 2006-12-08T00:33:46
Dec-8-6 12:33:46 pm => 2006-12-08T12:33:46
Dec-8-6 12:3:46 => 2006-12-08T12:03:46
Dec-8-6 12:3:46 am => 2006-12-08T00:03:46
Dec-8-6 12:3:46 pm => 2006-12-08T12:03:46
Dec-8-6 12:3:6 => 2006-12-08T12:03:06
Dec-8-6 12:3:6 am => 2006-12-08T00:03:06
Dec-8-6 12:3:6 pm => 2006-12-08T12:03:06
Dec-8-6 1:33:46 => 2006-12-08T01:33:46
Dec-8-6 1:33:46 am => 2006-12-08T01:33:46
Dec-8-6 1:33:46 pm => 2006-12-08T13:33:46
Dec-8-6 1:3:46 => 2006-12-08T01:03:46
Dec-8-6 1:3:46 am => 2006-12-08T01:03:46
Dec-8-6 1:3:46 pm => 2006-12-08T13:03:46
Dec-8-6 1:3:6 => 2006-12-08T01:03:06
Dec-8-6 1:3:6 am => 2006-12-08T01:03:06
Dec-8-6 1:3:6 pm => 2006-12-08T13:03:06
Dec 8 6 => 2006-12-08T00:00:00
Dec-8-6 => 2006-12-08T00:00:00
Dec/8/6 => 2006-12-08T00:00:00
Dec.8.6 => 2006-12-08T00:00:00
Dec\8\6 => 2006-12-08T00:00:00
December 1st, 2006 => 2006-12-01T00:00:00
December 2nd, 2006 => 2006-12-02T00:00:00
December 3rd, 2006 => 2006-12-03T00:00:00
December 4th, 2006 => 2006-12-04T00:00:00
Feb 1st 1997 00:00:00 => 1997-02-01T00:00:00
Feb-2006 12:33:46 => 2006-02-01T12:33:46
Feb-2006 12:33:46 am => 2006-02-01T00:33:46
Feb-2006 12:33:46 pm => 2006-02-01T12:33:46
Feb-2006 12:3:46 => 2006-02-01T12:03:46
Feb-2006 12:3:46 am => 2006-02-01T00:03:46
Feb-2006 12:3:46 pm => 2006-02-01T12:03:46
Feb-2006 12:3:6 => 2006-02-01T12:03:06
Feb-2006 12:3:6 am => 2006-02-01T00:03:06
Feb-2006 12:3:6 pm => 2006-02-01T12:03:06
Feb-2006 1:33:46 => 2006-02-01T01:33:46
Feb-2006 1:33:46 am => 2006-02-01T01:33:46
Feb-2006 1:33:46 pm => 2006-02-01T13:33:46
Feb-2006 1:3:46 => 2006-02-01T01:03:46
Feb-2006 1:3:46 am => 2006-02-01T01:03:46
Feb-2006 1:3:46 pm => 2006-02-01T13:03:46
Feb-2006 1:3:6 => 2006-02-01T01:03:06
Feb-2006 1:3:6 am => 2006-02-01T01:03:06
Feb-2006 1:3:6 pm => 2006-02-01T13:03:06
