release,date,author,status,maturity,version,first,distribution,abstract
TeX-Hyphen-0.140,2002-09-24T20:35:08,JANPAZ,backpan,released,0.140,,TeX-Hyphen,"hyphenate words using TeX's patterns"
EasyTCP-0.15,2002-09-25T03:02:37,MNAGUIB,backpan,released,0.15,,EasyTCP,"Easily create secure, bandwidth-friendly TCP/IP clients and servers"
School-Perl-Guide-0.1,2002-09-25T03:44:03,SNEEX,backpan,released,0.1,1,School-Perl-Guide,
XML-IDMEF-0.04,2002-09-25T08:43:38,ERWAN,backpan,released,0.04,,XML-IDMEF,"A module for building/parsing IDMEF messages"
Locale-Maketext-Lexicon-0.091,2002-09-25T09:56:01,AUTRIJUS,backpan,released,0.091,,Locale-Maketext-Lexicon,"Extract gettext strings from source"
Algorithm-Evolutionary-0.52,2002-09-25T10:09:43,JMERELO,backpan,released,0.52,,Algorithm-Evolutionary,"Perl extension for performing paradigm-free evolutionary algorithms."
Test-Verbose-0.000_4,2002-09-25T11:09:17,RBS,backpan,developer,0.000_4,1,Test-Verbose,"Run 'make TEST_VERBOSE=1' on one or more test files"
OpenFrame-3.02,2002-09-25T11:23:03,JDUNCAN,backpan,released,3.02,,OpenFrame,"a framework for network enabled applications"
OpenFrame-AppKit-1.03,2002-09-25T11:23:19,JDUNCAN,backpan,released,1.03,,OpenFrame-AppKit,"The OpenFrame AppKit"
Petal-0.73,2002-09-25T11:26:47,JHIVER,backpan,released,0.73,,Petal,"Perl Template Attribute Language"
Acme-Handwave-0.01,2002-09-25T12:31:31,HITHERTO,backpan,released,0.01,,Acme-Handwave,"Get the result you want without tedious algorithms or real programming"
Algorithm-Evolutionary-0.52_1,2002-09-25T12:33:23,JMERELO,backpan,developer,0.52_1,,Algorithm-Evolutionary,"Perl extension for performing paradigm-free evolutionary algorithms."
Acme-Handwave-0.01.1,2002-09-25T12:41:39,HITHERTO,backpan,released,v0.01.1,1,Acme-Handwave,"Get the result you want without tedious algorithms or real programming"
MQSeries-1.19,2002-09-25T13:04:17,HBIERSMA,backpan,released,1.19,,MQSeries,"Perl extension for MQSeries support"
Prima-1.07,2002-09-25T14:36:48,KARASIK,backpan,released,1.07,,Prima,"a perl graphic toolkit"
Prima-1.07-MSWin32-ActiveState-build631,2002-09-25T14:40:16,KARASIK,backpan,released,1.07,,Prima,"a perl graphic toolkit"
PostScript-File-0.03,2002-09-25T14:47:12,CPWILLMOT,backpan,released,0.03,,PostScript-File,"Base class for creating Adobe PostScript files"
XML-IDMEF-0.05,2002-09-25T15:29:26,ERWAN,backpan,released,0.05,,XML-IDMEF,"A module for building/parsing IDMEF messages"
Template-Plugin-HTML-Template-0.01,2002-09-25T15:50:47,MIYAGAWA,cpan,released,0.01,1,Template-Plugin-HTML-Template,"HTML::Template filter in TT"
XML-LibXML-Fixup-0.01,2002-09-25T15:51:04,NWETTERS,backpan,released,0.01,1,XML-LibXML-Fixup,"apply regexes to XML to fix validation and parsing errors"
Apache-AuthCookie-3.04,2002-09-25T17:06:26,MSCHOUT,backpan,released,3.04,,Apache-AuthCookie,"Perl Authentication and Authorization via cookies"
Template-Plugin-HTML-Template-0.02,2002-09-25T17:41:31,MIYAGAWA,latest,released,0.02,,Template-Plugin-HTML-Template,"HTML::Template filter in TT"
Chess-0.5.1,2002-09-25T17:48:22,BJR,backpan,released,v0.5.1,1,Chess,"Manipulate and validate a chessboard in Perl"
Class-Skin-0.02,2002-09-25T19:03:50,RANI,cpan,released,0.02,,Class-Skin,"Class for creating text out of text templates."
Algorithm-Evolutionary-0.52_2,2002-09-25T20:43:30,JMERELO,backpan,developer,0.52_2,,Algorithm-Evolutionary,"Perl extension for performing paradigm-free evolutionary algorithms."
Convert-Binary-C-0.03,2002-09-25T20:52:13,MHX,backpan,released,0.03,,Convert-Binary-C,"Binary Data Conversion using C Types"
Chess-0.5.2,2002-09-25T21:14:16,BJR,backpan,released,v0.5.2,,Chess,"Manipulate and validate a chessboard in Perl"
Module-Dependency-1.13,2002-09-25T23:57:16,PKENT,backpan,released,1.13,,Module-Dependency,"Collection of modules for examining dependencies between parents and children, like Perl files"
Schedule-Cron-Events-1.7,2002-09-25T23:57:32,PKENT,backpan,released,1.7,,Schedule-Cron-Events,"take a line from a crontab and find out when events will occur"
Crypt-OpenSSL-DSA-0.10,2002-09-26T00:21:17,TJMATHER,backpan,released,0.10,,Crypt-OpenSSL-DSA,"Digital Signature Algorithm using OpenSSL"
Geography-NationalGrid-1.6,2002-09-26T02:04:25,PKENT,backpan,released,1.6,1,Geography-NationalGrid,"Base class to create an object for a point and to transform coordinate systems"
DBD-ODBC-0.45_18,2002-09-26T04:14:01,JURL,cpan,developer,0.45_18,,DBD-ODBC,"ODBC Driver for DBI"
Device-Modem-1.22,2002-09-26T05:37:10,COSIMO,backpan,released,1.22,,Device-Modem,"Perl extension to talk to modem devices connected via serial port"
Astro-0.61,2002-09-26T05:42:16,CPHIL,backpan,released,0.61,,Astro,"Astronomical coordinate transformations"
Mac-Errors-0.6,2002-09-26T08:01:29,BDFOY,backpan,released,0.6,,Mac-Errors,"constants for Mac error codes"
UserMod,2002-09-26T08:25:07,VIDUL,backpan,released,0,1,UserMod,"modify user accounts"
Apache-Session-SharedMem-0.41,2002-09-26T08:26:58,SIMONW,backpan,released,0.41,,Apache-Session-SharedMem,"Session management via shared memory"
Thread-Conveyor-0.11,2002-09-26T08:51:48,ELIZABETH,backpan,released,0.11,,Thread-Conveyor,"transport of any data-structure between threads"
OpenFrame-Segment-Apache-1.01,2002-09-26T09:10:46,LBROCARD,backpan,released,1.01,,OpenFrame-Segment-Apache,"Run a small website through Apache"
Math-Geometry_2D-1.00,2002-09-26T09:14:15,DVDPOL,backpan,released,1.00,1,Math-Geometry_2D,"Module with 2D geometry functions"
GPC-1.00,2002-09-26T09:16:11,DVDPOL,backpan,released,1.00,1,GPC,"Perl wrapper for Alan Murta's gpc library"
CGI-Panel-0.92,2002-09-26T09:47:41,RSYMES,cpan,released,0.92,,CGI-Panel,"Create sophisticated event-driven web applications from simple panel objects"
WWW-UsePerl-Journal-0.06,2002-09-26T10:06:53,IDORU,backpan,released,0.06,,WWW-UsePerl-Journal,"use.perl.org journal tool"
Algorithm-Evolutionary-0.52_3,2002-09-26T10:25:31,JMERELO,backpan,developer,0.52_3,,Algorithm-Evolutionary,"Perl extension for performing paradigm-free evolutionary algorithms."
WAP-SAXDriver-wbxml-2.01,2002-09-26T10:30:39,PERRAD,cpan,released,2.01,,WAP-SAXDriver-wbxml,"SAX parser for WBXML file"
WAP-wbxml-1.07,2002-09-26T10:30:54,PERRAD,backpan,released,1.07,,WAP-wbxml,"XML Compiler"
XML-LibXML-Fixup-0.02,2002-09-26T11:17:13,NWETTERS,backpan,released,0.02,,XML-LibXML-Fixup,"apply regexes to XML to fix validation and parsing errors"
XML-LibXML-Fixup-0.03,2002-09-26T11:30:57,NWETTERS,latest,released,0.03,,XML-LibXML-Fixup,"apply regexes to XML to fix validation and parsing errors"
Acme-Spider-0.01,2002-09-26T11:50:56,KASEI,backpan,released,0.01,1,Acme-Spider,"frighten some other modules"
MARC-Record-1.11,2002-09-26T14:20:37,PETDANCE,backpan,released,1.11,,MARC-Record,"MARC record dump utility"
OpenFrame-Segment-Apache-1.02,2002-09-26T14:47:28,LBROCARD,backpan,released,1.02,,OpenFrame-Segment-Apache,"Run a small website through Apache"
OpenFrame-Segment-Apache-1.03,2002-09-26T15:24:54,LBROCARD,backpan,released,1.03,,OpenFrame-Segment-Apache,"Run a small website through Apache"
MPE-IMAGE-0.98a,2002-09-26T21:48:45,DOKSNER,latest,released,0.98,,MPE-IMAGE,"Access MPEs TurboIMAGE/XL databases from within Perl"
Pod-Simple-31337-0.01,2002-09-26T22:14:17,CWEST,backpan,released,0.01,1,Pod-Simple-31337,"Convert POD to Cool Talk"
I18N-AcceptLanguage-0.01,2002-09-26T22:42:30,CGILMORE,backpan,released,0.01,1,I18N-AcceptLanguage,"Matches language preference to available languages"
PApp-0.143,2002-09-27T09:55:48,MLEHMANN,backpan,released,0.143,,PApp,"multi-page-state-preserving web applications"
HTML-Table-1.17,2002-09-27T10:38:41,AJPEACOCK,backpan,released,1.17,,HTML-Table,"produces HTML tables"
GPC-1.01,2002-09-27T11:45:11,DVDPOL,backpan,released,1.01,,GPC,"Perl wrapper for Alan Murta's gpc library"
Math-Geometry-Planar-1.01,2002-09-27T11:47:08,DVDPOL,backpan,released,1.01,1,Math-Geometry-Planar,"Module with planar geometry functions"
OpenFrame-Segment-Apache-1.04,2002-09-27T12:01:14,LBROCARD,backpan,released,1.04,,OpenFrame-Segment-Apache,"Run a small website through Apache"
Thread-Conveyor-0.12,2002-09-27T12:09:45,ELIZABETH,backpan,released,0.12,,Thread-Conveyor,"transport of any data-structure between threads"
Math-Geometry-Planar-1.02,2002-09-27T12:31:28,DVDPOL,backpan,released,1.02,,Math-Geometry-Planar,"Module with planar geometry functions"
Devel-Carnivore-0.09,2002-09-27T12:42:56,MALTEU,latest,released,0.09,,Devel-Carnivore,"Spy on your hashes (and objects)"
Pod-Simple-31337-0.02,2002-09-27T13:44:49,CWEST,latest,released,0.02,,Pod-Simple-31337,"Convert POD to Cool Talk"
mod_perl-1.99_06,2002-09-27T15:19:03,DOUGM,backpan,developer,1.99_06,,mod_perl,"Apache mod_perl change logfile"
Text-Templar-2.42,2002-09-27T15:53:59,GED,backpan,released,2.42,,Text-Templar,"Parse a template, outputting lots of Parse::RecDescent debugging"
XML-Handler-Dtd2Html-0.20,2002-09-27T16:25:58,PERRAD,backpan,released,0.20,,XML-Handler-Dtd2Html,"SAX2 handler for generate a HTML documentation from a DTD"
SVGGraph-0.05,2002-09-27T16:47:16,TEUN,backpan,released,0.05,,SVGGraph,"Perl extension for creating SVG Graphs / Diagrams / Charts / Plots."
WWW-UsePerl-Journal-0.07,2002-09-27T16:49:15,IDORU,backpan,released,0.07,,WWW-UsePerl-Journal,"use.perl.org journal tool"
SQL-Abstract-1.10,2002-09-27T18:09:33,NWIGER,backpan,released,1.10,,SQL-Abstract,"Generate SQL from Perl data structures"
mod_perl-1.99_07,2002-09-27T19:41:50,DOUGM,backpan,developer,1.99_07,,mod_perl,"Apache mod_perl change logfile"
Mail-IMAPClient-2.2.4,2002-09-27T20:44:53,DJKERNEN,backpan,released,v2.2.4,,Mail-IMAPClient,"An IMAP Client API"
Log-Dispatch-Jabber-0.1,2002-09-27T20:57:13,ASCOPE,backpan,released,0.1,1,Log-Dispatch-Jabber,"Log messages via Jabber"
Convert-AcrossLite-0.02,2002-09-27T21:00:57,DSPARLING,backpan,released,0.02,1,Convert-AcrossLite,"Convert binary AcrossLite puzzle files to text."
Tk-MacCopy-1.1,2002-09-28T01:24:35,LUSOL,backpan,released,1.1,1,Tk-MacCopy,"Copy file, file Copy file[s] | dir[s], dir"
Syndicate-Channel-0.10,2002-09-28T06:30:28,DRRHO,backpan,released,0.10,1,Syndicate-Channel,"Generalized News Syndication."
Log-Log4perl-0.24,2002-09-28T07:09:59,MSCHILLI,backpan,released,0.24,,Log-Log4perl,"Log4j implementation for Perl"
Term-Screen-1.02,2002-09-28T10:27:22,JSTOWE,backpan,released,1.02,,Term-Screen,"A Simple all perl Term::Cap based screen positioning module"
Term-Cap-1.08,2002-09-28T10:42:05,JSTOWE,backpan,released,1.08,,Term-Cap,"Perl termcap interface"
Tk-MacCopy-1.2,2002-09-28T14:58:58,LUSOL,backpan,released,1.2,,Tk-MacCopy,"Copy file, file Copy file[s] | dir[s], dir"
Apache-Pod-0.01_01,2002-09-28T17:28:22,PETDANCE,backpan,developer,0.01_01,1,Apache-Pod,"base class for converting Pod files to prettier forms"
version-0.18,2002-09-28T18:40:37,JPEACOCK,backpan,released,0.18,1,version,"Perl extension for Version Objects"
Bit-Vector-6.3,2002-09-28T20:52:33,STBEY,backpan,released,6.3,,Bit-Vector,"Efficient bit vector, set of integers and ""big int"" math library"
checkbot-1.68,2002-09-28T21:13:06,JJDG,backpan,released,1.68,,checkbot,"WWW Link Verifier"
Devel-Cover-0.18,2002-09-28T21:35:01,PJCJ,backpan,released,0.18,,Devel-Cover,"convert gcov files to Devel::Cover databases"
Devel-Cover-0.19,2002-09-28T22:45:47,PJCJ,backpan,released,0.19,,Devel-Cover,"convert gcov files to Devel::Cover databases"
Apache-iTunes-0.05,2002-09-29T02:34:07,BDFOY,backpan,released,0.05,1,Apache-iTunes,"control iTunes from mod_perl"
Pod-Simple-0.91,2002-09-29T06:43:18,SBURKE,backpan,released,0.91,,Pod-Simple,"Perl for Cygwin"
Pod-Simple-0.92,2002-09-29T07:02:32,SBURKE,backpan,released,0.92,,Pod-Simple,"Perl for Cygwin"
Net-FreeDB2-0.8.2.2,2002-09-29T07:06:23,ZOCCAV,backpan,released,v0.8.2.2,1,Net-FreeDB2,"Net::FreeDB2's get CD info"
Date-Calc-5.3,2002-09-29T07:30:11,STBEY,backpan,released,5.3,,Date-Calc,"Calendar objects for different holiday schemes"
XML-DifferenceMarkup-0.06,2002-09-29T09:20:22,VBAR,backpan,released,0.06,,XML-DifferenceMarkup,
WWW-Gazetteer-0.10,2002-09-29T10:15:00,LBROCARD,backpan,released,0.10,1,WWW-Gazetteer,"Find location of world towns and cities"
WWW-Gazetteer-0.11,2002-09-29T10:33:53,LBROCARD,backpan,released,0.11,,WWW-Gazetteer,"Find location of world towns and cities"
Net-FreeDB2-0.8.2.6,2002-09-29T16:45:03,ZOCCAV,latest,released,v0.8.2.6,,Net-FreeDB2,"Net::FreeDB2's get CD info"
Net-YMSG-1.1,2002-09-29T19:02:21,VARUNK,cpan,released,1.1,1,Net-YMSG,"Interface to the Yahoo!Messenger IM protocol"
Net-Socket-NonBlock-0.06,2002-09-29T20:57:46,TPABA,cpan,released,0.06,,Net-Socket-NonBlock,"Perl extension for easy creation multi-socket single-thread application, especially non-forking TCP servers"
load-0.01,2002-09-29T21:34:25,ELIZABETH,backpan,released,0.01,1,load,"control when subroutines will be loaded"
DWH_File-0.1,2002-09-29T23:12:44,SUMUS,cpan,released,0.1,,DWH_File,
Tie-Scalar-OK-1.00,2002-09-29T23:23:16,JEFFA,backpan,released,1.00,1,Tie-Scalar-OK,"generate numbered 'ok/not ok' strings"
version-0.19,2002-09-29T23:49:33,JPEACOCK,backpan,released,0.19,1,version,"Perl extension for Version Objects"
Test-Smoke-1.16,2002-09-30T00:59:34,ABELTJE,backpan,released,1.16,,Test-Smoke,"Create matrix for smoke test results."
POE-Component-Child-1.16,2002-09-30T01:29:40,ECALDER,backpan,released,1.16,1,POE-Component-Child,"Child management component"
POE-Component-Player-Mpg123-1.2,2002-09-30T01:29:56,ECALDER,latest,released,1.2,1,POE-Component-Player-Mpg123,"a wrapper for the mpg123 player"
WWW-Yahoo-Groups-1.1,2002-09-30T01:39:49,SPOON,backpan,released,1.1,1,WWW-Yahoo-Groups,"automated access to Yahoo! Groups."
Zoidberg-0.03,2002-09-30T01:41:41,PARDUS,backpan,released,0.03,1,Zoidberg,"an other perl shell"
PDL-2.3.4,2002-09-30T01:43:33,CSOE,backpan,released,v2.3.4,,PDL,"shell interface to PDL documentation"
Pod-Simple-0.93,2002-09-30T05:02:25,SBURKE,backpan,released,0.93,,Pod-Simple,"Perl for Cygwin"
Bundle-KohaSupport-0.02,2002-09-30T05:07:37,KOHA,backpan,released,0.02,1,Bundle-KohaSupport,"A bundle of the modules required by Koha."
Apache-Pod-0.02,2002-09-30T05:17:46,PETDANCE,backpan,released,0.02,,Apache-Pod,"base class for converting Pod files to prettier forms"
Test-Manifest-0.7,2002-09-30T05:41:01,BDFOY,backpan,released,0.7,,Test-Manifest,"interact with a t/test_manifest file"
Win32-MIDI-API-0.03,2002-09-30T05:48:02,HAYASHI,backpan,released,0.03,1,Win32-MIDI-API,"Perl extension for MS Windows 32bit MIDI API"
DBIx-Simple-0.07,2002-09-30T05:51:43,JUERD,cpan,released,0.07,,DBIx-Simple,"Easy-to-use OO interface to DBI, capable of emulating subqueries"
ResourcePool-0.9908,2002-09-30T06:05:43,MWS,backpan,released,0.9908,,ResourcePool,"A connection caching and pooling class."
Test-Manifest-0.8,2002-09-30T06:20:46,BDFOY,backpan,released,0.8,,Test-Manifest,"interact with a t/test_manifest file"
Apache-ASP-2.41,2002-09-30T06:35:47,CHAMAS,backpan,released,2.41,,Apache-ASP,"Apache::ASP CGI and command line script processor"
Test-Data-0.6,2002-09-30T06:40:50,BDFOY,backpan,released,0.6,,Test-Data,"test functions for scalar variables"
ConfigReader-Simple-1.14,2002-09-30T06:51:01,BDFOY,backpan,released,1.14,,ConfigReader-Simple,"Simple configuration file parser"
HTTP-Size-0.4,2002-09-30T07:11:12,BDFOY,backpan,released,0.4,,HTTP-Size,"Get the byte size of an internet resource"
Mac-iTunes-0.7,2002-09-30T07:29:43,BDFOY,backpan,released,0.7,,Mac-iTunes,"a Tk interface to iTunes"
CGI-SpeedyCGI-2.21,2002-09-30T07:52:57,HORROCKS,cpan,released,2.21,,CGI-SpeedyCGI,"Speed up perl scripts by running them persistently."
PersistentPerl-2.21,2002-09-30T07:53:14,HORROCKS,cpan,released,2.21,,PersistentPerl,"Speed up perl scripts by running them persistently."
Test-Prereq-0.07,2002-09-30T07:58:39,BDFOY,backpan,released,0.07,,Test-Prereq,"check if Makefile.PL has the right pre-requisites"
Apache-iTunes-0.06,2002-09-30T08:17:18,BDFOY,backpan,released,0.06,,Apache-iTunes,"control iTunes from mod_perl"
Petal-0.74,2002-09-30T13:45:49,JHIVER,backpan,released,0.74,,Petal,"Perl Template Attribute Language"
load-0.02,2002-09-30T13:49:27,ELIZABETH,backpan,released,0.02,,load,"control when subroutines will be loaded"
Thread-Serialize-0.05,2002-09-30T13:49:42,ELIZABETH,backpan,released,0.05,,Thread-Serialize,"serialize data-structures between threads"
Thread-Conveyor-0.13,2002-09-30T13:51:43,ELIZABETH,backpan,released,0.13,,Thread-Conveyor,"transport of any data-structure between threads"
Thread-Conveyor-Monitored-0.09,2002-09-30T13:51:59,ELIZABETH,backpan,released,0.09,,Thread-Conveyor-Monitored,"monitor a belt for specific content"
Thread-Pool-0.28,2002-09-30T13:52:14,ELIZABETH,backpan,released,0.28,,Thread-Pool,"group of threads for performing similar jobs"
Thread-Pool-Resolve-0.08,2002-09-30T13:52:29,ELIZABETH,backpan,released,0.08,,Thread-Pool-Resolve,"resolve logs asynchronously"
Thread-Exit-0.04,2002-09-30T13:52:45,ELIZABETH,backpan,released,0.04,,Thread-Exit,"provide thread-local exit(), BEGIN {} and END {}"
Thread-Tie-0.08,2002-09-30T13:53:01,ELIZABETH,backpan,released,0.08,,Thread-Tie,"tie variables into a thread of their own"
Thread-Signal-1.06,2002-09-30T13:55:04,ELIZABETH,backpan,released,1.06,,Thread-Signal,"deliver a signal to a thread"
Thread-Status-0.03,2002-09-30T13:55:20,ELIZABETH,backpan,released,0.03,,Thread-Status,"report stack status of all running threads"
Thread-Use-0.03,2002-09-30T13:55:35,ELIZABETH,backpan,released,0.03,1,Thread-Use,"use a module inside a thread only"
Thread-Rand-0.04,2002-09-30T13:55:51,ELIZABETH,backpan,released,0.04,,Thread-Rand,"repeatable random sequences between threads"
PDF-Report-1.00,2002-09-30T16:49:57,AORR,cpan,released,1.00,1,PDF-Report,"A wrapper written for PDF::API2"
Netscape-Cache-0.45,2002-09-30T17:38:41,SREZIC,cpan,released,0.45,,Netscape-Cache,"object class for accessing Netscape cache files"
Scraper-2.26,2002-09-30T17:58:55,GLENNWOOD,cpan,released,2.26,,Scraper,"A Framework for scraping results from search engines."
Tk-DateEntry-1.34,2002-09-30T18:06:00,SREZIC,backpan,released,1.34,,Tk-DateEntry,"Drop down calendar widget for selecting dates."
Net-DNAT-0.07,2002-09-30T18:07:53,BBB,backpan,released,0.07,,Net-DNAT,"mod_perl Apache module to undo the side-effects of Net::DNAT"
EasyTCP-0.16,2002-09-30T20:20:38,MNAGUIB,backpan,released,0.16,,EasyTCP,"Easily create secure, bandwidth-friendly TCP/IP clients and servers"
Set-IntRange-5.1,2002-09-30T21:23:00,STBEY,backpan,released,5.1,,Set-IntRange,"Sets of Integers"
HTML-TagReader-0.12,2002-09-30T21:42:43,GUS,cpan,released,0.12,,HTML-TagReader,"Perl extension module for reading html/sgml/xml files by tags."
Benchmark-Thread-Size-0.03,2002-09-30T22:31:08,ELIZABETH,backpan,released,0.03,,Benchmark-Thread-Size,"report size of threads for different code approaches"
load-0.03,2002-09-30T22:31:23,ELIZABETH,backpan,released,0.03,,load,"control when subroutines will be loaded"
Log-Dispatch-Jabber-0.2,2002-09-30T22:39:39,ASCOPE,backpan,released,0.2,1,Log-Dispatch-Jabber,"Log messages via Jabber"
Graphics-RGBManipulate-0.01,2002-09-30T22:41:31,SARGIE,backpan,released,0.01,1,Graphics-RGBManipulate,"HSV adjustment tool for RGB colours"
Decision-Markov-0.02,2002-09-30T23:45:08,ALANSZ,cpan,released,0.02,,Decision-Markov,"Markov models for decision analysis"
Test-Data-0.7,2002-10-01T00:07:31,BDFOY,backpan,released,0.7,,Test-Data,"test functions for scalar variables"
dbMan-0.25,2002-10-01T00:14:12,MILSO,backpan,released,0.25,,dbMan,
Encode-compat-0.03,2002-10-01T02:07:56,AUTRIJUS,backpan,released,0.03,,Encode-compat,"Encode.pm emulation layer"
Log-Agent-0.303,2002-10-01T04:13:59,MROGASKI,cpan,released,0.303,,Log-Agent,"logging agent"
Time-modules-2002.1001,2002-10-01T04:29:00,MUIR,backpan,released,2002.1001,,Time-modules,"simply report the number of days in a month"
Unix-Conf-0.2,2002-10-01T07:29:49,KARTHIKK,latest,released,0.2,1,Unix-Conf,"Front end for class methods in various utility modules under the Unix::Conf namespace."
Unix-Conf-Bind8-0.3,2002-10-01T07:30:06,KARTHIKK,latest,released,0.3,,Unix-Conf-Bind8,"Front end for a suite of classes for manipulating a Bind8 conf and associated zone record files."
Locale-Maketext-Fuzzy-0.02,2002-10-01T08:02:21,AUTRIJUS,cpan,released,0.02,,Locale-Maketext-Fuzzy,"Maketext from already interpolated strings"
Class-MethodMaker-1.07,2002-10-01T08:04:28,FLUFFY,backpan,released,1.07,,Class-MethodMaker,"tools for making makefiles with."
Log-Info-1.10,2002-10-01T08:06:20,FLUFFY,backpan,released,1.10,,Log-Info,"tools for making makefiles with."
Math-Geometry-Planar-1.03,2002-10-01T09:44:06,DVDPOL,backpan,released,1.03,,Math-Geometry-Planar,"Module with planar geometry functions"
HTTP-Proxy-0.01,2002-10-01T10:01:14,BOOK,backpan,released,0.01,1,HTTP-Proxy,"A pure Perl HTTP proxy"
Bundle-KohaSupport-0.03,2002-10-01T11:13:56,KOHA,backpan,released,0.03,,Bundle-KohaSupport,"A bundle of the modules required by Koha."
WWW-Yahoo-Groups-1.2,2002-10-01T11:47:12,SPOON,backpan,released,1.2,,WWW-Yahoo-Groups,"automated access to Yahoo! Groups."
YiJing-0.01,2002-10-01T12:50:33,AUTRIJUS,backpan,released,0.01,1,YiJing,"The Book of Hacking"
EasyArgs-1.00,2002-10-01T13:22:36,GSLONDON,backpan,released,1.00,,EasyArgs,"Perl module for easily handling command line arguments."
Math-Geometry-Planar-1.04,2002-10-01T15:30:30,DVDPOL,backpan,released,1.04,,Math-Geometry-Planar,"A collection of planar geometry functions"
Tk-Copy-Mac-1.3,2002-10-01T16:55:21,LUSOL,latest,released,1.3,1,Tk-Copy-Mac,"Copy file, file Copy file[s] | dir[s], dir"
Tk-ProgressBar-Mac-1.1,2002-10-01T16:55:37,LUSOL,backpan,released,1.1,1,Tk-ProgressBar-Mac,"a blue, 3-D Macintosh Classic progress bar."
DBIx-Dump-0.01,2002-10-01T17:30:56,ISTERIN,cpan,released,0.01,1,DBIx-Dump,"Perl extension for dumping database (DBI) data into a variety of formats."
DBIx-Dump-0.02,2002-10-01T19:51:51,ISTERIN,cpan,released,0.02,,DBIx-Dump,"Perl extension for dumping database (DBI) data into a variety of formats."
Log-Dispatch-Jabber-0.21,2002-10-01T20:02:38,ASCOPE,backpan,released,0.21,,Log-Dispatch-Jabber,"Log messages via Jabber"
Encode-compat-0.04,2002-10-02T02:24:33,AUTRIJUS,backpan,released,0.04,,Encode-compat,"Encode.pm emulation layer"
Term-ANSIScreen-1.40,2002-10-02T02:24:49,AUTRIJUS,backpan,released,1.40,,Term-ANSIScreen,"Terminal control using ANSI escape sequences."
WWW-Yahoo-Groups-1.3,2002-10-02T02:36:18,SPOON,backpan,released,1.3,,WWW-Yahoo-Groups,"automated access to Yahoo! Groups."
WWW-Yahoo-Groups-1.4,2002-10-02T05:18:50,SPOON,backpan,released,1.4,,WWW-Yahoo-Groups,"automated access to Yahoo! Groups."
Net-DNS-0.29,2002-10-02T06:09:09,CREIN,backpan,released,0.29,,Net-DNS,"Put DNS MX queries in a hash lookup format"
Device-Conrad-RelaisControl-0.11,2002-10-02T06:43:52,NOHA,cpan,released,0.11,,Device-Conrad-RelaisControl,"Perl extension for accessing a Conrad Electronic Relaiscard"
MIME-Types-1.003,2002-10-02T07:40:46,MARKOV,backpan,released,1.003,,MIME-Types,"Definition of one MIME type"
Tk-DatePick-1.0,2002-10-02T07:51:01,LAWGON,cpan,released,1.0,1,Tk-DatePick,"Perl extension for Tk to pick dates"
GPC-1.02,2002-10-02T08:24:39,DVDPOL,backpan,released,1.02,,GPC,"Perl wrapper for Alan Murta's gpc library"
Regexp-Ignore-0.03,2002-10-02T10:57:21,RANI,latest,released,0.03,,Regexp-Ignore,"Let us ignore the HTML tags when parsing HTML text"
File-Scan-0.37,2002-10-02T11:17:36,HDIAS,backpan,released,0.37,,File-Scan,"Perl extension for Scanning files for Viruses"
Net-DNS-SEC-0.07,2002-10-02T12:45:02,OLAF,backpan,released,0.07,,Net-DNS-SEC,"DNSSEC extensions to Net::DNS"
DelimMatch-1.05,2002-10-02T12:52:13,NWALSH,cpan,released,1.05,,DelimMatch,"Perl extension to find regexp delimited strings with proper nesting"
Audio-ESD-0.02,2002-10-02T13:58:55,DJHD,latest,released,0.02,1,Audio-ESD,"Perl extension for talking to the Enlightened Sound Daemon"
AxKit-XSP-Swish-0.2,2002-10-02T15:55:04,FMACHABEE,backpan,released,0.2,,AxKit-XSP-Swish,"A namespace wrapper for accessing Swish-e."
Font-TTF-0.32,2002-10-02T16:18:52,MHOSKEN,backpan,released,0.32,,Font-TTF,"module for processing makefiles"
AxKit-XSP-Swish-0.2a,2002-10-02T17:46:22,FMACHABEE,latest,released,0.2,,AxKit-XSP-Swish,"A namespace wrapper for accessing Swish-e."
Bundle-KohaSupport-0.05,2002-10-02T18:07:12,KOHA,backpan,released,0.05,,Bundle-KohaSupport,"A bundle of the modules required by Koha."
I18N-Charset-1.22,2002-10-02T19:39:36,MTHURN,backpan,released,1.22,,I18N-Charset,"IANA Character Set Registry names and Unicode::MapUTF8 (et al.) conversion scheme names"
Config-Cfe-1.50,2002-10-02T19:57:07,JHAGG,latest,released,1.50,1,Config-Cfe,"add/remove sections in configuration files"
Log-Dispatch-Jabber-0.22,2002-10-02T22:04:29,ASCOPE,backpan,released,0.22,,Log-Dispatch-Jabber,"Log messages via Jabber"
RPM-Tools-0.7,2002-10-02T23:38:48,SHARRISON,cpan,released,0.7,,RPM-Tools,"cleanly generate an RPM"
WWW-Yahoo-Groups-1.5,2002-10-03T00:15:38,SPOON,backpan,released,1.5,,WWW-Yahoo-Groups,"automated access to Yahoo! Groups."
Storable-2.05,2002-10-03T03:37:51,AMS,backpan,released,2.05,,Storable,"persistence for Perl data structures"
DBIx-XHTML_Table-1.14,2002-10-03T03:47:53,JEFFA,backpan,released,1.14,,DBIx-XHTML_Table,"SQL query result set to XHTML table."
Tk-DatePick-1.01,2002-10-03T05:32:39,LAWGON,cpan,released,1.01,,Tk-DatePick,"Perl extension for Tk to pick dates"
Data-Fallback-0.01,2002-10-03T07:32:22,EARL,cpan,released,0.01,1,Data-Fallback,"fallback through an array of levels till you find your data, cacheing where desired"
YiJing-0.02,2002-10-03T07:57:35,AUTRIJUS,cpan,released,0.02,1,YiJing,"The Book of Hacking"
Astro-DSS-1.6,2002-10-03T08:59:18,AALLAN,cpan,released,1.6,,Astro-DSS,"Object definining a query request in the Digital Sky Survey"
Net-DHCP-Watch-2.00,2002-10-03T12:59:26,EJDRS,backpan,released,2.00,,Net-DHCP-Watch,"A class for monitoring a remote DHCPD server."
LJ-Simple-0.06,2002-10-03T13:32:52,SIMES,backpan,released,0.06,,LJ-Simple,"Simple Perl to access LiveJournal"
MersenneTwister-1.0.0,2002-10-03T20:13:42,JESUS,backpan,released,v1.0.0,1,MersenneTwister,"Perl extension for a Mersenne Twister PRGN implementation with context."
