release,date,author,status,maturity,version,first,distribution,abstract
Unicode-IMAPUtf7-1.04,2002-04-08T17:34:33,FABPOT,backpan,released,1.04,,Unicode-IMAPUtf7,"Perl extension to deal with IMAP UTF7"
Pod-Constants-0.14,2002-04-08T17:43:09,SAMV,backpan,released,0.14,,Pod-Constants,"Include constants from POD"
Net-DNS-ZoneFile-1.00,2002-04-08T18:18:01,LUISMUNOZ,backpan,released,1.00,1,Net-DNS-ZoneFile,"Perl extension to convert a zone file to a collection of RRs"
Encode-1.31,2002-04-08T18:51:14,DANKOGAI,backpan,released,1.31,,Encode,"character encodings"
Pod-Constants-0.15,2002-04-08T18:53:11,SAMV,backpan,released,0.15,,Pod-Constants,"Include constants from POD"
Term-Report-1.04,2002-04-08T20:03:43,SHAYH,cpan,released,1.04,,Term-Report,"Easy way to create dynamic 'reports' from within scripts."
Term-StatusBar-1.04,2002-04-08T20:05:34,SHAYH,cpan,released,1.04,,Term-StatusBar,"Dynamic progress bar"
Mail-Graph-0.06,2002-04-08T22:04:28,TELS,backpan,released,0.06,,Mail-Graph,"draw graphical stats for mails/spams"
HTTP-WebTest-1.99_05,2002-04-08T22:04:45,ILYAM,backpan,developer,1.99_05,,HTTP-WebTest,"test one or more web pages, either remotely or locally"
Geo-IP-0.09,2002-04-08T23:53:12,TJMATHER,backpan,released,0.09,,Geo-IP,"Find closest Mirror"
DBIx-DWIW-0.24,2002-04-09T00:27:24,JZAWODNY,cpan,released,0.24,,DBIx-DWIW,"Robust and simple DBI wrapper to Do What I Want (DWIW)"
XML-Checker-0.11,2002-04-09T01:19:57,TJMATHER,backpan,released,0.11,,XML-Checker,"A perl module for validating XML"
XML-SemanticDiff-0.95,2002-04-09T08:24:00,KHAMPTON,cpan,released,0.95,,XML-SemanticDiff,"Perl extension for comparing XML documents."
Term-Screen-Wizard-0.47,2002-04-09T08:43:48,OESTERHOL,backpan,released,0.47,,Term-Screen-Wizard,
Business-ISBN-1.67,2002-04-09T09:37:34,BDFOY,backpan,released,1.67,,Business-ISBN,"work with International Standard Book Numbers"
VERSION-RCS-1.03,2002-04-09T10:01:17,DANPEDER,backpan,released,1.03,1,VERSION-RCS,
Net-EMI-0.9.1,2002-04-09T11:00:42,JOCHEN,backpan,released,v0.9.1,1,Net-EMI,"EMI/UCP GSM SMSC Protocol Class (BETA!!!!)"
Term-Screen-Wizard-0.48,2002-04-09T11:34:41,OESTERHOL,backpan,released,0.48,,Term-Screen-Wizard,
App-Control-1.00,2002-04-09T11:52:50,AWRIGLEY,backpan,released,1.00,,App-Control,"Perl module for apachectl style control of another script or executable"
HTML-StickyForms-0.06,2002-04-09T15:55:01,PMH,cpan,released,0.06,,HTML-StickyForms,"HTML form generation for CGI or mod_perl"
Net_SSLeay.pm-1.15,2002-04-09T16:33:59,SAMPO,backpan,released,1.15,,Net_SSLeay,"Perl extension for using OpenSSL or SSLeay"
Lingua-Translate-0.03,2002-04-09T16:57:19,SAMV,backpan,released,0.03,,Lingua-Translate,"Translate text from one language to another"
CPANPLUS-0.03,2002-04-09T18:36:27,KANE,backpan,released,0.03,,CPANPLUS,"Report test results of a package retrieved from CPAN"
ExtUtils-AutoInstall-0.28,2002-04-09T18:41:40,AUTRIJUS,backpan,released,0.28,,ExtUtils-AutoInstall,"Automatic install of dependencies via CPAN"
Convert-IBM390-0.15,2002-04-09T18:51:30,GROMMEL,backpan,released,0.15,,Convert-IBM390,"functions for manipulating mainframe data"
Term-Screen-Wizard-0.49,2002-04-09T19:37:40,OESTERHOL,backpan,released,0.49,,Term-Screen-Wizard,"A wizard on your terminal..."
gmuck-1.04,2002-04-09T20:06:41,SCOP,backpan,released,1.04,,gmuck,"The Generated MarkUp Checker"
Encode-1.32,2002-04-09T20:26:37,DANKOGAI,backpan,released,1.32,,Encode,"character encodings"
Search-InvertedIndex-1.12,2002-04-09T22:38:38,SNOWHARE,backpan,released,1.12,,Search-InvertedIndex,"A manager for inverted index maps"
CGI-Minimal-1.09,2002-04-09T22:42:11,SNOWHARE,backpan,released,1.09,,CGI-Minimal,"A lightweight CGI form processing pacakge"
Device-Modem-1.10,2002-04-09T22:57:10,COSIMO,backpan,released,1.10,,Device-Modem,"Perl extension to talk to AT devices connected via serial port"
Device-Gsm-1.09,2002-04-09T22:59:08,COSIMO,backpan,released,1.09,,Device-Gsm,"Perl extension to interface GSM cellular / modems"
Spreadsheet-WriteExcel-0.36,2002-04-09T23:05:59,JMCNAMARA,backpan,released,0.36,,Spreadsheet-WriteExcel,"Write to a cross-platform Excel binary file."
DBD-Pg-1.12,2002-04-10T02:03:57,JBAKER,cpan,released,1.12,,DBD-Pg,"PostgreSQL database driver for the DBI module"
Schedule-Depend-0.08,2002-04-10T03:23:36,LEMBARK,backpan,released,0.08,,Schedule-Depend,
Apache-AuthenNTLM-0.15,2002-04-10T03:42:00,GRICHTER,backpan,released,0.15,,Apache-AuthenNTLM,"Perform Microsoft NTLM and Basic User Authentication"
Net-ext-1.011,2002-04-10T11:34:56,SPIDB,latest,released,1.011,,Net-ext,"TCP sockets interface module"
Language-Befunge-0.01,2002-04-10T12:11:00,JQUELIN,backpan,released,0.01,1,Language-Befunge,"a Befunge-98 interpreter."
Language-Befunge-0.02,2002-04-10T12:24:02,JQUELIN,backpan,released,0.02,,Language-Befunge,"a Befunge-98 interpreter."
IO-Socket-SSL-0.81,2002-04-10T12:43:43,ASPA,cpan,released,0.81,,IO-Socket-SSL,"a SSL socket interface class"
Net-SCP-Expect-0.03,2002-04-10T13:19:21,DJBERG,cpan,released,0.03,,Net-SCP-Expect,"Wrapper for scp that allows passwords via Expect."
Compress-LZF-0.1041,2002-04-10T14:13:00,MLEHMANN,backpan,released,0.1041,,Compress-LZF,"extremely leight-weight Lev-Zimpel-Free compression"
CPANPLUS-0.031,2002-04-10T14:40:47,KANE,backpan,released,0.031,,CPANPLUS,"Report test results of a package retrieved from CPAN"
Term-Screen-Wizard-0.51,2002-04-10T18:45:34,OESTERHOL,backpan,released,0.51,,Term-Screen-Wizard,"A wizard on your terminal..."
Schedule-Depend-0.09,2002-04-10T19:31:14,LEMBARK,backpan,released,0.09,,Schedule-Depend,
CGI.pm-2.81,2002-04-10T19:39:49,LDS,backpan,released,2.81,,CGI,"Simple Common Gateway Interface Class"
PApp-SQL-0.131,2002-04-10T20:01:20,MLEHMANN,backpan,released,0.131,,PApp-SQL,"absolutely easy yet fast and powerful sql access."
Net-IP-Match-0.01,2002-04-10T21:54:47,MARCEL,backpan,released,0.01,1,Net-IP-Match,"Efficiently match IP addresses against IP ranges"
Aw-0.14.1,2002-04-10T22:19:19,DYACOB,cpan,released,v0.14.1,,Aw,"Perl extension for the ActiveWorks C Application Development Kit"
Encode-1.33,2002-04-10T22:44:19,DANKOGAI,backpan,released,1.33,,Encode,"character encodings"
Config-General-1.33,2002-04-10T22:52:35,TLINDEN,backpan,released,1.33,,Config-General,"Generic Config Module"
DBD-Chart-0.61,2002-04-10T23:44:59,DARNOLD,backpan,released,0.61,,DBD-Chart,"DBI driver abstraction for DBD::Chart::Plot and GD::Graph"
Tie-Cache-LRU-0.21,2002-04-11T03:27:10,MSCHWERN,backpan,released,0.21,,Tie-Cache-LRU,"A Least-Recently Used cache"
ExtUtils-MakeMaker-5.90_01,2002-04-11T05:32:04,MSCHWERN,backpan,developer,5.90_01,,ExtUtils-MakeMaker,"utilities to write and check a MANIFEST file"
Lingua-Zompist-Verdurian-0.04,2002-04-11T06:53:33,PNE,backpan,released,0.04,,Lingua-Zompist-Verdurian,"Inflect Verdurian nouns, verbs, and adjectives"
Language-Befunge-0.03,2002-04-11T08:02:18,JQUELIN,backpan,released,0.03,,Language-Befunge,"a Befunge-98 interpreter."
Language-Befunge-0.04,2002-04-11T10:06:06,JQUELIN,backpan,released,0.04,,Language-Befunge,"a Befunge-98 interpreter."
Win32-Autoglob-1.01,2002-04-11T11:06:15,SBURKE,latest,released,1.01,1,Win32-Autoglob,"expand globs in @ARGV when the shell doesn't"
Language-Befunge-0.05,2002-04-11T12:26:07,JQUELIN,backpan,released,0.05,,Language-Befunge,"a Befunge-98 interpreter."
ups-nut-0.01,2002-04-11T12:27:59,KPETERS,cpan,released,0.01,1,ups-nut,"a module to talk to a UPS via NUT (Network UPS Tools) upsd"
CtCmd-1.00,2002-04-11T12:49:45,RATL,backpan,released,1.00,1,CtCmd,"Perl extension for Rational ClearCase"
Image-OrgChart-0.10,2002-04-11T13:01:41,MZSANFORD,backpan,released,0.10,,Image-OrgChart,"Perl extension for writing org charts"
Language-Befunge-0.06,2002-04-11T13:08:19,JQUELIN,backpan,released,0.06,,Language-Befunge,"a Befunge-98 interpreter."
Term-Screen-Wizard-0.52,2002-04-11T13:42:31,OESTERHOL,backpan,released,0.52,,Term-Screen-Wizard,"A wizard on your terminal..."
Time-HR-0.02,2002-04-11T13:54:03,AGOLOMSH,latest,released,0.02,,Time-HR,"Perl interface to high-resolution timer."
Image-OrgChart-0.15,2002-04-11T13:56:00,MZSANFORD,backpan,released,0.15,,Image-OrgChart,"Perl extension for writing org charts"
Tie-Cfg-0.10,2002-04-11T14:17:32,OESTERHOL,backpan,released,0.10,1,Tie-Cfg,"Ties simple configuration files to hashes."
Apache-Admin-Config-0.16,2002-04-11T14:56:41,RSOLIV,cpan,released,0.16,,Apache-Admin-Config,"A common module to manipulate Apache configuration files"
Imager-0.40,2002-04-11T15:09:57,ADDI,cpan,released,0.40,,Imager,"Perl extension for Generating 24 bit Images"
Language-Befunge-0.07,2002-04-11T15:53:55,JQUELIN,backpan,released,0.07,,Language-Befunge,"a Befunge-98 interpreter."
Acme-Colour-0.17,2002-04-11T15:54:11,LBROCARD,backpan,released,0.17,,Acme-Colour,"additive and subtractive human-readable colours"
Language-Befunge-0.08,2002-04-11T17:34:45,JQUELIN,backpan,released,0.08,,Language-Befunge,"a Befunge-98 interpreter."
Log-Dispatch-2.00,2002-04-11T17:46:27,DROLSKY,backpan,released,2.00,,Log-Dispatch,"Dispatches messages to multiple Log::Dispatch::* objects"
Log-Dispatch-DBI-0.02,2002-04-11T18:25:44,MIYAGAWA,latest,released,0.02,,Log-Dispatch-DBI,"Class for logging to database via DBI interface"
Log-Dispatch-Config-1.00,2002-04-11T18:27:36,MIYAGAWA,backpan,released,1.00,,Log-Dispatch-Config,"Log4j for Perl"
Lingua-Zompist-Verdurian-0.05,2002-04-11T18:41:13,PNE,cpan,released,0.05,,Lingua-Zompist-Verdurian,"Inflect Verdurian nouns, verbs, and adjectives"
Unicode-Strng-2.06-bin56Mac,2002-04-11T18:44:43,TWEGNER,cpan,released,2.06,1,Unicode-Strng,"String of Unicode characters (UCS2/UTF16)"
DBD-Multiplex-1.8,2002-04-11T19:46:32,TKISHEL,backpan,released,1.8,,DBD-Multiplex,"A multiplexing driver for the DBI."
Test-Inline-0.15,2002-04-11T19:55:05,MSCHWERN,backpan,released,0.15,,Test-Inline,"Convert embedded tests and code examples to .t files"
LSF-0.4,2002-04-11T21:55:08,MSOUTHERN,cpan,released,0.4,,LSF,"load various LSF modules"
PDL-NetCDF-0.81,2002-04-11T22:18:07,DHUNT,backpan,released,0.81,,PDL-NetCDF,"Object-oriented interface between NetCDF files and PDL objects."
Net-Ping-2.16,2002-04-11T22:49:15,BBB,backpan,released,2.16,,Net-Ping,"check a remote host for reachability"
Net-DNS-0.19,2002-04-11T23:04:19,BBB,backpan,released,0.19,,Net-DNS,"Put DNS MX queries in a hash lookup format"
Schedule-Depend-0.10,2002-04-11T23:53:12,LEMBARK,backpan,released,0.10,,Schedule-Depend,
Aw-0.15.0-110402,2002-04-12T01:03:18,DYACOB,backpan,released,v0.15.0,,Aw,"Perl extension for the ActiveWorks C Application Development Kit"
Cgi-Simple-0.03,2002-04-12T01:08:21,JFREEMAN,backpan,released,0.03,1,Cgi-Simple,"provides a simple framework for writing test scripts"
Finance-YahooJapan-HistoricalQuotes-0.01,2002-04-12T02:57:18,HATA,backpan,released,0.01,1,Finance-YahooJapan-HistoricalQuotes,
Parallel-MPI-0.03,2002-04-12T02:57:35,JOSH,latest,released,0.03,,Parallel-MPI,"Perl interface to the MPI message passing system"
Test-Simple-0.43,2002-04-12T03:06:03,MSCHWERN,backpan,released,0.43,,Test-Simple,"yet another framework for writing test scripts"
Net-DNAT-0.03,2002-04-12T04:25:35,BBB,backpan,released,0.03,,Net-DNAT,"mod_perl Apache module to undo the side-effects of Net::DNAT"
DBD-mysql-2.1012,2002-04-12T07:21:06,JWIED,cpan,released,2.1012,,DBD-mysql,"A bundle to install Perl drivers for mSQL or MySQL"
Schedule-Depend-0.11,2002-04-12T08:29:45,LEMBARK,backpan,released,0.11,,Schedule-Depend,
Schedule-Depend-0.12,2002-04-12T08:38:38,LEMBARK,backpan,released,0.12,,Schedule-Depend,
Schedule-Depend-0.13,2002-04-12T08:42:29,LEMBARK,backpan,released,0.13,,Schedule-Depend,
Language-Befunge-0.09,2002-04-12T10:07:07,JQUELIN,backpan,released,0.09,,Language-Befunge,"a Befunge-98 interpreter."
Log-Dispatch-Tk-1.5,2002-04-12T10:59:11,DDUMONT,backpan,released,1.5,,Log-Dispatch-Tk,"Class to redirect Log::Dispatch to Tk widgets"
Imager-0.41,2002-04-12T12:07:29,ADDI,cpan,released,0.41,,Imager,"Perl extension for Generating 24 bit Images"
WWW-Cache-Google-0.04,2002-04-12T12:40:19,MIYAGAWA,latest,released,0.04,,WWW-Cache-Google,"URI class for Google cache"
Language-Befunge-0.10,2002-04-12T13:05:08,JQUELIN,backpan,released,0.10,,Language-Befunge,"a Befunge-98 interpreter."
IO-Select-Trap-0.01,2002-04-12T13:14:58,SCOTTS,backpan,released,0.01,1,IO-Select-Trap,"IO::Select() functionality on Scalar-based Filehandles"
Net-SSH-W32Perl-0.03,2002-04-12T13:15:13,SCOTTS,backpan,released,0.03,1,Net-SSH-W32Perl,"MSWin32 compatibility layer for Net::SSH::Perl"
Jabber-JAX-Component-0.10,2002-04-12T14:50:49,PIERS,backpan,released,0.10,,Jabber-JAX-Component,"Perl wrapper for the Jabber JECL Library creates the Jabber Compoent Connection Object"
DBD-ODBC-0.40,2002-04-12T15:20:16,JURL,cpan,released,0.40,,DBD-ODBC,"ODBC Driver for DBI"
Apache-No404Proxy-0.05,2002-04-12T16:17:23,MIYAGAWA,latest,released,0.05,,Apache-No404Proxy,"404 free Proxy"
Mail-Miner-0.0a1,2002-04-12T16:19:14,SIMON,backpan,released,0.0,1,Mail-Miner,"Store and retrieve Useful Information from mail"
Language-Befunge-0.11,2002-04-12T16:33:50,JQUELIN,backpan,released,0.11,,Language-Befunge,"a Befunge-98 interpreter."
Language-Befunge-0.12,2002-04-12T16:52:03,JQUELIN,backpan,released,0.12,,Language-Befunge,"a Befunge-98 interpreter."
ClearCase-Argv-1.08,2002-04-12T17:05:34,DSB,backpan,released,1.08,,ClearCase-Argv,"ClearCase-specific subclass of Argv"
Net-DNAT-0.04,2002-04-12T17:20:10,BBB,backpan,released,0.04,,Net-DNAT,"mod_perl Apache module to undo the side-effects of Net::DNAT"
IO-Select-Trap-0.02,2002-04-12T18:13:59,SCOTTS,backpan,released,0.02,,IO-Select-Trap,"IO::Select() functionality on Scalar-based Filehandles"
Text-Scan-0.12,2002-04-12T18:22:34,IWOODHEAD,backpan,released,0.12,,Text-Scan,"Fast search for very large numbers of keys in a body of text."
Net-SSH-W32Perl-0.04,2002-04-12T18:29:12,SCOTTS,backpan,released,0.04,,Net-SSH-W32Perl,"MSWin32 compatibility layer for Net::SSH::Perl"
Tie-Cfg-0.11,2002-04-12T18:55:37,OESTERHOL,backpan,released,0.11,,Tie-Cfg,"Ties simple configuration files to hashes."
CGI-FormMagick-0.80,2002-04-12T20:26:24,SKUD,backpan,released,0.80,,CGI-FormMagick,"easily create CGI form-based applications"
Schedule-Depend-0.14,2002-04-12T20:36:49,LEMBARK,backpan,released,0.14,,Schedule-Depend,
Aw-0.15.0-120402,2002-04-12T20:40:25,DYACOB,backpan,released,v0.15.0,,Aw,"Perl extension for the ActiveWorks C Application Development Kit"
Net-SCP-Expect-0.04,2002-04-12T21:10:01,DJBERG,cpan,released,0.04,,Net-SCP-Expect,"Wrapper for scp that allows passwords via Expect."
Test-Exception-0.07,2002-04-12T21:42:38,ADIE,backpan,released,0.07,1,Test-Exception,"Convenience routines for testing exception based code"
Tie-Cache-LRU-Expires-0.51,2002-04-12T23:36:02,OESTERHOL,backpan,released,0.51,,Tie-Cache-LRU-Expires,"An expiring LRU cache."
Cgi-Simple-0.04,2002-04-13T00:39:45,JFREEMAN,backpan,released,0.04,,Cgi-Simple,"provides a simple framework for writing test scripts"
Tk-PopEntry-0.06,2002-04-13T04:38:02,DJBERG,latest,released,0.06,,Tk-PopEntry,"An Entry widget with an automatic, configurable right-click menu built in, plus input masks."
Tk-LabPopEntry-0.05,2002-04-13T05:09:13,DJBERG,latest,released,0.05,,Tk-LabPopEntry,"A LabEntry widget with an automatic, configurable right-click menu built in, plus input masks."
Mail-RFC822-Address-0.3,2002-04-13T08:54:13,PDWARREN,latest,released,0.3,,Mail-RFC822-Address,"Perl extension for validating email addresses according to RFC822"
Language-Befunge-0.20,2002-04-13T11:18:32,JQUELIN,backpan,released,0.20,,Language-Befunge,"a Befunge-98 interpreter."
HTML-ERuby-0.01,2002-04-13T11:26:56,IKEBE,cpan,released,0.01,1,HTML-ERuby,"ERuby processor for Perl."
HTTP-DAV-0.31,2002-04-13T12:31:59,PCOLLINS,cpan,released,0.31,,HTTP-DAV,"A WebDAV client library for Perl5"
Text-Shortcuts-0.02,2002-04-13T14:08:06,MUNCHIE,latest,released,0.02,1,Text-Shortcuts,"A shortcut creation & usage engine"
File-Scan-0.21,2002-04-13T17:47:06,HDIAS,backpan,released,0.21,,File-Scan,"Perl extension for Scanning files for Viruses"
Net-Google-0.3,2002-04-13T20:50:45,ASCOPE,cpan,released,0.3,,Net-Google,
SAP-WAS-SOAP-0.01,2002-04-13T20:52:36,PIERS,cpan,released,0.01,1,SAP-WAS-SOAP,"Perl extension for parsing and creating an Interface Object. The interface object would then be passed to the SAP::WAS::SOAP object to carry out the actual call, and return of values."
Net-SCP-0.06,2002-04-13T22:22:14,IVAN,backpan,released,0.06,,Net-SCP,"Perl extension for secure copy protocol"
Coro-0.534,2002-04-14T01:22:26,MLEHMANN,backpan,released,0.534,,Coro,"coroutine process abstraction"
HTML-ERuby-0.02,2002-04-14T01:24:24,IKEBE,latest,released,0.02,,HTML-ERuby,"ERuby processor for Perl."
File-Rdiff-0.01,2002-04-14T01:26:15,MLEHMANN,backpan,released,0.01,1,File-Rdiff,
Lingua-KO-Hangul-Util-0.09,2002-04-14T02:00:55,SADAHIRO,backpan,released,0.09,,Lingua-KO-Hangul-Util,"utility functions for Hangul Syllables"
if-0.01000001,2002-04-14T07:12:38,ILYAZ,cpan,released,0.01000001,1,if,"use a Perl module if a condition holds"
Apache-Session-Counted-1.117,2002-04-14T07:19:58,ANDK,backpan,released,1.117,,Apache-Session-Counted,"Session management via a File::CounterFile"
WWW-Search-Google-0.17,2002-04-14T10:31:36,LBROCARD,backpan,released,0.17,1,WWW-Search-Google,"search Google via SOAP"
ShiftJIS-Regexp-0.24,2002-04-14T10:48:07,SADAHIRO,backpan,released,0.24,,ShiftJIS-Regexp,"Shift_JIS-oriented regular expressions on byte-oriented perl"
ShiftJIS-Regexp-0.25,2002-04-14T13:40:18,SADAHIRO,backpan,released,0.25,,ShiftJIS-Regexp,"Shift_JIS-oriented regular expressions on byte-oriented perl"
Language-Befunge-0.30,2002-04-14T14:00:18,JQUELIN,backpan,released,0.30,,Language-Befunge,"a Befunge-98 interpreter."
Cache-Cache-1.01,2002-04-14T14:14:56,DCLINTON,cpan,released,1.01,,Cache-Cache,"data about objects in the cache"
ShiftJIS-CP932-Correct-0.05,2002-04-14T14:18:23,SADAHIRO,backpan,released,0.05,,ShiftJIS-CP932-Correct,"corrects a string in Windows CP-932 (a variant of Shift_JIS)"
ShiftJIS-CP932-MapUTF-0.12,2002-04-14T14:18:38,SADAHIRO,backpan,released,0.12,,ShiftJIS-CP932-MapUTF,"conversion between Microsoft Windows CP-932 and Unicode"
Net-Google-0.3.1,2002-04-14T14:43:18,ASCOPE,cpan,released,v0.3.1,1,Net-Google,
Net-Blogger-0.6.2.2,2002-04-14T14:51:34,ASCOPE,backpan,released,v0.6.2.2,,Net-Blogger,
Net-Google-0.4,2002-04-14T16:16:21,ASCOPE,cpan,released,0.4,,Net-Google,
Graphics-ColorNames-Mozilla-0.10,2002-04-14T21:18:35,XAVIER,cpan,released,0.10,1,Graphics-ColorNames-Mozilla,"Mozilla, Netscape 6.0, Galeon (anything using Gecko) color names and equivalent RGB values"
WWW-B_Rail-0.01,2002-04-14T21:31:39,BEATNIK,backpan,released,0.01,1,WWW-B_Rail,"Perl extension for b-rail.be"
File-Which-0.01,2002-04-14T22:27:13,PEREINAR,cpan,released,0.01,1,File-Which,"Portable implementation of the `which' utility"
Encode-1.40,2002-04-14T22:49:10,DANKOGAI,backpan,released,1.40,,Encode,"character encodings"
ec-1.23,2002-04-14T23:23:28,RKIES,backpan,released,1.23,,ec,"E-mail reader and composer for Unix and Perl/Tk."
Class-Tangram-1.10,2002-04-15T00:36:53,SAMV,backpan,released,1.10,,Class-Tangram,"create constructors, accessor and update methods for objects from a Tangram-compatible object specification."
Class-Tangram-1.11,2002-04-15T01:53:13,SAMV,backpan,released,1.11,,Class-Tangram,"create constructors, accessor and update methods for objects from a Tangram-compatible object specification."
BBDB-1.33,2002-04-15T04:05:10,LAXEN,backpan,released,1.33,,BBDB,"Perl extension for reading and writing bbdb files"
ASED.0.1,2002-04-15T06:03:49,TDL,backpan,released,0.1,1,ASED,"Perl extension providing an Advanced Stream EDitor"
Language-Befunge-0.31,2002-04-15T07:42:57,JQUELIN,backpan,released,0.31,,Language-Befunge,"a Befunge-98 interpreter."
DBD-mysql-2.1013,2002-04-15T07:49:36,JWIED,cpan,released,2.1013,,DBD-mysql,"A bundle to install Perl drivers for mSQL or MySQL"
Tie-Cache-LRU-Expires-0.52,2002-04-15T08:35:10,OESTERHOL,backpan,released,0.52,,Tie-Cache-LRU-Expires,"An expiring LRU cache."
Term-Screen-Wizard-0.53,2002-04-15T09:05:00,OESTERHOL,backpan,released,0.53,,Term-Screen-Wizard,"A wizard on your terminal..."
Language-Befunge-0.32,2002-04-15T10:03:43,JQUELIN,backpan,released,0.32,,Language-Befunge,"a Befunge-98 interpreter."
Net-MySQL-0.03,2002-04-15T10:24:47,OYAMA,backpan,released,0.03,,Net-MySQL,"Pure Perl MySQL network protocol interface."
DBD-mysqlPP-0.03,2002-04-15T10:26:39,OYAMA,backpan,released,0.03,,DBD-mysqlPP,"Pure Perl MySQL driver for the DBI"
ClearCase-Argv-1.09,2002-04-15T11:28:40,DSB,backpan,released,1.09,,ClearCase-Argv,"ClearCase-specific subclass of Argv"
Argv-1.08,2002-04-15T11:38:47,DSB,backpan,released,1.08,,Argv,"Provide an OO interface to an arg vector"
File-Scan-0.22,2002-04-15T13:02:03,HDIAS,backpan,released,0.22,,File-Scan,"Perl extension for Scanning files for Viruses"
Net-YahooMessenger-0.010,2002-04-15T13:27:54,OYAMA,cpan,released,0.010,1,Net-YahooMessenger,"Interface to the Yahoo!Messenger IM protocol"
Apache-Session-Counted-1.118,2002-04-15T13:46:05,ANDK,backpan,released,1.118,,Apache-Session-Counted,"Session management via a File::CounterFile"
IO-Select-Trap-0.03,2002-04-15T14:57:43,SCOTTS,cpan,released,0.03,,IO-Select-Trap,"IO::Select() functionality on Scalar-based Filehandles"
HTML-Merge-3.32,2002-04-15T15:10:54,RAZINF,backpan,released,3.32,,HTML-Merge,"Perl extension for clearing the screen and receiving a keystroke."
Language-Befunge-0.33,2002-04-15T16:07:51,JQUELIN,backpan,released,0.33,,Language-Befunge,"a Befunge-98 interpreter."
Inline-Befunge-0.01,2002-04-15T16:08:06,JQUELIN,backpan,released,0.01,,Inline-Befunge,"write Perl subs in Befunge"
PPerl-0.04,2002-04-15T16:37:17,MSERGEANT,backpan,released,0.04,,PPerl,"Make perl scripts persistent in memory"
I18N-Charset-1.16,2002-04-15T17:24:31,MTHURN,backpan,released,1.16,,I18N-Charset,"IANA Character Set Registry names and Unicode::Map8 conversion scheme names"
Lingua-EN-MatchNames-1.12,2002-04-15T19:29:40,BRIANL,cpan,released,1.12,,Lingua-EN-MatchNames,"Smart matching for human names."
Lingua-EN-Nickname-1.12,2002-04-15T19:31:31,BRIANL,cpan,released,1.12,,Lingua-EN-Nickname,"Genealogical nickname matching (Liz=Beth)"
Statistics-Lite-1.02,2002-04-15T19:31:46,BRIANL,cpan,released,1.02,1,Statistics-Lite,"Small stats stuff."
GraphViz-Data-Structure-0.06,2002-04-15T19:53:08,MCMAHON,backpan,released,0.06,,GraphViz-Data-Structure,"Visualise data structures"
Uttu-0.02,2002-04-15T22:32:02,JSMITH,backpan,released,0.02,,Uttu,"web interface driver"
Text-ASED-1.9,2002-04-16T00:24:20,TDL,backpan,released,1.9,,Text-ASED,"Perl extension providing an Advanced Stream EDitor"
DBD-ODBC-0.41,2002-04-16T02:05:32,JURL,cpan,released,0.41,,DBD-ODBC,"ODBC Driver for DBI"
Net-Google-0.4.1,2002-04-16T03:29:38,ASCOPE,cpan,released,v0.4.1,1,Net-Google,"simple OOP-ish interface to the Google SOAP API"
Net-Blogger-0.6.3,2002-04-16T03:31:30,ASCOPE,backpan,released,v0.6.3,,Net-Blogger,"an OOP-ish interface for accessing a weblog via the Blogger XML-RPC API."
SOAP-Lite-0.55,2002-04-16T05:20:54,KULCHENKO,backpan,released,0.55,,SOAP-Lite,
Net-CIDR-Lite-0.11,2002-04-16T05:44:00,DOUGW,backpan,released,0.11,,Net-CIDR-Lite,"Perl extension for merging IPv4 or IPv6 CIDR addresses"
Language-Befunge-0.34,2002-04-16T13:07:20,JQUELIN,backpan,released,0.34,,Language-Befunge,"a Befunge-98 interpreter."
RDF-Core-0.15,2002-04-16T14:01:15,PAVELH,backpan,released,0.15,,RDF-Core,"An object oriented Perl modules for handling tasks related to RDF."
Language-Befunge-0.35,2002-04-16T15:20:36,JQUELIN,backpan,released,0.35,,Language-Befunge,"a Befunge-98 interpreter."
Inline-Befunge-0.02,2002-04-16T15:51:32,JQUELIN,backpan,released,0.02,,Inline-Befunge,"write Perl subs in Befunge"
Java-JVM-Classfile-0.17,2002-04-16T16:18:36,LBROCARD,backpan,released,0.17,,Java-JVM-Classfile,"Parse JVM Classfiles"
Inline-Befunge-0.03,2002-04-16T16:44:10,JQUELIN,backpan,released,0.03,,Inline-Befunge,"write Perl subs in Befunge"
PApp-0.142,2002-04-16T17:20:02,MLEHMANN,backpan,released,0.142,,PApp,"multi-page-state-preserving web applications"
Parse-RecDescent-FAQ-2.30,2002-04-16T18:39:48,TBONE,backpan,released,2.30,,Parse-RecDescent-FAQ,"the official, authorized FAQ for Parse::RecDescent."
mixin-0.01,2002-04-16T19:46:39,MSCHWERN,backpan,released,0.01,1,mixin,"Mix-in inheritance, an alternative to multiple inheritance"
Net-Ewtoo-Bot-0.13,2002-04-16T20:13:05,GBROWN,backpan,released,0.13,1,Net-Ewtoo-Bot,"a Ewtoo-compatible talker robot client module"
Schedule-Depend-0.15,2002-04-16T20:18:26,LEMBARK,backpan,released,0.15,,Schedule-Depend,
RPM-Tools-0.1,2002-04-16T21:06:01,SHARRISON,cpan,released,0.1,1,RPM-Tools,"cleanly generate an RPM"
File-List-0.3,2002-04-16T23:15:43,DOPACKI,cpan,released,0.3,,File-List,"Perl extension for crawling directory trees and compiling lists of files"
Encode-1.41,2002-04-16T23:47:16,DANKOGAI,backpan,released,1.41,,Encode,"character encodings"
XML-DOM-1.39,2002-04-17T02:39:35,TJMATHER,backpan,released,1.39,,XML-DOM,"A perl module for building DOM Level 1 compliant document structures"
HTML-FillInForm-0.26,2002-04-17T02:47:57,TJMATHER,backpan,released,0.26,,HTML-FillInForm,"Populates HTML Forms with CGI data."
parrot-0.0.5,2002-04-17T04:09:40,JGOFF,backpan,released,v0.0.5,1,parrot,"Parrot byte code compiler"
XML-GDOME-0.78,2002-04-17T05:57:04,TJMATHER,backpan,released,0.78,,XML-GDOME,"Interface $class implementation."
WWW-Search-Google-0.18,2002-04-17T08:50:55,LBROCARD,backpan,released,0.18,,WWW-Search-Google,"search Google via SOAP"
Class-Container-0.01_01,2002-04-17T09:10:49,KWILLIAMS,backpan,developer,0.01_01,1,Class-Container,"Glues object frameworks together transparently"
Statistics-GaussHelmert-0.04,2002-04-17T10:17:38,HEUEL,backpan,released,0.04,1,Statistics-GaussHelmert,"General weighted least squares estimation"
Net-Ewtoo-Bot-0.14,2002-04-17T11:08:18,GBROWN,backpan,released,0.14,,Net-Ewtoo-Bot,"a Ewtoo-compatible talker robot client module"
String-Interpolate-0.1,2002-04-17T11:16:34,NOBULL,backpan,released,0.1,1,String-Interpolate,"Wrapper for builtin the Perl interpolatation engine."
