release,date,author,status,maturity,version,first,distribution,abstract
XML-Filter-XML_Directory_2-Base-1.4.2,2002-07-09T02:42:34,ASCOPE,cpan,released,v1.4.2,,XML-Filter-XML_Directory_2-Base,"base class for creating XML::Directory to something else SAX filters."
XML-Filter-XML_Directory_2XHTML-1.3,2002-07-09T02:42:49,ASCOPE,cpan,released,1.3,,XML-Filter-XML_Directory_2XHTML,"SAX2 filter for munging XML::Directory::SAX output into XHTML"
DBD-ODBC-0.42,2002-07-09T03:22:31,JURL,cpan,released,0.42,,DBD-ODBC,"ODBC Driver for DBI"
XForms-Generator-0.3.0,2002-07-09T07:59:51,DHAGEMAN,backpan,released,v0.3.0,,XForms-Generator,
Locale-Codes-2.05,2002-07-09T08:39:35,NEILB,backpan,released,2.05,,Locale-Codes,"ISO codes for script identification (ISO 15924)"
Unicode-Japanese-0.10,2002-07-09T09:11:34,MIKAGE,backpan,released,0.10,,Unicode-Japanese,"Japanese Character Encoding Handler"
AxKit-XSP-Minisession-1.01,2002-07-09T10:46:22,SIMON,backpan,released,1.01,,AxKit-XSP-Minisession,"Yet Another Session Handling Library"
AxKit-XSP-Minisession-1.02,2002-07-09T11:11:38,SIMON,cpan,released,1.02,,AxKit-XSP-Minisession,"Yet Another Session Handling Library"
Pixie-2.00,2002-07-09T11:24:40,JDUNCAN,backpan,released,2.00,1,Pixie,"The magic data pixie"
BackupD-1.11,2002-07-09T12:09:28,OPITZ,backpan,released,1.11,,BackupD,"A Backup Daemon"
XML-Twig-3.05,2002-07-09T16:02:36,MIROD,backpan,released,3.05,,XML-Twig,"A perl module for processing huge XML documents in tree mode."
Data-Serializer-0.16,2002-07-09T16:24:07,NEELY,backpan,released,0.16,,Data-Serializer,"a ""skeleton"" for writing ""t/*.t"" test files."
PerlIO-Via-Rotate-0.02,2002-07-09T19:44:07,ELIZABETH,backpan,released,0.02,,PerlIO-Via-Rotate,"PerlIO layer for encoding using rotational deviation"
PerlIO-Via-QuotedPrint-0.02,2002-07-09T19:45:58,ELIZABETH,backpan,released,0.02,,PerlIO-Via-QuotedPrint,"PerlIO layer for quoted-printable strings"
PerlIO-Via-MD5-0.02,2002-07-09T19:46:13,ELIZABETH,backpan,released,0.02,1,PerlIO-Via-MD5,"PerlIO layer for creating an MD5 digest of a file"
PHP-Session-0.11,2002-07-09T20:27:30,MIYAGAWA,backpan,released,0.11,,PHP-Session,"read / write PHP session files"
Config-General-2.05,2002-07-09T20:41:01,TLINDEN,backpan,released,2.05,,Config-General,"Generic Config Module"
Mail-Procmailrc-0.96,2002-07-09T22:40:51,SCOTTW,backpan,released,0.96,1,Mail-Procmailrc,"An interface to Procmail recipe files"
Apache-ForwardedFor-0.4,2002-07-10T05:15:45,JLAWRENC,backpan,released,0.4,1,Apache-ForwardedFor,"Re-set remote_ip to incoming client's ip when running mod_perl behind a reverse proxy server. In other words, copy the first IP from X-Forwarded-For header, which was set by your reverse proxy server, to the remote_ip connection property."
POE-Component-Client-HTTP-0.44,2002-07-10T05:32:07,RCAPUTO,backpan,released,0.44,,POE-Component-Client-HTTP,"a HTTP user-agent component"
Imager-Plot-0.07,2002-07-10T07:15:41,ADDI,cpan,released,0.07,,Imager-Plot,"Perl extension for generating fancy graphic plots in color."
PerlIO-via-QuotedPrint-0.03,2002-07-10T07:46:47,ELIZABETH,backpan,released,0.03,1,PerlIO-via-QuotedPrint,"PerlIO layer for quoted-printable strings"
PerlIO-via-Base64-0.03,2002-07-10T07:47:03,ELIZABETH,backpan,released,0.03,1,PerlIO-via-Base64,"PerlIO layer for base64 (MIME) encoded strings"
PerlIO-via-MD5-0.03,2002-07-10T07:47:18,ELIZABETH,backpan,released,0.03,1,PerlIO-via-MD5,"PerlIO layer for creating an MD5 digest of a file"
PerlIO-via-Rotate-0.03,2002-07-10T07:47:33,ELIZABETH,backpan,released,0.03,1,PerlIO-via-Rotate,"PerlIO layer for encoding using rotational deviation"
Graph-ReadWrite-1.07,2002-07-10T07:51:00,NEILB,backpan,released,1.07,,Graph-ReadWrite,"base class for Graph file format writers"
MQSeries-1.18,2002-07-10T13:12:57,HBIERSMA,backpan,released,1.18,,MQSeries,"Perl extension for MQSeries support"
BackupD-1.15,2002-07-10T14:16:53,OPITZ,cpan,released,1.15,,BackupD,"A Backup Daemon"
threads-shared-queue-any-0.01,2002-07-10T14:17:08,ELIZABETH,backpan,released,0.01,1,threads-shared-queue-any,"thread-safe queues for any data-structure"
Test-Warn-0.01,2002-07-10T15:03:10,BIGJ,cpan,released,0.01,1,Test-Warn,"Perl extension to test methods for warnings"
NexTrieve-0.38,2002-07-10T15:10:13,ELIZABETH,backpan,released,0.38,,NexTrieve,"Perl interface to NexTrieve search engine software"
Bundle-InterchangeKitchenSink-0.07,2002-07-10T15:46:02,MIKEH,backpan,released,0.07,,Bundle-InterchangeKitchenSink,"A bundle of most all the modules nice to have for Interchange. A lot of stuff."
Date-EzDate-1.00,2002-07-10T16:02:48,MIKO,backpan,released,1.00,,Date-EzDate,"Date and time manipulation made easy"
POE-Component-Client-HTTP-0.45,2002-07-10T16:19:28,RCAPUTO,backpan,released,0.45,,POE-Component-Client-HTTP,"a HTTP user-agent component"
ResourcePool-0.9906,2002-07-10T17:49:24,MWS,backpan,released,0.9906,,ResourcePool,"A connection caching and pooling class."
Mail-Box-2.018,2002-07-10T20:52:49,MARKOV,backpan,released,2.018,,Mail-Box,"walk through mailboxes and grep for something"
Oak-0.3,2002-07-10T21:11:41,DRUOSO,backpan,released,0.3,,Oak,"Base for all Oak Perl Object Tree"
Oak-Web-0.1,2002-07-10T21:13:32,DRUOSO,backpan,released,0.1,1,Oak-Web,"Class for creating applications in Oak"
Oak-Web-0.2,2002-07-10T21:15:24,DRUOSO,backpan,released,0.2,,Oak-Web,"Class for creating applications in Oak"
PerlIO-via-Base64-0.04,2002-07-10T21:43:21,ELIZABETH,backpan,released,0.04,,PerlIO-via-Base64,"PerlIO layer for base64 (MIME) encoded strings"
PerlIO-via-MD5-0.04,2002-07-10T21:43:37,ELIZABETH,backpan,released,0.04,,PerlIO-via-MD5,"PerlIO layer for creating an MD5 digest of a file"
PerlIO-via-QuotedPrint-0.04,2002-07-10T21:45:28,ELIZABETH,backpan,released,0.04,,PerlIO-via-QuotedPrint,"PerlIO layer for quoted-printable strings"
PerlIO-via-Rotate-0.04,2002-07-10T21:45:43,ELIZABETH,backpan,released,0.04,,PerlIO-via-Rotate,"PerlIO layer for encoding using rotational deviation"
XML-Ximple-1.00,2002-07-10T22:07:38,RELIANCE,cpan,released,1.00,1,XML-Ximple,"XML in Perl"
Oak-0.4,2002-07-10T22:28:54,DRUOSO,backpan,released,0.4,,Oak,"Base for all Oak Perl Object Tree"
FileHandle-Rollback-1.04,2002-07-10T22:55:18,MIKO,backpan,released,1.04,,FileHandle-Rollback,"FileHandle with commit and rollback"
PhotoIndex-1.20,2002-07-10T23:09:05,MYNEID,latest,released,1.20,,PhotoIndex,"Perl extension for creating a Photo Gallery with mod_perl creating everything on the fly"
Set-CheckList-1.00,2002-07-10T23:30:37,MIKO,backpan,released,1.00,1,Set-CheckList,"Keep track of a list of ""to do"" items"
Data-Taxi-0.91,2002-07-10T23:34:12,MIKO,backpan,released,0.91,,Data-Taxi,"Taint-aware, XML-ish data serialization"
Class-PublicPrivate-0.80,2002-07-10T23:54:05,MIKO,backpan,released,0.80,1,Class-PublicPrivate,"Class with public keys with any name and a separate set of private keys"
POE-Component-Client-DNS-0.94,2002-07-11T03:35:30,RCAPUTO,backpan,released,0.94,,POE-Component-Client-DNS,"a DNS client component"
Log-Log4perl-0.16,2002-07-11T05:56:24,MSCHILLI,backpan,released,0.16,1,Log-Log4perl,"Log4j implementation for Perl"
Net-MySQL-0.06,2002-07-11T07:02:29,OYAMA,backpan,released,0.06,,Net-MySQL,"Pure Perl MySQL network protocol interface."
Apache-ForwardedFor-0.5,2002-07-11T10:33:53,JLAWRENC,latest,released,0.5,,Apache-ForwardedFor,"Re-set remote_ip to incoming client's ip when running mod_perl behind a reverse proxy server. In other words, copy the first IP from X-Forwarded-For header, which was set by your reverse proxy server, to the remote_ip connection property."
Math-BooleanEval-1.00,2002-07-11T12:42:00,MIKO,backpan,released,1.00,,Math-BooleanEval,"Boolean expression parser"
Data-Page-Tied-0.01,2002-07-11T14:30:25,SMUELLER,backpan,released,0.01,1,Data-Page-Tied,"Tied interface for the Data::Page module"
Apache-FileManager-0.13,2002-07-11T14:33:52,PMC,cpan,released,0.13,,Apache-FileManager,"apache mod_perl file manager"
Mail-Audit-Attach-0.90,2002-07-11T15:17:09,CRENZ,backpan,released,0.90,1,Mail-Audit-Attach,"Mail::Audit plugin for attachment handling."
NewsTicker-0.02,2002-07-11T16:03:17,RLZWART,backpan,released,0.02,1,NewsTicker,"Perl extension for blah blah blah"
Win32-ToolHelp-0.1,2002-07-11T16:47:43,PRANTL,cpan,released,0.1,1,Win32-ToolHelp,"Perl extension for obtaining information about currently executing applications (using the ToolHelp API on Win32)"
SVGGraph-0.01,2002-07-11T18:05:37,TEUN,backpan,released,0.01,1,SVGGraph,"Perl extension for creating SVG Graphs."
PerlIO-subfile-0.06,2002-07-11T20:09:11,NWCLARK,backpan,released,0.06,,PerlIO-subfile,"Perl extension to provide a PerlIO layer to pretend a subsection of a file is a whole regular file."
Template-Plugin-PerlTidy-0.01,2002-07-11T20:53:12,BRIAC,backpan,released,0.01,1,Template-Plugin-PerlTidy,"Perl::Tidy filter"
Data-Serializer-0.17,2002-07-11T21:31:13,NEELY,backpan,released,0.17,,Data-Serializer,"a ""skeleton"" for writing ""t/*.t"" test files."
Inline-Java-0.33,2002-07-11T23:21:39,PATL,backpan,released,0.33,,Inline-Java,"Write Perl classes in Java."
Tie-RangeHash-0.70,2002-07-12T02:07:39,RRWO,backpan,released,0.70,,Tie-RangeHash,"Allows hashes to associate values with a range of keys"
Algorithm-MarkovChain-0.05,2002-07-12T02:50:01,RCLAMP,backpan,released,0.05,,Algorithm-MarkovChain,"Object oriented Markov chain generator"
Algorithm-MarkovChain-GHash-0.01,2002-07-12T02:51:56,RCLAMP,latest,released,0.01,1,Algorithm-MarkovChain-GHash,"Object oriented Markov chain generator, glib/C storage"
Test-MockObject-0.09,2002-07-12T05:16:34,CHROMATIC,backpan,released,0.09,,Test-MockObject,"Perl extension for emulating troublesome interfaces"
XML-Handler-Dtd2Html-0.10,2002-07-12T06:14:15,PERRAD,backpan,released,0.10,1,XML-Handler-Dtd2Html,"PerlSAX handler for generate a HTML documentation from a DTD"
AFS-2.02,2002-07-12T08:52:46,NOG,backpan,released,2.02,,AFS,"Perl interface to AFS programming APIs"
Calendar-Simple-0.01,2002-07-12T09:29:32,DAVECROSS,backpan,released,0.01,1,Calendar-Simple,"Perl extension to create simple calendars"
Data-Page-Tied-0.02,2002-07-12T09:46:23,SMUELLER,backpan,released,0.02,,Data-Page-Tied,"Tied interface for the Data::Page module"
Data-Page-Tied-0.03,2002-07-12T11:55:34,SMUELLER,backpan,released,0.03,,Data-Page-Tied,"Tied interface for the Data::Page module"
DBD-SQLite-0.18,2002-07-12T13:46:37,MSERGEANT,backpan,released,0.18,,DBD-SQLite,"Self Contained RDBMS in a DBI Driver"
PerlIO-via-StripHTML-0.04,2002-07-12T14:20:05,RGARCIA,latest,released,0.04,1,PerlIO-via-StripHTML,"PerlIO layer to strip HTML tags from an input file"
Test-Warn-0.02,2002-07-12T15:01:37,BIGJ,cpan,released,0.02,1,Test-Warn,"Perl extension to test methods for warnings"
Apache-Session-Generate-AutoIncrement-0.9,2002-07-12T16:04:36,PFLEURY,latest,released,0.9,1,Apache-Session-Generate-AutoIncrement,"Use monotonically increasing IDs"
Apache-Session-Serialize-Dumper-0.90,2002-07-12T16:06:38,PFLEURY,latest,released,0.90,1,Apache-Session-Serialize-Dumper,"Use Data::Dumper to zip up persistent data"
threads-farm-0.01,2002-07-12T16:59:27,ELIZABETH,backpan,released,0.01,1,threads-farm,"group of threads for performing similar jobs"
Memoize-1.01,2002-07-12T18:07:55,MJD,cpan,released,1.01,,Memoize,"Make functions faster by trading space for time"
Template-Plugin-PerlTidy-0.02,2002-07-12T18:27:37,BRIAC,backpan,released,0.02,,Template-Plugin-PerlTidy,"Perl::Tidy filter for Template Toolkit"
Calendar-Simple-1.03,2002-07-12T18:36:06,DAVECROSS,backpan,released,1.03,,Calendar-Simple,"Perl extension to create simple calendars"
Tie-Hash-Cannabinol-1.05,2002-07-12T18:43:05,DAVECROSS,backpan,released,1.05,,Tie-Hash-Cannabinol,"Perl extension for creating hashes that forget things"
Tie-Hash-FixedKeys-1.06,2002-07-12T18:44:57,DAVECROSS,backpan,released,1.06,,Tie-Hash-FixedKeys,"Perl extension for hashes with fixed keys"
Tie-Hash-Regex-0.07,2002-07-12T18:51:38,DAVECROSS,backpan,released,0.07,,Tie-Hash-Regex,"Match hash keys using Regular Expressions"
IIT-0.1,2002-07-12T20:57:22,ULLAPRA,backpan,released,0.1,1,IIT,"A Simple IIT Authentication Module"
Net-Ping-2.20,2002-07-12T21:25:45,BBB,backpan,released,2.20,,Net-Ping,"check a remote host for reachability"
Config-General-2.06,2002-07-12T23:24:51,TLINDEN,backpan,released,2.06,,Config-General,"Generic Config Module"
Thread-Queue-Any-0.02,2002-07-13T09:20:19,ELIZABETH,backpan,released,0.02,1,Thread-Queue-Any,"thread-safe queues for any data-structure"
Thread-Pool-0.02,2002-07-13T11:27:42,ELIZABETH,backpan,released,0.02,1,Thread-Pool,"group of threads for performing similar jobs"
Calendar-Simple-1.04,2002-07-13T14:15:17,DAVECROSS,backpan,released,1.04,,Calendar-Simple,"Perl extension to create simple calendars"
XML-XUpdate-LibXML-0.2.3,2002-07-13T14:36:40,PAJAS,backpan,released,v0.2.3,,XML-XUpdate-LibXML,"simple whitespace striping functions"
HTML-TableContentParser-0.12,2002-07-13T15:34:39,SDRABBLE,cpan,released,0.12,,HTML-TableContentParser,"Do interesting things with the contents of tables."
Scrape-USPS-ZipLookup-1.1,2002-07-13T16:29:22,GREGOR,backpan,released,1.1,1,Scrape-USPS-ZipLookup,"Standardize U.S. postal addresses."
Imager-Plot-0.08,2002-07-13T17:50:36,ADDI,cpan,released,0.08,,Imager-Plot,"Perl extension for generating fancy graphic plots in color."
Params-Validate-0.20,2002-07-13T18:37:14,DROLSKY,backpan,released,0.20,,Params-Validate,"Validate method/function parameters using attributes"
Quantum-Superpositions-1.04,2002-07-13T19:22:13,LEMBARK,backpan,released,1.04,,Quantum-Superpositions,"QM-like superpositions in Perl"
Spreadsheet-ParseExcel-0.2601,2002-07-13T22:41:34,KWITKNR,cpan,released,0.2601,,Spreadsheet-ParseExcel,"Get information from Excel file"
Thread-Queue-Any-0.03,2002-07-13T22:49:52,ELIZABETH,backpan,released,0.03,,Thread-Queue-Any,"thread-safe queues for any data-structure"
Thread-Pool-0.03,2002-07-13T22:51:44,ELIZABETH,backpan,released,0.03,,Thread-Pool,"group of threads for performing similar jobs"
perl-5.8.0-RC3,2002-07-14T00:26:18,JHI,backpan,developer,v5.8.0,,perl,"Perl pragma to control optional warnings"
ConfigReader-Simple-1.12,2002-07-14T04:13:58,BDFOY,backpan,released,1.12,,ConfigReader-Simple,"Simple configuration file parser"
Params-Validate-0.21,2002-07-14T06:35:41,DROLSKY,backpan,released,0.21,,Params-Validate,"Validate method/function parameters using attributes"
Text-Diff-0.34,2002-07-14T12:30:01,RBS,backpan,released,0.34,,Text-Diff,"Perform diffs on files and record sets"
Test-Differences-0.45,2002-07-14T12:33:29,RBS,backpan,released,0.45,,Test-Differences,"Test strings and data structures and show differences if not ok"
GSM-SMS-0.150,2002-07-14T13:02:22,JOHANVDB,backpan,released,0.150,,GSM-SMS,"Implements a simple .ini style config."
Term-WinConsole-0.01,2002-07-14T13:58:52,JMVILOMET,latest,released,0.01,1,Term-WinConsole,"Perl extension for text based windows management."
Date-Tolkien-Shire-1.1,2002-07-14T15:23:30,TBRAUN,backpan,released,1.1,,Date-Tolkien-Shire,
DNS-ZoneParse-0.81,2002-07-14T16:48:10,SIMONFLK,backpan,released,0.81,,DNS-ZoneParse,"Perl extension for parsing and manipulating DNS Zone Files."
Solaris-Procfs-0.21,2002-07-14T17:47:56,JNOLAN,backpan,released,0.21,,Solaris-Procfs,"access Solaris process information from Perl"
ImplicitThis-0.01_001,2002-07-14T21:22:57,SWALTERS,backpan,developer,0.01_001,1,ImplicitThis,"Syntactical Sugar for OO Methods"
ANSIColor-1.05,2002-07-14T21:29:41,RRA,backpan,released,1.05,,ANSIColor,"Color screen output using ANSI escape sequences"
PGP-Sign-0.17,2002-07-14T21:30:00,RRA,backpan,released,0.17,,PGP-Sign,
podlators-1.23,2002-07-15T05:54:25,RRA,backpan,released,1.23,,podlators,"Convert POD data to formatted *roff input"
Unicode-Japanese-0.11,2002-07-15T06:24:36,MIKAGE,backpan,released,0.11,,Unicode-Japanese,"Japanese Character Encoding Handler"
Unicode-Japanese-0.12,2002-07-15T06:46:26,MIKAGE,backpan,released,0.12,,Unicode-Japanese,"Japanese Character Encoding Handler"
Net-CIDR-Lite-0.12,2002-07-15T07:07:02,DOUGW,backpan,released,0.12,,Net-CIDR-Lite,"Perl extension for merging IPv4 or IPv6 CIDR addresses"
Lingua-CS-Num2Word-0.01,2002-07-15T07:17:12,RVASICEK,cpan,released,0.01,1,Lingua-CS-Num2Word,"number to text convertor for czech. Output text is in iso-8859-2 encoding."
Lingua-DE-Num2Word-0.01,2002-07-15T07:25:37,RVASICEK,cpan,released,0.01,1,Lingua-DE-Num2Word,"positive number to text convertor for german. Output text is in iso-8859-1 encoding."
Lingua-Num2Word-0.01,2002-07-15T07:29:05,RVASICEK,cpan,released,0.01,1,Lingua-Num2Word,"wrapper for number to text conversion modules of various languages in the Lingua:: hierarchy."
Win32-ToolHelp-0.2,2002-07-15T09:40:39,PRANTL,cpan,released,0.2,,Win32-ToolHelp,"Perl extension for obtaining information about currently executing applications (using the ToolHelp API on Win32)"
Win32API-ToolHelp-0.02,2002-07-15T09:44:12,PRANTL,latest,released,0.02,1,Win32API-ToolHelp,"Perl extension for obtaining information about currently executing applications using the plain Win32 ToolHelp API"
Win32API-ProcessStatus-0.01,2002-07-15T09:44:27,PRANTL,cpan,released,0.01,1,Win32API-ProcessStatus,"Perl extension for obtaining information about processes using the plain Win32 PSAPI"
Win32API-Process-0.01,2002-07-15T09:44:42,PRANTL,latest,released,0.01,1,Win32API-Process,"Perl extension for handling the processes using the plain Win32 API"
Net-CIDR-Lite-0.13,2002-07-15T09:46:34,DOUGW,backpan,released,0.13,,Net-CIDR-Lite,"Perl extension for merging IPv4 or IPv6 CIDR addresses"
DBI-1.29,2002-07-15T11:24:40,TIMB,backpan,released,1.29,,DBI,"Database independent interface for Perl"
POE-Component-Client-FTP-0.06,2002-07-15T11:41:33,MCHING,cpan,released,0.06,,POE-Component-Client-FTP,"Implements an FTP client POE Component"
POE-Filter-Ls-0.01,2002-07-15T11:58:26,MCHING,latest,released,0.01,1,POE-Filter-Ls,"translates common ls formats into a hashref"
Apache-Admin-Config-0.52,2002-07-15T12:17:02,RSOLIV,cpan,released,0.52,,Apache-Admin-Config,"A common module to manipulate Apache configuration files"
Apache-Admin-Config-0.53,2002-07-15T12:46:52,RSOLIV,cpan,released,0.53,,Apache-Admin-Config,"A common module to manipulate Apache configuration files"
Test-Warn-0.03,2002-07-15T12:58:53,BIGJ,cpan,released,0.03,,Test-Warn,"Perl extension to test methods for warnings"
Bot-Pluggable-0.02,2002-07-15T13:25:46,MSERGEANT,backpan,released,0.02,,Bot-Pluggable,"A plugin based IRC bot"
Thread-Pool-0.04,2002-07-15T13:30:50,ELIZABETH,backpan,released,0.04,,Thread-Pool,"group of threads for performing similar jobs"
HTML-TableContentParser-0.13,2002-07-15T14:01:11,SDRABBLE,cpan,released,0.13,,HTML-TableContentParser,"Do interesting things with the contents of tables."
Petal-0.1,2002-07-15T15:24:04,JHIVER,backpan,released,0.1,1,Petal,"Perl Template Attribute Language"
File-Scan-0.33,2002-07-15T15:40:47,HDIAS,backpan,released,0.33,,File-Scan,"Perl extension for Scanning files for Viruses"
Thread-Pool-0.11,2002-07-15T15:59:21,ELIZABETH,backpan,released,0.11,,Thread-Pool,"group of threads for performing similar jobs"
Meta-0.05,2002-07-15T16:27:33,VELTZER,backpan,released,0.05,,Meta,"demo the XmlTree widget."
Net-CIDR-Lite-0.14,2002-07-15T16:31:01,DOUGW,backpan,released,0.14,,Net-CIDR-Lite,"Perl extension for merging IPv4 or IPv6 CIDR addresses"
HTML-Mason-Request-WithApacheSession-0.03,2002-07-15T18:20:54,DROLSKY,backpan,released,0.03,,HTML-Mason-Request-WithApacheSession,"Add a session to the Mason Request object"
Set-Window-1.01,2002-07-15T18:50:40,SWMCD,latest,released,1.01,,Set-Window,"Manages an interval on the integer line"
IO-Socket-Multicast-0.21,2002-07-15T19:52:00,LDS,cpan,released,0.21,,IO-Socket-Multicast,"Send and receive multicast messages"
Class-Date-1.1.0,2002-07-15T19:53:57,DLUX,backpan,released,v1.1.0,,Class-Date,"Class for easy date and time manipulation"
Class-DispatchToAll-0.10,2002-07-15T20:45:46,DOMM,backpan,released,0.10,1,Class-DispatchToAll,"dispatch a method call to all inherited methods"
Crypt-OpenPGP-1.01,2002-07-15T21:19:34,BTROTT,backpan,released,1.01,,Crypt-OpenPGP,"Pure-Perl OpenPGP implementation"
Bundle-BioPerl-2.02,2002-07-15T23:04:11,CRAFFI,backpan,released,2.02,,Bundle-BioPerl,"A bundle to install external CPAN modules used by BioPerl"
Bundle-BioPerl-2.03,2002-07-15T23:44:09,CRAFFI,backpan,released,2.03,,Bundle-BioPerl,"A bundle to install external CPAN modules used by BioPerl"
Params-Validate-0.22,2002-07-15T23:49:14,DROLSKY,backpan,released,0.22,,Params-Validate,"Validate method/function parameters"
SOAP-MIME-0.55-2,2002-07-16T01:02:41,BYRNE,cpan,released,0.55,1,SOAP-MIME,"Patch to SOAP::Lite to add attachment support. This module allows Perl clients to both compose messages with attachments, and to parse messages with attachments."
Spreadsheet-ParseExcel-0.2602,2002-07-16T02:07:27,KWITKNR,cpan,released,0.2602,,Spreadsheet-ParseExcel,"Get information from Excel file"
Log-Log4perl-0.17,2002-07-16T04:43:25,MSCHILLI,backpan,released,0.17,,Log-Log4perl,"Log4j implementation for Perl"
bioperl-1.0.2,2002-07-16T07:58:58,BIRNEY,backpan,released,v1.0.2,,bioperl,"a tutorial for bioperl"
PHP-Session-0.12,2002-07-16T08:11:30,MIYAGAWA,backpan,released,0.12,,PHP-Session,"read / write PHP session files"
Locale-Codes-2.06,2002-07-16T09:10:01,NEILB,backpan,released,2.06,,Locale-Codes,"ISO codes for script identification (ISO 15924)"
Lingua-Num2Word-0.02,2002-07-16T09:49:30,RVASICEK,cpan,released,0.02,,Lingua-Num2Word,"wrapper for number to text conversion modules of various languages in the Lingua:: hierarchy."
Thread-Pool-0.12,2002-07-16T10:03:17,ELIZABETH,backpan,released,0.12,,Thread-Pool,"group of threads for performing similar jobs"
File-Random-0.13,2002-07-16T10:13:41,BIGJ,cpan,released,0.13,,File-Random,"Perl module for random selecting of a file"
Locale-Maketext-Lexicon-0.06,2002-07-16T10:36:45,AUTRIJUS,backpan,released,0.06,,Locale-Maketext-Lexicon,"Extract gettext strings from source"
PHP-Session-0.13,2002-07-16T10:38:45,MIYAGAWA,backpan,released,0.13,,PHP-Session,"read / write PHP session files"
Petal.0.2,2002-07-16T11:02:23,JHIVER,backpan,released,0.2,,Petal,"Perl Template Attribute Language"
Unicode-Transliterate.0.3,2002-07-16T12:02:26,JHIVER,latest,released,0.3,,Unicode-Transliterate,"Perl wrapper for ICU transliteration services"
HTML-Tagreader-0.04,2002-07-16T12:25:47,GUS,backpan,released,0.04,1,HTML-Tagreader,"Perl extension module for reading html/sgml/xml tags"
Term-WinConsole-0.02,2002-07-16T13:17:36,JMVILOMET,latest,released,0.02,,Term-WinConsole,"Perl extension for text based windows management."
Test-Warn-0.04,2002-07-16T13:32:19,BIGJ,cpan,released,0.04,,Test-Warn,"Perl extension to test methods for warnings"
Apache-CookieToQuery-1,2002-07-16T16:31:55,ALEXP,backpan,released,1,1,Apache-CookieToQuery,"Rewrite query string by adding cookie information"
Params-Validate-0.23,2002-07-16T16:42:25,DROLSKY,backpan,released,0.23,,Params-Validate,"Validate method/function parameters"
Log-Log4perl-0.18,2002-07-16T17:11:12,MSCHILLI,backpan,released,0.18,,Log-Log4perl,"Log4j implementation for Perl"
DNS-ZoneParse-0.82,2002-07-16T17:50:49,SIMONFLK,backpan,released,0.82,,DNS-ZoneParse,"Perl extension for parsing and manipulating DNS Zone Files."
Log-Channel-0.5,2002-07-16T17:57:53,JMAY,backpan,released,0.5,,Log-Channel,"yet another logging package"
Apache-CookieToQuery-1.02,2002-07-16T18:01:36,ALEXP,backpan,released,1.02,,Apache-CookieToQuery,"Rewrite query string by adding cookie information"
Template-Plugin-Clickable-0.01,2002-07-16T20:39:05,MIYAGAWA,backpan,released,0.01,1,Template-Plugin-Clickable,"Make URLs clickable in HTML"
Template-Plugin-FillInForm-0.01,2002-07-16T20:41:00,MIYAGAWA,backpan,released,0.01,1,Template-Plugin-FillInForm,"TT plugin for HTML::FillInForm"
Astro-STSDAS-Table-0.1,2002-07-16T22:28:36,DJERIUS,backpan,released,0.1,1,Astro-STSDAS-Table,"access STSDAS format table files"
Astro-STSDAS-Table-0.11,2002-07-16T22:43:59,DJERIUS,backpan,released,0.11,,Astro-STSDAS-Table,"access STSDAS format table files"
Log-Log4perl-0.19,2002-07-16T23:11:10,MSCHILLI,backpan,released,0.19,,Log-Log4perl,"Log4j implementation for Perl"
Apache-Session-Serialize-YAML-0.01,2002-07-16T23:27:37,MIYAGAWA,cpan,released,0.01,1,Apache-Session-Serialize-YAML,"use YAML for serialization"
SVG-2.24,2002-07-16T23:57:41,RONAN,cpan,released,2.24,,SVG,"Perl extension for generating Scalable Vector Graphics (SVG) documents"
Apache-CookieToQuery-1.03,2002-07-17T00:09:59,ALEXP,backpan,released,1.03,,Apache-CookieToQuery,"Rewrite query string by adding cookie information"
IMDb-0.01,2002-07-17T00:29:36,RSOLIV,backpan,released,0.01,1,IMDb,"Abstract class to query the Internet Movie Database"
Net-Telnet-3.03,2002-07-17T01:39:31,JROGERS,cpan,released,3.03,,Net-Telnet,"interact with TELNET port or other TCP ports"
interface-0.01,2002-07-17T02:27:49,SWALTERS,backpan,released,0.01,1,interface,"simple compile time interface checking for OO Perl"
Locale-Maketext-Lexicon-0.07,2002-07-17T03:06:31,AUTRIJUS,backpan,released,0.07,,Locale-Maketext-Lexicon,"Extract gettext strings from source"
CGI-AIS-Session-0.02,2002-07-17T06:33:32,DAVIDNICO,latest,released,0.02,,CGI-AIS-Session,"Perl extension to manage CGI user sessions with external identity authentication via AIS"
Class-Container-0.06,2002-07-17T07:51:49,KWILLIAMS,backpan,released,0.06,,Class-Container,"Glues object frameworks together transparently"
MacOSX-iTunes-0.5_01,2002-07-17T08:27:23,BDFOY,backpan,developer,0.5_01,1,MacOSX-iTunes,"common functions for tests"
Validate-Net-0.1,2002-07-17T08:37:41,ADAMK,backpan,released,0.1,1,Validate-Net,"Format validation and more for Net:: related strings"
Apache-CookieToQuery-1.04,2002-07-17T08:46:15,ALEXP,backpan,released,1.04,,Apache-CookieToQuery,"Rewrite query string by adding cookie information"
Thread-Queue-Monitored-0.01,2002-07-17T09:27:49,ELIZABETH,backpan,released,0.01,1,Thread-Queue-Monitored,"monitor a queue for content"
Locale-Maketext-Lexicon-0.08,2002-07-17T09:38:05,AUTRIJUS,backpan,released,0.08,,Locale-Maketext-Lexicon,"Extract gettext strings from source"
