0.000000000 10.0.0.1.6699 > 10.0.0.2.55309: . ack 225051666 win 65463 
0.000014000 10.0.0.3.80 > 10.0.0.4.14401: S 457330477:457330477(0) ack 810547499 win 34932 
0.000014000 10.0.0.1.6699 > 10.0.0.2.55309: . 3069529864:3069531324(1460) ack 225051666 win 65463 
0.000024000 10.0.0.5.12119 > 10.0.0.6.80: F 2073668891:2073668891(0) ack 183269290 win 64240 
0.000034000 10.0.0.7.4725 > 10.0.0.8.445: S 3152140131:3152140131(0) win 16384 
0.000067000 10.0.0.1.6699 > 10.0.0.2.55309: P 3069531324:3069531944(620) ack 225051666 win 65463 
0.000072000 10.0.0.11.3381 > 10.0.0.12.445: S 1378088462:1378088462(0) win 16384 
0.000083000 10.0.0.13.1653 > 10.0.0.1.6699: P 3272208349:3272208357(8) ack 501563814 win 32767 
0.000093000 10.0.0.14.1320 > 10.0.0.15.445: S 3127123478:3127123478(0) win 64170 
0.000095000 10.0.0.4.14401 > 10.0.0.3.80: R 810547499:810547499(0) ack 457330478 win 34932 
0.000103000 10.0.0.16.2871 > 10.0.0.17.2261: . 2121446674:2121448054(1380) ack 1652492330 win 16150 
0.000106000 10.0.0.6.80 > 10.0.0.5.12119: . ack 2073668892 win 8529 
0.000116000 10.0.0.18.39582 > 10.0.0.19.25: S 2635943118:2635943118(0) win 49640 
0.000126000 10.0.0.1.6699 > 10.0.0.13.1653: . 501570054:501571468(1414) ack 3272208357 win 46719 
0.000152000 10.0.0.13.1653 > 10.0.0.1.6699: P 3272208357:3272208365(8) ack 501565894 win 32767 
0.000162000 10.0.0.20.3790 > 10.0.0.10.3568: . ack 192281343 win 32767 
0.000172000 10.0.0.16.2871 > 10.0.0.17.2261: P 2121448054:2121448722(668) ack 1652492330 win 16150 
0.000174000 10.0.0.1.6699 > 10.0.0.13.1653: P 501571468:501572134(666) ack 3272208357 win 46719 
0.000203000 10.0.0.1.6699 > 10.0.0.13.1653: . 501572134:501573548(1414) ack 3272208365 win 46718 
0.000212000 10.0.0.23.8090 > 10.0.0.24.2752: . 3416959480:3416960860(1380) ack 1214958873 win 57960 
0.000251000 10.0.0.1.6699 > 10.0.0.13.1653: P 501573548:501574214(666) ack 3272208365 win 46718 
0.000260000 10.0.0.23.8090 > 10.0.0.24.2752: . 3416960860:3416962240(1380) ack 1214958873 win 57960 
0.000281000 10.0.0.10.3568 > 10.0.0.20.3790: . 192287487:192288847(1360) ack 3045020009 win 17290 
0.000307000 10.0.0.20.3790 > 10.0.0.10.3568: . ack 192283391 win 32767 
0.000317000 10.0.0.20.3790 > 10.0.0.10.3568: . ack 192285439 win 32767 
0.000328000 10.0.0.10.3568 > 10.0.0.20.3790: P 192288847:192289535(688) ack 3045020009 win 17290 
0.000336000 10.0.0.27.4684 > 10.0.0.28.135: S 1098667004:1098667004(0) win 64240 
0.000346000 10.0.0.13.1653 > 10.0.0.1.6699: . ack 501567974 win 32767 
0.000356000 10.0.0.29.43444 > 10.0.0.6.80: F 251240878:251240878(0) ack 181458387 win 23360 
0.000358000 10.0.0.1.6699 > 10.0.0.30.4924: . ack 3435896764 win 64975 
0.000368000 10.0.0.17.2261 > 10.0.0.16.2871: . ack 2121448722 win 16560 
0.000379000 10.0.0.10.3568 > 10.0.0.20.3790: . 192289535:192290895(1360) ack 3045020009 win 17290 
0.000400000 10.0.0.20.3790 > 10.0.0.10.3568: . ack 192287487 win 32767 
0.000411000 10.0.0.35.4633 > 10.0.0.36.135: S 3808492367:3808492367(0) win 65535 
0.000422000 10.0.0.16.2871 > 10.0.0.17.2261: . 2121448722:2121450102(1380) ack 1652492330 win 16150 
0.000426000 10.0.0.24.2752 > 10.0.0.23.8090: . ack 3416960860 win 64860 
0.000436000 10.0.0.10.3568 > 10.0.0.20.3790: P 192290895:192291583(688) ack 3045020009 win 17290 
0.000466000 10.0.0.37.42812 > 10.0.0.38.113: S 4294352886:4294352886(0) win 24820 
0.000469000 10.0.0.35.4634 > 10.0.0.39.135: S 3808550908:3808550908(0) win 65535 
0.000476000 10.0.0.10.3568 > 10.0.0.20.3790: . 192291583:192292943(1360) ack 3045020009 win 17290 
0.000479000 10.0.0.40.1260 > 10.0.0.17.2257: . ack 2855225976 win 16560 
0.000489000 10.0.0.35.4635 > 10.0.0.41.135: S 3808596568:3808596568(0) win 65535 
0.000499000 10.0.0.16.2871 > 10.0.0.17.2261: P 2121450102:2121450770(668) ack 1652492330 win 16150 
0.000523000 10.0.0.10.3568 > 10.0.0.20.3790: P 192292943:192293631(688) ack 3045020009 win 17290 
0.000539000 10.0.0.35.4636 > 10.0.0.44.135: S 3808649868:3808649868(0) win 65535 
0.000549000 10.0.0.23.8090 > 10.0.0.24.2752: . 3416962240:3416963620(1380) ack 1214958873 win 57960 
0.000569000 10.0.0.1.6699 > 10.0.0.13.1653: . 501574214:501575628(1414) ack 3272208365 win 46718 
0.000596000 10.0.0.29.43518 > 10.0.0.45.80: F 241617456:241617456(0) ack 1911633204 win 28960 
0.000606000 10.0.0.35.4637 > 10.0.0.46.135: S 3808714554:3808714554(0) win 65535 
0.000616000 10.0.0.47.4687 > 10.0.0.1.6699: P 1660358184:1660358192(8) ack 1054926970 win 14560 
0.000617000 10.0.0.1.6699 > 10.0.0.13.1653: P 501575628:501576294(666) ack 3272208365 win 46718 
0.000626000 10.0.0.35.4638 > 10.0.0.48.135: S 3808779748:3808779748(0) win 65535 
0.000636000 10.0.0.23.8090 > 10.0.0.24.2752: P 3416963620:3416964600(980) ack 1214958873 win 57960 
0.000646000 10.0.0.6.80 > 10.0.0.29.43444: . ack 251240879 win 8556 
0.000656000 10.0.0.10.3568 > 10.0.0.20.3790: . 192293631:192294991(1360) ack 3045020009 win 17290 
0.000673000 10.0.0.13.1653 > 10.0.0.1.6699: P 3272208365:3272208373(8) ack 501569388 win 32767 
0.000684000 10.0.0.35.4639 > 10.0.0.49.135: S 3808824607:3808824607(0) win 65535 
0.000694000 10.0.0.16.2871 > 10.0.0.17.2261: . 2121450770:2121452150(1380) ack 1652492330 win 16150 
0.000704000 10.0.0.10.3568 > 10.0.0.20.3790: P 192294991:192295679(688) ack 3045020009 win 17290 
0.000733000 10.0.0.17.2257 > 10.0.0.40.1260: . 2855230116:2855231496(1380) ack 3057858504 win 16162 
0.000742000 10.0.0.50.3362 > 10.0.0.1.6699: . ack 685296000 win 8140 
0.000752000 10.0.0.16.2871 > 10.0.0.17.2261: P 2121452150:2121452818(668) ack 1652492330 win 16150 
0.000781000 10.0.0.17.2261 > 10.0.0.16.2871: . ack 2121450770 win 16560 
0.000781000 10.0.0.35.4640 > 10.0.0.51.135: S 3808881660:3808881660(0) win 65535 
0.000791000 10.0.0.45.80 > 10.0.0.29.43518: . ack 241617457 win 24616 
0.000792000 10.0.0.13.1653 > 10.0.0.1.6699: P 3272208373:3272208381(8) ack 501570054 win 32101 
0.000801000 10.0.0.24.2752 > 10.0.0.23.8090: . ack 3416963620 win 64860 
0.000811000 10.0.0.53.63614 > 10.0.0.54.25: S 2002101132:2002101132(0) win 24820 
0.000821000 10.0.0.1.6699 > 10.0.0.47.4687: . 1054926970:1054928430(1460) ack 1660358192 win 64807 
0.000849000 10.0.0.35.4641 > 10.0.0.55.135: S 3808927247:3808927247(0) win 65535 
0.000857000 10.0.0.56.3389 > 10.0.0.57.62260: S 355887866:355887866(0) ack 290514462 win 46424 
0.000859000 10.0.0.1.6699 > 10.0.0.47.4687: P 1054928430:1054929050(620) ack 1660358192 win 64807 
0.000865000 10.0.0.35.4642 > 10.0.0.58.135: S 3808961740:3808961740(0) win 65535 
0.000872000 10.0.0.35.4643 > 10.0.0.59.135: S 3809015150:3809015150(0) win 65535 
0.000880000 10.0.0.35.4644 > 10.0.0.60.135: S 3809080094:3809080094(0) win 65535 
0.000888000 10.0.0.61.3100 > 10.0.0.62.445: S 3610627271:3610627271(0) win 64240 
0.000895000 10.0.0.16.2871 > 10.0.0.17.2261: . 2121452818:2121454198(1380) ack 1652492330 win 16150 
0.000909000 10.0.0.63.3427 > 10.0.0.64.6881: . 3881037250:3881038710(1460) ack 1488952571 win 64037 
0.000928000 10.0.0.35.4645 > 10.0.0.65.135: S 3809129906:3809129906(0) win 65535 
0.000935000 10.0.0.64.6881 > 10.0.0.63.3427: . ack 3881051850 win 17520 
0.000943000 10.0.0.47.4687 > 10.0.0.1.6699: . ack 1054929050 win 12480 
0.000943000 10.0.0.17.2261 > 10.0.0.16.2871: . ack 2121452818 win 16560 
0.000951000 10.0.0.66.2588 > 10.0.0.67.445: S 3878112967:3878112967(0) win 64240 
0.000951000 10.0.0.1.6699 > 10.0.0.13.1653: . ack 3272208381 win 46716 
0.000958000 10.0.0.35.4646 > 10.0.0.68.135: S 3809191708:3809191708(0) win 65535 
0.000958000 10.0.0.1.6699 > 10.0.0.13.1653: . 501576294:501577708(1414) ack 3272208381 win 46716 
0.000966000 10.0.0.56.80 > 10.0.0.69.26441: S 365008533:365008533(0) ack 4151188254 win 60015 
0.000974000 10.0.0.70.5029 > 10.0.0.71.135: S 2278399698:2278399698(0) win 64240 
0.000981000 10.0.0.16.2871 > 10.0.0.17.2261: P 2121454198:2121454866(668) ack 1652492330 win 16150 
0.000991000 10.0.0.1.6699 > 10.0.0.13.1653: P 501577708:501578374(666) ack 3272208381 win 46716 
0.001002000 10.0.0.35.4647 > 10.0.0.72.135: S 3809229214:3809229214(0) win 65535 
0.001012000 10.0.0.63.3427 > 10.0.0.64.6881: . 3881051850:3881053310(1460) ack 1488952571 win 64037 
0.001028000 10.0.0.11.3660 > 10.0.0.73.445: S 1360212336:1360212336(0) win 16384 
0.001036000 10.0.0.35.4648 > 10.0.0.74.135: S 3809266994:3809266994(0) win 65535 
0.001043000 10.0.0.35.4649 > 10.0.0.75.135: S 3809331258:3809331258(0) win 65535 
0.001045000 10.0.0.63.3427 > 10.0.0.64.6881: P 3881053310:3881053647(337) ack 1488952571 win 64037 
0.001051000 10.0.0.11.3626 > 10.0.0.12.445: S 1359963875:1359963875(0) win 16384 
0.001059000 10.0.0.35.4650 > 10.0.0.76.135: S 3809365298:3809365298(0) win 65535 
0.001060000 10.0.0.17.2261 > 10.0.0.16.2871: . ack 2121454866 win 16560 
0.001066000 10.0.0.7.4117 > 10.0.0.77.445: S 3127035625:3127035625(0) win 16384 
0.001074000 10.0.0.35.4651 > 10.0.0.79.135: S 3809426946:3809426946(0) win 65535 
0.001091000 10.0.0.35.4652 > 10.0.0.84.135: S 3809462312:3809462312(0) win 65535 
0.001098000 10.0.0.63.4596 > 10.0.0.85.6881: . 2504803088:2504804540(1452) ack 2571610256 win 64097 
0.001124000 10.0.0.85.6881 > 10.0.0.63.4596: . ack 2504803088 win 65535 
0.001132000 10.0.0.64.6881 > 10.0.0.63.3427: . ack 3881053647 win 17520 
0.001132000 10.0.0.63.4596 > 10.0.0.85.6881: . 2504805992:2504807444(1452) ack 2571610256 win 64097 
0.001139000 10.0.0.64.6881 > 10.0.0.63.3427: P 1488952571:1488952588(17) ack 3881053647 win 17520 
0.001147000 10.0.0.88.3262 > 10.0.0.89.443: . ack 962505216 win 8760 
0.001155000 10.0.0.23.8090 > 10.0.0.24.2752: . 3416964600:3416965980(1380) ack 1214958873 win 57960 
0.001173000 10.0.0.24.2752 > 10.0.0.23.8090: . ack 3416965980 win 64860 
0.001181000 10.0.0.1.6699 > 10.0.0.30.4924: . 3803402313:3803403753(1440) ack 3435896764 win 64975 
0.001215000 10.0.0.1.6699 > 10.0.0.30.4924: P 3803403753:3803405193(1440) ack 3435896764 win 64975 
0.001215000 10.0.0.30.4924 > 10.0.0.1.6699: . ack 3803400873 win 17280 
0.001223000 10.0.0.2.55309 > 10.0.0.1.6699: . ack 3069525704 win 8140 
0.001230000 10.0.0.2.55309 > 10.0.0.1.6699: P 225051666:225051674(8) ack 3069527164 win 8760 
0.001238000 10.0.0.2.55309 > 10.0.0.1.6699: . ack 3069527784 win 8140 
0.001246000 10.0.0.2.55309 > 10.0.0.1.6699: P 225051674:225051682(8) ack 3069527784 win 8140 
0.001248000 10.0.0.1.6699 > 10.0.0.30.4924: P 3803405193:3803406153(960) ack 3435896764 win 64975 
0.001253000 10.0.0.2.55309 > 10.0.0.1.6699: . ack 3069529864 win 8760 
0.001261000 10.0.0.2.55309 > 10.0.0.1.6699: P 225051682:225051690(8) ack 3069529864 win 8760 
0.001269000 10.0.0.23.8090 > 10.0.0.24.2752: P 3416965980:3416967213(1233) ack 1214958873 win 57960 
0.001274000 10.0.0.1.6699 > 10.0.0.2.55309: . 3069531944:3069533404(1460) ack 225051666 win 65463 
0.001307000 10.0.0.1.6699 > 10.0.0.2.55309: P 3069533404:3069534024(620) ack 225051674 win 65455 
0.001313000 10.0.0.2.55309 > 10.0.0.1.6699: . ack 3069531944 win 8760 
0.001320000 10.0.0.92.3809 > 10.0.0.93.445: S 3498133914:3498133914(0) win 16384 
0.001327000 10.0.0.1.6699 > 10.0.0.2.55309: . 3069534024:3069535484(1460) ack 225051674 win 65455 
0.001328000 10.0.0.16.2871 > 10.0.0.17.2261: . 2121454866:2121456246(1380) ack 1652492330 win 16150 
0.001360000 10.0.0.88.3262 > 10.0.0.89.443: . ack 962505216 win 8760 
0.001360000 10.0.0.1.6699 > 10.0.0.2.55309: P 3069535484:3069536104(620) ack 225051682 win 65447 
0.001380000 10.0.0.96.3508 > 10.0.0.97.445: S 2556447888:2556447888(0) win 16384 
0.001380000 10.0.0.1.6699 > 10.0.0.2.55309: . 3069536104:3069537564(1460) ack 225051682 win 65447 
0.001387000 10.0.0.3.80 > 10.0.0.98.8020: S 461830122:461830122(0) ack 3710041371 win 17019 
0.001395000 10.0.0.99.3631 > 10.0.0.100.135: S 3933936962:3933936962(0) win 64512 
0.001403000 10.0.0.16.2871 > 10.0.0.17.2261: P 2121456246:2121456914(668) ack 1652492330 win 16150 
0.001414000 10.0.0.1.6699 > 10.0.0.2.55309: P 3069537564:3069538184(620) ack 225051682 win 65447 
0.001433000 10.0.0.1.6699 > 10.0.0.2.55309: . 3069538184:3069539644(1460) ack 225051690 win 65439 
0.001443000 10.0.0.104.1183 > 10.0.0.105.135: S 665039225:665039225(0) win 16384 
0.001451000 10.0.0.50.3362 > 10.0.0.1.6699: P 4272166848:4272166856(8) ack 685297460 win 8760 
0.001459000 10.0.0.106.2967 > 10.0.0.107.135: S 2283798709:2283798709(0) win 64800 
0.001466000 10.0.0.108.1601 > 10.0.0.109.135: S 708062372:708062372(0) win 64240 
0.001467000 10.0.0.1.6699 > 10.0.0.2.55309: P 3069539644:3069540264(620) ack 225051690 win 65439 
0.001474000 10.0.0.110.2515 > 10.0.0.111.445: S 22318896:22318896(0) win 16384 
0.001482000 10.0.0.16.2871 > 10.0.0.17.2261: . 2121456914:2121458294(1380) ack 1652492330 win 16150 
0.001494000 10.0.0.53.63296 > 10.0.0.54.25: S 1933909112:1933909112(0) win 24820 
0.001509000 10.0.0.17.2261 > 10.0.0.16.2871: . ack 2121456914 win 16560 
0.001514000 10.0.0.30.4924 > 10.0.0.1.6699: . ack 3803402313 win 17280 
0.001517000 10.0.0.1.6699 > 10.0.0.50.3362: . 685302240:685303700(1460) ack 4272166856 win 64223 
0.001521000 10.0.0.104.1233 > 10.0.0.105.135: S 666679089:666679089(0) win 16384 
0.001529000 10.0.0.27.1073 > 10.0.0.113.445: S 1111605153:1111605153(0) win 64240 
0.001537000 10.0.0.104.1234 > 10.0.0.105.135: S 666733488:666733488(0) win 16384 
0.001544000 10.0.0.16.2871 > 10.0.0.17.2261: P 2121458294:2121458962(668) ack 1652492330 win 16150 
0.001551000 10.0.0.1.6699 > 10.0.0.50.3362: P 685303700:685304320(620) ack 4272166856 win 64223 
0.001570000 10.0.0.1.6699 > 10.0.0.30.4924: . 3803406153:3803407593(1440) ack 3435896764 win 64975 
0.001572000 10.0.0.116.3476 > 10.0.0.117.135: S 301223834:301223834(0) win 8760 
0.001580000 10.0.0.40.1260 > 10.0.0.17.2257: . ack 2855225976 win 16560 
0.001588000 10.0.0.104.1244 > 10.0.0.105.135: S 667168073:667168073(0) win 16384 
0.001595000 10.0.0.118.80 > 10.0.0.119.2963: F 227414795:227414795(0) ack 3900839276 win 5840 
0.001603000 10.0.0.116.3474 > 10.0.0.120.135: S 301120761:301120761(0) win 8760 
0.001604000 10.0.0.1.6699 > 10.0.0.30.4924: P 3803407593:3803408233(640) ack 3435896764 win 64975 
0.001611000 10.0.0.116.3472 > 10.0.0.121.135: S 301024641:301024641(0) win 8760 
0.001618000 10.0.0.116.3473 > 10.0.0.122.135: S 301083768:301083768(0) win 8760 
0.001623000 10.0.0.17.2261 > 10.0.0.16.2871: . ack 2121458962 win 16560 
0.001626000 10.0.0.116.3475 > 10.0.0.123.135: S 301174309:301174309(0) win 8760 
0.001631000 10.0.0.17.2257 > 10.0.0.40.1260: . 2855225976:2855227356(1380) ack 3057858504 win 16162 
0.001634000 10.0.0.124.3569 > 10.0.0.125.135: S 2263626771:2263626771(0) win 16384 
0.001652000 10.0.0.16.2871 > 10.0.0.17.2261: . 2121458962:2121460342(1380) ack 1652492330 win 16150 
0.001663000 10.0.0.119.2963 > 10.0.0.118.80: . ack 227414796 win 65535 
0.001686000 10.0.0.63.3427 > 10.0.0.64.6881: . ack 1488952588 win 64020 
0.001694000 10.0.0.17.2261 > 10.0.0.16.2871: . ack 2121461010 win 16560 
0.001701000 10.0.0.127.2617 > 10.0.0.128.3531: P 1947323264:1947323265(1) ack 656935367 win 8023 
0.001728000 10.0.0.17.2261 > 10.0.0.16.2871: . ack 2121463058 win 16560 
0.001735000 10.0.0.1.6699 > 10.0.0.13.1653: . 501578374:501579788(1414) ack 3272208389 win 46715 
0.001745000 10.0.0.116.3480 > 10.0.0.131.135: S 301444468:301444468(0) win 8760 
0.001752000 10.0.0.16.2871 > 10.0.0.17.2261: P 2121460342:2121461010(668) ack 1652492330 win 16150 
0.001768000 10.0.0.1.6699 > 10.0.0.13.1653: P 501579788:501580454(666) ack 3272208389 win 46715 
0.001773000 10.0.0.116.3477 > 10.0.0.132.135: S 301285447:301285447(0) win 8760 
0.001780000 10.0.0.116.3479 > 10.0.0.133.135: S 301381551:301381551(0) win 8760 
0.001788000 10.0.0.116.3478 > 10.0.0.134.135: S 301336095:301336095(0) win 8760 
0.001796000 10.0.0.116.3481 > 10.0.0.136.135: S 301498341:301498341(0) win 8760 
0.001800000 10.0.0.24.2752 > 10.0.0.23.8090: . ack 3416967213 win 63627 
0.001803000 10.0.0.104.1453 > 10.0.0.105.135: S 673612471:673612471(0) win 16384 
0.001822000 10.0.0.140.2213 > 10.0.0.141.135: S 2412547634:2412547634(0) win 16384 
0.001826000 10.0.0.24.2752 > 10.0.0.23.8090: . ack 3416969053 win 64860 
0.001830000 10.0.0.142.3807 > 10.0.0.143.135: S 1600194471:1600194471(0) win 64240 
0.001837000 10.0.0.16.2871 > 10.0.0.17.2261: . 2121461010:2121462390(1380) ack 1652492330 win 16150 
0.001856000 10.0.0.10.3568 > 10.0.0.20.3790: . 192295679:192297039(1360) ack 3045020009 win 17290 
0.001887000 10.0.0.148.1728 > 10.0.0.149.445: S 359551788:359551788(0) win 64240 
0.001888000 10.0.0.10.3568 > 10.0.0.20.3790: P 192297039:192297727(688) ack 3045020009 win 17290 
0.001894000 10.0.0.16.2871 > 10.0.0.17.2261: P 2121462390:2121463058(668) ack 1652492330 win 16150 
0.001908000 10.0.0.1.6699 > 10.0.0.2.55309: . ack 225051706 win 65423 
0.001915000 10.0.0.13.1653 > 10.0.0.1.6699: P 3272208381:3272208389(8) ack 501572134 win 32767 
0.001916000 10.0.0.1.6699 > 10.0.0.2.55309: . 3069540264:3069541724(1460) ack 225051706 win 65423 
0.001922000 10.0.0.116.3482 > 10.0.0.150.135: S 301559780:301559780(0) win 8760 
0.001930000 10.0.0.116.3484 > 10.0.0.151.135: S 301670724:301670724(0) win 8760 
0.001938000 10.0.0.116.3483 > 10.0.0.152.135: S 301622964:301622964(0) win 8760 
0.001945000 10.0.0.116.3485 > 10.0.0.153.135: S 301712320:301712320(0) win 8760 
0.001950000 10.0.0.1.6699 > 10.0.0.2.55309: P 3069541724:3069542344(620) ack 225051706 win 65423 
0.001953000 10.0.0.116.3486 > 10.0.0.154.135: S 301762584:301762584(0) win 8760 
0.001961000 10.0.0.155.2977 > 10.0.0.156.445: S 714604753:714604753(0) win 16384 
0.001968000 10.0.0.157.2873 > 10.0.0.158.445: S 3469213020:3469213020(0) win 44620 
0.001969000 10.0.0.10.3568 > 10.0.0.20.3790: . 192297727:192299087(1360) ack 3045020009 win 17290 
0.001998000 10.0.0.47.4687 > 10.0.0.1.6699: . ack 1054929050 win 16240 
0.002001000 10.0.0.10.3568 > 10.0.0.20.3790: P 192299087:192299775(688) ack 3045020009 win 17290 
0.002006000 10.0.0.23.8090 > 10.0.0.24.2752: P 3416967213:3416967673(460) ack 1214958873 win 57960 
0.002022000 10.0.0.116.3487 > 10.0.0.163.135: S 301814220:301814220(0) win 8760 
0.002029000 10.0.0.24.2752 > 10.0.0.23.8090: . ack 3416971813 win 64860 
0.002029000 10.0.0.116.3488 > 10.0.0.164.135: S 301851706:301851706(0) win 8760 
0.002037000 10.0.0.1.6699 > 10.0.0.13.1653: . 501580454:501581868(1414) ack 3272208389 win 46715 
0.002037000 10.0.0.116.3489 > 10.0.0.165.135: S 301907310:301907310(0) win 8760 
0.002053000 10.0.0.116.3490 > 10.0.0.166.135: S 301969400:301969400(0) win 8760 
0.002060000 10.0.0.23.8090 > 10.0.0.24.2752: . 3416967673:3416969053(1380) ack 1214958873 win 57960 
0.002070000 10.0.0.17.2261 > 10.0.0.16.2871: . ack 2121465106 win 16560 
0.002077000 10.0.0.1.6699 > 10.0.0.13.1653: P 501581868:501582534(666) ack 3272208389 win 46715 
0.002092000 10.0.0.23.8090 > 10.0.0.24.2752: . 3416969053:3416970433(1380) ack 1214958873 win 57960 
0.002098000 10.0.0.1.6699 > 10.0.0.2.55309: . 3069542344:3069543804(1460) ack 225051706 win 65423 
0.002124000 10.0.0.116.3491 > 10.0.0.167.135: S 302022433:302022433(0) win 8760 
0.002131000 10.0.0.1.6699 > 10.0.0.2.55309: P 3069543804:3069544424(620) ack 225051706 win 65423 
0.002132000 10.0.0.56.80 > 10.0.0.168.14122: S 354871794:354871794(0) ack 173080703 win 10767 
0.002147000 10.0.0.155.2604 > 10.0.0.156.445: S 706352595:706352595(0) win 16384 
0.002151000 10.0.0.1.6699 > 10.0.0.2.55309: . 3069544424:3069545884(1460) ack 225051706 win 65423 
0.002170000 10.0.0.20.3790 > 10.0.0.10.3568: . ack 192289535 win 32767 
0.002178000 10.0.0.110.2542 > 10.0.0.111.445: S 23093380:23093380(0) win 16384 
0.002184000 10.0.0.1.6699 > 10.0.0.2.55309: P 3069545884:3069546504(620) ack 225051706 win 65423 
0.002186000 10.0.0.169.4757 > 10.0.0.170.445: S 2900903613:2900903613(0) win 65280 
0.002193000 10.0.0.2.55309 > 10.0.0.1.6699: P 225051690:225051698(8) ack 3069533404 win 8760 
0.002201000 10.0.0.2.55309 > 10.0.0.1.6699: P 225051698:225051706(8) ack 3069535484 win 8760 
0.002204000 10.0.0.45.80 > 10.0.0.171.51332: S 1913859778:1913859778(0) ack 702755715 win 24616 
0.002209000 10.0.0.20.3790 > 10.0.0.10.3568: . ack 192291583 win 32767 
0.002212000 10.0.0.1.6699 > 10.0.0.2.55309: . 3069546504:3069547964(1460) ack 225051722 win 65407 
0.002216000 10.0.0.16.2871 > 10.0.0.17.2261: . 2121463058:2121464438(1380) ack 1652492330 win 16150 
0.002245000 10.0.0.1.6699 > 10.0.0.2.55309: P 3069547964:3069548584(620) ack 225051722 win 65407 
0.002248000 10.0.0.23.8090 > 10.0.0.24.2752: . 3416970433:3416971813(1380) ack 1214958873 win 57960 
0.002265000 10.0.0.45.80 > 10.0.0.171.51332: . ack 702755993 win 24338 
0.002272000 10.0.0.1.6699 > 10.0.0.13.1653: . ack 3272208413 win 46712 
0.002280000 10.0.0.1.6699 > 10.0.0.13.1653: . 501582534:501583948(1414) ack 3272208413 win 46712 
0.002281000 10.0.0.23.8090 > 10.0.0.24.2752: . 3416971813:3416973193(1380) ack 1214958873 win 57960 
0.002313000 10.0.0.172.4454 > 10.0.0.173.135: S 1897699644:1897699644(0) win 64240 
0.002313000 10.0.0.1.6699 > 10.0.0.13.1653: P 501583948:501584614(666) ack 3272208413 win 46712 
0.002320000 10.0.0.172.4455 > 10.0.0.173.135: S 1897745407:1897745407(0) win 64240 
0.002328000 10.0.0.16.2871 > 10.0.0.17.2261: P 2121464438:2121465106(668) ack 1652492330 win 16150 
0.002333000 10.0.0.1.6699 > 10.0.0.13.1653: . 501584614:501586028(1414) ack 3272208421 win 46711 
0.002348000 10.0.0.13.1653 > 10.0.0.1.6699: . ack 501574214 win 32767 
0.002356000 10.0.0.50.3362 > 10.0.0.1.6699: . ack 685298080 win 8140 
0.002364000 10.0.0.2.55309 > 10.0.0.1.6699: . ack 3069536104 win 8140 
0.002366000 10.0.0.1.6699 > 10.0.0.13.1653: P 501586028:501586694(666) ack 3272208421 win 46711 
0.002371000 10.0.0.13.1653 > 10.0.0.1.6699: P 3272208389:3272208397(8) ack 501575628 win 32767 
0.002379000 10.0.0.2.55309 > 10.0.0.1.6699: . ack 3069538184 win 8760 
0.002386000 10.0.0.45.80 > 10.0.0.171.51332: P 1913859779:1913860766(987) ack 702755993 win 24616 
0.002387000 10.0.0.2.55309 > 10.0.0.1.6699: . ack 3069538184 win 8760 
0.002394000 10.0.0.171.51332 > 10.0.0.45.80: S 702755714:702755714(0) win 5840 
0.002402000 10.0.0.2.55309 > 10.0.0.1.6699: P 225051706:225051722(16) ack 3069538184 win 8760 
0.002410000 10.0.0.2.55309 > 10.0.0.1.6699: . ack 3069540264 win 8760 
0.002412000 10.0.0.45.80 > 10.0.0.171.51332: F 1913860766:1913860766(0) ack 702755993 win 24616 
0.002419000 10.0.0.17.2261 > 10.0.0.16.2871: . ack 2121467154 win 16560 
0.002427000 10.0.0.45.80 > 10.0.0.171.51332: . ack 702755994 win 24616 
0.002435000 10.0.0.1.6699 > 10.0.0.13.1653: . 501586694:501588108(1414) ack 3272208429 win 46710 
0.002440000 10.0.0.172.4463 > 10.0.0.173.135: S 1898180275:1898180275(0) win 64240 
0.002448000 10.0.0.16.2871 > 10.0.0.17.2261: . 2121465106:2121466486(1380) ack 1652492330 win 16150 
0.002468000 10.0.0.1.6699 > 10.0.0.13.1653: P 501588108:501588774(666) ack 3272208429 win 46710 
0.002480000 10.0.0.172.4464 > 10.0.0.173.135: S 1898215623:1898215623(0) win 64240 
0.002488000 10.0.0.171.51332 > 10.0.0.45.80: . ack 1913859779 win 5840 
0.002488000 10.0.0.24.2752 > 10.0.0.23.8090: . ack 3416974573 win 64860 
0.002495000 10.0.0.171.51332 > 10.0.0.45.80: P 702755715:702755993(278) ack 1913859779 win 5840 
0.002496000 10.0.0.53.63582 > 10.0.0.175.25: S 1995487318:1995487318(0) win 24820 
0.002503000 10.0.0.176.1954 > 10.0.0.177.37: S 4258612409:4258612409(0) win 64240 
0.002509000 10.0.0.13.1653 > 10.0.0.1.6699: P 3272208397:3272208413(16) ack 501576294 win 32101 
0.002511000 10.0.0.17.2261 > 10.0.0.16.2871: . ack 2121469202 win 16560 
0.002517000 10.0.0.172.4466 > 10.0.0.173.135: S 1898304257:1898304257(0) win 64240 
0.002519000 10.0.0.1.6699 > 10.0.0.47.4687: . 1054929050:1054930510(1460) ack 1660358200 win 64799 
0.002524000 10.0.0.13.1653 > 10.0.0.1.6699: P 3272208413:3272208421(8) ack 501578374 win 32767 
0.002542000 10.0.0.16.2871 > 10.0.0.17.2261: P 2121466486:2121467154(668) ack 1652492330 win 16150 
0.002552000 10.0.0.10.3582 > 10.0.0.179.2032: . 377408117:377408118(1) ack 2267397583 win 16165 
0.002560000 10.0.0.1.6699 > 10.0.0.47.4687: P 1054930510:1054931130(620) ack 1660358200 win 64799 
0.002562000 10.0.0.128.3531 > 10.0.0.127.2617: . ack 1947323265 win 15276 
0.002570000 10.0.0.171.51332 > 10.0.0.45.80: . ack 1913859779 win 5840 
0.002578000 10.0.0.171.51332 > 10.0.0.45.80: . ack 1913860767 win 6909 
0.002579000 10.0.0.17.2257 > 10.0.0.40.1260: . 2855231496:2855232876(1380) ack 3057858504 win 16162 
0.002585000 10.0.0.171.51332 > 10.0.0.45.80: F 702755993:702755993(0) ack 1913860767 win 6909 
0.002593000 10.0.0.16.2871 > 10.0.0.17.2261: . 2121467154:2121468534(1380) ack 1652492330 win 16150 
0.002626000 10.0.0.17.2257 > 10.0.0.40.1260: . 2855232876:2855234256(1380) ack 3057858504 win 16162 
0.002641000 10.0.0.180.3719 > 10.0.0.181.445: S 3386539121:3386539121(0) win 16384 
0.002659000 10.0.0.13.1653 > 10.0.0.1.6699: P 3272208421:3272208429(8) ack 501580454 win 32767 
0.002661000 10.0.0.17.2261 > 10.0.0.16.2871: . ack 2121471250 win 16560 
0.002667000 10.0.0.23.8090 > 10.0.0.24.2752: . 3416973193:3416974573(1380) ack 1214958873 win 57960 
0.002668000 10.0.0.1.6699 > 10.0.0.182.2775: P 219948687:219950135(1448) ack 1008245739 win 46700 
0.002700000 10.0.0.183.3619 > 10.0.0.184.135: S 875162302:875162302(0) win 16384 
0.002703000 10.0.0.185.48831 > 10.0.0.186.6667: . ack 3976025151 win 63712 
0.002708000 10.0.0.187.2021 > 10.0.0.188.445: S 3222408242:3222408242(0) win 65280 
0.002715000 10.0.0.16.2871 > 10.0.0.17.2261: P 2121468534:2121469202(668) ack 1652492330 win 16150 
0.002729000 10.0.0.176.1954 > 10.0.0.177.37: . ack 255456326 win 64240 
0.002736000 10.0.0.183.3620 > 10.0.0.192.135: S 875227198:875227198(0) win 16384 
0.002737000 10.0.0.1.6699 > 10.0.0.13.1653: . 501588774:501590188(1414) ack 3272208429 win 46710 
0.002743000 10.0.0.47.4687 > 10.0.0.1.6699: P 1660358192:1660358200(8) ack 1054929050 win 16240 
0.002764000 10.0.0.183.3621 > 10.0.0.195.135: S 875278691:875278691(0) win 16384 
0.002769000 10.0.0.1.6699 > 10.0.0.13.1653: P 501590188:501590854(666) ack 3272208429 win 46710 
0.002772000 10.0.0.23.8090 > 10.0.0.24.2752: P 3416974573:3416975051(478) ack 1214958873 win 57960 
0.002789000 10.0.0.40.1260 > 10.0.0.17.2257: . ack 2855225976 win 16560 
0.002790000 10.0.0.196.22 > 10.0.0.197.65407: P 4101997354:4101997482(128) ack 1712763471 win 50400 
0.002797000 10.0.0.183.3622 > 10.0.0.198.135: S 875329466:875329466(0) win 16384 
0.002800000 10.0.0.17.2261 > 10.0.0.16.2871: . ack 2121473298 win 16560 
0.002804000 10.0.0.183.3623 > 10.0.0.199.135: S 875387880:875387880(0) win 16384 
0.002808000 10.0.0.10.3568 > 10.0.0.20.3790: . 192299775:192301135(1360) ack 3045020009 win 17290 
0.002821000 10.0.0.183.3624 > 10.0.0.200.135: S 875447609:875447609(0) win 16384 
0.002829000 10.0.0.183.3625 > 10.0.0.201.135: S 875504090:875504090(0) win 16384 
0.002840000 10.0.0.10.3568 > 10.0.0.20.3790: P 192301135:192301823(688) ack 3045020009 win 17290 
0.002848000 10.0.0.16.2871 > 10.0.0.17.2261: . 2121469202:2121470582(1380) ack 1652492330 win 16150 
0.002860000 10.0.0.24.2752 > 10.0.0.23.8090: . ack 3416976431 win 64860 
0.002868000 10.0.0.1.6699 > 10.0.0.13.1653: . ack 3272208445 win 46708 
0.002875000 10.0.0.1.6699 > 10.0.0.13.1653: . 501590854:501592268(1414) ack 3272208445 win 46708 
0.002880000 10.0.0.183.3626 > 10.0.0.203.135: S 875554444:875554444(0) win 16384 
0.002888000 10.0.0.204.80 > 10.0.0.205.33537: R 0:0(0) ack 28960 win 0 
0.002895000 10.0.0.183.3628 > 10.0.0.206.135: S 875657592:875657592(0) win 16384 
0.002903000 10.0.0.183.3627 > 10.0.0.207.135: S 875596067:875596067(0) win 16384 
0.002908000 10.0.0.1.6699 > 10.0.0.13.1653: P 501592268:501592934(666) ack 3272208445 win 46708 
0.002911000 10.0.0.183.3629 > 10.0.0.208.135: S 875712166:875712166(0) win 16384 
0.002918000 10.0.0.16.2871 > 10.0.0.17.2261: P 2121470582:2121471250(668) ack 1652492330 win 16150 
0.002928000 10.0.0.10.3568 > 10.0.0.20.3790: . 192301823:192303183(1360) ack 3045020009 win 17290 
0.002939000 10.0.0.183.3630 > 10.0.0.209.135: S 875747404:875747404(0) win 16384 
0.002946000 10.0.0.186.6667 > 10.0.0.185.48831: P 3976025091:3976025151(60) ack 515809825 win 17376 
0.002956000 10.0.0.183.3631 > 10.0.0.210.135: S 875806606:875806606(0) win 16384 
0.002961000 10.0.0.10.3568 > 10.0.0.20.3790: P 192303183:192303871(688) ack 3045020009 win 17290 
0.002963000 10.0.0.211.1067 > 10.0.0.212.445: S 2896721961:2896721961(0) win 65535 
0.002980000 10.0.0.215.2220 > 10.0.0.216.445: S 85144768:85144768(0) win 64240 
0.002988000 10.0.0.183.3632 > 10.0.0.217.135: S 875871464:875871464(0) win 16384 
0.002996000 10.0.0.183.3633 > 10.0.0.218.135: S 875905788:875905788(0) win 16384 
0.003003000 10.0.0.47.4687 > 10.0.0.1.6699: . ack 1054931130 win 14160 
0.003011000 10.0.0.183.3634 > 10.0.0.219.135: S 875960126:875960126(0) win 16384 
0.003019000 10.0.0.220.3518 > 10.0.0.221.135: S 1746785740:1746785740(0) win 16384 
0.003026000 10.0.0.222.3732 > 10.0.0.223.445: S 1588427688:1588427688(0) win 16384 
0.003034000 10.0.0.183.3635 > 10.0.0.224.135: S 876014675:876014675(0) win 16384 
0.003042000 10.0.0.225.1972 > 10.0.0.226.445: S 136005640:136005640(0) win 65280 
0.003049000 10.0.0.183.3636 > 10.0.0.227.135: S 876047674:876047674(0) win 16384 
0.003057000 10.0.0.183.3637 > 10.0.0.228.135: S 876111434:876111434(0) win 16384 
0.003065000 10.0.0.229.3115 > 10.0.0.230.135: S 2665371348:2665371348(0) win 16384 
0.003072000 10.0.0.183.3638 > 10.0.0.231.135: S 876170854:876170854(0) win 16384 
0.003080000 10.0.0.30.4924 > 10.0.0.1.6699: P 3435896764:3435896780(16) ack 3803402313 win 17280 
0.003088000 10.0.0.88.3262 > 10.0.0.89.443: . ack 962507021 win 8760 
0.003096000 10.0.0.232.1731 > 10.0.0.233.445: S 2596390052:2596390052(0) win 64240 
0.003103000 10.0.0.13.1653 > 10.0.0.1.6699: . ack 501582534 win 32767 
0.003111000 10.0.0.177.37 > 10.0.0.176.1954: S 255456325:255456325(0) ack 4258612410 win 5840 
0.003119000 10.0.0.234.4056 > 10.0.0.235.445: S 4127383408:4127383408(0) win 60352 
0.003126000 10.0.0.16.2871 > 10.0.0.17.2261: . 2121471250:2121472630(1380) ack 1652492330 win 16150 
0.003158000 10.0.0.13.1653 > 10.0.0.1.6699: P 3272208429:3272208437(8) ack 501582534 win 32767 
0.003166000 10.0.0.179.2032 > 10.0.0.10.3582: . ack 377408117 win 0 
0.003174000 10.0.0.16.2871 > 10.0.0.17.2261: P 2121472630:2121473298(668) ack 1652492330 win 16150 
0.003194000 10.0.0.20.3790 > 10.0.0.10.3568: . ack 192293631 win 32767 
0.003202000 10.0.0.23.8090 > 10.0.0.24.2752: . 3416975051:3416976431(1380) ack 1214958873 win 57960 
0.003234000 10.0.0.23.8090 > 10.0.0.24.2752: . 3416976431:3416977811(1380) ack 1214958873 win 57960 
0.003266000 10.0.0.13.1653 > 10.0.0.1.6699: P 3272208437:3272208445(8) ack 501584614 win 32767 
0.003273000 10.0.0.20.3790 > 10.0.0.10.3568: . ack 192295679 win 32767 
0.003281000 10.0.0.13.1653 > 10.0.0.1.6699: P 3272208445:3272208453(8) ack 501586694 win 32767 
0.003289000 10.0.0.2.55309 > 10.0.0.1.6699: P 225051722:225051730(8) ack 3069540264 win 8760 
0.003296000 10.0.0.2.55309 > 10.0.0.1.6699: . ack 3069542344 win 8760 
0.003304000 10.0.0.197.65407 > 10.0.0.196.22: P 1712763471:1712763519(48) ack 4101997482 win 16648 
0.003346000 10.0.0.23.8090 > 10.0.0.24.2752: . 3416977811:3416979191(1380) ack 1214958873 win 57960 
0.003378000 10.0.0.23.8090 > 10.0.0.24.2752: . 3416979191:3416980571(1380) ack 1214958873 win 57960 
0.003411000 10.0.0.238.4385 > 10.0.0.239.135: S 3025175843:3025175843(0) win 32000 
0.003418000 10.0.0.50.3362 > 10.0.0.1.6699: P 4272166856:4272166864(8) ack 685299540 win 8760 
0.003426000 10.0.0.177.37 > 10.0.0.176.1954: P 255456326:255456330(4) ack 4258612410 win 5840 
0.003434000 10.0.0.197.65407 > 10.0.0.196.22: P 1712763519:1712763567(48) ack 4101997578 win 16552 
0.003443000 10.0.0.177.37 > 10.0.0.176.1954: F 255456330:255456330(0) ack 4258612410 win 5840 
0.003474000 10.0.0.244.3076 > 10.0.0.245.445: S 1282783426:1282783426(0) win 16384 
0.003482000 10.0.0.246.4203 > 10.0.0.247.445: S 3300237388:3300237388(0) win 64240 
0.003504000 10.0.0.2.55309 > 10.0.0.1.6699: P 225051730:225051738(8) ack 3069543804 win 8760 
0.003521000 10.0.0.2.55309 > 10.0.0.1.6699: P 225051738:225051746(8) ack 3069545884 win 8760 
0.003529000 10.0.0.2.55309 > 10.0.0.1.6699: P 225051746:225051754(8) ack 3069547964 win 8760 
0.003537000 10.0.0.16.2871 > 10.0.0.17.2261: . 2121473298:2121474678(1380) ack 1652492330 win 16150 
0.003582000 10.0.0.180.4988 > 10.0.0.253.445: S 3330091497:3330091497(0) win 16384 
0.003590000 10.0.0.254.41325 > 10.0.0.255.41010: R 0:0(0) ack 1672977576 win 0 
0.003597000 10.0.1.0.3867 > 10.0.1.1.445: S 2219091903:2219091903(0) win 16384 
0.003605000 10.0.0.197.65407 > 10.0.0.196.22: P 1712763567:1712763615(48) ack 4101997674 win 16456 
0.003628000 10.0.0.16.2871 > 10.0.0.17.2261: P 2121474678:2121475346(668) ack 1652492330 win 16150 
0.003648000 10.0.1.2.1332 > 10.0.1.3.135: S 3013224215:3013224215(0) win 64240 
0.003656000 10.0.1.2.1333 > 10.0.1.3.135: S 3013266036:3013266036(0) win 64240 
0.003664000 10.0.1.2.1334 > 10.0.1.3.135: S 3013300491:3013300491(0) win 64240 
0.003671000 10.0.1.4.3327 > 10.0.1.5.445: S 267037389:267037389(0) win 16384 
0.003693000 10.0.1.8.4087 > 10.0.1.9.135: S 2902875560:2902875560(0) win 16384 
0.003701000 10.0.0.16.2871 > 10.0.0.17.2261: . 2121475346:2121476726(1380) ack 1652492330 win 16150 
0.003733000 10.0.1.10.3093 > 10.0.1.11.445: S 590572113:590572113(0) win 16384 
0.003741000 10.0.1.12.6668 > 10.0.0.185.58057: P 3821389791:3821389838(47) ack 4137702534 win 8192 
0.003750000 10.0.0.197.65407 > 10.0.0.196.22: P 1712763615:1712763663(48) ack 4101998010 win 17640 
0.003760000 10.0.0.16.2871 > 10.0.0.17.2261: P 2121476726:2121477394(668) ack 1652492330 win 16150 
0.003780000 10.0.1.10.3062 > 10.0.1.11.445: S 589152310:589152310(0) win 16384 
0.003788000 10.0.0.177.37 > 10.0.0.176.1954: . ack 4258612411 win 5840 
0.003795000 10.0.0.155.3109 > 10.0.0.156.445: S 715940403:715940403(0) win 16384 
0.003803000 10.0.0.229.2246 > 10.0.1.13.445: S 2634592526:2634592526(0) win 16384 
0.003811000 10.0.0.16.2871 > 10.0.0.17.2261: . 2121477394:2121478774(1380) ack 1652492330 win 16150 
0.003843000 10.0.0.23.8090 > 10.0.0.24.2752: . 3416980571:3416981951(1380) ack 1214958873 win 57960 
0.003875000 10.0.0.16.2871 > 10.0.0.17.2261: P 2121478774:2121479442(668) ack 1652492330 win 16150 
0.003905000 10.0.0.11.3982 > 10.0.0.73.135: S 1363215305:1363215305(0) win 16384 
0.003913000 10.0.1.14.3531 > 10.0.1.15.1395: P 1634213844:1634213845(1) ack 3676539951 win 63927 
0.003921000 10.0.0.13.1653 > 10.0.0.1.6699: . ack 501588108 win 32767 
0.003928000 10.0.0.13.1653 > 10.0.0.1.6699: P 3272208453:3272208461(8) ack 501588774 win 32101 
0.003936000 10.0.0.88.3262 > 10.0.0.89.443: . ack 962507021 win 8760 
0.003944000 10.0.0.23.8090 > 10.0.0.24.2752: P 3416981951:3416982093(142) ack 1214958873 win 57960 
0.003955000 10.0.1.16.1840 > 10.0.1.17.139: S 1686095675:1686095675(0) win 8192 
0.003962000 10.0.0.197.65407 > 10.0.0.196.22: P 1712763663:1712763711(48) ack 4101998618 win 17032 
0.003972000 10.0.1.18.6667 > 10.0.0.185.59294: P 5462601:5462645(44) ack 33687945 win 57920 
0.003981000 10.0.0.47.4687 > 10.0.0.1.6699: P 1660358200:1660358208(8) ack 1054931130 win 14160 
0.003989000 10.0.0.13.1653 > 10.0.0.1.6699: . ack 501590854 win 32767 
0.004015000 10.0.1.19.1109 > 10.0.1.20.135: S 600535963:600535963(0) win 16384 
0.004023000 10.0.0.13.1653 > 10.0.0.1.6699: P 3272208461:3272208469(8) ack 501590854 win 32767 
0.004030000 10.0.0.13.1653 > 10.0.0.1.6699: P 3272208469:3272208477(8) ack 501592934 win 32767 
0.004038000 10.0.0.2.55309 > 10.0.0.1.6699: . ack 3069548584 win 8140 
0.004055000 10.0.0.16.2871 > 10.0.0.17.2261: . 2121479442:2121480822(1380) ack 1652492330 win 16150 
0.004985000 10.0.1.23.1607 > 10.0.1.24.135: S 1112429885:1112429885(0) win 8760 
0.015241000 10.0.1.25.1252 > 10.0.1.26.135: S 1518692366:1518692366(0) win 64240 
0.023432000 10.0.0.16.2871 > 10.0.0.17.2261: . 2121481490:2121482870(1380) ack 1652492330 win 16150 
0.024743000 10.0.1.27.3025 > 10.0.1.28.135: S 1289583035:1289583035(0) win 64512 
0.027109000 10.0.1.23.1608 > 10.0.1.29.135: S 1112490420:1112490420(0) win 8760 
0.031336000 10.0.1.27.3026 > 10.0.1.30.135: S 1289637615:1289637615(0) win 64512 
0.031706000 10.0.0.47.4687 > 10.0.0.1.6699: . ack 1054933210 win 15840 
0.037050000 10.0.0.13.1653 > 10.0.0.1.6699: P 3272208485:3272208493(8) ack 501597094 win 32767 
0.037148000 10.0.0.89.443 > 10.0.0.88.3262: . ack 1415570205 win 24820 
0.037935000 10.0.0.47.4687 > 10.0.0.1.6699: P 1660358208:1660358216(8) ack 1054933210 win 15840 
0.038031000 10.0.1.27.3027 > 10.0.1.31.135: S 1289702694:1289702694(0) win 64512 
0.039957000 10.0.1.32.6112 > 10.0.1.33.1057: . ack 2437129322 win 65175 
0.040792000 10.0.0.40.1260 > 10.0.0.17.2257: . ack 2855225976 win 16560 
0.042872000 10.0.0.16.2871 > 10.0.0.17.2261: P 2121482870:2121483538(668) ack 1652492330 win 16150 
0.044367000 10.0.1.27.3028 > 10.0.1.36.135: S 1289741274:1289741274(0) win 64512 
0.048618000 10.0.1.37.4955 > 10.0.1.38.445: S 1730608083:1730608083(0) win 16384 
0.050636000 10.0.1.27.3029 > 10.0.1.39.135: S 1289790039:1289790039(0) win 64512 
0.056714000 10.0.0.1.6699 > 10.0.0.2.55309: . ack 225051794 win 65335 
0.057339000 10.0.0.50.3362 > 10.0.0.1.6699: . ack 685300160 win 8140 
0.057348000 10.0.1.27.3030 > 10.0.1.40.135: S 1289854174:1289854174(0) win 64512 
0.058658000 10.0.0.1.6699 > 10.0.0.2.55309: . 3069563144:3069564604(1460) ack 225051794 win 65335 
0.058975000 10.0.0.1.6699 > 10.0.0.2.55309: P 3069564604:3069565224(620) ack 225051794 win 65335 
0.060578000 10.0.0.1.6699 > 10.0.0.2.55309: . 3069565224:3069566684(1460) ack 225051794 win 65335 
0.062106000 10.0.0.1.6699 > 10.0.0.2.55309: P 3069566684:3069567304(620) ack 225051802 win 65327 
0.063684000 10.0.0.1.6699 > 10.0.0.2.55309: . 3069567304:3069568764(1460) ack 225051802 win 65327 
0.064218000 10.0.0.1.6699 > 10.0.0.2.55309: P 3069568764:3069569384(620) ack 225051802 win 65327 
0.064674000 10.0.0.197.65407 > 10.0.0.196.22: . ack 4101999130 win 16520 
0.066513000 10.0.0.1.6699 > 10.0.0.50.3362: . 685306400:685307860(1460) ack 4272166872 win 64207 
0.066604000 10.0.0.1.6699 > 10.0.0.50.3362: P 685307860:685308480(620) ack 4272166872 win 64207 
0.066681000 10.0.1.27.3031 > 10.0.1.41.135: S 1289898060:1289898060(0) win 64512 
0.068299000 10.0.0.1.6699 > 10.0.0.2.55309: . 3069569384:3069570844(1460) ack 225051810 win 65319 
0.068393000 10.0.0.1.6699 > 10.0.0.2.55309: P 3069570844:3069571464(620) ack 225051810 win 65319 
0.068532000 10.0.1.42.2371 > 10.0.1.43.445: S 3519194919:3519194919(0) win 16384 
0.068998000 10.0.0.13.1653 > 10.0.0.1.6699: . ack 501599174 win 32767 
0.069742000 10.0.0.17.2261 > 10.0.0.16.2871: . ack 2121489682 win 16560 
0.070299000 10.0.1.27.3032 > 10.0.1.44.135: S 1289944839:1289944839(0) win 64512 
0.070307000 10.0.0.196.22 > 10.0.0.197.65407: P 4102001050:4102001930(880) ack 1712763807 win 50400 
0.070854000 10.0.1.45.4387 > 10.0.1.46.445: S 1859872040:1859872040(0) win 65535 
0.072261000 10.0.0.23.8090 > 10.0.0.24.2752: . 3416986819:3416988199(1380) ack 1214958873 win 57960 
0.075632000 10.0.0.99.3126 > 10.0.1.47.135: S 3918319467:3918319467(0) win 64512 
0.075712000 10.0.0.99.3133 > 10.0.1.47.135: S 3918556217:3918556217(0) win 64512 
0.075950000 10.0.1.45.4388 > 10.0.1.46.445: S 1859910559:1859910559(0) win 65535 
0.077160000 10.0.1.27.3033 > 10.0.1.48.135: S 1289982757:1289982757(0) win 64512 
0.083668000 10.0.1.27.3034 > 10.0.1.49.135: S 1290033006:1290033006(0) win 64512 
0.083914000 10.0.0.37.42812 > 10.0.0.38.113: R 4294352887:4294352887(0) win 24820 
0.086995000 10.0.0.40.1260 > 10.0.0.17.2257: . ack 2855225976 win 16560 
0.088041000 10.0.0.23.8090 > 10.0.0.24.2752: P 3416988199:3416989158(959) ack 1214958873 win 57960 
0.089181000 10.0.0.20.3790 > 10.0.0.10.3568: . ack 192301823 win 32767 
0.090072000 10.0.1.27.3035 > 10.0.1.50.135: S 1290074468:1290074468(0) win 64512 
0.091018000 10.0.1.51.1640 > 10.0.1.52.135: S 3157128831:3157128831(0) win 16384 
0.094789000 10.0.0.104.4183 > 10.0.0.105.135: S 641447795:641447795(0) win 16384 
0.095020000 10.0.1.51.1643 > 10.0.1.52.135: S 3157182236:3157182236(0) win 16384 
0.097060000 10.0.1.27.3036 > 10.0.1.53.135: S 1290107768:1290107768(0) win 64512 
0.097657000 10.0.1.54.2362 > 10.0.1.55.135: S 2169137524:2169137524(0) win 46080 
0.102747000 10.0.0.17.2257 > 10.0.0.40.1260: . 2855225976:2855227356(1380) ack 3057858504 win 16162 
0.103698000 10.0.0.37.25 > 10.0.1.58.53039: . ack 44240063 win 24616 
0.103897000 10.0.1.59.80 > 10.0.1.60.56585: R 0:0(0) ack 959383346 win 0 
0.104120000 10.0.0.47.4687 > 10.0.0.1.6699: . ack 1054935290 win 13760 
0.106011000 10.0.1.42.2358 > 10.0.1.43.445: S 3518613997:3518613997(0) win 16384 
0.106286000 10.0.1.27.3037 > 10.0.1.61.135: S 1290163518:1290163518(0) win 64512 
0.108725000 10.0.0.30.4924 > 10.0.0.1.6699: . ack 3803408233 win 16640 
0.112691000 10.0.1.27.3038 > 10.0.1.63.135: S 1290225003:1290225003(0) win 64512 
0.113823000 10.0.0.13.1653 > 10.0.0.1.6699: P 3272208493:3272208501(8) ack 501601254 win 32767 
0.117082000 10.0.0.197.65407 > 10.0.0.196.22: P 1712763711:1712763759(48) ack 4102000042 win 17640 
0.119311000 10.0.1.27.3039 > 10.0.1.64.135: S 1290282824:1290282824(0) win 64512 
0.120430000 10.0.0.53.25 > 10.0.1.65.34363: S 1907307467:1907307467(0) ack 86586748 win 24616 
0.121669000 10.0.0.45.80 > 10.0.0.171.51356: S 1914311330:1914311330(0) ack 698843998 win 24616 
0.122636000 10.0.0.196.22 > 10.0.0.197.65407: P 4102001930:4102002522(592) ack 1712763855 win 50400 
0.129039000 10.0.1.27.3040 > 10.0.1.68.135: S 1290325340:1290325340(0) win 64512 
0.131127000 10.0.0.37.25 > 10.0.0.38.15208: P 4294097518:4294097617(99) ack 1940722525 win 24820 
0.132561000 10.0.1.27.3041 > 10.0.1.69.135: S 1290363886:1290363886(0) win 64512 
0.134393000 10.0.0.24.2752 > 10.0.0.23.8090: . ack 3416991771 win 64755 
0.135035000 10.0.0.13.1653 > 10.0.0.1.6699: . ack 501603334 win 32767 
0.140179000 10.0.1.70.3847 > 10.0.1.71.5555: . ack 3194150773 win 16534 
0.142241000 10.0.1.27.3042 > 10.0.1.72.135: S 1290436224:1290436224(0) win 64512 
0.142739000 10.0.0.45.80 > 10.0.0.171.51356: . ack 698844276 win 24338 
0.148101000 10.0.0.1.6699 > 10.0.0.47.4687: . 1054935290:1054936750(1460) ack 1660358224 win 64775 
0.148194000 10.0.0.1.6699 > 10.0.0.47.4687: P 1054936750:1054937370(620) ack 1660358224 win 64775 
0.148234000 10.0.1.27.3043 > 10.0.1.73.135: S 1290470142:1290470142(0) win 64512 
0.148491000 10.0.0.20.3790 > 10.0.0.10.3568: . ack 192303871 win 32767 
0.150045000 10.0.1.75.49267 > 10.0.1.76.5190: P 23646984:23646990(6) ack 2551361790 win 65535 
0.155295000 10.0.1.27.3044 > 10.0.1.77.135: S 1290503500:1290503500(0) win 64512 
0.155615000 10.0.0.45.80 > 10.0.0.171.51356: P 1914311331:1914312318(987) ack 698844276 win 24616 
0.155680000 10.0.0.45.80 > 10.0.0.171.51356: F 1914312318:1914312318(0) ack 698844276 win 24616 
0.161498000 10.0.0.16.2871 > 10.0.0.17.2261: . 2121483538:2121484918(1380) ack 1652492330 win 16150 
0.165426000 10.0.0.197.65407 > 10.0.0.196.22: P 1712763759:1712763807(48) ack 4102000618 win 17064 
0.169743000 10.0.1.58.53039 > 10.0.0.37.25: . ack 4293722345 win 5741 
0.172844000 10.0.0.37.25 > 10.0.1.58.53039: P 4293722561:4293722610(49) ack 44240063 win 24616 
0.173455000 10.0.1.23.1609 > 10.0.1.78.135: S 1112540481:1112540481(0) win 8760 
0.173492000 10.0.0.196.22 > 10.0.0.197.65407: P 4102002522:4102002954(432) ack 1712763903 win 50400 
0.176785000 10.0.0.45.80 > 10.0.0.171.51356: . ack 698844277 win 24616 
0.177478000 10.0.0.16.2871 > 10.0.0.17.2261: P 2121484918:2121485586(668) ack 1652492330 win 16150 
0.180494000 10.0.1.23.1611 > 10.0.1.79.135: S 1112636096:1112636096(0) win 8760 
0.180611000 10.0.1.23.1612 > 10.0.1.80.135: S 1112671438:1112671438(0) win 8760 
0.181074000 10.0.1.23.1613 > 10.0.1.81.135: S 1112722950:1112722950(0) win 8760 
0.181224000 10.0.1.23.1610 > 10.0.1.82.135: S 1112589708:1112589708(0) win 8760 
0.184247000 10.0.1.83.63669 > 10.0.1.84.135: S 889218782:889218782(0) win 64240 
0.186207000 10.0.1.85.1584 > 10.0.1.86.135: S 141665266:141665266(0) win 16384 
0.187148000 10.0.1.71.5555 > 10.0.1.70.3847: P 3194147987:3194149367(1380) ack 794563950 win 31740 
0.187581000 10.0.0.11.3028 > 10.0.0.73.445: S 1415391341:1415391341(0) win 16384 
0.187973000 10.0.1.23.1614 > 10.0.1.87.135: S 1112777619:1112777619(0) win 8760 
0.191147000 10.0.1.58.53039 > 10.0.0.37.25: P 44240003:44240027(24) ack 4293722345 win 5741 
0.191311000 10.0.1.88.1119 > 10.0.1.89.135: S 1709085022:1709085022(0) win 64512 
0.194693000 10.0.1.71.5555 > 10.0.1.70.3847: P 3194149367:3194150747(1380) ack 794563950 win 31740 
0.194832000 10.0.0.37.25 > 10.0.0.38.15208: . ack 1940722550 win 24820 
0.195504000 10.0.0.37.25 > 10.0.0.38.15208: P 4294097617:4294097690(73) ack 1940722550 win 24820 
0.196034000 10.0.1.92.4030 > 10.0.1.93.445: S 2150323652:2150323652(0) win 16384 
0.198451000 10.0.0.155.2117 > 10.0.0.156.445: S 694706256:694706256(0) win 16384 
0.199981000 10.0.0.10.3568 > 10.0.0.20.3790: . 192312063:192313423(1360) ack 3045020009 win 17290 
0.200067000 10.0.0.10.3568 > 10.0.0.20.3790: P 192313423:192314111(688) ack 3045020009 win 17290 
0.200654000 10.0.0.17.2261 > 10.0.0.16.2871: . ack 2121491062 win 16560 
0.203265000 10.0.0.66.2711 > 10.0.0.67.445: S 3882059609:3882059609(0) win 64240 
0.203910000 10.0.0.10.3568 > 10.0.0.20.3790: . 192314111:192315471(1360) ack 3045020009 win 17290 
0.203996000 10.0.0.10.3568 > 10.0.0.20.3790: P 192315471:192316159(688) ack 3045020009 win 17290 
0.206472000 10.0.0.66.2712 > 10.0.0.67.445: S 3882097945:3882097945(0) win 64240 
0.209198000 10.0.1.23.1615 > 10.0.1.98.135: S 1112810725:1112810725(0) win 8760 
0.209809000 10.0.0.66.2716 > 10.0.0.67.445: S 3882145199:3882145199(0) win 64240 
0.210654000 10.0.0.16.2871 > 10.0.0.17.2261: . 2121485586:2121486966(1380) ack 1652492330 win 16150 
0.214714000 10.0.0.11.3086 > 10.0.0.12.445: S 1415587289:1415587289(0) win 16384 
0.215277000 10.0.1.23.1617 > 10.0.1.99.135: S 1112901981:1112901981(0) win 8760 
0.216492000 10.0.1.23.1616 > 10.0.1.100.135: S 1112867835:1112867835(0) win 8760 
0.222134000 10.0.1.23.1619 > 10.0.1.101.135: S 1113021734:1113021734(0) win 8760 
0.222832000 10.0.1.23.1618 > 10.0.1.102.135: S 1112973848:1112973848(0) win 8760 
0.223767000 10.0.0.16.2871 > 10.0.0.17.2261: P 2121486966:2121487634(668) ack 1652492330 win 16150 
0.231541000 10.0.1.105.4557 > 10.0.1.106.3531: P 1414426605:1414426606(1) ack 2111693051 win 15698 
0.234043000 10.0.1.107.4207 > 10.0.1.108.445: S 2494951399:2494951399(0) win 65280 
0.235336000 10.0.1.109.57778 > 10.0.1.110.25: S 1885137306:1885137306(0) win 8760 
0.235834000 10.0.0.234.2514 > 10.0.0.235.445: S 4087352333:4087352333(0) win 60352 
0.239338000 10.0.0.24.2752 > 10.0.0.23.8090: . ack 3416994531 win 64860 
0.244821000 10.0.0.23.8090 > 10.0.0.24.2752: P 3416989158:3416990286(1128) ack 1214958873 win 57960 
0.245068000 10.0.0.2.55309 > 10.0.0.1.6699: P 225051778:225051786(8) ack 3069556284 win 8760 
0.246256000 10.0.1.42.2600 > 10.0.1.111.445: S 3522306800:3522306800(0) win 16384 
0.247824000 10.0.0.1.6699 > 10.0.0.13.1653: . ack 3272208517 win 46699 
0.249638000 10.0.0.1.6699 > 10.0.0.13.1653: . 501611654:501613068(1414) ack 3272208517 win 46699 
0.249729000 10.0.0.1.6699 > 10.0.0.13.1653: P 501613068:501613734(666) ack 3272208517 win 46699 
0.250546000 10.0.1.23.1620 > 10.0.1.112.135: S 1113067398:1113067398(0) win 8760 
0.257018000 10.0.1.71.5555 > 10.0.1.70.3847: P 3194150747:3194150773(26) ack 794563950 win 31740 
0.257088000 10.0.0.24.2752 > 10.0.0.23.8090: . ack 3416997291 win 64860 
0.259885000 10.0.0.1.6699 > 10.0.0.13.1653: . 501613734:501615148(1414) ack 3272208517 win 46699 
0.259975000 10.0.0.1.6699 > 10.0.0.13.1653: P 501615148:501615814(666) ack 3272208517 win 46699 
0.265463000 10.0.1.23.1622 > 10.0.1.113.135: S 1113170675:1113170675(0) win 8760 
0.267275000 10.0.0.155.2121 > 10.0.0.156.445: S 694950141:694950141(0) win 16384 
0.271738000 10.0.1.23.1623 > 10.0.1.114.135: S 1113234115:1113234115(0) win 8760 
0.271961000 10.0.1.23.1621 > 10.0.1.116.135: S 1113106722:1113106722(0) win 8760 
0.272630000 10.0.0.155.2120 > 10.0.0.156.445: S 694893162:694893162(0) win 16384 
0.278698000 10.0.0.37.25 > 10.0.0.38.15208: P 4294097690:4294097760(70) ack 1940722607 win 24820 
0.279316000 10.0.1.23.1624 > 10.0.1.119.135: S 1113283739:1113283739(0) win 8760 
0.282503000 10.0.0.17.2261 > 10.0.0.16.2871: . ack 2121493110 win 16560 
0.284990000 10.0.1.23.1626 > 10.0.1.120.135: S 1113371775:1113371775(0) win 8760 
0.285610000 10.0.1.23.1625 > 10.0.1.121.135: S 1113327711:1113327711(0) win 8760 
0.288571000 10.0.0.17.2257 > 10.0.0.40.1260: . 2855227356:2855228736(1380) ack 3057858504 win 16162 
0.289925000 10.0.0.1.6699 > 10.0.0.13.1653: . ack 3272208533 win 46697 
0.291713000 10.0.0.23.8090 > 10.0.0.24.2752: . 3416990286:3416991666(1380) ack 1214958873 win 57960 
0.291739000 10.0.0.1.6699 > 10.0.0.13.1653: . 501615814:501617228(1414) ack 3272208533 win 46697 
0.291829000 10.0.0.1.6699 > 10.0.0.13.1653: P 501617228:501617894(666) ack 3272208533 win 46697 
0.293933000 10.0.0.37.25 > 10.0.1.58.53039: P 4293722610:4293722656(46) ack 44240091 win 24616 
0.295014000 10.0.1.58.53039 > 10.0.0.37.25: . ack 4293722561 win 5525 
0.298009000 10.0.1.71.5555 > 10.0.1.70.3847: . ack 794563962 win 31740 
0.302987000 10.0.1.126.33234 > 10.0.1.127.5190: . ack 598608383 win 6432 
0.304356000 10.0.0.155.2124 > 10.0.0.156.445: S 695149799:695149799(0) win 16384 
0.305401000 10.0.1.58.53039 > 10.0.0.37.25: P 44240027:44240063(36) ack 4293722561 win 5525 
0.307530000 10.0.0.88.3262 > 10.0.0.89.443: . ack 962509425 win 8760 
0.307781000 10.0.0.23.8090 > 10.0.0.24.2752: P 3416991666:3416991771(105) ack 1214958873 win 57960 
0.321984000 10.0.1.130.42061 > 10.0.1.131.8080: S 241237629:241237629(0) win 5840 
0.335543000 10.0.0.88.3262 > 10.0.0.89.443: F 1415570204:1415570204(0) ack 962509425 win 8760 
0.341697000 10.0.0.17.2257 > 10.0.0.40.1260: . 2855228736:2855230116(1380) ack 3057858504 win 16162 
0.342660000 10.0.1.132.3157 > 10.0.1.133.445: S 1625239538:1625239538(0) win 16384 
0.343773000 10.0.0.66.2733 > 10.0.0.67.445: S 3882632890:3882632890(0) win 64240 
0.349987000 10.0.0.10.3568 > 10.0.0.20.3790: . 192316159:192317519(1360) ack 3045020009 win 17290 
0.350073000 10.0.0.10.3568 > 10.0.0.20.3790: P 192317519:192318207(688) ack 3045020009 win 17290 
0.350117000 10.0.0.37.25 > 10.0.0.38.15208: P 4294097760:4294097806(46) ack 1940722635 win 24820 
0.354083000 10.0.0.10.3568 > 10.0.0.20.3790: . 192318207:192319567(1360) ack 3045020009 win 17290 
0.354169000 10.0.0.10.3568 > 10.0.0.20.3790: P 192319567:192320255(688) ack 3045020009 win 17290 
0.354937000 10.0.0.2.55309 > 10.0.0.1.6699: P 225051786:225051794(8) ack 3069558364 win 8760 
0.356444000 10.0.0.2.55309 > 10.0.0.1.6699: . ack 3069558984 win 8140 
0.357294000 10.0.0.16.2871 > 10.0.0.17.2261: . 2121487634:2121489014(1380) ack 1652492330 win 16150 
0.358161000 10.0.0.2.55309 > 10.0.0.1.6699: P 225051794:225051802(8) ack 3069558984 win 8140 
0.358925000 10.0.1.70.3847 > 10.0.1.71.5555: . ack 3194152153 win 16560 
0.359673000 10.0.0.2.55309 > 10.0.0.1.6699: . ack 3069561064 win 8760 
0.360240000 10.0.0.66.2740 > 10.0.0.67.445: S 3882850317:3882850317(0) win 64240 
0.361107000 10.0.0.2.55309 > 10.0.0.1.6699: . ack 3069561064 win 8760 
0.361419000 10.0.0.50.3362 > 10.0.0.1.6699: P 4272166864:4272166872(8) ack 685301620 win 8760 
0.362419000 10.0.0.2.55309 > 10.0.0.1.6699: P 225051802:225051810(8) ack 3069561064 win 8760 
0.364244000 10.0.0.2.55309 > 10.0.0.1.6699: . ack 3069563144 win 8760 
0.366475000 10.0.0.16.2871 > 10.0.0.17.2261: P 2121489014:2121489682(668) ack 1652492330 win 16150 
0.367271000 10.0.0.66.2742 > 10.0.0.67.445: S 3882949918:3882949918(0) win 64240 
0.368407000 10.0.0.197.65407 > 10.0.0.196.22: . ack 4102001050 win 16632 
0.368759000 10.0.0.196.22 > 10.0.0.197.65407: P 4102002954:4102003866(912) ack 1712763903 win 50400 
0.369649000 10.0.0.17.2261 > 10.0.0.16.2871: . ack 2121495158 win 16560 
0.370381000 10.0.0.66.2743 > 10.0.0.67.445: S 3883000445:3883000445(0) win 64240 
0.392010000 10.0.1.140.4699 > 10.0.1.141.445: S 605619233:605619233(0) win 65535 
0.400253000 10.0.0.66.2750 > 10.0.0.67.445: S 3883422508:3883422508(0) win 64240 
0.402214000 10.0.1.142.1050 > 10.0.1.143.445: S 2536422063:2536422063(0) win 16384 
0.403868000 10.0.0.37.25 > 10.0.0.38.15208: P 4294097806:4294097856(50) ack 1940722641 win 24820 
0.406977000 10.0.0.11.4038 > 10.0.0.12.135: S 1364425175:1364425175(0) win 16384 
0.412276000 10.0.1.144.3302 > 10.0.1.145.135: S 2198957188:2198957188(0) win 65535 
0.416240000 10.0.0.37.25 > 10.0.1.58.53039: P 4293722656:4293722706(50) ack 44240097 win 24616 
0.417293000 10.0.0.24.2752 > 10.0.0.23.8090: . ack 3416998898 win 64860 
0.418256000 10.0.1.146.3981 > 10.0.1.147.445: S 1914960668:1914960668(0) win 64240 
0.419835000 10.0.0.197.65407 > 10.0.0.196.22: P 1712763807:1712763855(48) ack 4102001930 win 17640 
0.419961000 10.0.0.17.2261 > 10.0.0.16.2871: . ack 2121497206 win 16560 
0.419989000 10.0.0.171.51356 > 10.0.0.45.80: S 698843997:698843997(0) win 5840 
0.421631000 10.0.0.196.22 > 10.0.0.197.65407: P 4102003866:4102004538(672) ack 1712763951 win 50400 
0.426751000 10.0.0.1.6699 > 10.0.0.2.55309: . 3069571464:3069572924(1460) ack 225051826 win 65303 
0.426842000 10.0.0.1.6699 > 10.0.0.2.55309: P 3069572924:3069573544(620) ack 225051826 win 65303 
0.427138000 10.0.1.10.3560 > 10.0.1.11.445: S 604542140:604542140(0) win 16384 
0.428203000 10.0.0.1.6699 > 10.0.0.2.55309: . ack 225051842 win 65287 
0.430086000 10.0.0.1.6699 > 10.0.0.2.55309: . 3069573544:3069575004(1460) ack 225051842 win 65287 
0.430398000 10.0.0.1.6699 > 10.0.0.2.55309: P 3069575004:3069575624(620) ack 225051842 win 65287 
0.432009000 10.0.0.1.6699 > 10.0.0.2.55309: . 3069575624:3069577084(1460) ack 225051842 win 65287 
0.432536000 10.0.0.23.8090 > 10.0.0.24.2752: . 3416991771:3416993151(1380) ack 1214958873 win 57960 
0.433392000 10.0.0.1.6699 > 10.0.0.13.1653: . 501617894:501619308(1414) ack 3272208533 win 46697 
0.433779000 10.0.0.1.6699 > 10.0.0.13.1653: P 501619308:501619974(666) ack 3272208533 win 46697 
0.434324000 10.0.0.1.6699 > 10.0.0.2.55309: P 3069577084:3069577704(620) ack 225051850 win 65279 
0.435918000 10.0.0.1.6699 > 10.0.0.2.55309: . 3069577704:3069579164(1460) ack 225051850 win 65279 
0.436009000 10.0.0.1.6699 > 10.0.0.2.55309: P 3069579164:3069579784(620) ack 225051850 win 65279 
0.441515000 10.0.0.171.51356 > 10.0.0.45.80: . ack 1914311331 win 5840 
0.441724000 10.0.0.171.51356 > 10.0.0.45.80: P 698843998:698844276(278) ack 1914311331 win 5840 
0.444251000 10.0.0.47.4687 > 10.0.0.1.6699: P 1660358216:1660358224(8) ack 1054935290 win 13760 
0.453526000 10.0.0.37.25 > 10.0.0.38.15208: . ack 1940724101 win 24820 
0.456654000 10.0.0.1.6699 > 10.0.0.13.1653: . ack 3272208549 win 46695 
0.458503000 10.0.0.1.6699 > 10.0.0.13.1653: . 501619974:501621388(1414) ack 3272208549 win 46695 
0.458609000 10.0.0.10.3568 > 10.0.0.20.3790: . 192320255:192321615(1360) ack 3045020009 win 17290 
0.458698000 10.0.0.10.3568 > 10.0.0.20.3790: P 192321615:192322303(688) ack 3045020009 win 17290 
0.458754000 10.0.0.1.6699 > 10.0.0.13.1653: P 501621388:501622054(666) ack 3272208549 win 46695 
0.459910000 10.0.1.76.5190 > 10.0.1.75.49267: . ack 23646990 win 16384 
0.464676000 10.0.1.153.4557 > 10.0.1.154.445: S 4175863360:4175863360(0) win 65280 
0.465873000 10.0.0.11.4039 > 10.0.0.73.445: S 1364470136:1364470136(0) win 16384 
0.468627000 10.0.0.196.22 > 10.0.0.197.65407: P 4102004538:4102004986(448) ack 1712763999 win 50400 
0.471990000 10.0.0.197.65407 > 10.0.0.196.22: P 1712763855:1712763903(48) ack 4102002522 win 17048 
0.475170000 10.0.0.171.51356 > 10.0.0.45.80: . ack 1914311331 win 5840 
0.475310000 10.0.0.171.51356 > 10.0.0.45.80: . ack 1914312319 win 6909 
0.475364000 10.0.0.171.51356 > 10.0.0.45.80: F 698844276:698844276(0) ack 1914312319 win 6909 
0.486228000 10.0.0.16.2871 > 10.0.0.17.2261: . 2121489682:2121491062(1380) ack 1652492330 win 16150 
0.490530000 10.0.0.1.6699 > 10.0.0.13.1653: . 501622054:501623468(1414) ack 3272208557 win 46694 
0.490620000 10.0.0.1.6699 > 10.0.0.13.1653: P 501623468:501624134(666) ack 3272208557 win 46694 
0.493108000 10.0.0.38.15208 > 10.0.0.37.25: P 1940722525:1940722550(25) ack 4294097617 win 64141 
0.495284000 10.0.0.20.3790 > 10.0.0.10.3568: . ack 192305919 win 32767 
0.497846000 10.0.0.24.2752 > 10.0.0.23.8090: . ack 3417001511 win 64860 
0.499683000 10.0.0.20.3790 > 10.0.0.10.3568: . ack 192307967 win 32767 
0.500408000 10.0.0.7.4635 > 10.0.0.77.445: S 3133587399:3133587399(0) win 16384 
0.503291000 10.0.0.16.2871 > 10.0.0.17.2261: P 2121491062:2121491730(668) ack 1652492330 win 16150 
0.510455000 10.0.0.53.63613 > 10.0.0.54.25: S 2001578022:2001578022(0) win 24820 
0.510498000 10.0.0.1.6699 > 10.0.0.30.4924: . ack 3435896796 win 64943 
0.516298000 10.0.0.47.4687 > 10.0.0.1.6699: . ack 1054937370 win 11680 
0.522319000 10.0.0.1.6699 > 10.0.0.13.1653: . 501624134:501625548(1414) ack 3272208565 win 46693 
0.522409000 10.0.0.1.6699 > 10.0.0.13.1653: P 501625548:501626214(666) ack 3272208565 win 46693 
0.526306000 10.0.0.10.3568 > 10.0.0.20.3790: . 192322303:192323663(1360) ack 3045020009 win 17290 
0.526392000 10.0.0.10.3568 > 10.0.0.20.3790: P 192323663:192324351(688) ack 3045020009 win 17290 
0.533680000 10.0.0.23.8090 > 10.0.0.24.2752: . 3416993151:3416994531(1380) ack 1214958873 win 57960 
0.533800000 10.0.0.23.8090 > 10.0.0.24.2752: . 3416994531:3416995911(1380) ack 1214958873 win 57960 
0.534569000 10.0.1.58.53039 > 10.0.0.37.25: . ack 4293722610 win 5476 
0.540398000 10.0.0.13.1653 > 10.0.0.1.6699: P 3272208501:3272208509(8) ack 501604748 win 32767 
0.541495000 10.0.1.157.3133 > 10.0.1.158.1772: . 842877100:842878480(1380) ack 3217924254 win 16158 
0.541498000 10.0.0.38.15208 > 10.0.0.37.25: P 1940722550:1940722607(57) ack 4294097690 win 64068 
0.542558000 10.0.1.71.5555 > 10.0.1.70.3847: P 3194150773:3194152153(1380) ack 794563962 win 31740 
0.543775000 10.0.1.159.4579 > 10.0.1.160.135: S 1479419258:1479419258(0) win 64240 
0.544794000 10.0.0.1.6699 > 10.0.0.47.4687: . 1054937370:1054938830(1460) ack 1660358232 win 64767 
0.544885000 10.0.0.1.6699 > 10.0.0.47.4687: P 1054938830:1054939450(620) ack 1660358232 win 64767 
0.546015000 10.0.0.13.1653 > 10.0.0.1.6699: P 3272208509:3272208517(8) ack 501605414 win 32101 
0.551518000 10.0.0.23.8090 > 10.0.0.24.2752: . 3416995911:3416997291(1380) ack 1214958873 win 57960 
0.553559000 10.0.0.37.25 > 10.0.0.38.15208: . ack 1940726948 win 24820 
0.556422000 10.0.0.13.1653 > 10.0.0.1.6699: . ack 501607494 win 32767 
0.559964000 10.0.1.161.22 > 10.0.1.162.3468: P 2450460942:2450460986(44) ack 1829602324 win 24820 
0.562910000 10.0.1.58.53039 > 10.0.0.37.25: P 44240063:44240091(28) ack 4293722610 win 5476 
0.564780000 10.0.0.17.2261 > 10.0.0.16.2871: . ack 2121499254 win 16560 
0.567623000 10.0.0.23.8090 > 10.0.0.24.2752: P 3416997291:3416997518(227) ack 1214958873 win 57960 
0.568004000 10.0.1.163.3125 > 10.0.1.164.445: S 545792547:545792547(0) win 16384 
0.572365000 10.0.0.13.1653 > 10.0.0.1.6699: P 3272208517:3272208525(8) ack 501608908 win 32767 
0.577263000 10.0.1.165.2565 > 10.0.1.166.445: S 272244533:272244533(0) win 16384 
0.577682000 10.0.1.70.3847 > 10.0.1.71.5555: . ack 3194152589 win 16124 
0.577834000 10.0.0.16.2871 > 10.0.0.17.2261: . 2121491730:2121493110(1380) ack 1652492330 win 16150 
0.583695000 10.0.1.8.1158 > 10.0.1.167.445: S 2933023763:2933023763(0) win 16384 
0.584015000 10.0.0.40.1260 > 10.0.0.17.2257: . ack 2855225976 win 16560 
0.588217000 10.0.0.13.1653 > 10.0.0.1.6699: P 3272208525:3272208533(8) ack 501610988 win 32767 
0.591099000 10.0.1.165.2585 > 10.0.1.166.445: S 272612650:272612650(0) win 16384 
0.591758000 10.0.0.16.2871 > 10.0.0.17.2261: P 2121493110:2121493778(668) ack 1652492330 win 16150 
0.594500000 10.0.1.165.2592 > 10.0.1.166.445: S 272671381:272671381(0) win 16384 
0.598340000 10.0.0.24.2752 > 10.0.0.23.8090: . ack 3417003079 win 64860 
0.600737000 10.0.1.171.1475 > 10.0.1.172.80: R 3163285554:3163285554(0) win 0 
0.601575000 10.0.1.127.5190 > 10.0.1.126.33234: . ack 301888393 win 16384 
0.608335000 10.0.0.10.3568 > 10.0.0.20.3790: . 192324351:192325711(1360) ack 3045020009 win 17290 
0.608421000 10.0.0.10.3568 > 10.0.0.20.3790: P 192325711:192326399(688) ack 3045020009 win 17290 
0.612141000 10.0.0.35.4693 > 10.0.1.174.135: S 3811964534:3811964534(0) win 65535 
0.617377000 10.0.1.165.2613 > 10.0.1.166.445: S 273289410:273289410(0) win 16384 
0.617406000 10.0.0.24.2752 > 10.0.0.23.8090: . ack 3417005839 win 64860 
0.620411000 10.0.0.35.4694 > 10.0.1.175.135: S 3812005964:3812005964(0) win 65535 
0.621164000 10.0.0.10.3568 > 10.0.0.20.3790: . 192326399:192327759(1360) ack 3045020009 win 17290 
0.621250000 10.0.0.10.3568 > 10.0.0.20.3790: P 192327759:192328447(688) ack 3045020009 win 17290 
0.622110000 10.0.0.38.15208 > 10.0.0.37.25: P 1940722607:1940722635(28) ack 4294097760 win 63998 
0.628177000 10.0.0.35.4695 > 10.0.1.178.135: S 3812064830:3812064830(0) win 65535 
0.632002000 10.0.0.1.6699 > 10.0.0.30.4924: . 3803414473:3803415913(1440) ack 3435896796 win 64943 
0.633436000 10.0.0.37.25 > 10.0.1.58.53039: . ack 44240729 win 24616 
0.635586000 10.0.0.47.4687 > 10.0.0.1.6699: . ack 1054937370 win 15440 
0.636319000 10.0.0.35.4696 > 10.0.1.181.135: S 3812118963:3812118963(0) win 65535 
0.636980000 10.0.0.40.1260 > 10.0.0.17.2257: . ack 2855225976 win 16560 
0.642511000 10.0.0.1.6699 > 10.0.0.30.4924: . ack 3435896812 win 64927 
0.642616000 10.0.1.182.1617 > 10.0.1.183.445: S 577198787:577198787(0) win 64240 
0.645215000 10.0.0.20.3790 > 10.0.0.10.3568: . ack 192310015 win 32767 
0.648157000 10.0.0.35.4697 > 10.0.1.184.135: S 3812157106:3812157106(0) win 65535 
0.649694000 10.0.0.20.3790 > 10.0.0.10.3568: . ack 192312063 win 32767 
0.649781000 10.0.0.1.6699 > 10.0.0.30.4924: P 3803415913:3803417353(1440) ack 3435896812 win 64927 
0.651000000 10.0.0.1.6699 > 10.0.0.30.4924: P 3803417353:3803418793(1440) ack 3435896812 win 64927 
0.653290000 10.0.0.17.2261 > 10.0.0.16.2871: . ack 2121501302 win 16560 
0.656329000 10.0.0.35.4698 > 10.0.1.185.135: S 3812213327:3812213327(0) win 65535 
0.659994000 10.0.0.50.3362 > 10.0.0.1.6699: . ack 685302240 win 8140 
0.663871000 10.0.0.10.3568 > 10.0.0.20.3790: . 192328447:192329807(1360) ack 3045020009 win 17290 
0.663957000 10.0.0.10.3568 > 10.0.0.20.3790: P 192329807:192330495(688) ack 3045020009 win 17290 
0.664202000 10.0.0.35.4699 > 10.0.1.187.135: S 3812276119:3812276119(0) win 65535 
0.664257000 10.0.0.142.4543 > 10.0.1.188.135: S 1619638811:1619638811(0) win 64240 
0.664991000 10.0.0.16.2871 > 10.0.0.17.2261: . 2121493778:2121495158(1380) ack 1652492330 win 16150 
0.665302000 10.0.1.182.1625 > 10.0.1.183.445: S 577429378:577429378(0) win 64240 
0.666919000 10.0.0.197.65407 > 10.0.0.196.22: . ack 4102002954 win 16616 
0.667007000 10.0.0.30.4924 > 10.0.0.1.6699: P 3435896788:3435896796(8) ack 3803408233 win 16640 
0.667345000 10.0.0.37.25 > 10.0.1.58.53039: P 4293722706:4293722762(56) ack 44240729 win 24616 
0.669678000 10.0.0.196.22 > 10.0.0.197.65407: P 4102004986:4102005994(1008) ack 1712763999 win 50400 
0.672362000 10.0.0.35.4700 > 10.0.1.189.135: S 3812327734:3812327734(0) win 65535 
0.675786000 10.0.1.190.3599 > 10.0.1.191.135: S 1817568538:1817568538(0) win 64240 
0.680076000 10.0.0.35.4701 > 10.0.1.192.135: S 3812382895:3812382895(0) win 65535 
0.688773000 10.0.0.16.2871 > 10.0.0.17.2261: P 2121495158:2121495826(668) ack 1652492330 win 16150 
0.692162000 10.0.0.35.4702 > 10.0.1.193.135: S 3812420649:3812420649(0) win 65535 
0.695038000 10.0.1.58.53039 > 10.0.0.37.25: . ack 4293722656 win 5430 
0.696440000 10.0.1.194.50472 > 10.0.1.195.445: S 2373997978:2373997978(0) win 64240 
0.697506000 10.0.0.37.25 > 10.0.0.38.15208: P 4294097856:4294097912(56) ack 1940726948 win 24820 
0.697519000 10.0.0.17.2261 > 10.0.0.16.2871: . ack 2121503350 win 16560 
0.700060000 10.0.0.35.4703 > 10.0.1.196.135: S 3812462033:3812462033(0) win 65535 
0.700633000 10.0.1.197.2957 > 10.0.0.17.2222: . ack 1846962023 win 0 
0.701847000 10.0.0.38.15208 > 10.0.0.37.25: P 1940722635:1940722641(6) ack 4294097806 win 63952 
0.707153000 10.0.1.146.4073 > 10.0.1.198.445: S 1917488063:1917488063(0) win 64240 
0.708447000 10.0.0.35.4704 > 10.0.1.199.135: S 3812518072:3812518072(0) win 65535 
0.711859000 10.0.0.23.8090 > 10.0.0.24.2752: . 3416997518:3416998898(1380) ack 1214958873 win 57960 
0.714432000 10.0.1.58.53039 > 10.0.0.37.25: P 44240091:44240097(6) ack 4293722656 win 5430 
0.715291000 10.0.0.16.2871 > 10.0.0.17.2261: . 2121495826:2121497206(1380) ack 1652492330 win 16150 
0.715957000 10.0.0.35.4705 > 10.0.1.200.135: S 3812552108:3812552108(0) win 65535 
0.718033000 10.0.1.190.3602 > 10.0.1.191.135: S 1817673994:1817673994(0) win 64240 
0.718581000 10.0.1.71.5555 > 10.0.1.70.3847: P 3194152153:3194152589(436) ack 794563962 win 31740 
0.719058000 10.0.0.197.65407 > 10.0.0.196.22: P 1712763903:1712763951(48) ack 4102003866 win 17640 
0.719130000 10.0.0.196.22 > 10.0.0.197.65407: P 4102005994:4102006682(688) ack 1712764047 win 50400 
0.719772000 10.0.1.201.4062 > 10.0.1.202.445: S 3131037067:3131037067(0) win 16384 
0.720189000 10.0.0.1.6699 > 10.0.0.50.3362: . 685308480:685309940(1460) ack 4272166880 win 64199 
0.720282000 10.0.0.1.6699 > 10.0.0.50.3362: P 685309940:685310560(620) ack 4272166880 win 64199 
0.721687000 10.0.0.2.55309 > 10.0.0.1.6699: P 225051810:225051826(16) ack 3069563144 win 8760 
0.723175000 10.0.0.2.55309 > 10.0.0.1.6699: . ack 3069565224 win 8760 
0.724124000 10.0.0.35.4706 > 10.0.1.203.135: S 3812588365:3812588365(0) win 65535 
0.724792000 10.0.0.2.55309 > 10.0.0.1.6699: P 225051826:225051834(8) ack 3069566684 win 8760 
0.726443000 10.0.0.2.55309 > 10.0.0.1.6699: P 225051834:225051842(8) ack 3069568764 win 8760 
0.727689000 10.0.0.2.55309 > 10.0.0.1.6699: . ack 3069569384 win 8140 
0.727989000 10.0.0.23.8090 > 10.0.0.24.2752: P 3416998898:3417000131(1233) ack 1214958873 win 57960 
0.728546000 10.0.0.13.1653 > 10.0.0.1.6699: . ack 501611654 win 32101 
0.729138000 10.0.0.2.55309 > 10.0.0.1.6699: P 225051842:225051850(8) ack 3069569384 win 8140 
0.729417000 10.0.0.1.6699 > 10.0.1.204.35295: . ack 1151398638 win 46602 
0.730666000 10.0.0.2.55309 > 10.0.0.1.6699: . ack 3069571464 win 8760 
0.735194000 10.0.0.1.6699 > 10.0.1.205.1308: . 643038684:643040144(1460) ack 2348231193 win 65039 
0.735288000 10.0.0.1.6699 > 10.0.1.205.1308: P 643040144:643040764(620) ack 2348231193 win 65039 
0.735328000 10.0.0.24.2752 > 10.0.0.23.8090: . ack 3417005878 win 64821 
0.736235000 10.0.0.35.4707 > 10.0.1.206.135: S 3812635897:3812635897(0) win 65535 
0.736987000 10.0.0.16.2871 > 10.0.0.17.2261: P 2121497206:2121497874(668) ack 1652492330 win 16150 
0.739426000 10.0.0.13.1653 > 10.0.0.1.6699: P 3272208533:3272208541(8) ack 501611654 win 32101 
0.740412000 10.0.1.207.1531 > 10.0.1.208.135: S 2730651623:2730651623(0) win 25200 
0.744041000 10.0.0.35.4708 > 10.0.1.210.135: S 3812675022:3812675022(0) win 65535 
0.746280000 10.0.0.37.25 > 10.0.0.38.15208: P 4294097912:4294097935(23) ack 1940726954 win 24820 
0.747494000 10.0.1.106.3531 > 10.0.1.105.4557: . ack 1414426606 win 63517 
0.749770000 10.0.1.161.22 > 10.0.1.162.3468: P 2450460986:2450461030(44) ack 1829602368 win 24820 
0.751384000 10.0.0.38.15208 > 10.0.0.37.25: . 1940722641:1940724101(1460) ack 4294097856 win 63902 
0.751630000 10.0.0.38.15208 > 10.0.0.37.25: . 1940724101:1940725561(1460) ack 4294097856 win 63902 
0.751726000 10.0.0.38.15208 > 10.0.0.37.25: P 1940725561:1940726948(1387) ack 4294097856 win 63902 
0.752181000 10.0.0.35.4709 > 10.0.1.213.135: S 3812708391:3812708391(0) win 65535 
0.753925000 10.0.0.20.3790 > 10.0.0.10.3568: . ack 192314111 win 32767 
0.755223000 10.0.0.13.1653 > 10.0.0.1.6699: P 3272208541:3272208549(8) ack 501613734 win 32767 
0.760171000 10.0.1.215.1195 > 10.0.1.216.445: S 1374364335:1374364335(0) win 16384 
0.760181000 10.0.0.35.4710 > 10.0.1.217.135: S 3812765766:3812765766(0) win 65535 
0.763927000 10.0.0.1.6699 > 10.0.0.2.55309: . ack 225051866 win 65263 
0.765687000 10.0.1.140.4720 > 10.0.1.218.445: S 606235302:606235302(0) win 65535 
0.765801000 10.0.0.1.6699 > 10.0.0.2.55309: . 3069579784:3069581244(1460) ack 225051866 win 65263 
0.765895000 10.0.0.1.6699 > 10.0.0.2.55309: P 3069581244:3069581864(620) ack 225051866 win 65263 
0.767136000 10.0.0.197.65407 > 10.0.0.196.22: P 1712763951:1712763999(48) ack 4102004538 win 16968 
0.767814000 10.0.0.1.6699 > 10.0.0.2.55309: . 3069581864:3069583324(1460) ack 225051874 win 65255 
0.768224000 10.0.0.1.6699 > 10.0.0.2.55309: P 3069583324:3069583944(620) ack 225051874 win 65255 
0.768937000 10.0.0.196.22 > 10.0.0.197.65407: P 4102006682:4102007146(464) ack 1712764095 win 50400 
0.770004000 10.0.0.1.6699 > 10.0.0.2.55309: . 3069583944:3069585404(1460) ack 225051882 win 65247 
0.770097000 10.0.0.1.6699 > 10.0.0.2.55309: P 3069585404:3069586024(620) ack 225051882 win 65247 
0.772272000 10.0.0.35.4711 > 10.0.1.219.135: S 3812801012:3812801012(0) win 65535 
0.777893000 10.0.1.58.53039 > 10.0.0.37.25: . ack 4293722706 win 5380 
0.780342000 10.0.0.35.4712 > 10.0.1.220.135: S 3812853184:3812853184(0) win 65535 
0.781428000 10.0.0.155.3222 > 10.0.0.156.445: S 720171582:720171582(0) win 16384 
0.783295000 10.0.0.10.3568 > 10.0.0.20.3790: . 192330495:192331855(1360) ack 3045020009 win 17290 
0.783381000 10.0.0.10.3568 > 10.0.0.20.3790: P 192331855:192332543(688) ack 3045020009 win 17290 
0.786994000 10.0.0.13.1653 > 10.0.0.1.6699: P 3272208549:3272208557(8) ack 501615814 win 32767 
0.792235000 10.0.0.23.8090 > 10.0.0.24.2752: . 3417000131:3417001511(1380) ack 1214958873 win 57960 
0.805147000 10.0.0.17.2257 > 10.0.0.40.1260: . 2855237016:2855238396(1380) ack 3057858504 win 16162 
0.806551000 10.0.0.17.2257 > 10.0.0.40.1260: . 2855238396:2855239776(1380) ack 3057858504 win 16162 
0.807732000 10.0.0.17.2257 > 10.0.0.40.1260: . 2855239776:2855241156(1380) ack 3057858504 win 16162 
0.808240000 10.0.0.23.8090 > 10.0.0.24.2752: P 3417001511:3417001699(188) ack 1214958873 win 57960 
0.808903000 10.0.0.17.2257 > 10.0.0.40.1260: . 2855241156:2855242536(1380) ack 3057858504 win 16162 
0.811510000 10.0.1.92.4828 > 10.0.1.222.135: S 2169874086:2169874086(0) win 16384 
0.818733000 10.0.0.13.1653 > 10.0.0.1.6699: P 3272208557:3272208565(8) ack 501617894 win 32767 
0.822040000 10.0.0.20.3790 > 10.0.0.10.3568: . ack 192316159 win 32767 
0.824064000 10.0.1.223.4149 > 10.0.1.224.135: S 2127588280:2127588280(0) win 64240 
0.829635000 10.0.1.58.53039 > 10.0.0.37.25: P 44240097:44240729(632) ack 4293722706 win 5380 
0.830361000 10.0.1.225.2734 > 10.0.1.226.3531: . ack 2259899485 win 16558 
0.833985000 10.0.1.227.1186 > 10.0.1.228.135: S 1616418268:1616418268(0) win 64240 
0.837750000 10.0.1.162.3468 > 10.0.1.161.22: P 1829602280:1829602324(44) ack 2450460942 win 63951 
0.841173000 10.0.0.47.4687 > 10.0.0.1.6699: P 1660358224:1660358232(8) ack 1054937370 win 15440 
0.846307000 10.0.0.17.2261 > 10.0.0.16.2871: . ack 2121505398 win 16560 
0.854890000 10.0.1.229.61767 > 10.0.1.230.80: S 1829827352:1829827352(0) win 8192 
0.860130000 10.0.0.16.2871 > 10.0.0.17.2261: . 2121497874:2121499254(1380) ack 1652492330 win 16150 
0.866837000 10.0.0.1.6699 > 10.0.0.13.1653: . 501626214:501627628(1414) ack 3272208565 win 46693 
0.867213000 10.0.0.1.6699 > 10.0.0.13.1653: P 501627628:501628294(666) ack 3272208565 win 46693 
0.870847000 10.0.1.204.35295 > 10.0.0.1.6699: P 1151398630:1151398638(8) ack 2508912461 win 56 
0.875389000 10.0.0.16.2871 > 10.0.0.17.2261: P 2121499254:2121499922(668) ack 1652492330 win 16150 
0.877701000 10.0.0.24.2752 > 10.0.0.23.8090: . ack 3417007781 win 64860 
0.882675000 10.0.1.232.4416 > 10.0.1.233.445: S 1704209347:1704209347(0) win 16384 
0.884563000 10.0.0.1.4681 > 10.0.1.234.6699: P 3454430212:3454430358(146) ack 2024728704 win 64106 
0.892605000 10.0.0.23.8090 > 10.0.0.24.2752: . 3417001699:3417003079(1380) ack 1214958873 win 57960 
0.892714000 10.0.0.23.8090 > 10.0.0.24.2752: . 3417003079:3417004459(1380) ack 1214958873 win 57960 
0.901894000 10.0.1.235.2198 > 10.0.1.236.3517: . ack 365676620 win 17680 
0.901987000 10.0.1.59.80 > 10.0.1.237.27997: R 0:0(0) ack 423255044 win 0 
0.903652000 10.0.0.20.3790 > 10.0.0.10.3568: . ack 192318207 win 32767 
0.905736000 10.0.0.85.6881 > 10.0.0.63.4596: . ack 2504805992 win 65535 
0.909955000 10.0.0.85.6881 > 10.0.0.63.4596: . ack 2504808896 win 65535 
0.911704000 10.0.0.23.8090 > 10.0.0.24.2752: . 3417004459:3417005839(1380) ack 1214958873 win 57960 
0.912751000 10.0.0.1.6699 > 10.0.0.13.1653: . ack 3272208581 win 46691 
0.912933000 10.0.0.47.4687 > 10.0.0.1.6699: . ack 1054939450 win 13360 
0.914470000 10.0.0.148.1246 > 10.0.1.238.445: S 345022367:345022367(0) win 64240 
0.914594000 10.0.0.1.6699 > 10.0.0.13.1653: . 501628294:501629708(1414) ack 3272208581 win 46691 
0.914945000 10.0.0.1.6699 > 10.0.0.13.1653: P 501629708:501630374(666) ack 3272208581 win 46691 
0.916664000 10.0.0.1.6699 > 10.0.0.2.55309: . 3069586024:3069587484(1460) ack 225051882 win 65247 
0.916863000 10.0.0.20.3790 > 10.0.0.10.3568: . ack 192320255 win 32767 
0.919400000 10.0.0.1.6699 > 10.0.0.13.1653: . 501630374:501631788(1414) ack 3272208589 win 46690 
0.920028000 10.0.0.1.6699 > 10.0.0.13.1653: P 501631788:501632454(666) ack 3272208589 win 46690 
0.927820000 10.0.0.23.8090 > 10.0.0.24.2752: P 3417005839:3417005878(39) ack 1214958873 win 57960 
0.928810000 10.0.0.30.4924 > 10.0.0.1.6699: . ack 3803408233 win 16640 
0.931975000 10.0.0.30.4924 > 10.0.0.1.6699: . ack 3803410313 win 17280 
0.932057000 10.0.0.116.3495 > 10.0.1.240.135: S 302668237:302668237(0) win 8760 
0.934421000 10.0.0.30.4924 > 10.0.0.1.6699: P 3435896796:3435896804(8) ack 3803411753 win 17280 
0.936766000 10.0.1.207.4355 > 10.0.1.242.445: S 2686562728:2686562728(0) win 25200 
0.937457000 10.0.0.30.4924 > 10.0.0.1.6699: . ack 3803412393 win 16640 
