name_id,name_en
"Memberikan informasi dalam bentuk database yang menampilkan informasi di bidang jejaring sosial",-
"Jasa perencanaan dan pengaturan upacara dan resepsi pernikahan","planning and arranging of wedding ceremonies and wedding receptions"
"menyediakan jasa/layanan pramutamu untuk orang lain, yaitu, reservasi pemesanan, memfasilitasi pembelian, mengatur pengiriman, membuat pengaturan pribadi yang diminta, memberikan rekomendasi mengenai produk dan jasa, memberikan informasi khusus kepada pelanggan untuk memenuhi kebutuhan individu, dan penyediaan pengingat dan pemberitahuan elektronik","providing concierge services for others, namely, booking reservations, facilitating purchases, arranging deliveries, making requested personal arrangements, providing recommendations on products and services, providing customer-specific information to meet individual needs, and provision of electronic reminders and notifications"
"menyediakan/memberikan informasi dalam bentuk database yang menampilkan informasi di bidang jaringan/jejaring sosial dan pengenalan sosial","providing information in the form of databases featuring information in the fields of social networking and social introduction"
"Organisasi sosial kemasyarakatan",-
"penyewaan alarm gas, alarm kebakaran dan alarm pencurian","rental of gas alarms, fire alarms and burglar alarms"
"layanan jejaring sosial online yang dapat diakses melalui aplikasi seluler yang dapat diunduh.","online social networking services accessible by means of downloadable mobile applications."
"Jasa penyelesaian perselisihan hubungan industrial",-
"Jasa penyelesaian perselisihan hubungan industrial dalam rangka kesejahteraan anggota dan keluarganya",-
"konsultasi kepatuhan peraturan di bidang mata uang digital, mata uang virtual, mata uang kripto, aset digital dan blockchain, aset digital (digitized asset), token digital, token kripto (crypto token) dan aplikasi token utilitas","regulatory compliance consultancy in the field of digital currency, virtual currency, cryptocurrency, digital and blockchain asset, digitized asset, digital token, crypto token and utility token applications"
"menyediakan situs web (website) yang menampilkan informasi tentang pengembangan privasi, keamanan, blockchain dan teknologi buku besar yang didistribusikan (distributed ledger technologies), dan undang-undang tata kelola data (data governance law)","providing a website featuring information on the development of privacy, security, blockchain and distributed ledger technologies, and data governance law"
"penyediaan layanan autentikasi pengguna","provision of user authentication services"
"lisensi hak cipta","copyright licensing"
"lisensi teknologi dan perangkat lunak","licensing of technology and software"
"jasa jejaring sosial daring (online) untuk investor yang memungkinkan perdagangan finansial/keuangan dan pertukaran mata uang digital (financial trades and exchange of digital currency), mata uang virtual, mata uang kripto, aset digital dan blockchain, aset digital (digitized assets), token digital, token kripto (crypto tokens) dan token utilitas","online social networking service for investors allowing financial trades and exchange of digital currency, virtual currency, cryptocurrency, digital and blockchain assets, digitized assets, digital tokens, crypto tokens and utility tokens"
"lisensi barang cetakan","Licensing of printed matter"
"eksploitasi hak kekayaan industri dan hak cipta dengan cara lisensi","Exploitation of industrial property rights and copyright by licensing"
"lisensi hak yang berkaitan dengan penggunaan foto","Licensing of rights relating to the use of photographs"
"lisensi hak yang berkaitan dengan produksi video","Licensing of rights relating to video productions"
"lisensi hak yang berkaitan dengan produksi audio","Licensing of rights relating to audio productions"
"menyediakan informasi online dalam bidang kekayaan intelektual dan hak cipta","providing online information in the field of intellectual property and copyright"
"menyediakan informasi dalam bidang kekayaan intelektual dan hak cipta","providing information in the fields of intellectual property and copyright"
"meninjau standar dan praktik untuk memastikan kepatuhan terhadap hukum dan peraturan","reviewing standards and practices to assure compliance with laws and regulations"
"menyediakan informasi dalam bidang kekayaan intelektual dan hak cipta melalui database online","provide information on intellectual property and copyright through online databases"
"Jasa Perlindungan Anak",-
"Audit kepatuhan regulasi","Regulatory compliance auditing"
"jasa konsultasi hukum","legal consultancy services"
"layanan konsultasi yang berkaitan dengan hukum","advisory services relating to the law"
"layanan pelacakan kendaraan curian","stolen vehicle tracking services"
"lisensi perangkat lunak komputer","computer software licensing"
"jasa konsultasi yang berkaitan dengan urusan regulasi","advisory services relating to regulatory affairs"
"konsultasi kepatuhan peraturan di bidang mata uang digital, mata uang virtual, cryptocurrency, aset digital dan blockchain, aset digital, token digital, token kripto, dan aplikasi token utilitas","regulatory compliance consultancy in the field of digital currency, virtual currency, cryptocurrency, digital and blockchain asset, digitized asset, digital token, crypto token and utility token applications"
"layanan validasi identitas","identity validation services"
"menyediakan informasi dalam bidang kekayaan intelektual dan hak cipta melalui database online","provide information on intellectual property and copyright through online databases"
"Jasa sinode wihara",-
"layanan mediasi untuk perselisihan perkawinan","mediation services for marital disputes"
"jasa pengawasan hak cipta","copyright watch services"
"deteksi dan pelacakan pencurian kendaraan melalui sistem elektronik","vehicle theft detection and tracking by means of electronic systems"
"lisensi perangkat lunak komputer/ teknologi dan program komputer yang tidak berkaitan dengan informasi bisnis pelatihan bisnis jaringan bisnis kursus pengembangan profesional kegiatan pengembangan profesional dan standar pengaturan untuk tata kelola perusahaan","Licensing of computer software/ technology and computer programs not in relation to business information business training business networking professional development courses professional development events and setting standards for corporate governance"
"lisensi sistem komunikasi nirkabel yang tidak berkaitan dengan informasi bisnis pelatihan bisnis jaringan bisnis kursus pengembangan profesional kegiatan pengembangan profesional dan standar pengaturan untuk tata kelola perusahaan","licensing of wireless communication system not in relation to business information business training business networking professional development courses professional development events and setting standards for corporate governance"
"Konsultasi kepatuhan regulasi dalam bidang investasi dan keuangan","Regulatory compliance consulting in the fields of investments and finance"
"layanan bantuan hukum","legal aid services"
"layanan klub sosial (layanan hiburan, olahraga, dan budaya)","social club services (entertainment, sporting and cultural services)"
