name_id,name_en
"Jasa-jasa penyanggaan resolusi perselisihan dan litigasi","Litigation and dispute resolution support services"
"Jasa-jasa sekuritas ialah: penyediaan penilaian keamanan (security) atas lokasi-lokasi secara fisik, sistem-sistem informasi dan
lingkungan-lingkungan pekerjaan","Security services, namely providing security assessments of 
physical locations, information systems, and working
environments"
"Pengenalan dan jejaring sosial berbasis jaringan komputer global","Global computer network-based social introduction and networking"
"jasa penempatan nomor identifikasi untuk ditempelkan pada barang-barang berharga untuk memfasilitasi penemuan barangnya kembali setelah kehilangan atau pencurian [jasa keamanan]","assignment of identification numbers to affix to valuables to facilitate their recovery following loss or theft [security services]"
"jasa penyediaan informasi melalui situs web daring (online) interaktif dibidang perkencanan dan fasilitasi perkenalan individu dan pengembangan hubungan dan persahabatan","providing information via interactive on-line web sites in the field of dating and to facilitate introduction of individuals and development of relationships and friendships"
"jasa penyediaan pilihan kartu ucapan elektronik secara daring (online)","providing a selection of on-line electronic greeting cards"
"jasa mediasi [layanan hukum]","mediation [legal services]"
"jasa lisensi barang cetakan [layanan hukum]","licensing of printed matter [legal services]"
"Pengantar sosial dan layanan jejaring sosial","Social introduction and social networking services"
"jasa konsultasi hukum yang berkaitan dengan pemetaan paten","legal consultancy relating to patent mapping"
"jasa pengawalan/pengiringan di masyarakat [pendampingan/penemanan]","escorting in society [chaperoning]"
"Memberikan informasi dalam bentuk database yang menampilkan informasi di bidang jejaring sosial, pengenalan sosial dan kencan","Providing information in the form of databases featuring information in the fields of social networking, social introduction and dating"
"Organisasi masyarakat yang bergerak di bidang pelayanan kemasyarakatan",-
"lisensi hak kekayaan intelektual.","licensing of intellectual property rights"
"jasa manajemen hak cipta","copyright management services"
"Konsultasi terkait merek Internasional",-
"Layanan hukum terkait pendaftaran merek Internasional",-
"Jasa perpanjangan merek Internasional",-
"Jasa menanggapi oposisi merek Internasional",-
"Jasa permohonan penambahan negara merek Internasional","subsequent designation state"
"Jasa transformasi merek Internasional",-
"Pemantauan merek Internasional",-
"Menyediakan jasa perawatan untuk tempat tinggal dan kantor, yaitu, menawarkan bantuan untuk manusia usia lanjut (manula) atau orang yang membutuhkan perawatan khusus dan profesional medis di tempat","Providing care services for residences and offices, namely, offering assistance with daily living for seniors or person who needs special care and medical professional on-site"
"Jasa konsultasi kekayaan intelektual","Intellectual property consultancy services"
"Konsultasi hukum dan hubungan industrial",-
"Konsultasi perizinan usaha mikro dan kecil (IUMK)",-
"Pemantauan sistem keamanan","Monitoring of security systems"
"Penjaga siang dan malam","Day and night guards"
"Konsultasi untuk mendapatkan sosialisasi dan sertifikasi halal",-
"Konsultasi mengenai peraturan keselamatan di tempat kerja","Consultancy on regulations on safety at work"
"Konsultasi keamanan, termasuk dalam hal keamanan pusat komersial dan kompleks perbelanjaan","Security consultancy, including as regards security of commercial centres and shopping complexes"
"jasa konsultasi astrologi","astrology consultancy"
"jasa penyaringan/pemeriksaan bagasi untuk tujuan keamanan","baggage screening for security purposes"
"jasa pemesanan untuk jasa pembelanja pribadi","booking services for personal shopper services"
"jasa dukungan litigasi yang dibantu komputer","computer assisted litigation support"
"jasa konsultasi yang berkaitan dengan perlindungan merek dagang","consultancy relating to trademark protection"
"jasa pembuatan akta tanah [layanan hukum]","conveyancing services [legal services]"
"jasa penjaga siang dan malam","day and night guard services"
"Wanita Penghibur",-
"Tukang Kemat (Dukun Santet)",-
"jasa usaha penguburan","funerary undertaking"
"jasa ramalan zodiak","horoscope casting"
"jasa penyediaan informasi tentang penataan pakaian pribadi","information about personal wardrobe styling services"
"jasa penelitian hukum","legal research"
"jasa hukum untuk prosedur yang berkaitan dengan hak properti industri","legal services for procedures relating to industrial property rights"
"jasa pengawasan hukum","legal watching services"
"jasa pemantauan alarm keamanan dan pencurian","monitoring of burglar and security alarms"
"jasa penataan gaya pribadi yang terdiri dari jasa pengukuran dan pengepasan bra","personal styling services consisting of bra measuring and fitting services"
"jasa penyelidikan latar belakang pra-kerja","pre-employment background investigation services"
"jasa penyewaan peralatan keselamatan","rental of safety equipment"
"jasa penyewaan kamar pengantin (huppah) pernikahan","rental of wedding huppahs"
"jasa inspeksi keamanan untuk pihak lain","security inspection services for others"
"Jasa mengadakan kebaktian",-
"Jasa Lisensi Waralaba","Franchise License Services"
"Jasa perpanjangan merek",-
"Jasa pembuatan sanggahan merek",-
"Jasa menanggapi sanggahan merek",-
"Jasa mengajukan oposisi merek",-
"Jasa menanggapi oposisi merek",-
"Jasa mengajukan banding merek ke Komisi Banding Merek",-
"Jasa pengambilan sertifikat merek",-
"Jasa drafting paten",-
"Jasa penelusuran paten",-
"Jasa pendaftaran paten",-
"Jasa pembuatan sanggahan paten",-
"Jasa menanggapi sanggahan paten",-
"Jasa mengajukan oposisi paten",-
"Jasa menanggapi oposisi paten",-
"Jasa mengajukan banding paten ke Komisi Banding Paten",-
"Jasa pengambilan sertifikat paten",-
"Jasa manajemen Paten",-
"Jasa pendaftaran hak cipta",-
"Jasa menanggapi penolakan cipta",-
"Jasa pengambilan sertifikat Hak Cipta",-
"Jasa pembuatan peringatan hak cipta di koran",-
"Jasa pendaftaran desain industri",-
"Jasa menanggapi sanggahan desain",-
"Jasa mengajukan oposisi desain industri",-
"Jasa menanggapi oposisi desain industri",-
"Jasa pengambilan sertifikat desain industri",-
"Jasa lisensi desain industri",-
"Jasa manajemen desain industri",-
"Jasa pendaftaran rahasia dagang",-
"Jasa lisensi rahasia dagang",-
"Jasa penelusuran nama domain",-
"Jasa perpanjangan nama domain",-
"Jasa lisensi domain",-
"Jasa gugatan nama domain",-
"memberikan informasi di bidang pengembangan diri, peningkatan diri, pemenuhan diri, amal, kedermawanan/filantropi, sukarelawan (volunteer), pelayanan masyarakat dan umum, dan kegiatan kemanusiaan","providing information in the field of personal development, self-improvement, self-fulfillment, charitable, philanthropic, volunteer, public and community services, and humanitarian activities"
pendampingan,chaperoning
"Perkumpulan sosial keagamaan",-
"Nasihat hukum dalam menanggapi permintaan untuk tender","Legal advice in responding to calls for tenders"
"jasa/layanan verifikasi pengguna","user verification services"
"jasa/layanan verifikasi identifikasi","identification verification services"
"jasa/layanan verifikasi identifikasi bisnis","business identification verification services"
"Layanan kekayaan intelektual yaitu percetakan sertifikat kekayaan intelektual termasuk: sertifikat paten, sertifikat merek, surat
pencatatan ciptaan, sertifikat desain industri,
pencatatan perpanjangan merek, pencatatan
pengalihan hak, pencatatan lisensi",-
"meramal melalui jaringan komunikasi elektronik dan memberikan informasi yang berkaitan dengannya","fortune-telling through electronic communications networks and providing information relating thereto"
"Jasa penelusuran merek",-
"Sosial kemasyarakatan",-
"jasa konsultasi yang berkaitan dengan lisensi merek dagang","consultancy relating to trademark licensing"
"jasa perlindungan dari penipuan dan pencurian identitas","fraud and identity theft protection services"
"jasa hukum yang berkaitan dengan eksploitasi hak transmisi","legal services relating to the exploitation of transmission rights"
"jasa penyelenggaraan pertemuan keluarga yang berduka untuk memperingati kematian orang tercinta","organizing meetings of bereaved families to commemorate the death of a loved one"
"jasa penyediaan informasi tentang prosedur hukum yang berkaitan dengan tuntutan hukum atau isu/persoalan hukum lainnya","providing information on legal procedures relating to lawsuits or other legal issues"
"Jasa agen kekayaan intelektual","intellectual property agency services"
"jasa pernikahan",-
"jasa pemakaman",-
"melakukan upacara pernikahan sipil",-
"melakukan upacara pemakaman",-
"melakanan upcara layanan doa keagamaan",-
"melakukan upacara keagamaan",-
"mediasi perceraian",-
"usaha perkuburan",-
"Layanan Kurator dan Pengurus untuk Kepailitan dan Penundaan Kewajiban Pembayaran Utang.","Receiver and Administrator Services for Bankruptcy and Debt Restructuring."
"Layanan Kurator dalam Kepailitan (Hukum Kepailitan dan Penundaan Kewajiban Pembayaran Utang).","Receiver Services in Bankruptcy (Bankruptcy and Debt Restructuring Law)."
"Layanan Hukum Kepailitan dan Penundaan Kewajiban Pembayaran Utang.","Legal Services for Bankruptcy and Debt Restructuring."
"Layanan Pengurus dalam Penundaan Kewajiban Pembayaran Utang (Hukum Kepailitan dan Penundaan Kewajiban Pembayaran Utang).","Administrator Services for Debt Restructuring (Bankruptcy and Debt Restructuring Law)."
"Memberikan informasi tentang Hukum Kepailitan dan Penundaan Kewajiban Pembayaran Utang.","Providing information regarding on Bankruptcy and Debt Restructuring Law."
"Memberikan informasi mengenai prosedur hukum yang berkaitan dengan hukum Kepailitan dan Penundaan Kewajiban Pembayaran Utang.","Providing information on legal procedures related to Bankruptcy and Debt Restructuring."
"Memberikan Solusi Hukum mengenai Kepailitan dan Penundaan Kewajiban Pembayaran Utang.","Providing Legal Solution on Bankruptcy and Debt Restructuring Law."
"jasa pemberian sertifikat digital berupa tanda tangan elektronik yang menunjukkan identitas pihak yang melakukan transaksi",-
"jasa penyewaan CCTV (Closed Circuit Television)",-
"layanan komunikasi dan laporan darurat untuk konfirmasi keamanan","emergency communication and report services for safety confirmation"
"layanan advis dan informasi yang berhubungan dengan tindakan darurat","advisory and information services relating to emergency action"
"layanan konsultasi dan informasi yang berkaitan dengan bencana, pencegahan kejahatan dan pencegahan bencana melalui situs web","advisory and information services relating to disaster, crime-prevention and disaster prevention via a web site"
"menyediakan informasi lokasi untuk orang, obyek, dan binatang menggunakan terminal komputer","providing location information for people, objects, and animals using communication terminals"
"Pemberian lisensi atas merek dagang",-
"Pengolahan hak cipta dan desain industri",-
"Manajemen merek dagang",-
"penyediaan informasi yang berhubungan dengan fesyen","providing information relating to fashion"
"Lembaga swadaya masyarakat yang bergerak di bidang sosial dan kemanusiaan",-
"layanan individu dan layanan sosial yang diberikan oleh orang lain untuk memenuhi kebutuhan individu",-
"Jasa penyediaan pakaian dan sepatu untuk orang-orang yang membutuhkan (Iayanan amal)",-
"Pelayanan untuk masyarakat korban bencana alam",-
"Lembaga sosial kemanusiaan yang fokus pada penanganan kasus-kasus kemanusiaan yang melanda dunia baik bencana alam dan bencana non alam (yang berbasis kerelawanan)",-
"Jasa bantuan tuna wisma",-
"Jasa bantuan korban bencana alam",-
"Jasa penasehatan mengenai permasalahan peraturan-peraturan dibidang lingkungan hidup","Advisory on environmental regulatory matters"
"Jasa konsultasi mengenai permasalahan peraturan-peraturan dibidang lingkungan hidup","Consultancy on environmental regulatory matters"
"Jasa konsultasi ahli dibidang kejahatan siber","Expert consultancy in the field of cyber crimes"
"Jasa konsultasi ahli dibidang penilaian kerugian dibidang hukum","Expert consultancy in the field of legal damage assessment"
"Penyedia layanan informasi, penasihat, dan konsultasi terkait lisensi, lisensi database, lisensi penggunaan perangkat lunak komputer dan program komputer, lisensi perangkat lunak dan teknologi, autentikasi akses internet, layanan autentikasi dan verifikasi pengguna","Provision of information, advisory and consultancy services relating to Advisory services relating to licensing, database licensing services, licensing of the use of computer software and computer programs, licensing of software and technology, internet access authentication services, user authentication and verification services"
"jasa pekerjaan rumah yang dilakukan untuk memenuhi kebutuhan perorangan","housework services rendered to meet the needs of individuals"
"penyediaan informasi yang berhubungan dengan atlet profesional melalui Internet","providing information relating to professional athletes via on the Internet"
"Penyediaan website yang menampilkan informasi konsumen terkait dengan vendor-vendor pernikahan","Providing a website featuring consumer information in the field of wedding vendors"
"Penyediaan informasi konsumen, berita, serta komentar pada bidang vendor-vendor pesta pernikahan secara online","Providing online consumer information, news and commentary in the field of wedding vendors"
"Penyediaan informasi untuk pencari teman dan layanan memperkenalkan  teman berbasis Internet untuk pengguna umum","Providing information for Internet-based seeking friends and friends introduction services for general users"
"layanan peramalan dan penyediaan informasi yang berhubungan dengannya","fortune-telling services and providing information relating thereto"
"Penyediaan informasi yang berkaitan dengan individu termasuk profil dan buku harian mengunakan papan buletin di Internet","providing information relating to individuals including profiles and diaries using bulletin board on the Internet"
"Penyediaan informasi yang berkaitan dengan individu","providing information relating to individuals"
"Jasa-jasa konsultasi dibidang daftar (listing) dan penelusuran persyaratan-persyaratan peraturan-peraturan Pemerintah Dalam Negeri dan Luar Negeri, untuk memperoleh ijin-ijin dan pemenuhan syarat peraturan-peraturan","consulting services in the field of listing and tracking of  foreign and domestic government regulatory requirements, for obtaining permits and regulatory compliance"
"Lisensi data digital, gambar diam, gambar bergerak, audio dan teks","Licensing of digital data, still images, moving images, audio and text"
"Layanan konsultasi yang berkaitan dengan perencanaan sosial, pendampingan, layanan agen pengenalan pribadi, menjaga rumah, menjaga anak, menjaga hewan peliharaan, agen detektif, perjanjian,  casting horoskop","Consultancy services relating to social planning, chaperoning, personal introduction agency services, house sitting, babysitting, pet sitting, detective agencies, undertaking, horoscope casting"
"Pengumpulan, manajemen, penelitian, analisis dan evaluasi informasi yang berkaitan dengan situasi dan hukum internasional","Collection, management, research, analysis and evaluation of information relating to international situation and laws"
"Jasa-jasa pemenuhan syarat peraturan-peraturan, ialah: meninjau standar-standar dan praktik-praktik untuk membantu para
klien untuk memenuhi syarat dengan peraturan-peraturan Pemerintah, peraturan-peraturan dan aturan-aturan dibidang
per-Bank-an dan pemasaran modal (capital market), asuransi, pengelolaan asset, pajak, akunting, audit, jasa-jasa keuangan,
jasa-jasa pengawasan ekspor dan bea cukai, keamanan makanan, perkakas-perkakas kedokteran, anti penyuapan dan korupsi,
pharmasi dan ilmu pengetahuan hidup, manfaat para karyawan, perobahan iklim, berbagai keperluan (utility), energi, perawatan
kesehatan, telekomunikasi data pribadi, otomotif, dan keramahtamahan dan bersantai","Regulatory compliance services, namely reviewing standards
and practices to assist clients with compliance with
governmental laws, regulations and rules in the fields of
banking and capital markets, insurance, asset management,
tax, accounting, auditing, financial services, export controls
and customs, food safety, medical devices, anti-bribery and
corruption, pharmaceuticals and life sciences, employee
benefits, climate change, utilities, energy,  health care,
telecommunications, data privacy, automotive, and hospitality
and leisure"
"penyediaan informasi yang berhubungan dengan layanan perkenalan teman laki-laki dan perempuan untuk orang yang ingin berinteraksi sebagai teman dengan menggunakan transmisi","providing information relating to male and female friends Introduction services for person wishes to interact as a friend using transmission"
"Jasa konsultasi ahli dibidang perselisihan dan penipuan terhadap perawatan kesehatan","Expert consultancy in the field of healthcare fraud and disputes"
"Jasa konsultasi ahli dibidang perselisihan konstruksi atau rancang bangun","Expert consultancy in the field of construction disputes"
"Jasa konsultasi ahli dibidang perselisihan perniagaan yang kompleks atau rumit","Expert consultancy in the field of complex business disputes"
"Penyediaan informasi untuk berteman dan memperkenalkan teman melalui Internet","providing information for making and introducing friends via the Internet"
"Penyediaan akses ke  komputer database dan database online yang dapat dicari dalam bidang jejaring social dan pengenalan sosial","providing access to computer databases and online searchable databases in the fields of social networking and social introduction"
"Layanan jejaring sosial online dalam bidang perawatan kecantikan dan pribadi","Online social networking services in the field of beauty and personal care"
"Jasa sinode gereja",-
"Jasa monitoring alarm untuk penyusup dan pencuri, jasa monitoring alarm dan alat pendeteksi api dan banjir","Intruder and burglar alarms monitoring services, fire and flood detecting device and alarm monitoring services"
"Penyediaan layanan jejaring sosial online di bidang manajemen proyek","Providing online social networking services in the field of project management"
"Penyediaan layanan jejaring sosial online di bidang manajemen bisnis","Providing online social networking services in the field business management"
"Penyediaan  layanan jejaring sosial online di bidang manajemen strategis","Providing online social networking services in the field strategic management"
"Jasa belanja perorangan","Individual shopping services"
"Jasa pelayan","Butler services"
"jasa navigasi oleh terminal komunikasi dengan jaringan komunikasi","navigation services by communication terminals with communication networks"
"menyediakan informasi peta dan memetakan informasi area tentang tempat tinggal oleh terminal komunikasi dengan jaringan komunikasi","providing map information and map around areas information about residence site by communication terminals with communication networks"
"membantu penentuan lokasi anak-anak untuk tujuan keamanan dan keselamatan menggunakan sistem penentuan posisi global","assisting in the locating of children for security and safety purposes using a global positioning system"
"jasa keamanan untuk kebakaran, gas dan penjaga dengan sistem pemantauan jarak jauh","security services for fire, gas and guard by remote monitoring systems"
"lisensi komputer","computer licensing"
"Menyediakan layanan concierge untuk orang lain untuk memenuhi kebutuhan individu yaitu pemesanan reservasi memfasilitasi pembelian pribadi mengatur pengiriman pribadi membuat pengaturan pribadi yang diminta memberikan rekomendasi produk dan layanan menyediakan informasi khusus pelanggan untuk memenuhi kebutuhan individu","Providing concierge services for others to meet the needs of individuals namely booking reservations facilitating personal purchases arranging personal deliveries making requested personal arrangements providing recommendations on products and services providing customer-specific information to meet individual needs"
"Layanan konsultasi di bidang jejaring sosial online dan layanan media sosial","Consulting services in the field of online social networking and social media services"
"Menyediakan layanan otentikasi untuk informasi identifikasi pribadi","Providing authentication services for personal identification information"
"layanan verifikasi identitas [keamanan komputer]","identity verification services [computer security]"
"Layanan keamanan data dan informasi","Data and information security services"
"Layanan pramutamu pribadi untuk orang lain yang terdiri dari membuat pengaturan dan reservasi pribadi yang diminta dan memberikan informasi khusus pelanggan untuk memenuhi kebutuhan individu","Personal concierge services for others comprising making requested personal arrangements and reservations and providing customer-specific information to meet individual needs"
"Layanan jejaring sosial yang terkait dengan kegiatan olahraga kebugaran dan pembinaan yang disediakan melalui situs web komunitas online dan jaringan komunikasi komputer dan elektronik lainnya","Social networking services related to sports fitness and coaching activities provided through a community website online and other computer and electronic communication networks"
"Layanan kencan online","Online dating services"
"Memberikan informasi di bidang jejaring sosial dan pengenalan sosial","Providing information in the fields of social networking and social introduction"
"Menyediakan layanan jejaring sosial yaitu penyediaan informasi di bidang pengembangan pribadi peningkatan diri pemenuhan diri amal filantropi sukarelawan layanan publik dan komunitas dan kegiatan kemanusiaan","Providing social networking services namely the provision of information in the field of personal development self-improvement self-fulfillment charitable philanthropic volunteer public and community services and humanitarian activities"
"Pengenalan sosial dan jaringan dan layanan kencan","Social introduction and networking and dating services"
"jasa lisensi konsep waralaba","Licensing of franchise concepts"
"jasa lisensi konsep waralaba","Licensing of franchising concepts"
"Pengenalan dan jejaring sosial berbasis internet","Internet based social introduction and networking"
"Yayasan Sosial Kemasyarakatan",-
"penyediaan informasi yang berhubungan dengan layanan kencan","providing information relating to dating services"
"Konsultasi kepatuhan peraturan di bidang media sosial","Regulatory compliance consulting in the field of social media"
"Lisensi teknologi","Licensing of technology"
Lisensi,Licensing
"Lisensi program komputer","Computer program licensing"
"Lisensi karakter kartun","Cartoon character licensing"
"Lisensi permainan komputer","Licensing of computer games"
"Memberikan perlindungan bagi orang lain sebagai jasa keamanan","Providing protection for others being security services"
"Jasa agen perkenalan pribadi","Personal introduction agency services"
"Meninjau standar dan praktik yang berkaitan dengan peraturan konten media sosial","Reviewing standards and practices relating to social media content regulatory"
"Menyediakan saran dan informasi terkait pencegahan bencana","Providing advice and information relating to disaster prevention"
"Menyediakan informasi terkait bencana alam","Providing information relating to natural disasters"
"layanan konsultasi dan informasi yang berkaitan dengan bencana pencegahan kejahatan dan pencegahan bencana","advisory and information services relating to disaster crime-prevention and disaster prevention"
"Menyediakan saran dan informasi yang berkaitan dengan pencurian dan keamanan","Providing advice and information relating to burglary and security"
"jasa pemakaman","funerary services"
"jaringan investasi sosial online dalam bentuk layanan jaringan sosial daring di bidang investasi","online social investment network in the nature of an on-line social networking services in the field of investments"
"jasa lisensi paten dan permohonan paten [layanan hukum]","licensing of patents and patent applications [legal services]"
"jasa lisensi program radio dan televisi [layanan hukum]","licensing of radio and television programs [legal services]"
"jasa lisensi desain terdaftar [layanan hukum]","licensing of registered designs [legal services]"
"jasa lisensi penelitian dan pengembangan [layanan hukum]","licensing of research and development [legal services]"
"jasa lisensi hak yang berkaitan dengan produksi audio [layanan hukum]","licensing of rights relating to audio productions [legal services]"
"jasa lisensi hak yang berkaitan dengan film [layanan hukum]","licensing of rights relating to films [legal services]"
"jasa lisensi hak yang berkaitan dengan produksi televisi [layanan hukum]","licensing of rights relating to television productions [legal services]"
"jasa lisensi hak yang berkaitan dengan produksi, format dan program televisi, video dan radio [layanan hukum]","licensing of rights relating to television, video and radio programs, productions and formats [legal services]"
"jasa lisensi hak yang berkaitan dengan produksi video [layanan hukum]","licensing of rights relating to video productions [legal services]"
"jasa lisensi hak atas produksi film, televisi dan video [layanan hukum]","licensing of rights to films, television and video productions [legal services]"
"jasa lisensi teknologi [layanan hukum]","licensing of technology [legal services]"
"jasa lisensi merek dagang [layanan hukum]","licensing of trademarks [legal services]"
"jasa lisensi","licensing services"
