name_id,name_en
"jasa lisensi yang berkaitan dengan penerbitan musik [layanan hukum]","licensing services relating to music publishing [legal services]"
"jasa lisensi yang berkaitan dengan hak pertunjukan [layanan hukum]","licensing services relating to performance rights [legal services]"
"jasa lisensi yang berkaitan dengan pembuatan barang [layanan hukum]","licensing services relating to the manufacture of goods [legal services]"
"jasa penjaga pantai","lifeguard services"
"jasa pemberian saran litigasi","litigation advice"
"jasa litigasi","litigation services"
"jasa dukungan litigasi","litigation support services"
"jasa melobi, selain untuk tujuan komersial","lobbying services, other than for commercial purposes"
"jasa biro penangangan barang yang hilang dan tertinggal","lost and found bureau services"
"jasa pengembalian properti yang hilang","lost property return"
"jasa manajemen dan eksploitasi hak properti industri dan hak cipta dengan lisensi untuk orang lain [layanan hukum]","management and exploitation of industrial property rights and copyright by licensing for others [legal services]"
"jasa pengelolaan hak properti industri dan hak cipta","management of industrial property rights and copyright"
"jasa pengelolaan hak properti industri dan hak cipta untuk orang lain","management of industrial property rights and copyright for others"
"jasa agen perkencanan","dating agency services"
"jasa perkencanan","dating services"
"jasa agen detektif","detective agency services"
"Ngajak Pulang (Selamatan Sebelum Panen Padi)",-
"Ngalap (Panen Padi)",-
Ngederep,-
Pancalang,-
"Tukang Mandiin (Jasa Memandikan Jenazah)",-
"jasa penyiapan laporan hukum di bidang hak asasi manusia","preparation of legal reports in the field of human rights"
"jasa investigasi pribadi","private investigation"
"jasa konsultasi hukum profesional yang berkaitan dengan waralaba","professional legal consultations relating to franchising"
"jasa penyediaan dan pengadaan upacara pernikahan sipil non-denominasi dan non-agama","providing and conducting non-denominational, non-religious civil marriage ceremonies"
"jasa penyediaan pakaian untuk anak-anak yang membutuhkan untuk tujuan amal","providing clothing to needy children for charitable purposes"
"jasa penyediaan pakaian untuk orang yang membutuhkan [jasa amal]","providing clothing to needy persons [charitable services]"
"jasa penyediaan pakaian untuk orang yang kurang mampu untuk tujuan amal","providing clothing to underprivileged persons for charitable purposes"
"jasa penyediaan layanan pertemanan untuk keluarga pasien dengan gangguan yang mengancam jiwa","providing companionship services for families of patients with life threatening disorders"
"jasa penyediaan konsultasi dan informasi di bidang tanggap darurat untuk masyarakat","providing consultancy and information in the field of emergency response for communities"
"jasa penyediaan fasilitas pemasyarakatan","providing correctional facilities"
"jasa penyediaan dukungan emosional kepada pasien kanker dan keluarganya melalui forum interaktif secara daring (online)","providing emotional support to cancer patients and their families via interactive on-line forums"
"jasa penyediaan ruang kubur atau rumah charnel (rumah penyimpanan kerangka manusia)","providing grave spaces or charnel houses"
"jasa penyediaan informasi horoskop melalui jaringan komputer","providing horoscope information via computer networks"
"jasa penyediaan informasi tentang layanan hukum melalui situs web","providing information about legal services via a web site"
"jasa penyediaan informasi tentang paten dan permohonan paten dari situs web","providing information about patents and patent applications from a web site"
"jasa penyediaan informasi dari database komputer tentang layanan investigasi yang berkaitan dengan kendaraan yang hilang atau dicuri","providing information from a computer database about investigation services relating to lost or stolen vehicles"
"jasa penyediaan informasi di bidang hukum","providing information in the field of law"
"jasa penyediaan informasi di bidang permohonan paten melalui database yang dapat ditelusuri secara daring (online)","providing information in the field of patent applications via an on-line searchable database"
"jasa penyediaan informasi di bidang pengembangan diri","providing information in the field of self-improvement"
"jasa penyediaan informasi tentang hak properti industri","providing information on industrial property rights"
"jasa penyediaan informasi tentang isu/persoalan yang berkaitan dengan hak asasi manusia","providing information on issues relating to human rights"
"jasa penyediaan informasi tentang pengembangan privasi, keamanan dan undang-undang tata kelola data dari situs web","providing information on the development of privacy, security and data governance law from a web site"
"jasa penyediaan informasi tentang pengembangan privasi, keamanan dan undang-undang tata kelola data melalui situs web","providing information on the development of privacy, security and data governance law via a web site"
"jasa penyediaan informasi terkait dengan penyewaan pakaian","providing information relating to clothing rental services"
"jasa penyediaan informasi terkait dengan agen lisensi hak cipta","providing information relating to copyright licensing agencies"
"jasa penyediaan informasi yang berkaitan dengan urusan hukum","providing information relating to legal affairs"
"jasa penyediaan informasi terkait dengan kendaraan yang hilang atau dicuri dari basis data (database) komputer","providing information relating to lost or stolen vehicles from a computer database"
"jasa penyediaan informasi yang berkaitan dengan perkenalan pasangan pernikahan atau perkencanan","providing information relating to marriage partner introduction or dating services"
"jasa penyediaan informasi terkait dengan pengawalan keamanan pribadi","providing information relating to personal body guarding services"
"jasa penyediaan informasi terkait dengan penataan busana/pakaian pribadi","providing information relating to personal wardrobe styling"
"jasa penyediaan informasi terkait dengan jasa penjaga keamanan","providing information relating to security guard services"
"jasa penyediaan informasi terkait dengan penyewaan alarm kebakaran","providing information relating to the rental of fire alarms"
"jasa investigasi detektif","detective investigations"
"jasa penyelesaian sengketa","dispute resolution services"
"jasa mediasi perceraian","divorce mediation"
"jasa pengasuh/pembawa jalan-jalan anjing","dog walking services"
"jasa pendaftaran nama domain, yaitu, melakukan penelusuran nama domain untuk tujuan memberikan nasihat hukum tentang pendaftaran nama domain","domain name registration services, namely, conducting domain name searches for the purpose of providing legal advice on domain name registration"
"jasa pemantauan elektronik untuk kontrol akses dan sistem keamanan lingkungan gedung","electronic monitoring services for control of building environmental access and security systems"
"jasa pemantauan elektronik dalam hal jasa pengawasan keamanan yang berkaitan dengan keselamatan fisik orang dan keamanan properti berwujud","electronic monitoring services in the nature of security surveillance services relating to the physical safety of persons and security of tangible property"
"jasa pembalseman","embalming services"
"jasa peringatan darurat","emergency alert services"
"jasa pengawalan/pengiringan","escort services"
"jasa penginjilan atau pastur","evangelical or pastoral services"
"jasa pelayanan penginjilan","evangelistic ministerial services"
"jasa penyewaan gaun malam","evening dress rental"
"jasa konsultasi ahli yang berkaitan dengan isu/persoalan hukum","expert consultancy relating to legal issues"
"jasa eksploitasi hak properti industri dan hak cipta dengan lisensi [layanan hukum]","exploitation of industrial property rights and copyright by licensing [legal services]"
"jasa lisensi film, televisi dan video [layanan hukum]","film, television and video licensing [legal services]"
"jasa lisensi film, televisi, video, musik dan gambar [layanan hukum]","film, television, video, music and image licensing [legal services]"
"jasa pengambilan sidik jari dan pendaftaran sidik jari anak-anak","fingerprinting and fingerprint registration of children"
"jasa pengambilan sidik jari","fingerprinting services"
"jasa konsultasi pencegahan kebakaran","fire prevention consultancy"
"jasa penyewaan alas kaki","footwear rental"
"jasa peramalan dalam hal peramalan keberuntungan","forecasting services in the nature of fortune-telling"
"jasa peramalan keberuntungan",fortune-telling
"jasa perawatan anak asuh","foster care"
"jasa pendeteksian penipuan di bidang perbankan","fraud detection services in the field of banking"
"jasa pendeteksian penipuan di bidang kartu kredit","fraud detection services in the field of credit cards"
"jasa pendeteksian penipuan di bidang kartu kredit untuk pembelian secara daring (online)","fraud detection services in the field of credit cards for on-line purchasing"
"jasa pendeteksian penipuan di bidang asuransi perawatan kesehatan","fraud detection services in the field of health care insurance"
"jasa pendeteksian penipuan di bidang asuransi","fraud detection services in the field of insurance"
"jasa pengaturan pemakaman","funeral arrangement services"
"jasa rumah duka","funeral home services"
"jasa pemakaman beserta kremasi","funeral services accompanying cremation"
"jasa pemakaman beserta kremasi hewan peliharaan","funeral services accompanying cremation of pets"
"jasa penelitian silsilah","genealogical research"
"jasa pemberian lisensi kepada orang lain untuk penggunaan hak properti industri dan hak cipta","granting of licenses to others for the use of industrial property rights and copyright"
"jasa perwalian","guardianship services"
"jasa penjaga","guard services"
"jasa penjaga untuk mencegah gangguan pencuri","guard services for preventing the intrusion of burglars"
"jasa pramutamu hotel","hotel concierge services"
"jasa penjaga rumah","house sitting"
"jasa pengawasan properti industri","industrial property watching services"
"jasa penyediaan informasi terkait dengan penyewaan alat pemadam kebakaran","providing information relating to the rental of fire extinguishers"
"jasa penyediaan fasilitas pemasyarakatan (lapas) remaja","providing juvenile correction facilities"
"jasa penyediaan informasi hukum dari database interaktif daring (online)","providing legal information from an on-line interactive database"
"jasa penyediaan kartu ucapan elektronik secara daring (online)","providing on-line electronic greeting cards"
"jasa penyediaan informasi secara daring (online) dibidang hukum","providing on-line information in the field of law"
"jasa penyediaan informasi secara daring (online) dibidang hal-hal spiritual, pertolongan terhadap diri sendiri (self-help), dan pemberdayaan pribadi","providing on-line information in the field of spirituality, self-help, and personal empowerment subject matters"
"penyediaan jasa advokasi pasien kepada pasien rumah sakit dan pasien di fasilitas perawatan jangka panjang","providing patient advocate services to hospital patients and patients in long-term care facilities"
"jasa penyediaan fasilitas pemasyarakatan (lapas) pidana","providing penal correction facilities"
"penyediaan jasa dukungan pribadi untuk pasien kanker dan keluarganya","providing personal support services for cancer patients and their families"
"penyediaan jasa dukungan pribadi untuk keluarga pasien dengan gangguan yang mengancam jiwa","providing personal support services for families of patients with life threatening disorders"
"penyediaan jasa pengintaian dan pengawasan","providing reconnaissance and surveillance services"
"jasa penyediaan informasi keamanan melalui situs web","providing security information via a web site"
"jasa penyediaan sepatu untuk anak-anak yang membutuhkan untuk tujuan amal","providing shoes to needy children for charitable purposes"
"jasa penyediaan sepatu untuk orang yang membutuhkan [jasa amal]","providing shoes to needy persons [charitable services]"
"jasa penyediaan sepatu untuk orang yang kurang mampu untuk tujuan amal","providing shoes to underprivileged persons for charitable purposes"
"jasa penyediaan pendapat hukum ahli","provision of expert legal opinions"
"jasa penyediaan informasi, saran dan konsultasi yang berkaitan dengan jasa keamanan untuk perlindungan properti dan individu","provision of information, advice and consultancy in relation to security services for the protection of property and individuals"
"jasa pembacaan batin/cenayang","psychic reading services"
"Jasa kapel pernikahan","wedding chapel services"
"jasa konsultasi zodiak","zodiac consultation"
"jasa penyediaan informasi, penasihat dan konsultasi yang berkaitan dengan masalah hukum","information, advisory and consultancy services relating to legal matters"
"jasa penyediaan informasi yang berkaitan dengan koordinasi mode untuk individu","information relating to fashion coordination services for individuals"
"jasa inspeksi pabrik untuk tujuan keselamatan","inspection of factories for safety purposes"
"jasa konsultasi kekayaan intelektual","intellectual property consultancy"
"jasa pendaftaran nama domain untuk identifikasi pengguna pada jaringan komputer global [layanan hukum]","registration of domain names for identification of users on a global computer network [legal service]"
"jasa pendaftaran nama domain untuk identifikasi pengguna pada jaringan komputer global [layanan hukum]","registration of domain names for identification of users on a global computer network [legal services]"
"jasa pendaftaran nama domain [layanan hukum]","registration of domain names [legal services]"
"jasa pelepasan merpati untuk acara-acara khusus","releasing doves for special occasions"
"jasa penyewaan altar","rental of altars"
"jasa penyewaan palang penghalang pengendali kerumunan","rental of crowd control barriers"
"jasa penyewaan gaun","rental of dresses"
"jasa penyewaan gaun malam","rental of evening dresses"
"jasa penyewaan alarm kebakaran","rental of fire alarms"
"jasa penyewaan alat pemadam kebakaran","rental of fire extinguishers"
"jasa penyewaan tas tangan","rental of handbags"
"jasa penyewaan perhiasan","rental of jewelry"
"jasa penyewaan jaket pelampung","rental of life jackets"
"jasa penyewaan pakaian pelindung","rental of protective clothing"
"jasa penyewaan peralatan dan pakaian pelindung","rental of protective clothing and equipment"
"jasa penyewaan peralatan pelindung","rental of protective equipment"
"jasa penyewaan helm pelindung","rental of protective helmets"
"jasa penyewaan penutup muka (masker) pelindung","rental of protective masks"
"jasa penyewaan brankas","rental of safes"
"jasa penyewaan peralatan pengawasan keamanan","rental of security surveillance equipment"
"jasa penyewaan sepatu","rental of shoes"
"jasa penyewaan tanda untuk pesan pribadi","rental of signs for personal messages"
"jasa penyewaan seragam","rental of uniforms"
"jasa penyewaan jam tangan","rental of watches"
"jasa penyewaan tuksedo","tuxedo rental"
"jasa penyediaan analisa terkait dengan ancaman keamanan untuk keselamatan fisik orang","security threat analysis for the physical safety of persons"
"jasa penyewaan topi","rental of hats"
"jasa penyediaan pendeta/pastor/orang yang meresmikan pernikahan","providing wedding officiant services"
"jasa konsultasi kekayaan intelektual untuk inventor/penemu","intellectual property consultancy services for inventors"
"jasa konsultasi kekayaan intelektual untuk organisasi nirlaba","intellectual property consultancy services for non-profit organizations"
"jasa konsultasi kekayaan intelektual untuk universitas dan lembaga penelitian","intellectual property consultancy services for universities and research institutions"
"jasa konsultasi kekayaan intelektual di bidang paten dan permohonan paten","intellectual property consultancy services in the field of patents and patent applications"
"jasa pengawasan kekayaan intelektual","intellectual property watching services"
"jasa pemakaman","interment services"
"jasa perkencanan, perjodohan, dan perkenalan pribadi berbasis internet","internet-based dating, matchmaking and personal introduction services"
"jasa perjodohan berbasis internet","internet-based matchmaking services"
"jasa perkenalan pribadi berbasis internet","internet-based personal introduction services"
"jasa perkenalan sosial berbasis internet","internet-based social introduction services"
"jasa perkencanan, perkenalan dan jejaring sosial berbasis internet","internet-based social networking, introduction, and dating services"
"jasa jejaring sosial berbasis internet","internet-based social networking services"
"jasa perkencanan internet","internet dating services"
"jasa investigasi dan pengawasan yang berkaitan dengan keselamatan fisik orang dan keamanan properti berwujud","investigation and surveillance services relating to the physical safety of persons and security of tangible property"
"jasa investigasi terkait dengan klaim asuransi","investigation services related to insurance claims"
"jasa investigasi yang berkaitan dengan keselamatan fisik orang","investigation services relating to the physical safety of persons"
"jasa investigasi yang berkaitan dengan keamanan properti berwujud","investigation services relating to the security of tangible property"
"jasa pemindaian iris dan retina untuk mengidentifikasi hewan peliharaan yang hilang dan dicuri","iris and retina scanning for identifying lost and stolen pets"
"jasa bantuan memakai kimono","kimono dressing assistance"
"jasa pembersihan ranjau darat","landmine clearing"
"jasa pendeteksian dan pembuangan ranjau darat","landmine detection and disposal services"
"jasa sewa guna usaha nama domain internet","leasing of internet domain names"
"jasa sewa guna usaha hak reproduksi foto dan transparansi kepada orang lain [layanan hukum]","leasing reproduction rights of photographs and transparencies to others [legal services]"
"jasa administrasi hukum lisensi","legal administration of licences"
"jasa penasihat hukum","legal advice"
"jasa penasihat dan perwakilan hukum","legal advice and representation"
"jasa penasihat hukum dalam menanggapi permintaan proposal [RFP]","legal advice in responding to requests for proposals [RFPs]"
"jasa penasihat hukum yang berkaitan dengan waralaba","legal advice relating to franchising"
"jasa advokasi hukum","legal advocacy services"
"jasa penelitian hukum dan peradilan di bidang kekayaan intelektual","legal and judicial research services in the field of intellectual property"
"jasa bantuan hukum dalam pembuatan kontrak","legal assistance in the drawing up of contracts"
"jasa konsultasi hukum di bidang perpajakan","legal consultancy in the field of taxation"
"jasa konsultasi hukum yang berkaitan dengan waralaba","legal consultancy relating to franchising"
"jasa konsultasi hukum yang berkaitan dengan hak kekayaan intelektual","legal consultancy relating to intellectual property rights"
"jasa konsultasi hukum yang berkaitan dengan iklan televisi, hiburan televisi dan olahraga","legal consultancy relating to television advertising, television entertainment and sports"
"jasa perwakilan dan bantuan dalam sengketa hukum di hadapan badan arbitrasi, mediasi, dan penyelesaian sengketa alternatif","representation and assistance in legal disputes before arbitration, mediation, and alternative dispute resolution bodies"
"jasa peninjauan standar dan praktik untuk memastikan kesesuaian dengan peraturan perundang-undangan anti-korupsi","reviewing standards and practices to assure compliance with anti-corruption laws and regulations"
"jasa peninjauan standar dan praktik untuk memastikan kesesuaian dengan peraturan perundang-undangan","reviewing standards and practices to assure compliance with laws and regulations"
"jasa menjalankan tugas untuk orang lain/jasa penerimaan tugas-tugas suruhan","running errands for others"
"jasa audit keselamatan untuk meningkatkan keselamatan pekerja konstruksi di lokasi konstruksi rumah tinggal","safety auditing to improve safety of construction workers on residential construction sites"
"jasa penilaian risiko keamanan terhadap individu atau properti","security assessment of risks to individuals or property"
"jasa pengawasan keamanan orang dan barang bawaan di bandara","security control of persons and luggage in airports"
"jasa uji kelayakan keamanan untuk individu atau pebisnis yang bepergian atau membuka kantor di luar negeri","security due diligence services for individuals or businesses traveling or opening an office overseas"
"jasa penjaga keamanan untuk fasilitas","security guarding for facilities"
"jasa penjaga keamanan","security guard services"
"jasa penjaga keamanan untuk gedung","security guard services for buildings"
"jasa penjaga keamanan untuk perlindungan properti dan individu","security guard services for the protection of property and individuals"
"jasa pemeriksaan keamanan bagasi","security screening of baggage"
"jasa keamanan untuk gedung","security services for buildings"
"jasa keamanan untuk perorangan dan pebisnis yang melakukan perjalanan internasional dan domestik","security services for individuals and business persons traveling internationally and domestically"
"jasa keamanan untuk perlindungan fisik individu dan properti yang berwujud","security services for the physical protection of tangible property and individuals"
"jasa keamanan untuk perlindungan properti dan individu","security services for the protection of property and individuals"
"jasa keamanan yang berkaitan dengan kendaraan","security services relating to vehicles"
"jasa penyediaan analisa terkait dengan ancaman keamanan untuk keselamatan fisik individu","security threat analysis for the physical safety of individuals"
"jasa konsultasi hukum","legal consultation services"
"jasa penyiapan dokumen hukum dan jasa penelitian untuk pengacara","legal document preparation and research services for attorneys"
"jasa penyiapan dokumen hukum","legal document preparation services"
"jasa penyediaan informasi hukum","legal information services"
"jasa investigasi hukum","legal investigation services"
"jasa penelitian hukum yang berkaitan dengan penggabungan bisnis","legal research relating to business mergers"
"jasa penelitian hukum yang berkaitan dengan hak kekayaan intelektual","legal research relating to intellectual property rights"
"jasa penelitian hukum yang berkaitan dengan transaksi lahan yasan/realestat","legal research relating to real estate transactions"
"jasa hukum","legal services"
"jasa penyediaan analisa terkait dengan ancaman keamanan untuk perlindungan individu","security threat analysis for the protection of individuals"
"jasa pemberitahuan aktual","service of actual notice"
"jasa pencarian orang","skip tracing services"
"jasa agen perkenalan sosial","social introduction agency services"
"jasa sosial yang diberikan oleh pihak lain untuk memenuhi kebutuhan individu","social services rendered by others to meet the needs of individuals"
"jasa konsultasi spiritual","spiritual consultancy"
"jasa penemuan kembali kendaraan yang dicuri","stolen vehicle recovery services"
"jasa pengawasan","surveillance services"
"jasa pengawasan yang berkaitan dengan keselamatan fisik orang","surveillance services relating to the physical safety of persons"
"jasa pengawasan yang berkaitan dengan keamanan properti yang berwujud","surveillance services relating to the security of tangible property"
"Jasa penelusuran judul","title searching"
"jasa pelacakan dan pemindaian iris atau retina mata sebagai cara untuk mengidentifikasi hewan peliharaan","tracking and iris or retina scanning as means of identifying pets"
"jasa pelacakan, pencarian dan pemantauan untuk menemukan kembali hewan yang hilang","tracking, locating and monitoring services for recovering lost animals"
"jasa pelacakan properti yang dicuri","tracking of stolen property"
"jasa pelacakan kendaraan yang dicuri","tracking of stolen vehicles"
"jasa pelacakan informasi/keterangan untuk barang yang tersandi","tracking services for retrieval of encoded products"
"jasa agen merek dagang","trademark agent services"
"jasa pemantauan merek dagang [layanan hukum]","trademark monitoring [legal services]"
"jasa pengawasan/pengamatan merek dagang","trademark watching services"
"jasa verifikasi identifikasi pribadi [investigasi latar belakang pribadi]","verification of personal identification [personal background investigations]"
"jasa video kencan","video dating services"
"jasa pemantauan video fasilitas, yang dapat dilihat melalui jaringan komputer global [pemantauan online / daring]","video monitoring of facilities, viewable through a global computer network [on-line monitoring]"
"jasa agen pernikahan","marriage agency services"
"jasa konseling dan pembinaan pernikahan","marriage counselling and coaching"
"jasa konseling bimbingan pernikahan","marriage guidance counselling"
"jasa perkenalan pasangan pernikahan atau perkencanan","marriage partner introduction or dating services"
"jasa perjodohan","matchmaking services"
"jasa mediasi",mediation
"jasa mediasi dalam prosedur hukum","mediation in legal procedures"
"jasa investigasi orang hilang","missing person investigations"
"jasa pemantauan sistem deteksi kebakaran","monitoring fire detection systems"
"jasa pemantauan sistem penanggulangan/pemadaman kebakaran","monitoring fire suppression systems"
"jasa pemantauan sistem deteksi gas","monitoring gas detection systems"
"jasa pemantauan sistem udara pernapasan industri","monitoring industrial breathing air systems"
"jasa pemantauan hak properti industri untuk tujuan penasehat hukum","monitoring industrial property rights for legal advisory purposes"
"jasa pemantauan hak kekayaan intelektual untuk tujuan penasehat hukum","monitoring intellectual property rights for legal advisory purposes"
