"concept_id"	"concept_name"	"domain_id"	"vocabulary_id"	"concept_class_id"	"standard_concept"	"concept_code"	"valid_start_date"	"valid_end_date"	"invalid_reason"
4054389	Accidental exposure to blacking	Observation	SNOMED	Event	S	"242272008"	2002-01-31	2099-12-31	
4054390	Accidental exposure to pyrethroid insecticide	Observation	SNOMED	Event	S	"242277002"	2002-01-31	2099-12-31	
4054391	Accidental exposure to organophosphorus herbicide	Observation	SNOMED	Event	S	"242281002"	2002-01-31	2099-12-31	
4054465	Accidental exposure to dinitro compound herbicide	Observation	SNOMED	Event	S	"242283004"	2002-01-31	2099-12-31	
4054466	Accidental exposure to molluscicide	Observation	SNOMED	Event	S	"242289000"	2002-01-31	2099-12-31	
4054467	Accidental exposure to plant food	Observation	SNOMED	Event	S	"242290009"	2002-01-31	2099-12-31	
4054468	Accidental exposure to fertilizer	Observation	SNOMED	Event	S	"242291008"	2002-01-31	2099-12-31	
4054481	Accidental exposure to white spirit	Observation	SNOMED	Event	S	"242372006"	2002-01-31	2099-12-31	
